club_name,club_id,last_source,last_answer,probability_raw,page,last_source_dt,last_answer_dt,probability_pct,Player
Celtic Glasgow,371,19.08.2024,19.08.2024,-,1,2024-08-19,2024-08-19,,Aaron Connolly
FC Middlesbrough,641,29.12.2021,29.12.2021,-,1,2021-12-29,2021-12-29,,Aaron Connolly
TSG 1899 Hoffenheim,533,22.11.2018,22.11.2018,-,1,2018-11-22,2018-11-22,,Aaron Connolly
Manchester United,985,25.09.2023,25.09.2023,-,1,2023-09-25,2023-09-25,,Aaron Hickey
FC Arsenal,11,25.09.2023,25.09.2023,-,1,2023-09-25,2023-09-25,,Aaron Hickey
FC Liverpool,31,25.09.2023,25.09.2023,-,1,2023-09-25,2023-09-25,,Aaron Hickey
FC Bayern München,27,24.09.2023,24.09.2023,-,1,2023-09-24,2023-09-24,,Aaron Hickey
Manchester City,281,24.04.2023,24.04.2023,-,1,2023-04-24,2023-04-24,,Aaron Hickey
FC Brentford,1148,08.07.2022,08.07.2022,-,1,2022-07-08,2022-07-08,,Aaron Hickey
FC Arsenal,11,03.05.2022,03.05.2022,-,1,2022-05-03,2022-05-03,,Aaron Hickey
SSC Neapel,6195,01.05.2022,01.05.2022,-,1,2022-05-01,2022-05-01,,Aaron Hickey
Newcastle United,762,30.03.2022,30.03.2022,-,1,2022-03-30,2022-03-30,,Aaron Hickey
AC Mailand,5,29.03.2022,29.03.2022,-,1,2022-03-29,2022-03-29,,Aaron Hickey
Aston Villa,405,05.01.2022,23.01.2022,-,1,2022-01-05,2022-01-23,,Aaron Hickey
FC Bayern München,27,24.09.2020,24.09.2020,-,1,2020-09-24,2020-09-24,,Aaron Hickey
FC Bologna,1025,04.09.2020,04.09.2020,-,1,2020-09-04,2020-09-04,,Aaron Hickey
FC Arsenal,11,30.10.2015,30.10.2015,-,1,2015-10-30,2015-10-30,,Aaron Leya Iseka
FC Chelsea,631,27.03.2015,27.03.2015,-,1,2015-03-27,2015-03-27,,Aaron Leya Iseka
Brighton & Hove Albion,1237,09.08.2019,09.08.2019,-,1,2019-08-09,2019-08-09,,Aaron Mooy
Manchester City,281,28.06.2018,28.06.2018,-,1,2018-06-28,2018-06-28,,Aaron Mooy
FC Southampton,180,26.06.2018,26.06.2018,-,1,2018-06-26,2018-06-26,,Aaron Mooy
West Ham United,379,26.06.2018,26.06.2018,-,1,2018-06-26,2018-06-26,,Aaron Mooy
FC Everton,29,26.06.2018,26.06.2018,-,1,2018-06-26,2018-06-26,,Aaron Mooy
Manchester City,281,12.06.2016,12.06.2016,-,1,2016-06-12,2016-06-12,,Aaron Mooy
Newcastle United,762,31.07.2025,31.07.2025,-,1,2025-07-31,2025-07-31,,Aaron Ramsdale
West Ham United,379,10.04.2025,10.04.2025,-,1,2025-04-10,2025-04-10,,Aaron Ramsdale
FC Southampton,180,28.08.2024,29.08.2024,-,1,2024-08-28,2024-08-29,,Aaron Ramsdale
Newcastle United,762,01.04.2024,01.04.2024,-,1,2024-04-01,2024-04-01,,Aaron Ramsdale
FC Chelsea,631,16.12.2023,16.12.2023,-,1,2023-12-16,2023-12-16,,Aaron Ramsdale
Wolverhampton Wanderers,543,26.11.2023,26.11.2023,-,1,2023-11-26,2023-11-26,,Aaron Ramsdale
FC Bayern München,27,19.09.2023,20.09.2023,-,1,2023-09-19,2023-09-20,,Aaron Ramsdale
FC Arsenal,11,18.08.2021,21.08.2021,-,1,2021-08-18,2021-08-21,,Aaron Ramsdale
Sheffield United,350,15.08.2020,15.08.2020,-,1,2020-08-15,2020-08-15,,Aaron Ramsdale
Tottenham Hotspur,148,12.03.2020,12.03.2020,-,1,2020-03-12,2020-03-12,,Aaron Ramsdale
FC Chelsea,631,12.03.2020,12.03.2020,-,1,2020-03-12,2020-03-12,,Aaron Ramsdale
FC Everton,29,30.01.2017,30.01.2017,-,1,2017-01-30,2017-01-30,,Aaron Ramsdale
UNAM Pumas,7633,04.07.2025,04.07.2025,-,1,2025-07-04,2025-07-04,,Aaron Ramsey
Cardiff City,603,15.07.2023,15.07.2023,-,1,2023-07-15,2023-07-15,,Aaron Ramsey
OGC Nizza,417,01.08.2022,01.08.2022,-,1,2022-08-01,2022-08-01,,Aaron Ramsey
Galatasaray,141,29.07.2022,29.07.2022,-,1,2022-07-29,2022-07-29,,Aaron Ramsey
Nottingham Forest,703,26.07.2022,26.07.2022,-,1,2022-07-26,2022-07-26,,Aaron Ramsey
Cardiff City,603,07.06.2022,07.06.2022,-,1,2022-06-07,2022-06-07,,Aaron Ramsey
Glasgow Rangers,124,31.01.2022,31.01.2022,-,1,2022-01-31,2022-01-31,,Aaron Ramsey
Wolverhampton Wanderers,543,31.01.2022,31.01.2022,-,1,2022-01-31,2022-01-31,,Aaron Ramsey
FC Everton,29,09.12.2021,09.12.2021,-,1,2021-12-09,2021-12-09,,Aaron Ramsey
Newcastle United,762,11.10.2021,10.11.2021,-,1,2021-10-11,2021-11-10,,Aaron Ramsey
West Ham United,379,27.09.2021,27.09.2021,-,1,2021-09-27,2021-09-27,,Aaron Ramsey
FC Arsenal,11,10.06.2021,10.06.2021,-,1,2021-06-10,2021-06-10,,Aaron Ramsey
FC Liverpool,31,20.05.2021,20.05.2021,-,1,2021-05-20,2021-05-20,,Aaron Ramsey
Tottenham Hotspur,148,29.03.2021,30.03.2021,-,1,2021-03-29,2021-03-30,,Aaron Ramsey
Crystal Palace,873,27.03.2021,27.03.2021,-,1,2021-03-27,2021-03-27,,Aaron Ramsey
Manchester United,985,27.04.2020,27.04.2020,-,2,2020-04-27,2020-04-27,,Aaron Ramsey
Juventus Turin,506,11.02.2019,11.02.2019,-,2,2019-02-11,2019-02-11,,Aaron Ramsey
FC Bayern München,27,10.01.2019,11.02.2019,-,2,2019-01-10,2019-02-11,,Aaron Ramsey
Real Madrid,418,01.01.2019,01.01.2019,-,2,2019-01-01,2019-01-01,,Aaron Ramsey
FC Paris Saint-Germain,583,31.12.2018,31.12.2018,-,2,2018-12-31,2018-12-31,,Aaron Ramsey
Inter Mailand,46,31.12.2018,31.12.2018,-,2,2018-12-31,2018-12-31,,Aaron Ramsey
FC Everton,29,29.11.2018,01.12.2018,-,2,2018-11-29,2018-12-01,,Aaron Ramsey
FC Chelsea,631,29.10.2018,29.10.2018,-,2,2018-10-29,2018-10-29,,Aaron Ramsey
Manchester United,985,29.10.2018,29.10.2018,-,2,2018-10-29,2018-10-29,,Aaron Ramsey
Lazio Rom,398,19.10.2018,20.10.2018,-,2,2018-10-19,2018-10-20,,Aaron Ramsey
AC Mailand,5,13.09.2018,13.09.2018,-,2,2018-09-13,2018-09-13,,Aaron Ramsey
FC Liverpool,31,04.08.2018,06.08.2018,-,2,2018-08-04,2018-08-06,,Aaron Ramsey
FC Barcelona,131,17.01.2016,17.01.2016,-,2,2016-01-17,2016-01-17,,Aaron Ramsey
FC Fulham,931,21.04.2011,22.04.2011,-,2,2011-04-21,2011-04-22,,Aaron Ramsey
West Ham United,379,10.08.2024,10.08.2024,-,1,2024-08-10,2024-08-10,,Aaron Wan-Bissaka
Galatasaray,141,22.06.2024,24.06.2024,-,1,2024-06-22,2024-06-24,,Aaron Wan-Bissaka
Inter Mailand,46,29.05.2024,29.05.2024,-,1,2024-05-29,2024-05-29,,Aaron Wan-Bissaka
Al-Nassr FC,18544,29.04.2024,29.04.2024,-,1,2024-04-29,2024-04-29,,Aaron Wan-Bissaka
Crystal Palace,873,15.01.2024,15.01.2024,-,1,2024-01-15,2024-01-15,,Aaron Wan-Bissaka
Wolverhampton Wanderers,543,10.01.2023,10.01.2023,-,1,2023-01-10,2023-01-10,,Aaron Wan-Bissaka
AS Rom,12,06.05.2022,06.05.2022,-,1,2022-05-06,2022-05-06,,Aaron Wan-Bissaka
Manchester United,985,29.06.2019,29.06.2019,-,1,2019-06-29,2019-06-29,,Aaron Wan-Bissaka
Manchester City,281,15.05.2019,15.05.2019,-,1,2019-05-15,2019-05-15,,Aaron Wan-Bissaka
FC Bayern München,27,18.03.2019,19.03.2019,-,1,2019-03-18,2019-03-19,,Aaron Wan-Bissaka
FC Arsenal,11,25.02.2019,27.02.2019,-,1,2019-02-25,2019-02-27,,Aaron Wan-Bissaka
Borussia Dortmund,16,12.02.2019,16.02.2019,-,1,2019-02-12,2019-02-16,,Aaron Wan-Bissaka
FC Everton,29,04.11.2018,04.11.2018,-,1,2018-11-04,2018-11-04,,Aaron Wan-Bissaka
Eintracht Frankfurt,24,03.07.2023,03.07.2023,-,1,2023-07-03,2023-07-03,,Aarón Martín
SV Werder Bremen,86,28.06.2023,03.07.2023,-,1,2023-06-28,2023-07-03,,Aarón Martín
Espanyol Barcelona,714,15.02.2023,15.02.2023,-,1,2023-02-15,2023-02-15,,Aarón Martín
FC Turin,416,14.12.2022,14.12.2022,-,1,2022-12-14,2022-12-14,,Aarón Martín
FC Bologna,1025,14.12.2022,14.12.2022,-,1,2022-12-14,2022-12-14,,Aarón Martín
Besiktas JK,114,,27.07.2022,-,1,,2022-07-27,,Aarón Martín
FC Getafe,3709,04.07.2022,24.07.2022,-,1,2022-07-04,2022-07-24,,Aarón Martín
Genua CFC,252,31.07.2021,01.08.2021,-,1,2021-07-31,2021-08-01,,Aarón Martín
Real Betis Sevilla,150,05.09.2020,05.09.2020,-,1,2020-09-05,2020-09-05,,Aarón Martín
Borussia Mönchengladbach,18,23.05.2019,24.05.2019,-,1,2019-05-23,2019-05-24,,Aarón Martín
1.FSV Mainz 05,39,06.08.2018,06.08.2018,-,1,2018-08-06,2018-08-06,,Aarón Martín
VfL Wolfsburg,82,05.07.2018,13.07.2018,-,1,2018-07-05,2018-07-13,,Aarón Martín
FC Everton,29,08.05.2018,08.05.2018,-,1,2018-05-08,2018-05-08,,Aarón Martín
Benfica Lissabon,294,08.05.2018,08.05.2018,-,1,2018-05-08,2018-05-08,,Aarón Martín
RB Leipzig,23826,09.02.2018,09.02.2018,-,1,2018-02-09,2018-02-09,,Aarón Martín
Manchester City,281,07.11.2017,07.11.2017,-,2,2017-11-07,2017-11-07,,Aarón Martín
FC Barcelona,131,14.10.2017,14.10.2017,-,2,2017-10-14,2017-10-14,,Aarón Martín
Real Madrid,418,14.10.2017,14.10.2017,-,2,2017-10-14,2017-10-14,,Aarón Martín
Manchester United,985,14.10.2017,14.10.2017,-,2,2017-10-14,2017-10-14,,Aarón Martín
RC Lens,826,18.08.2025,18.08.2025,-,1,2025-08-18,2025-08-18,,Abdallah Sima
FC Augsburg,167,09.08.2025,11.08.2025,25 %,1,2025-08-09,2025-08-11,25.0,Abdallah Sima
VfL Wolfsburg,82,09.08.2025,09.08.2025,21 %,1,2025-08-09,2025-08-09,21.0,Abdallah Sima
VfB Stuttgart,79,13.05.2025,13.06.2025,27 %,1,2025-05-13,2025-06-13,27.0,Abdallah Sima
1.FSV Mainz 05,39,13.05.2025,13.05.2025,-,1,2025-05-13,2025-05-13,,Abdallah Sima
FC Schalke 04,33,10.07.2022,10.07.2022,-,1,2022-07-10,2022-07-10,,Abdallah Sima
FC Arsenal,11,30.08.2021,31.08.2021,-,1,2021-08-30,2021-08-31,,Abdallah Sima
West Ham United,379,30.08.2021,30.08.2021,-,1,2021-08-30,2021-08-30,,Abdallah Sima
Brighton & Hove Albion,1237,30.08.2021,30.08.2021,-,1,2021-08-30,2021-08-30,,Abdallah Sima
Manchester United,985,27.04.2021,29.04.2021,-,1,2021-04-27,2021-04-29,,Abdallah Sima
FC Everton,29,28.02.2021,28.02.2021,-,1,2021-02-28,2021-02-28,,Abdallah Sima
Real Betis Sevilla,150,02.09.2023,02.09.2023,-,1,2023-09-02,2023-09-02,,Abde Ezzalzouli
Bayer 04 Leverkusen,15,25.05.2023,23.08.2023,-,1,2023-05-25,2023-08-23,,Abde Ezzalzouli
Juventus Turin,506,11.07.2023,11.07.2023,-,1,2023-07-11,2023-07-11,,Abde Ezzalzouli
FC Barcelona,131,19.06.2023,19.06.2023,-,1,2023-06-19,2023-06-19,,Abde Ezzalzouli
Nottingham Forest,703,27.02.2023,27.02.2023,-,1,2023-02-27,2023-02-27,,Abde Ezzalzouli
AC Florenz,430,25.12.2022,25.12.2022,-,1,2022-12-25,2022-12-25,,Abdelhamid Sabiri
Olympique Lyon,1041,22.12.2022,22.12.2022,-,1,2022-12-22,2022-12-22,,Abdelhamid Sabiri
Lazio Rom,398,26.09.2020,28.09.2020,-,1,2020-09-26,2020-09-28,,Abdelhamid Sabiri
Sivasspor,2381,06.05.2020,06.05.2020,-,1,2020-05-06,2020-05-06,,Abdelhamid Sabiri
Besiktas JK,114,06.05.2020,06.05.2020,-,1,2020-05-06,2020-05-06,,Abdelhamid Sabiri
Basaksehir FK,6890,06.05.2020,06.05.2020,-,1,2020-05-06,2020-05-06,,Abdelhamid Sabiri
Trabzonspor,449,06.05.2020,06.05.2020,-,1,2020-05-06,2020-05-06,,Abdelhamid Sabiri
Galatasaray,141,06.05.2020,06.05.2020,-,1,2020-05-06,2020-05-06,,Abdelhamid Sabiri
SC Paderborn 07,127,27.08.2019,27.08.2019,-,1,2019-08-27,2019-08-27,,Abdelhamid Sabiri
Hamburger SV,41,26.07.2019,26.07.2019,-,1,2019-07-26,2019-07-26,,Abdelhamid Sabiri
SV Werder Bremen,86,23.04.2019,24.04.2019,-,1,2019-04-23,2019-04-24,,Abdelhamid Sabiri
Eintracht Frankfurt,24,23.04.2019,23.04.2019,-,1,2019-04-23,2019-04-23,,Abdelhamid Sabiri
Huddersfield Town,1110,23.08.2017,23.08.2017,-,1,2017-08-23,2017-08-23,,Abdelhamid Sabiri
Aston Villa,405,28.07.2017,28.07.2017,-,1,2017-07-28,2017-07-28,,Abdelhamid Sabiri
1.FC Nürnberg,4,26.05.2016,26.05.2016,-,1,2016-05-26,2016-05-26,,Abdelhamid Sabiri
Al-Arabi SC,1230,15.08.2023,15.08.2023,-,1,2023-08-15,2023-08-15,,Abdou Diallo
FC Paris Saint-Germain,583,09.06.2023,09.06.2023,-,1,2023-06-09,2023-06-09,,Abdou Diallo
RB Leipzig,23826,31.08.2022,01.09.2022,-,1,2022-08-31,2022-09-01,,Abdou Diallo
AS Rom,12,26.08.2022,26.08.2022,-,1,2022-08-26,2022-08-26,,Abdou Diallo
Aston Villa,405,25.08.2022,25.08.2022,-,1,2022-08-25,2022-08-25,,Abdou Diallo
West Ham United,379,08.08.2022,08.08.2022,-,1,2022-08-08,2022-08-08,,Abdou Diallo
SSC Neapel,6195,15.07.2022,15.07.2022,-,1,2022-07-15,2022-07-15,,Abdou Diallo
AC Mailand,5,12.01.2022,12.01.2022,-,1,2022-01-12,2022-01-12,,Abdou Diallo
FC Paris Saint-Germain,583,16.07.2019,16.07.2019,-,1,2019-07-16,2019-07-16,,Abdou Diallo
Olympique Lyon,1041,06.07.2019,07.07.2019,-,1,2019-07-06,2019-07-07,,Abdou Diallo
Borussia Dortmund,16,26.06.2018,26.06.2018,-,1,2018-06-26,2018-06-26,,Abdou Diallo
Olympique Lyon,1041,22.06.2018,22.06.2018,-,1,2018-06-22,2018-06-22,,Abdou Diallo
RB Leipzig,23826,01.06.2018,04.06.2018,-,1,2018-06-01,2018-06-04,,Abdou Diallo
SSC Neapel,6195,01.06.2018,01.06.2018,-,1,2018-06-01,2018-06-01,,Abdou Diallo
FC Arsenal,11,26.04.2018,26.04.2018,-,1,2018-04-26,2018-04-26,,Abdou Diallo
1.FSV Mainz 05,39,12.07.2017,14.07.2017,-,2,2017-07-12,2017-07-14,,Abdou Diallo
AC Florenz,430,14.06.2017,14.06.2017,-,2,2017-06-14,2017-06-14,,Abdou Diallo
Real Saragossa,142,21.07.2016,21.07.2016,-,2,2016-07-21,2016-07-21,,Abdou Diallo
Galatasaray,141,27.08.2021,27.08.2021,-,1,2021-08-27,2021-08-27,,Abdou Harroui
LOSC Lille,1082,09.05.2021,09.05.2021,-,1,2021-05-09,2021-05-09,,Abdou Harroui
SV Werder Bremen,86,05.03.2021,05.03.2021,-,1,2021-03-05,2021-03-05,,Abdou Harroui
Al-Shabab FC,9840,12.05.2025,12.05.2025,-,1,2025-05-12,2025-05-12,,Abdoulaye Doucouré
AS Rom,12,10.12.2024,10.12.2024,-,1,2024-12-10,2024-12-10,,Abdoulaye Doucouré
Al-Ettifaq FC,7732,20.01.2024,20.01.2024,-,1,2024-01-20,2024-01-20,,Abdoulaye Doucouré
Nottingham Forest,703,23.12.2022,23.12.2022,-,1,2022-12-23,2022-12-23,,Abdoulaye Doucouré
FC Fulham,931,21.12.2022,21.12.2022,-,1,2022-12-21,2022-12-21,,Abdoulaye Doucouré
FC Everton,29,08.09.2020,08.09.2020,-,1,2020-09-08,2020-09-08,,Abdoulaye Doucouré
FC Chelsea,631,31.01.2019,31.01.2019,-,1,2019-01-31,2019-01-31,,Abdoulaye Doucouré
FC Paris Saint-Germain,583,27.12.2018,27.12.2018,-,1,2018-12-27,2018-12-27,,Abdoulaye Doucouré
Tottenham Hotspur,148,02.11.2018,02.11.2018,-,1,2018-11-02,2018-11-02,,Abdoulaye Doucouré
FC Liverpool,31,21.02.2018,29.03.2018,-,1,2018-02-21,2018-03-29,,Abdoulaye Doucouré
Manchester United,985,07.03.2018,07.03.2018,-,1,2018-03-07,2018-03-07,,Abdoulaye Doucouré
FC Arsenal,11,20.02.2018,20.02.2018,-,1,2018-02-20,2018-02-20,,Abdoulaye Doucouré
FC Watford,1010,31.01.2016,31.01.2016,-,1,2016-01-31,2016-01-31,,Abdoulaye Doucouré
SSC Neapel,6195,31.08.2015,31.08.2015,-,1,2015-08-31,2015-08-31,,Abdoulaye Doucouré
1.FSV Mainz 05,39,06.08.2019,15.08.2019,-,1,2019-08-06,2019-08-15,,Abdoulaye Touré
TSG 1899 Hoffenheim,533,05.08.2019,05.08.2019,-,1,2019-08-05,2019-08-05,,Abdoulaye Touré
FC Burnley,1132,07.08.2018,07.08.2018,-,1,2018-08-07,2018-08-07,,Abdoulaye Touré
Bayer 04 Leverkusen,15,23.12.2017,27.12.2017,-,1,2017-12-23,2017-12-27,,Abdoulaye Touré
FC Schalke 04,33,23.12.2017,23.12.2017,-,1,2017-12-23,2017-12-23,,Abdoulaye Touré
1.FC Köln,3,22.01.2017,22.01.2017,-,1,2017-01-22,2017-01-22,,Abdoulaye Touré
Borussia Mönchengladbach,18,21.01.2017,22.01.2017,-,1,2017-01-21,2017-01-22,,Abdoulaye Touré
AFC Sunderland,289,21.01.2017,21.01.2017,-,1,2017-01-21,2017-01-21,,Abdoulaye Touré
Sampdoria Genua,1038,21.01.2017,21.01.2017,-,1,2017-01-21,2017-01-21,,Abdoulaye Touré
Borussia Dortmund,16,11.01.2025,14.01.2025,-,1,2025-01-11,2025-01-14,,Abdukodir Khusanov
Manchester City,281,12.01.2025,12.01.2025,-,1,2025-01-12,2025-01-12,,Abdukodir Khusanov
Real Madrid,418,06.01.2025,06.01.2025,-,1,2025-01-06,2025-01-06,,Abdukodir Khusanov
RB Leipzig,23826,22.12.2024,22.12.2024,-,1,2024-12-22,2024-12-22,,Abdukodir Khusanov
Bayer 04 Leverkusen,15,22.12.2024,22.12.2024,-,1,2024-12-22,2024-12-22,,Abdukodir Khusanov
Tottenham Hotspur,148,21.12.2024,21.12.2024,-,1,2024-12-21,2024-12-21,,Abdukodir Khusanov
Newcastle United,762,21.12.2024,21.12.2024,-,1,2024-12-21,2024-12-21,,Abdukodir Khusanov
RC Lens,826,13.07.2023,13.07.2023,-,1,2023-07-13,2023-07-13,,Abdukodir Khusanov
Olympique Lyon,1041,22.05.2024,22.05.2024,-,1,2024-05-22,2024-05-22,,Abner
Manchester City,281,16.07.2023,16.07.2023,-,1,2023-07-16,2023-07-16,,Achraf Hakimi
Real Madrid,418,08.01.2023,08.01.2023,-,1,2023-01-08,2023-01-08,,Achraf Hakimi
FC Barcelona,131,18.08.2022,19.08.2022,-,1,2022-08-18,2022-08-19,,Achraf Hakimi
FC Bayern München,27,27.06.2021,28.06.2021,-,1,2021-06-27,2021-06-28,,Achraf Hakimi
FC Paris Saint-Germain,583,24.06.2021,24.06.2021,-,1,2021-06-24,2021-06-24,,Achraf Hakimi
FC Chelsea,631,18.06.2021,18.06.2021,-,1,2021-06-18,2021-06-18,,Achraf Hakimi
FC Arsenal,11,06.04.2021,19.04.2021,-,1,2021-04-06,2021-04-19,,Achraf Hakimi
Borussia Dortmund,16,15.03.2021,19.04.2021,-,1,2021-03-15,2021-04-19,,Achraf Hakimi
Inter Mailand,46,09.09.2020,09.09.2020,-,1,2020-09-09,2020-09-09,,Achraf Hakimi
FC Bayern München,27,27.06.2020,21.07.2020,-,1,2020-06-27,2020-07-21,,Achraf Hakimi
Borussia Dortmund,16,26.06.2020,27.06.2020,-,1,2020-06-26,2020-06-27,,Achraf Hakimi
Manchester City,281,15.06.2020,15.06.2020,-,1,2020-06-15,2020-06-15,,Achraf Hakimi
Tottenham Hotspur,148,12.06.2020,12.06.2020,-,1,2020-06-12,2020-06-12,,Achraf Hakimi
FC Arsenal,11,21.05.2020,21.05.2020,-,1,2020-05-21,2020-05-21,,Achraf Hakimi
FC Paris Saint-Germain,583,10.05.2020,10.05.2020,-,1,2020-05-10,2020-05-10,,Achraf Hakimi
Juventus Turin,506,03.04.2020,03.04.2020,-,2,2020-04-03,2020-04-03,,Achraf Hakimi
FC Paris Saint-Germain,583,03.04.2020,03.04.2020,-,2,2020-04-03,2020-04-03,,Achraf Hakimi
FC Chelsea,631,29.03.2020,29.03.2020,-,2,2020-03-29,2020-03-29,,Achraf Hakimi
SSC Neapel,6195,06.06.2018,06.06.2018,-,2,2018-06-06,2018-06-06,,Achraf Hakimi
FC Southampton,180,08.06.2024,08.06.2024,-,1,2024-06-08,2024-06-08,,Adam Lallana
Brighton & Hove Albion,1237,27.07.2020,27.07.2020,-,1,2020-07-27,2020-07-27,,Adam Lallana
Leicester City,1003,08.06.2020,08.06.2020,-,1,2020-06-08,2020-06-08,,Adam Lallana
FC Burnley,1132,27.05.2020,27.05.2020,-,1,2020-05-27,2020-05-27,,Adam Lallana
Newcastle United,762,31.12.2019,31.12.2019,-,1,2019-12-31,2019-12-31,,Adam Lallana
FC Paris Saint-Germain,583,17.11.2019,17.11.2019,-,1,2019-11-17,2019-11-17,,Adam Lallana
FC Southampton,180,19.05.2019,19.05.2019,-,1,2019-05-19,2019-05-19,,Adam Lallana
Tottenham Hotspur,148,09.05.2016,09.05.2016,-,1,2016-05-09,2016-05-09,,Adam Lallana
FC Liverpool,31,01.07.2014,14.05.2014,-,1,2014-07-01,2014-05-14,,Adam Lallana
Manchester United,985,26.04.2014,26.04.2014,-,1,2014-04-26,2014-04-26,,Adam Lallana
Tottenham Hotspur,148,20.04.2014,20.04.2014,-,1,2014-04-20,2014-04-20,,Adam Lallana
FC Fulham,931,20.12.2009,20.12.2009,-,1,2009-12-20,2009-12-20,,Adam Lallana
FC Watford,1010,02.07.2018,02.07.2018,-,1,2018-07-02,2018-07-02,,Adam Masina
Tottenham Hotspur,148,26.11.2017,26.11.2017,-,1,2017-11-26,2017-11-26,,Adam Masina
FC Sevilla,368,19.08.2017,19.08.2017,-,1,2017-08-19,2017-08-19,,Adam Masina
Inter Mailand,46,14.03.2016,14.03.2016,-,1,2016-03-14,2016-03-14,,Adam Masina
LOSC Lille,1082,01.09.2022,01.09.2022,-,1,2022-09-01,2022-09-01,,Adam Ounas
Sampdoria Genua,1038,24.08.2022,24.08.2022,-,1,2022-08-24,2022-08-24,,Adam Ounas
US Lecce,1005,11.08.2022,11.08.2022,-,1,2022-08-11,2022-08-11,,Adam Ounas
FC Bologna,1025,20.07.2022,20.07.2022,-,1,2022-07-20,2022-07-20,,Adam Ounas
Olympique Marseille,244,26.08.2021,26.08.2021,-,1,2021-08-26,2021-08-26,,Adam Ounas
Venezia FC,607,19.07.2021,19.07.2021,-,1,2021-07-19,2021-07-19,,Adam Ounas
Olympiakos Piräus,683,19.06.2021,19.06.2021,-,1,2021-06-19,2021-06-19,,Adam Ounas
FC Crotone,4083,01.02.2021,01.02.2021,-,1,2021-02-01,2021-02-01,,Adam Ounas
Cagliari Calcio,1390,05.10.2020,05.10.2020,-,1,2020-10-05,2020-10-05,,Adam Ounas
Hellas Verona,276,04.10.2020,04.10.2020,-,1,2020-10-04,2020-10-04,,Adam Ounas
OGC Nizza,417,28.08.2019,28.08.2019,-,1,2019-08-28,2019-08-28,,Adam Ounas
US Sassuolo,6574,25.01.2018,25.01.2018,-,1,2018-01-25,2018-01-25,,Adam Ounas
SSC Neapel,6195,03.07.2017,04.07.2017,-,1,2017-07-03,2017-07-04,,Adam Ounas
FC Red Bull Salzburg,409,21.06.2016,21.06.2016,-,1,2016-06-21,2016-06-21,,Adam Ounas
RB Leipzig,23826,16.06.2016,16.06.2016,-,1,2016-06-16,2016-06-16,,Adam Ounas
Manchester United,985,21.04.2016,21.04.2016,-,2,2016-04-21,2016-04-21,,Adam Ounas
SV Waldhof Mannheim,85,04.07.2025,04.07.2025,-,1,2025-07-04,2025-07-04,,Adama Diakhaby
1.FC Magdeburg,187,29.09.2022,01.10.2022,-,1,2022-09-29,2022-10-01,,Adama Diakhaby
Amiens SC,1416,02.02.2021,02.02.2021,-,1,2021-02-02,2021-02-02,,Adama Diakhaby
Nottingham Forest,703,20.01.2020,20.01.2020,-,1,2020-01-20,2020-01-20,,Adama Diakhaby
FC Schalke 04,33,09.06.2019,09.06.2019,-,1,2019-06-09,2019-06-09,,Adama Diakhaby
Huddersfield Town,1110,20.07.2018,20.07.2018,-,1,2018-07-20,2018-07-20,,Adama Diakhaby
AS Monaco,162,02.08.2017,02.08.2017,-,1,2017-08-02,2017-08-02,,Adama Diakhaby
Newcastle United,762,26.06.2017,26.06.2017,-,1,2017-06-26,2017-06-26,,Adama Diakhaby
Sampdoria Genua,1038,27.11.2024,27.11.2024,-,1,2024-11-27,2024-11-27,,Adama Soumaoro
AS Monaco,162,14.11.2018,14.11.2018,-,1,2018-11-14,2018-11-14,,Adama Soumaoro
Lokomotiv Moskau,932,20.08.2018,20.08.2018,-,1,2018-08-20,2018-08-20,,Adama Soumaoro
Olympique Lyon,1041,20.08.2018,20.08.2018,-,1,2018-08-20,2018-08-20,,Adama Soumaoro
FC Everton,29,06.08.2018,06.08.2018,-,1,2018-08-06,2018-08-06,,Adama Soumaoro
AFC Sunderland,289,23.02.2016,23.02.2016,-,1,2016-02-23,2016-02-23,,Adama Soumaoro
FC Sevilla,368,27.04.2025,27.04.2025,-,1,2025-04-27,2025-04-27,,Adama Traoré
Besiktas JK,114,14.01.2025,14.01.2025,-,1,2025-01-14,2025-01-14,,Adama Traoré
FC Fulham,931,11.08.2023,11.08.2023,-,1,2023-08-11,2023-08-11,,Adama Traoré
AS Rom,12,08.07.2023,08.07.2023,-,1,2023-07-08,2023-07-08,,Adama Traoré
SSC Neapel,6195,03.07.2023,03.07.2023,-,1,2023-07-03,2023-07-03,,Adama Traoré
AC Mailand,5,01.07.2023,01.07.2023,-,1,2023-07-01,2023-07-01,,Adama Traoré
SSC Neapel,6195,19.01.2023,19.01.2023,-,1,2023-01-19,2023-01-19,,Adama Traoré
Atlético Madrid,13,08.12.2022,08.12.2022,-,1,2022-12-08,2022-12-08,,Adama Traoré
Real Betis Sevilla,150,26.11.2022,26.11.2022,-,1,2022-11-26,2022-11-26,,Adama Traoré
Leeds United,399,17.06.2022,18.06.2022,-,1,2022-06-17,2022-06-18,,Adama Traoré
FC Everton,29,21.04.2022,21.04.2022,-,1,2022-04-21,2022-04-21,,Adama Traoré
FC Barcelona,131,27.01.2022,28.01.2022,-,1,2022-01-27,2022-01-28,,Adama Traoré
Tottenham Hotspur,148,24.01.2022,27.01.2022,-,1,2022-01-24,2022-01-27,,Adama Traoré
FC Valencia,1049,09.11.2021,09.11.2021,-,1,2021-11-09,2021-11-09,,Adama Traoré
Juventus Turin,506,07.07.2020,07.07.2020,-,1,2020-07-07,2020-07-07,,Adama Traoré
Manchester City,281,07.07.2020,07.07.2020,-,2,2020-07-07,2020-07-07,,Adama Traoré
FC Liverpool,31,24.05.2020,25.05.2020,-,2,2020-05-24,2020-05-25,,Adama Traoré
FC Bayern München,27,22.05.2020,22.05.2020,-,2,2020-05-22,2020-05-22,,Adama Traoré
Manchester United,985,20.05.2020,20.05.2020,-,2,2020-05-20,2020-05-20,,Adama Traoré
FC Bayern München,27,04.04.2020,05.04.2020,-,2,2020-04-04,2020-04-05,,Adama Traoré
Real Madrid,418,07.02.2020,07.02.2020,-,2,2020-02-07,2020-02-07,,Adama Traoré
AS Rom,12,02.10.2019,02.10.2019,-,2,2019-10-02,2019-10-02,,Adama Traoré
FC Middlesbrough,641,31.01.2019,31.01.2019,-,2,2019-01-31,2019-01-31,,Adama Traoré
Wolverhampton Wanderers,543,08.08.2018,08.08.2018,-,2,2018-08-08,2018-08-08,,Adama Traoré
Huddersfield Town,1110,03.07.2018,03.07.2018,-,2,2018-07-03,2018-07-03,,Adama Traoré
FC Paris Saint-Germain,583,18.06.2018,18.06.2018,-,2,2018-06-18,2018-06-18,,Adama Traoré
Newcastle United,762,29.05.2018,29.05.2018,-,2,2018-05-29,2018-05-29,,Adama Traoré
FC Chelsea,631,06.05.2018,06.05.2018,-,2,2018-05-06,2018-05-06,,Adama Traoré
LOSC Lille,1082,28.08.2017,28.08.2017,-,2,2017-08-28,2017-08-28,,Adama Traoré
FC Middlesbrough,641,31.08.2016,31.08.2016,-,2,2016-08-31,2016-08-31,,Adama Traoré
Aston Villa,405,13.08.2015,13.08.2015,-,3,2015-08-13,2015-08-13,,Adama Traoré
West Ham United,379,12.08.2015,12.08.2015,-,3,2015-08-12,2015-08-12,,Adama Traoré
FC Liverpool,31,04.08.2015,04.08.2015,-,3,2015-08-04,2015-08-04,,Adama Traoré
Sampdoria Genua,1038,25.06.2015,25.06.2015,-,3,2015-06-25,2015-06-25,,Adama Traoré
Stoke City,512,26.01.2015,26.01.2015,-,3,2015-01-26,2015-01-26,,Adama Traoré
FC Everton,29,26.12.2014,26.12.2014,-,3,2014-12-26,2014-12-26,,Adama Traoré
Galatasaray,141,03.09.2025,03.09.2025,46 %,1,2025-09-03,2025-09-03,46.0,Ademola Lookman
FC Bayern München,27,01.09.2025,01.09.2025,34 %,1,2025-09-01,2025-09-01,34.0,Ademola Lookman
Juventus Turin,506,09.04.2025,09.04.2025,-,1,2025-04-09,2025-04-09,,Ademola Lookman
FC Paris Saint-Germain,583,21.08.2024,21.08.2024,-,1,2024-08-21,2024-08-21,,Ademola Lookman
Atalanta Bergamo,800,04.08.2022,04.08.2022,-,1,2022-08-04,2022-08-04,,Ademola Lookman
Leicester City,1003,09.07.2022,09.07.2022,-,1,2022-07-09,2022-07-09,,Ademola Lookman
Crystal Palace,873,28.08.2021,31.08.2021,-,1,2021-08-28,2021-08-31,,Ademola Lookman
FC Burnley,1132,02.08.2021,31.08.2021,-,1,2021-08-02,2021-08-31,,Ademola Lookman
FC Watford,1010,02.08.2021,31.08.2021,-,1,2021-08-02,2021-08-31,,Ademola Lookman
Wolverhampton Wanderers,543,,31.08.2021,-,1,,2021-08-31,,Ademola Lookman
Hertha BSC,44,23.08.2021,23.08.2021,-,1,2021-08-23,2021-08-23,,Ademola Lookman
FC Fulham,931,30.09.2020,30.09.2020,-,1,2020-09-30,2020-09-30,,Ademola Lookman
Besiktas JK,114,06.05.2020,06.05.2020,-,1,2020-05-06,2020-05-06,,Ademola Lookman
Newcastle United,762,27.01.2020,27.01.2020,-,1,2020-01-27,2020-01-27,,Ademola Lookman
RB Leipzig,23826,25.07.2019,25.07.2019,-,1,2019-07-25,2019-07-25,,Ademola Lookman
FC Southampton,180,18.05.2019,18.05.2019,-,2,2019-05-18,2019-05-18,,Ademola Lookman
AC Mailand,5,29.01.2019,29.01.2019,-,2,2019-01-29,2019-01-29,,Ademola Lookman
Crystal Palace,873,04.11.2018,04.11.2018,-,2,2018-11-04,2018-11-04,,Ademola Lookman
RB Leipzig,23826,31.08.2018,31.08.2018,-,2,2018-08-31,2018-08-31,,Ademola Lookman
FC Everton,29,04.01.2017,04.01.2017,-,2,2017-01-04,2017-01-04,,Ademola Lookman
RB Leipzig,23826,10.11.2016,10.11.2016,-,2,2016-11-10,2016-11-10,,Ademola Lookman
FC Southampton,180,17.04.2016,17.04.2016,-,2,2016-04-17,2016-04-17,,Ademola Lookman
FC Liverpool,31,28.03.2016,28.03.2016,-,2,2016-03-28,2016-03-28,,Ademola Lookman
FC Chelsea,631,14.01.2016,14.01.2016,-,2,2016-01-14,2016-01-14,,Ademola Lookman
Tottenham Hotspur,148,14.01.2016,14.01.2016,-,2,2016-01-14,2016-01-14,,Ademola Lookman
Manchester City,281,14.01.2016,14.01.2016,-,2,2016-01-14,2016-01-14,,Ademola Lookman
FC Arsenal,11,14.01.2016,14.01.2016,-,2,2016-01-14,2016-01-14,,Ademola Lookman
FC Chelsea,631,17.12.2015,17.12.2015,-,2,2015-12-17,2015-12-17,,Ademola Lookman
Tottenham Hotspur,148,17.12.2015,17.12.2015,-,2,2015-12-17,2015-12-17,,Ademola Lookman
Manchester City,281,17.12.2015,17.12.2015,-,2,2015-12-17,2015-12-17,,Ademola Lookman
AFC Sunderland,289,01.09.2023,01.09.2023,-,1,2023-09-01,2023-09-01,,Adil Aouchiche
Feyenoord Rotterdam,234,13.07.2022,13.07.2022,-,1,2022-07-13,2022-07-13,,Adil Aouchiche
AS Saint-Étienne,618,20.07.2020,20.07.2020,-,1,2020-07-20,2020-07-20,,Adil Aouchiche
FC Schalke 04,33,20.07.2020,20.07.2020,-,1,2020-07-20,2020-07-20,,Adil Aouchiche
FC Bayern München,27,20.07.2020,20.07.2020,-,1,2020-07-20,2020-07-20,,Adil Aouchiche
Bayer 04 Leverkusen,15,19.06.2020,19.06.2020,-,1,2020-06-19,2020-06-19,,Adil Aouchiche
Galatasaray,141,04.04.2020,04.04.2020,-,1,2020-04-04,2020-04-04,,Adil Aouchiche
FC Girondins Bordeaux,40,04.04.2020,04.04.2020,-,1,2020-04-04,2020-04-04,,Adil Aouchiche
AS Saint-Étienne,618,18.06.2022,22.06.2022,-,1,2022-06-18,2022-06-22,,Adil Rami
Olympique Marseille,244,14.07.2017,14.07.2017,-,1,2017-07-14,2017-07-14,,Adil Rami
FC Paris Saint-Germain,583,31.01.2017,31.01.2017,-,1,2017-01-31,2017-01-31,,Adil Rami
Leicester City,1003,13.07.2016,13.07.2016,-,1,2016-07-13,2016-07-13,,Adil Rami
Zenit St. Petersburg,964,17.06.2016,17.06.2016,-,1,2016-06-17,2016-06-17,,Adil Rami
FC Liverpool,31,17.06.2016,17.06.2016,-,1,2016-06-17,2016-06-17,,Adil Rami
FC Arsenal,11,17.06.2016,17.06.2016,-,1,2016-06-17,2016-06-17,,Adil Rami
FC Everton,29,17.06.2016,17.06.2016,-,1,2016-06-17,2016-06-17,,Adil Rami
AS Monaco,162,27.08.2014,27.08.2014,-,1,2014-08-27,2014-08-27,,Adil Rami
FC Arsenal,11,14.05.2014,15.05.2014,-,1,2014-05-14,2014-05-15,,Adil Rami
AC Mailand,5,14.05.2014,14.05.2014,-,1,2014-05-14,2014-05-14,,Adil Rami
Manchester United,985,26.04.2014,26.04.2014,-,1,2014-04-26,2014-04-26,,Adil Rami
Olympique Marseille,244,24.04.2014,25.04.2014,-,1,2014-04-24,2014-04-25,,Adil Rami
AS Rom,12,18.07.2013,18.07.2013,-,1,2013-07-18,2013-07-18,,Adil Rami
SSC Neapel,6195,21.06.2013,21.06.2013,-,1,2013-06-21,2013-06-21,,Adil Rami
Borussia Dortmund,16,18.06.2013,19.06.2013,-,2,2013-06-18,2013-06-19,,Adil Rami
Inter Mailand,46,01.06.2013,01.06.2013,-,2,2013-06-01,2013-06-01,,Adil Rami
Lazio Rom,398,31.05.2013,31.05.2013,-,2,2013-05-31,2013-05-31,,Adil Rami
FC Chelsea,631,11.05.2013,11.05.2013,-,2,2013-05-11,2013-05-11,,Adil Rami
Anzhi Makhachkala,2700,10.04.2013,10.04.2013,-,2,2013-04-10,2013-04-10,,Adil Rami
FC Barcelona,131,21.09.2011,21.09.2011,-,2,2011-09-21,2011-09-21,,Adil Rami
FC Valencia,1049,21.12.2010,22.12.2010,-,2,2010-12-21,2010-12-22,,Adil Rami
FC Bayern München,27,21.12.2010,21.12.2010,-,2,2010-12-21,2010-12-21,,Adil Rami
Olympique Lyon,1041,21.06.2010,21.06.2010,-,2,2010-06-21,2010-06-21,,Adil Rami
Juventus Turin,506,04.05.2010,04.05.2010,-,2,2010-05-04,2010-05-04,,Adil Rami
FC Liverpool,31,23.02.2010,24.02.2010,-,2,2010-02-23,2010-02-24,,Adil Rami
Al-Tai FC,40079,29.08.2023,29.08.2023,-,1,2023-08-29,2023-08-29,,Adnan Januzaj
Basaksehir FK,6890,31.01.2023,31.01.2023,-,1,2023-01-31,2023-01-31,,Adnan Januzaj
FC Valencia,1049,15.01.2023,15.01.2023,-,1,2023-01-15,2023-01-15,,Adnan Januzaj
FC Sevilla,368,30.08.2022,30.08.2022,-,1,2022-08-30,2022-08-30,,Adnan Januzaj
FC Everton,29,23.07.2022,23.07.2022,-,1,2022-07-23,2022-07-23,,Adnan Januzaj
West Ham United,379,15.06.2022,15.06.2022,-,1,2022-06-15,2022-06-15,,Adnan Januzaj
SSC Neapel,6195,01.02.2022,01.02.2022,-,1,2022-02-01,2022-02-01,,Adnan Januzaj
AS Rom,12,23.01.2020,23.01.2020,-,1,2020-01-23,2020-01-23,,Adnan Januzaj
FC Everton,29,19.03.2019,19.03.2019,-,1,2019-03-19,2019-03-19,,Adnan Januzaj
Real Sociedad San Sebastián,681,13.07.2017,13.07.2017,-,1,2017-07-13,2017-07-13,,Adnan Januzaj
AS Rom,12,14.06.2017,14.06.2017,-,1,2017-06-14,2017-06-14,,Adnan Januzaj
Olympique Lyon,1041,11.01.2017,11.01.2017,-,1,2017-01-11,2017-01-11,,Adnan Januzaj
AFC Sunderland,289,10.08.2016,10.08.2016,-,1,2016-08-10,2016-08-10,,Adnan Januzaj
Lazio Rom,398,03.08.2016,03.08.2016,-,1,2016-08-03,2016-08-03,,Adnan Januzaj
AC Mailand,5,30.07.2016,30.07.2016,-,1,2016-07-30,2016-07-30,,Adnan Januzaj
AC Florenz,430,14.03.2016,14.03.2016,-,2,2016-03-14,2016-03-14,,Adnan Januzaj
Manchester United,985,07.01.2016,07.01.2016,-,2,2016-01-07,2016-01-07,,Adnan Januzaj
FC Barcelona,131,09.10.2015,09.10.2015,-,2,2015-10-09,2015-10-09,,Adnan Januzaj
Borussia Dortmund,16,31.08.2015,31.08.2015,-,2,2015-08-31,2015-08-31,,Adnan Januzaj
VfL Wolfsburg,82,25.08.2015,25.08.2015,-,2,2015-08-25,2015-08-25,,Adnan Januzaj
West Ham United,379,25.08.2015,25.08.2015,-,2,2015-08-25,2015-08-25,,Adnan Januzaj
FC Everton,29,26.06.2015,03.07.2015,-,2,2015-06-26,2015-07-03,,Adnan Januzaj
PSV Eindhoven,383,04.05.2015,04.05.2015,-,2,2015-05-04,2015-05-04,,Adnan Januzaj
FC Paris Saint-Germain,583,16.01.2015,16.01.2015,-,2,2015-01-16,2015-01-16,,Adnan Januzaj
FC Porto,720,16.01.2015,16.01.2015,-,2,2015-01-16,2015-01-16,,Adnan Januzaj
Juventus Turin,506,16.01.2015,16.01.2015,-,2,2015-01-16,2015-01-16,,Adnan Januzaj
Aston Villa,405,11.01.2015,11.01.2015,-,2,2015-01-11,2015-01-11,,Adnan Januzaj
Hull City,3008,23.12.2014,23.12.2014,-,2,2014-12-23,2014-12-23,,Adnan Januzaj
Inter Mailand,46,23.12.2014,23.12.2014,-,2,2014-12-23,2014-12-23,,Adnan Januzaj
FC Bayern München,27,10.05.2014,08.08.2014,-,2,2014-05-10,2014-08-08,,Adnan Januzaj
FC Barcelona,131,10.10.2013,10.10.2013,-,3,2013-10-10,2013-10-10,,Adnan Januzaj
Manchester City,281,15.09.2013,15.09.2013,-,3,2013-09-15,2013-09-15,,Adnan Januzaj
AC Mailand,5,11.06.2025,11.06.2025,-,1,2025-06-11,2025-06-11,,Adrien Rabiot
Olympique Marseille,244,15.09.2024,15.09.2024,-,1,2024-09-15,2024-09-15,,Adrien Rabiot
Newcastle United,762,13.09.2024,13.09.2024,-,1,2024-09-13,2024-09-13,,Adrien Rabiot
Manchester United,985,10.09.2024,11.09.2024,-,1,2024-09-10,2024-09-11,,Adrien Rabiot
Galatasaray,141,08.09.2024,08.09.2024,-,1,2024-09-08,2024-09-08,,Adrien Rabiot
Al-Nassr FC,18544,08.09.2024,08.09.2024,-,1,2024-09-08,2024-09-08,,Adrien Rabiot
FC Bayern München,27,28.08.2024,29.08.2024,-,1,2024-08-28,2024-08-29,,Adrien Rabiot
FC Liverpool,31,22.08.2024,23.08.2024,-,1,2024-08-22,2024-08-23,,Adrien Rabiot
Real Madrid,418,08.07.2024,18.07.2024,-,1,2024-07-08,2024-07-18,,Adrien Rabiot
Manchester United,985,02.05.2024,02.05.2024,-,1,2024-05-02,2024-05-02,,Adrien Rabiot
FC Bayern München,27,27.06.2023,27.06.2023,-,1,2023-06-27,2023-06-27,,Adrien Rabiot
AS Monaco,162,29.07.2022,29.07.2022,-,1,2022-07-29,2022-07-29,,Adrien Rabiot
Olympique Lyon,1041,25.07.2022,25.07.2022,-,1,2022-07-25,2022-07-25,,Adrien Rabiot
FC Liverpool,31,23.06.2022,15.07.2022,-,1,2022-06-23,2022-07-15,,Adrien Rabiot
FC Chelsea,631,23.06.2022,23.06.2022,-,1,2022-06-23,2022-06-23,,Adrien Rabiot
Newcastle United,762,10.11.2021,15.11.2021,-,2,2021-11-10,2021-11-15,,Adrien Rabiot
Borussia Dortmund,16,11.10.2021,12.10.2021,-,2,2021-10-11,2021-10-12,,Adrien Rabiot
Manchester City,281,26.03.2021,26.03.2021,-,2,2021-03-26,2021-03-26,,Adrien Rabiot
FC Everton,29,17.02.2021,17.02.2021,-,2,2021-02-17,2021-02-17,,Adrien Rabiot
FC Barcelona,131,04.07.2020,04.07.2020,-,2,2020-07-04,2020-07-04,,Adrien Rabiot
FC Arsenal,11,22.05.2020,22.05.2020,-,2,2020-05-22,2020-05-22,,Adrien Rabiot
Tottenham Hotspur,148,24.10.2019,24.10.2019,-,2,2019-10-24,2019-10-24,,Adrien Rabiot
FC Everton,29,01.07.2019,01.07.2019,-,2,2019-07-01,2019-07-01,,Adrien Rabiot
Manchester United,985,01.07.2019,01.07.2019,-,2,2019-07-01,2019-07-01,,Adrien Rabiot
Juventus Turin,506,01.07.2019,01.07.2019,-,2,2019-07-01,2019-07-01,,Adrien Rabiot
Real Betis Sevilla,150,30.05.2019,30.05.2019,-,2,2019-05-30,2019-05-30,,Adrien Rabiot
FC Bayern München,27,08.05.2019,08.05.2019,-,2,2019-05-08,2019-05-08,,Adrien Rabiot
Real Madrid,418,02.04.2019,02.04.2019,-,2,2019-04-02,2019-04-02,,Adrien Rabiot
Atlético Madrid,13,20.03.2019,26.03.2019,-,2,2019-03-20,2019-03-26,,Adrien Rabiot
Tottenham Hotspur,148,27.01.2019,27.01.2019,-,2,2019-01-27,2019-01-27,,Adrien Rabiot
FC Chelsea,631,13.01.2019,13.01.2019,-,3,2019-01-13,2019-01-13,,Adrien Rabiot
FC Liverpool,31,03.01.2019,03.01.2019,-,3,2019-01-03,2019-01-03,,Adrien Rabiot
FC Barcelona,131,23.12.2018,23.12.2018,-,3,2018-12-23,2018-12-23,,Adrien Rabiot
FC Arsenal,11,05.12.2018,05.12.2018,-,3,2018-12-05,2018-12-05,,Adrien Rabiot
Manchester City,281,30.08.2018,30.08.2018,-,3,2018-08-30,2018-08-30,,Adrien Rabiot
SSC Neapel,6195,15.12.2015,15.12.2015,-,3,2015-12-15,2015-12-15,,Adrien Rabiot
AC Mailand,5,24.11.2015,24.11.2015,-,3,2015-11-24,2015-11-24,,Adrien Rabiot
Inter Mailand,46,24.11.2015,24.11.2015,-,3,2015-11-24,2015-11-24,,Adrien Rabiot
AS Rom,12,28.06.2015,28.06.2015,-,3,2015-06-28,2015-06-28,,Adrien Rabiot
Hamburger SV,41,31.01.2015,13.02.2015,-,3,2015-01-31,2015-02-13,,Adrien Rabiot
FC Sevilla,368,29.01.2015,29.01.2015,-,3,2015-01-29,2015-01-29,,Adrien Rabiot
Ajax Amsterdam,610,12.10.2014,12.10.2014,-,3,2014-10-12,2014-10-12,,Adrien Rabiot
Borussia Dortmund,16,28.05.2014,28.05.2014,-,3,2014-05-28,2014-05-28,,Adrien Rabiot
FC Toulouse,415,05.08.2013,05.08.2013,-,3,2013-08-05,2013-08-05,,Adrien Rabiot
Sampdoria Genua,1038,04.10.2020,04.10.2020,-,1,2020-10-04,2020-10-04,,Adrien Silva
Sporting Lissabon,336,24.03.2020,24.03.2020,-,1,2020-03-24,2020-03-24,,Adrien Silva
AS Monaco,162,23.08.2019,23.08.2019,-,1,2019-08-23,2019-08-23,,Adrien Silva
FC Stade Rennes,273,19.08.2019,19.08.2019,-,1,2019-08-19,2019-08-19,,Adrien Silva
Inter Mailand,46,23.01.2019,23.01.2019,-,1,2019-01-23,2019-01-23,,Adrien Silva
FC Girondins Bordeaux,40,19.01.2019,19.01.2019,-,1,2019-01-19,2019-01-19,,Adrien Silva
Leicester City,1003,16.11.2017,16.11.2017,-,1,2017-11-16,2017-11-16,,Adrien Silva
FC Everton,29,12.07.2017,12.07.2017,-,1,2017-07-12,2017-07-12,,Adrien Silva
Tottenham Hotspur,148,12.07.2017,12.07.2017,-,1,2017-07-12,2017-07-12,,Adrien Silva
Juventus Turin,506,06.01.2017,06.01.2017,-,1,2017-01-06,2017-01-06,,Adrien Silva
West Ham United,379,09.08.2012,09.08.2012,-,1,2012-08-09,2012-08-09,,Adrien Silva
Montpellier HSC,969,16.06.2012,16.06.2012,-,1,2012-06-16,2012-06-16,,Adrien Silva
RC Lens,826,12.01.2023,12.01.2023,-,1,2023-01-12,2023-01-12,,Adrien Thomasson
SV Werder Bremen,86,03.08.2019,03.08.2019,-,1,2019-08-03,2019-08-03,,Adrien Thomasson
SC Freiburg,60,05.06.2018,16.06.2018,-,1,2018-06-05,2018-06-16,,Adrien Thomasson
Parma Calcio 1913,130,05.06.2018,05.06.2018,-,1,2018-06-05,2018-06-05,,Adrien Thomasson
Olympiakos Piräus,683,13.05.2018,13.05.2018,-,1,2018-05-13,2018-05-13,,Adrien Thomasson
FC Schalke 04,33,10.04.2018,10.04.2018,-,1,2018-04-10,2018-04-10,,Adrien Thomasson
1.FSV Mainz 05,39,02.04.2018,02.04.2018,-,1,2018-04-02,2018-04-02,,Adrien Thomasson
FC Nantes,995,03.06.2015,03.06.2015,-,1,2015-06-03,2015-06-03,,Adrien Thomasson
Manchester United,985,10.06.2016,10.06.2016,-,1,2016-06-10,2016-06-10,,Afriyie Acquah
Parma Calcio 1913,130,29.06.2014,22.07.2013,-,1,2014-06-29,2013-07-22,,Afriyie Acquah
Sampdoria Genua,1038,29.06.2013,29.06.2013,-,1,2013-06-29,2013-06-29,,Afriyie Acquah
US Sassuolo,6574,22.06.2013,22.06.2013,-,1,2013-06-22,2013-06-22,,Afriyie Acquah
TSG 1899 Hoffenheim,533,24.01.2013,24.01.2013,-,1,2013-01-24,2013-01-24,,Afriyie Acquah
AC Florenz,430,29.01.2022,29.01.2022,-,1,2022-01-29,2022-01-29,,Agustín Álvarez
FC Barcelona,131,15.12.2021,15.12.2021,-,1,2021-12-15,2021-12-15,,Agustín Álvarez
Borussia Dortmund,16,01.12.2021,02.12.2021,-,1,2021-12-01,2021-12-02,,Agustín Álvarez
Real Madrid,418,13.09.2021,13.09.2021,-,1,2021-09-13,2021-09-13,,Agustín Álvarez
Göztepe,1467,29.05.2025,29.05.2025,-,1,2025-05-29,2025-05-29,,Ahmed Kutucu
Shakhtar Donetsk,660,29.05.2025,29.05.2025,-,1,2025-05-29,2025-05-29,,Ahmed Kutucu
Raków Czestochowa,9644,29.05.2025,29.05.2025,-,1,2025-05-29,2025-05-29,,Ahmed Kutucu
Galatasaray,141,23.01.2025,23.01.2025,-,1,2025-01-23,2025-01-23,,Ahmed Kutucu
SV Sandhausen,254,12.01.2022,12.01.2022,-,1,2022-01-12,2022-01-12,,Ahmed Kutucu
Basaksehir FK,6890,04.07.2021,04.07.2021,-,1,2021-07-04,2021-07-04,,Ahmed Kutucu
FC Schalke 04,33,22.04.2021,22.04.2021,-,1,2021-04-22,2021-04-22,,Ahmed Kutucu
Heracles Almelo,1304,21.01.2021,21.01.2021,-,1,2021-01-21,2021-01-21,,Ahmed Kutucu
Hannover 96,42,06.01.2021,21.01.2021,-,1,2021-01-06,2021-01-21,,Ahmed Kutucu
Trabzonspor,449,13.01.2021,14.01.2021,-,1,2021-01-13,2021-01-14,,Ahmed Kutucu
Fenerbahce,36,30.12.2020,14.01.2021,-,1,2020-12-30,2021-01-14,,Ahmed Kutucu
1.FC Union Berlin,89,05.01.2021,06.01.2021,-,1,2021-01-05,2021-01-06,,Ahmed Kutucu
Arminia Bielefeld,10,05.01.2021,05.01.2021,-,1,2021-01-05,2021-01-05,,Ahmed Kutucu
US Sassuolo,6574,05.01.2021,05.01.2021,-,1,2021-01-05,2021-01-05,,Ahmed Kutucu
TSG 1899 Hoffenheim,533,05.01.2021,05.01.2021,-,1,2021-01-05,2021-01-05,,Ahmed Kutucu
1.FSV Mainz 05,39,04.01.2021,05.01.2021,-,2,2021-01-04,2021-01-05,,Ahmed Kutucu
Parma Calcio 1913,130,04.01.2021,04.01.2021,-,2,2021-01-04,2021-01-04,,Ahmed Kutucu
Hellas Verona,276,04.01.2021,04.01.2021,-,2,2021-01-04,2021-01-04,,Ahmed Kutucu
Besiktas JK,114,03.01.2021,04.01.2021,-,2,2021-01-03,2021-01-04,,Ahmed Kutucu
Olympique Marseille,244,16.09.2020,16.09.2020,-,2,2020-09-16,2020-09-16,,Ahmed Kutucu
Galatasaray,141,15.07.2020,24.07.2020,-,2,2020-07-15,2020-07-24,,Ahmed Kutucu
Fortuna Düsseldorf,38,16.11.2019,20.11.2019,-,2,2019-11-16,2019-11-20,,Ahmed Kutucu
SV Werder Bremen,86,18.11.2019,18.11.2019,-,2,2019-11-18,2019-11-18,,Ahmed Kutucu
SC Freiburg,60,16.11.2019,16.11.2019,-,2,2019-11-16,2019-11-16,,Ahmed Kutucu
FC Bayern München,27,10.02.2019,10.02.2019,-,2,2019-02-10,2019-02-10,,Ahmed Kutucu
Olympique Lyon,1041,07.08.2023,07.08.2023,-,1,2023-08-07,2023-08-07,,Ainsley Maitland-Niles
SV Werder Bremen,86,05.08.2023,07.08.2023,-,1,2023-08-05,2023-08-07,,Ainsley Maitland-Niles
FC Southampton,180,31.08.2022,31.08.2022,-,1,2022-08-31,2022-08-31,,Ainsley Maitland-Niles
Nottingham Forest,703,11.06.2022,11.06.2022,-,1,2022-06-11,2022-06-11,,Ainsley Maitland-Niles
AS Rom,12,04.01.2022,04.01.2022,-,1,2022-01-04,2022-01-04,,Ainsley Maitland-Niles
FC Everton,29,01.01.2022,01.01.2022,-,1,2022-01-01,2022-01-01,,Ainsley Maitland-Niles
FC Burnley,1132,22.07.2021,22.07.2021,-,1,2021-07-22,2021-07-22,,Ainsley Maitland-Niles
Leicester City,1003,22.07.2021,22.07.2021,-,1,2021-07-22,2021-07-22,,Ainsley Maitland-Niles
FC Watford,1010,19.06.2021,19.06.2021,-,1,2021-06-19,2021-06-19,,Ainsley Maitland-Niles
Crystal Palace,873,20.04.2021,20.04.2021,-,1,2021-04-20,2021-04-20,,Ainsley Maitland-Niles
West Bromwich Albion,984,01.02.2021,01.02.2021,-,1,2021-02-01,2021-02-01,,Ainsley Maitland-Niles
Wolverhampton Wanderers,543,22.08.2020,30.08.2020,-,1,2020-08-22,2020-08-30,,Ainsley Maitland-Niles
FC Arsenal,11,17.11.2020,17.11.2020,-,1,2020-11-17,2020-11-17,,Aitor Fernández
BSC Young Boys,452,08.07.2025,09.07.2025,-,1,2025-07-08,2025-07-09,,Alan Virginius
Genua CFC,252,25.06.2025,25.06.2025,-,1,2025-06-25,2025-06-25,,Alan Virginius
Fenerbahce,36,23.03.2025,23.03.2025,-,1,2025-03-23,2025-03-23,,Alan Virginius
SC Freiburg,60,03.06.2024,03.06.2024,-,1,2024-06-03,2024-06-03,,Alan Virginius
Clermont Foot 63,3524,08.01.2024,08.01.2024,-,1,2024-01-08,2024-01-08,,Alan Virginius
AFC Sunderland,289,25.08.2023,25.08.2023,-,1,2023-08-25,2023-08-25,,Alan Virginius
Bayer 04 Leverkusen,15,01.07.2022,01.07.2022,-,1,2022-07-01,2022-07-01,,Alan Virginius
RSC Anderlecht,58,21.05.2022,21.05.2022,-,1,2022-05-21,2022-05-21,,Alan Virginius
FC Stade Rennes,273,04.04.2022,04.04.2022,-,1,2022-04-04,2022-04-04,,Alan Virginius
VfB Stuttgart,79,07.07.2021,07.07.2021,-,1,2021-07-07,2021-07-07,,Alan Virginius
Borussia Mönchengladbach,18,28.05.2021,03.07.2021,-,1,2021-05-28,2021-07-03,,Alan Virginius
VfL Wolfsburg,82,28.05.2021,28.05.2021,-,1,2021-05-28,2021-05-28,,Alan Virginius
PSV Eindhoven,383,16.07.2025,17.07.2025,83 %,1,2025-07-16,2025-07-17,83.0,Alassane Pléa
LOSC Lille,1082,26.06.2025,26.06.2025,39 %,1,2025-06-26,2025-06-26,39.0,Alassane Pléa
Besiktas JK,114,04.04.2025,25.06.2025,19 %,1,2025-04-04,2025-06-25,19.0,Alassane Pléa
Crystal Palace,873,26.04.2025,29.04.2025,-,1,2025-04-26,2025-04-29,,Alassane Pléa
Olympique Lyon,1041,07.06.2024,11.06.2024,-,1,2024-06-07,2024-06-11,,Alassane Pléa
FC Stade Rennes,273,07.06.2024,07.06.2024,-,1,2024-06-07,2024-06-07,,Alassane Pléa
Fenerbahce,36,05.08.2022,05.08.2022,-,1,2022-08-05,2022-08-05,,Alassane Pléa
OGC Nizza,417,05.08.2022,05.08.2022,-,1,2022-08-05,2022-08-05,,Alassane Pléa
Nottingham Forest,703,22.07.2022,23.07.2022,-,1,2022-07-22,2022-07-23,,Alassane Pléa
Olympique Marseille,244,22.07.2022,22.07.2022,-,1,2022-07-22,2022-07-22,,Alassane Pléa
FC Everton,29,22.07.2022,22.07.2022,-,1,2022-07-22,2022-07-22,,Alassane Pléa
Newcastle United,762,19.01.2022,24.01.2022,-,1,2022-01-19,2022-01-24,,Alassane Pléa
Zenit St. Petersburg,964,19.01.2022,19.01.2022,-,1,2022-01-19,2022-01-19,,Alassane Pléa
Manchester United,985,03.06.2021,06.06.2021,-,1,2021-06-03,2021-06-06,,Alassane Pléa
FC Arsenal,11,03.06.2021,03.06.2021,-,1,2021-06-03,2021-06-03,,Alassane Pléa
Tottenham Hotspur,148,19.05.2020,19.05.2020,-,2,2020-05-19,2020-05-19,,Alassane Pléa
Leicester City,1003,19.05.2020,19.05.2020,-,2,2020-05-19,2020-05-19,,Alassane Pléa
FC Barcelona,131,24.03.2020,31.03.2020,-,2,2020-03-24,2020-03-31,,Alassane Pléa
Borussia Dortmund,16,24.06.2019,24.06.2019,-,2,2019-06-24,2019-06-24,,Alassane Pléa
Dalian Professional (2009-2024),33304,02.02.2019,03.02.2019,-,2,2019-02-02,2019-02-03,,Alassane Pléa
Borussia Mönchengladbach,18,13.07.2018,13.07.2018,-,2,2018-07-13,2018-07-13,,Alassane Pléa
Borussia Dortmund,16,11.07.2018,11.07.2018,-,2,2018-07-11,2018-07-11,,Alassane Pléa
Newcastle United,762,04.07.2018,10.07.2018,-,2,2018-07-04,2018-07-10,,Alassane Pléa
West Ham United,379,02.07.2018,02.07.2018,-,2,2018-07-02,2018-07-02,,Alassane Pléa
Tottenham Hotspur,148,27.06.2018,27.06.2018,-,2,2018-06-27,2018-06-27,,Alassane Pléa
FC Valencia,1049,14.04.2018,14.04.2018,-,2,2018-04-14,2018-04-14,,Alassane Pléa
Panathinaikos Athen,265,17.07.2025,17.07.2025,-,1,2025-07-17,2025-07-17,,Alban Lafont
Stade Brest 29,3911,09.06.2025,09.06.2025,-,1,2025-06-09,2025-06-09,,Alban Lafont
LOSC Lille,1082,09.06.2025,09.06.2025,-,1,2025-06-09,2025-06-09,,Alban Lafont
Celta Vigo,940,25.07.2023,25.07.2023,-,1,2023-07-25,2023-07-25,,Alban Lafont
FC Brentford,1148,10.01.2023,10.01.2023,-,1,2023-01-10,2023-01-10,,Alban Lafont
Real Madrid,418,25.04.2020,25.04.2020,-,1,2020-04-25,2020-04-25,,Alban Lafont
AC Florenz,430,03.07.2018,03.07.2018,-,1,2018-07-03,2018-07-03,,Alban Lafont
PSV Eindhoven,383,29.05.2018,29.05.2018,-,1,2018-05-29,2018-05-29,,Alban Lafont
Crystal Palace,873,29.05.2018,29.05.2018,-,1,2018-05-29,2018-05-29,,Alban Lafont
SSC Neapel,6195,12.03.2018,15.03.2018,-,1,2018-03-12,2018-03-15,,Alban Lafont
FC Arsenal,11,12.03.2018,12.03.2018,-,1,2018-03-12,2018-03-12,,Alban Lafont
FC Barcelona,131,14.02.2018,16.02.2018,-,1,2018-02-14,2018-02-16,,Alban Lafont
Olympique Marseille,244,30.12.2016,30.12.2016,-,1,2016-12-30,2016-12-30,,Alban Lafont
FC Watford,1010,13.10.2016,13.10.2016,-,1,2016-10-13,2016-10-13,,Alban Lafont
FC Porto,720,13.10.2016,13.10.2016,-,1,2016-10-13,2016-10-13,,Alban Lafont
Juventus Turin,506,13.10.2016,13.10.2016,-,2,2016-10-13,2016-10-13,,Alban Lafont
FC Red Bull Salzburg,409,23.03.2016,25.03.2016,-,2,2016-03-23,2016-03-25,,Alban Lafont
Hamburger SV,41,31.08.2025,01.09.2025,83 %,1,2025-08-31,2025-09-01,83.0,Albert Sambi Lokonga
FC Sevilla,368,13.07.2024,13.07.2024,-,1,2024-07-13,2024-07-13,,Albert Sambi Lokonga
FC Everton,29,18.06.2024,18.06.2024,-,1,2024-06-18,2024-06-18,,Albert Sambi Lokonga
FC Bayern München,27,03.06.2024,04.06.2024,-,1,2024-06-03,2024-06-04,,Albert Sambi Lokonga
Luton Town,1031,01.09.2023,01.09.2023,-,1,2023-09-01,2023-09-01,,Albert Sambi Lokonga
Brighton & Hove Albion,1237,22.08.2023,22.08.2023,-,1,2023-08-22,2023-08-22,,Albert Sambi Lokonga
FC Burnley,1132,01.08.2023,01.08.2023,-,1,2023-08-01,2023-08-01,,Albert Sambi Lokonga
Borussia Dortmund,16,,31.01.2023,-,1,,2023-01-31,,Albert Sambi Lokonga
AS Rom,12,27.08.2022,27.08.2022,-,1,2022-08-27,2022-08-27,,Albert Sambi Lokonga
AC Mailand,5,12.08.2022,12.08.2022,-,1,2022-08-12,2022-08-12,,Albert Sambi Lokonga
FC Arsenal,11,19.07.2021,19.07.2021,-,1,2021-07-19,2021-07-19,,Albert Sambi Lokonga
FC Bayern München,27,01.07.2021,01.07.2021,-,1,2021-07-01,2021-07-01,,Albert Sambi Lokonga
Borussia Dortmund,16,,22.01.2021,-,1,,2021-01-22,,Albert Sambi Lokonga
RB Leipzig,23826,21.01.2021,21.01.2021,-,1,2021-01-21,2021-01-21,,Albert Sambi Lokonga
AC Mailand,5,14.01.2021,14.01.2021,-,1,2021-01-14,2021-01-14,,Albert Sambi Lokonga
FC Sevilla,368,14.01.2021,14.01.2021,-,2,2021-01-14,2021-01-14,,Albert Sambi Lokonga
VfL Wolfsburg,82,25.07.2018,26.07.2018,-,1,2018-07-25,2018-07-26,,Alberto Grassi
SSC Neapel,6195,21.01.2016,21.01.2016,-,1,2016-01-21,2016-01-21,,Alberto Grassi
FC Paris Saint-Germain,583,18.01.2016,18.01.2016,-,1,2016-01-18,2016-01-18,,Alberto Grassi
AC Mailand,5,18.01.2016,18.01.2016,-,1,2016-01-18,2016-01-18,,Alberto Grassi
AC Florenz,430,15.01.2016,15.01.2016,-,1,2016-01-15,2016-01-15,,Alberto Grassi
Como 1907,1047,13.07.2024,13.07.2024,-,1,2024-07-13,2024-07-13,,Alberto Moreno
Lazio Rom,398,21.03.2019,21.03.2019,-,1,2019-03-21,2019-03-21,,Alberto Moreno
Borussia Mönchengladbach,18,20.01.2019,22.01.2019,-,1,2019-01-20,2019-01-22,,Alberto Moreno
Fenerbahce,36,19.11.2018,19.11.2018,-,1,2018-11-19,2018-11-19,,Alberto Moreno
FC Sevilla,368,07.11.2018,07.11.2018,-,1,2018-11-07,2018-11-07,,Alberto Moreno
FC Barcelona,131,10.10.2018,10.10.2018,-,1,2018-10-10,2018-10-10,,Alberto Moreno
FC Watford,1010,04.08.2017,04.08.2017,-,1,2017-08-04,2017-08-04,,Alberto Moreno
SSC Neapel,6195,22.06.2017,22.06.2017,-,1,2017-06-22,2017-06-22,,Alberto Moreno
Hertha BSC,44,19.06.2017,21.06.2017,-,1,2017-06-19,2017-06-21,,Alberto Moreno
AC Mailand,5,12.04.2017,12.04.2017,-,1,2017-04-12,2017-04-12,,Alberto Moreno
Inter Mailand,46,12.04.2017,12.04.2017,-,1,2017-04-12,2017-04-12,,Alberto Moreno
AS Rom,12,07.08.2015,07.08.2015,-,1,2015-08-07,2015-08-07,,Alberto Moreno
FC Liverpool,31,13.08.2014,12.08.2014,-,1,2014-08-13,2014-08-12,,Alberto Moreno
FC Chelsea,631,11.05.2014,11.05.2014,-,1,2014-05-11,2014-05-11,,Alberto Moreno
Manchester United,985,05.05.2014,05.05.2014,-,1,2014-05-05,2014-05-05,,Alberto Moreno
Real Madrid,418,30.03.2014,31.03.2014,-,2,2014-03-30,2014-03-31,,Alberto Moreno
Atlético Madrid,13,27.02.2014,28.02.2014,-,2,2014-02-27,2014-02-28,,Alberto Moreno
FC Everton,29,24.09.2013,24.09.2013,-,2,2013-09-24,2013-09-24,,Alberto Moreno
FC Kopenhagen,190,10.01.2022,10.01.2022,-,1,2022-01-10,2022-01-10,,Albin Ekdal
Sampdoria Genua,1038,14.08.2018,14.08.2018,-,1,2018-08-14,2018-08-14,,Albin Ekdal
Besiktas JK,114,07.08.2018,07.08.2018,-,1,2018-08-07,2018-08-07,,Albin Ekdal
Benfica Lissabon,294,01.08.2018,01.08.2018,-,1,2018-08-01,2018-08-01,,Albin Ekdal
Sporting Lissabon,336,31.07.2018,31.07.2018,-,1,2018-07-31,2018-07-31,,Albin Ekdal
Cagliari Calcio,1390,30.07.2018,30.07.2018,-,1,2018-07-30,2018-07-30,,Albin Ekdal
Atalanta Bergamo,800,06.07.2018,06.07.2018,-,1,2018-07-06,2018-07-06,,Albin Ekdal
Udinese Calcio,410,01.07.2018,01.07.2018,-,1,2018-07-01,2018-07-01,,Albin Ekdal
Genua CFC,252,22.06.2018,24.06.2018,-,1,2018-06-22,2018-06-24,,Albin Ekdal
Leeds United,399,02.06.2018,04.06.2018,-,1,2018-06-02,2018-06-04,,Albin Ekdal
SSC Neapel,6195,22.12.2015,24.12.2015,-,1,2015-12-22,2015-12-24,,Albin Ekdal
Hamburger SV,41,18.07.2015,18.07.2015,-,1,2015-07-18,2015-07-18,,Albin Ekdal
Fenerbahce,36,25.06.2015,25.06.2015,-,1,2015-06-25,2015-06-25,,Albin Ekdal
AC Florenz,430,25.06.2015,25.06.2015,-,1,2015-06-25,2015-06-25,,Albin Ekdal
VfB Stuttgart,79,04.06.2015,04.06.2015,-,1,2015-06-04,2015-06-04,,Albin Ekdal
FC Turin,416,27.05.2015,27.05.2015,-,2,2015-05-27,2015-05-27,,Albin Ekdal
Borussia Dortmund,16,20.05.2015,20.05.2015,-,2,2015-05-20,2015-05-20,,Albin Ekdal
FC Schalke 04,33,20.05.2015,20.05.2015,-,2,2015-05-20,2015-05-20,,Albin Ekdal
FC Augsburg,167,11.05.2015,12.05.2015,-,2,2015-05-11,2015-05-12,,Albin Ekdal
Inter Mailand,46,11.05.2015,11.05.2015,-,2,2015-05-11,2015-05-11,,Albin Ekdal
Trabzonspor,449,11.05.2015,11.05.2015,-,2,2015-05-11,2015-05-11,,Albin Ekdal
Lazio Rom,398,03.04.2015,03.04.2015,-,2,2015-04-03,2015-04-03,,Albin Ekdal
1.FC Köln,3,14.01.2015,17.01.2015,-,2,2015-01-14,2015-01-17,,Albin Ekdal
Borussia Mönchengladbach,18,05.08.2011,05.08.2011,-,2,2011-08-05,2011-08-05,,Albin Ekdal
Hannover 96,42,02.08.2011,03.08.2011,-,2,2011-08-02,2011-08-03,,Albin Ekdal
Bayer 04 Leverkusen,15,13.06.2024,13.06.2024,-,1,2024-06-13,2024-06-13,,Aleix García
West Ham United,379,07.06.2024,07.06.2024,-,1,2024-06-07,2024-06-07,,Aleix García
FC Barcelona,131,10.01.2024,10.01.2024,-,1,2024-01-10,2024-01-10,,Aleix García
Manchester City,281,31.07.2015,31.07.2015,-,1,2015-07-31,2015-07-31,,Aleix García
Fenerbahce,36,06.06.2021,06.06.2021,-,1,2021-06-06,2021-06-06,,Aleix Vidal
Basaksehir FK,6890,22.01.2021,22.01.2021,-,1,2021-01-22,2021-01-22,,Aleix Vidal
FC Sevilla,368,03.08.2018,04.08.2018,-,1,2018-08-03,2018-08-04,,Aleix Vidal
AS Rom,12,24.01.2018,24.01.2018,-,1,2018-01-24,2018-01-24,,Aleix Vidal
AC Mailand,5,20.10.2017,20.10.2017,-,1,2017-10-20,2017-10-20,,Aleix Vidal
Juventus Turin,506,28.08.2017,28.08.2017,-,1,2017-08-28,2017-08-28,,Aleix Vidal
Galatasaray,141,03.01.2017,07.01.2017,-,1,2017-01-03,2017-01-07,,Aleix Vidal
Olympique Marseille,244,03.12.2016,03.12.2016,-,1,2016-12-03,2016-12-03,,Aleix Vidal
Inter Mailand,46,31.05.2016,31.05.2016,-,1,2016-05-31,2016-05-31,,Aleix Vidal
FC Liverpool,31,28.05.2016,28.05.2016,-,1,2016-05-28,2016-05-28,,Aleix Vidal
FC Barcelona,131,08.06.2015,27.05.2015,-,1,2015-06-08,2015-05-27,,Aleix Vidal
FC Bologna,1025,21.06.2021,21.06.2021,-,1,2021-06-21,2021-06-21,,Aleksandar Kolarov
Inter Mailand,46,08.09.2020,08.09.2020,-,1,2020-09-08,2020-09-08,,Aleksandar Kolarov
Fenerbahce,36,20.06.2019,01.07.2019,-,1,2019-06-20,2019-07-01,,Aleksandar Kolarov
AS Rom,12,23.07.2017,23.07.2017,-,1,2017-07-23,2017-07-23,,Aleksandar Kolarov
Besiktas JK,114,01.07.2017,02.07.2017,-,1,2017-07-01,2017-07-02,,Aleksandar Kolarov
Inter Mailand,46,10.06.2015,02.12.2014,-,1,2015-06-10,2014-12-02,,Aleksandar Kolarov
Juventus Turin,506,07.05.2014,07.05.2014,-,1,2014-05-07,2014-05-07,,Aleksandar Kolarov
Zenit St. Petersburg,964,15.01.2014,15.01.2014,-,1,2014-01-15,2014-01-15,,Aleksandar Kolarov
Galatasaray,141,15.10.2013,15.10.2013,-,1,2013-10-15,2013-10-15,,Aleksandar Kolarov
FC Everton,29,20.08.2013,20.08.2013,-,1,2013-08-20,2013-08-20,,Aleksandar Kolarov
AC Mailand,5,10.07.2012,10.07.2012,-,1,2012-07-10,2012-07-10,,Aleksandar Kolarov
SSC Neapel,6195,08.06.2012,08.06.2012,-,1,2012-06-08,2012-06-08,,Aleksandar Kolarov
FC Barcelona,131,14.03.2012,14.03.2012,-,1,2012-03-14,2012-03-14,,Aleksandar Kolarov
Atlético Madrid,13,14.03.2012,14.03.2012,-,1,2012-03-14,2012-03-14,,Aleksandar Kolarov
FC Paris Saint-Germain,583,06.01.2012,06.01.2012,-,1,2012-01-06,2012-01-06,,Aleksandar Kolarov
AC Florenz,430,01.05.2011,02.05.2011,-,2,2011-05-01,2011-05-02,,Aleksandar Kolarov
Manchester City,281,24.07.2010,24.07.2010,-,2,2010-07-24,2010-07-24,,Aleksandar Kolarov
Real Madrid,418,12.07.2010,12.07.2010,-,2,2010-07-12,2010-07-12,,Aleksandar Kolarov
FC Bayern München,27,06.01.2010,07.01.2010,-,2,2010-01-06,2010-01-07,,Aleksandar Kolarov
Al-Nassr FC,18544,02.06.2025,02.06.2025,23 %,1,2025-06-02,2025-06-02,23.0,Alessandro Bastoni
Manchester United,985,25.02.2024,25.02.2024,-,1,2024-02-25,2024-02-25,,Alessandro Bastoni
FC Chelsea,631,25.02.2024,25.02.2024,-,1,2024-02-25,2024-02-25,,Alessandro Bastoni
Tottenham Hotspur,148,08.06.2022,08.06.2022,-,1,2022-06-08,2022-06-08,,Alessandro Bastoni
Manchester City,281,26.05.2021,27.05.2021,-,1,2021-05-26,2021-05-27,,Alessandro Bastoni
FC Bayern München,27,19.03.2021,27.03.2021,-,1,2021-03-19,2021-03-27,,Alessandro Bastoni
FC Liverpool,31,19.03.2021,19.03.2021,-,1,2021-03-19,2021-03-19,,Alessandro Bastoni
FC Barcelona,131,19.03.2021,19.03.2021,-,1,2021-03-19,2021-03-19,,Alessandro Bastoni
FC Paris Saint-Germain,583,10.07.2020,10.07.2020,-,1,2020-07-10,2020-07-10,,Alessandro Bastoni
SSC Neapel,6195,12.07.2024,12.07.2024,-,1,2024-07-12,2024-07-12,,Alessandro Buongiorno
Juventus Turin,506,05.05.2024,05.05.2024,-,1,2024-05-05,2024-05-05,,Alessandro Buongiorno
Inter Mailand,46,05.05.2024,05.05.2024,-,1,2024-05-05,2024-05-05,,Alessandro Buongiorno
AC Mailand,5,17.01.2024,17.01.2024,-,1,2024-01-17,2024-01-17,,Alessandro Buongiorno
FC Bayern München,27,16.01.2024,17.01.2024,-,1,2024-01-16,2024-01-17,,Alessandro Buongiorno
FC Chelsea,631,25.12.2023,25.12.2023,-,1,2023-12-25,2023-12-25,,Alessandro Buongiorno
Brighton & Hove Albion,1237,07.01.2023,08.01.2023,-,1,2023-01-07,2023-01-08,,Alessandro Buongiorno
FC Bologna,1025,06.06.2024,06.06.2024,-,1,2024-06-06,2024-06-06,,Alessandro Florenzi
AC Mailand,5,18.08.2021,19.08.2021,-,1,2021-08-18,2021-08-19,,Alessandro Florenzi
FC Paris Saint-Germain,583,11.09.2020,11.09.2020,-,1,2020-09-11,2020-09-11,,Alessandro Florenzi
FC Everton,29,17.08.2020,17.08.2020,-,1,2020-08-17,2020-08-17,,Alessandro Florenzi
Leeds United,399,31.07.2020,31.07.2020,-,1,2020-07-31,2020-07-31,,Alessandro Florenzi
Cagliari Calcio,1390,18.12.2019,18.12.2019,-,1,2019-12-18,2019-12-18,,Alessandro Florenzi
AC Florenz,430,18.12.2019,18.12.2019,-,1,2019-12-18,2019-12-18,,Alessandro Florenzi
Sampdoria Genua,1038,12.11.2019,12.11.2019,-,1,2019-11-12,2019-11-12,,Alessandro Florenzi
Inter Mailand,46,30.06.2018,30.06.2018,-,1,2018-06-30,2018-06-30,,Alessandro Florenzi
FC Chelsea,631,10.06.2018,10.06.2018,-,1,2018-06-10,2018-06-10,,Alessandro Florenzi
Manchester United,985,15.03.2016,16.03.2016,-,1,2016-03-15,2016-03-16,,Alessandro Florenzi
FC Empoli,749,08.01.2019,08.01.2019,-,1,2019-01-08,2019-01-08,,Alessandro Murgia
Wolfsberger AC,4441,06.02.2025,06.02.2025,-,1,2025-02-06,2025-02-06,,Alessandro Schöpf
SC Freiburg,60,09.05.2022,08.07.2022,-,1,2022-05-09,2022-07-08,,Alessandro Schöpf
FC Bologna,1025,,16.01.2022,-,1,,2022-01-16,,Alessandro Schöpf
FC Schalke 04,33,07.01.2016,07.01.2016,-,1,2016-01-07,2016-01-07,,Alessandro Schöpf
Hannover 96,42,30.11.2015,14.12.2015,-,1,2015-11-30,2015-12-14,,Alessandro Schöpf
Hamburger SV,41,09.12.2015,10.12.2015,-,1,2015-12-09,2015-12-10,,Alessandro Schöpf
VfB Stuttgart,79,08.12.2015,08.12.2015,-,1,2015-12-08,2015-12-08,,Alessandro Schöpf
Borussia Mönchengladbach,18,24.06.2014,25.06.2014,-,1,2014-06-24,2014-06-25,,Alessandro Schöpf
1.FC Nürnberg,4,24.06.2014,24.06.2014,-,1,2014-06-24,2014-06-24,,Alessandro Schöpf
FC Bologna,1025,08.08.2025,08.08.2025,-,1,2025-08-08,2025-08-08,,Alessandro Zanoli
Genua CFC,252,02.01.2024,02.01.2024,-,1,2024-01-02,2024-01-02,,Alessandro Zanoli
Sporting Lissabon,336,06.08.2023,06.08.2023,-,1,2023-08-06,2023-08-06,,Alessandro Zanoli
Sampdoria Genua,1038,05.01.2023,05.01.2023,-,1,2023-01-05,2023-01-05,,Alessandro Zanoli
US Salernitana 1919,380,15.12.2022,15.12.2022,-,1,2022-12-15,2022-12-15,,Alessandro Zanoli
FC Empoli,749,10.07.2023,10.07.2023,-,1,2023-07-10,2023-07-10,,Alessio Cragno
US Salernitana 1919,380,11.12.2022,11.12.2022,-,1,2022-12-11,2022-12-11,,Alessio Cragno
AS Rom,12,26.04.2019,26.04.2019,-,1,2019-04-26,2019-04-26,,Alessio Cragno
FC Red Bull Salzburg,409,28.03.2017,04.04.2017,-,1,2017-03-28,2017-04-04,,Alessio Cragno
FC Basel 1893,26,26.01.2014,29.01.2014,-,1,2014-01-26,2014-01-29,,Alessio Cragno
Lazio Rom,398,12.07.2022,12.07.2022,-,1,2022-07-12,2022-07-12,,Alessio Romagnoli
FC Fulham,931,25.06.2022,25.06.2022,-,1,2022-06-25,2022-06-25,,Alessio Romagnoli
FC Barcelona,131,31.03.2021,31.03.2021,-,1,2021-03-31,2021-03-31,,Alessio Romagnoli
FC Chelsea,631,23.10.2018,23.10.2018,-,1,2018-10-23,2018-10-23,,Alessio Romagnoli
Juventus Turin,506,02.06.2018,05.06.2018,-,1,2018-06-02,2018-06-05,,Alessio Romagnoli
FC Everton,29,07.05.2017,07.05.2017,-,1,2017-05-07,2017-05-07,,Alessio Romagnoli
FC Bayern München,27,25.03.2016,27.03.2016,-,1,2016-03-25,2016-03-27,,Alessio Romagnoli
AC Mailand,5,11.08.2015,11.08.2015,-,1,2015-08-11,2015-08-11,,Alessio Romagnoli
FC Chelsea,631,18.07.2015,18.07.2015,-,1,2015-07-18,2015-07-18,,Alessio Romagnoli
SSC Neapel,6195,06.07.2015,06.07.2015,-,1,2015-07-06,2015-07-06,,Alessio Romagnoli
Sampdoria Genua,1038,14.05.2015,14.05.2015,-,1,2015-05-14,2015-05-14,,Alessio Romagnoli
Manchester United,985,05.03.2014,05.03.2014,-,1,2014-03-05,2014-03-05,,Alessio Romagnoli
Vitesse Arnheim,499,08.08.2013,09.08.2013,-,1,2013-08-08,2013-08-09,,Alessio Romagnoli
FC Empoli,749,19.12.2024,19.12.2024,-,1,2024-12-19,2024-12-19,,Alessio Zerbin
FC Lugano,2790,30.01.2020,30.01.2020,-,1,2020-01-30,2020-01-30,,Alessio da Cruz
Hamburger SV,41,05.01.2018,07.01.2018,-,1,2018-01-05,2018-01-07,,Alessio da Cruz
VfL Wolfsburg,82,06.01.2018,06.01.2018,-,1,2018-01-06,2018-01-06,,Alessio da Cruz
FC Fulham,931,01.09.2023,01.09.2023,-,1,2023-09-01,2023-09-01,,Alex Iwobi
FC Everton,29,08.08.2019,08.08.2019,-,1,2019-08-08,2019-08-08,,Alex Iwobi
Sheffield United,350,23.11.2015,23.11.2015,-,1,2015-11-23,2015-11-23,,Alex Iwobi
FC Reading,1032,23.11.2015,23.11.2015,-,1,2015-11-23,2015-11-23,,Alex Iwobi
Birmingham City,337,23.11.2015,23.11.2015,-,1,2015-11-23,2015-11-23,,Alex Iwobi
Espanyol Barcelona,714,05.08.2024,05.08.2024,-,1,2024-08-05,2024-08-05,,Alex Král
Deportivo Alavés,1108,26.07.2024,29.07.2024,-,1,2024-07-26,2024-07-29,,Alex Král
Borussia Mönchengladbach,18,02.06.2023,02.06.2023,-,1,2023-06-02,2023-06-02,,Alex Král
1.FC Union Berlin,89,02.06.2023,02.06.2023,-,1,2023-06-02,2023-06-02,,Alex Král
FC Schalke 04,33,14.07.2022,14.07.2022,-,1,2022-07-14,2022-07-14,,Alex Král
RB Leipzig,23826,13.07.2022,13.07.2022,-,1,2022-07-13,2022-07-13,,Alex Král
Hertha BSC,44,12.07.2022,13.07.2022,-,1,2022-07-12,2022-07-13,,Alex Král
Bayer 04 Leverkusen,15,20.06.2022,12.07.2022,-,1,2022-06-20,2022-07-12,,Alex Král
West Ham United,379,31.08.2021,31.08.2021,-,1,2021-08-31,2021-08-31,,Alex Král
Leeds United,399,06.01.2021,06.01.2021,-,1,2021-01-06,2021-01-06,,Alex Král
Wolverhampton Wanderers,543,06.01.2021,06.01.2021,-,1,2021-01-06,2021-01-06,,Alex Král
Newcastle United,762,06.01.2021,06.01.2021,-,1,2021-01-06,2021-01-06,,Alex Král
Spartak Moskau,232,01.09.2019,01.09.2019,-,1,2019-09-01,2019-09-01,,Alex Král
1.FC Köln,3,15.06.2018,19.06.2018,-,1,2018-06-15,2018-06-19,,Alex Král
Galatasaray,141,15.12.2024,15.12.2024,-,1,2024-12-15,2024-12-15,,Alex Meret
Inter Mailand,46,22.11.2024,22.11.2024,-,1,2024-11-22,2024-11-22,,Alex Meret
AC Florenz,430,28.12.2021,28.12.2021,-,1,2021-12-28,2021-12-28,,Alex Meret
AS Rom,12,24.03.2021,24.03.2021,-,1,2021-03-24,2021-03-24,,Alex Meret
SSC Neapel,6195,05.07.2018,05.07.2018,-,1,2018-07-05,2018-07-05,,Alex Meret
AS Rom,12,07.06.2018,07.06.2018,-,1,2018-06-07,2018-06-07,,Alex Meret
AC Florenz,430,07.06.2018,07.06.2018,-,1,2018-06-07,2018-06-07,,Alex Meret
FC Bayern München,27,31.03.2017,01.04.2017,-,1,2017-03-31,2017-04-01,,Alex Meret
RB Leipzig,23826,31.03.2017,31.03.2017,-,1,2017-03-31,2017-03-31,,Alex Meret
Juventus Turin,506,06.03.2017,06.03.2017,-,1,2017-03-06,2017-03-06,,Alex Meret
FC Burnley,1132,23.06.2025,23.06.2025,-,1,2025-06-23,2025-06-23,,Alex Oxlade-Chamberlain
Wolverhampton Wanderers,543,01.02.2025,01.02.2025,-,1,2025-02-01,2025-02-01,,Alex Oxlade-Chamberlain
Sheffield United,350,11.08.2024,11.08.2024,-,1,2024-08-11,2024-08-11,,Alex Oxlade-Chamberlain
Besiktas JK,114,09.08.2023,14.08.2023,-,1,2023-08-09,2023-08-14,,Alex Oxlade-Chamberlain
Aston Villa,405,11.06.2023,11.06.2023,-,1,2023-06-11,2023-06-11,,Alex Oxlade-Chamberlain
Brighton & Hove Albion,1237,26.03.2023,26.03.2023,-,1,2023-03-26,2023-03-26,,Alex Oxlade-Chamberlain
Newcastle United,762,26.03.2023,26.03.2023,-,1,2023-03-26,2023-03-26,,Alex Oxlade-Chamberlain
FC Arsenal,11,11.10.2021,11.10.2021,-,1,2021-10-11,2021-10-11,,Alex Oxlade-Chamberlain
Borussia Dortmund,16,05.05.2021,06.05.2021,-,1,2021-05-05,2021-05-06,,Alex Oxlade-Chamberlain
Atlético Madrid,13,12.05.2020,12.05.2020,-,1,2020-05-12,2020-05-12,,Alex Oxlade-Chamberlain
FC Liverpool,31,31.08.2017,31.08.2017,-,1,2017-08-31,2017-08-31,,Alex Oxlade-Chamberlain
FC Chelsea,631,30.08.2017,30.08.2017,-,1,2017-08-30,2017-08-30,,Alex Oxlade-Chamberlain
Stoke City,512,25.07.2017,16.08.2017,-,1,2017-07-25,2017-08-16,,Alex Oxlade-Chamberlain
Manchester United,985,09.03.2017,09.03.2017,-,1,2017-03-09,2017-03-09,,Alex Oxlade-Chamberlain
Leicester City,1003,22.05.2016,22.05.2016,-,1,2016-05-22,2016-05-22,,Alex Oxlade-Chamberlain
West Ham United,379,27.04.2016,27.04.2016,-,2,2016-04-27,2016-04-27,,Alex Oxlade-Chamberlain
FC Southampton,180,13.04.2016,13.04.2016,-,2,2016-04-13,2016-04-13,,Alex Oxlade-Chamberlain
Manchester City,281,09.03.2016,09.03.2016,-,2,2016-03-09,2016-03-09,,Alex Oxlade-Chamberlain
FC Arsenal,11,09.08.2011,09.08.2011,-,2,2011-08-09,2011-08-09,,Alex Oxlade-Chamberlain
FC Barcelona,131,04.03.2011,04.03.2011,-,2,2011-03-04,2011-03-04,,Alex Oxlade-Chamberlain
Tottenham Hotspur,148,05.01.2011,05.01.2011,-,2,2011-01-05,2011-01-05,,Alex Oxlade-Chamberlain
Botafogo Rio de Janeiro,537,03.09.2024,03.09.2024,-,1,2024-09-03,2024-09-03,,Alex Telles
Al-Nassr FC,18544,22.07.2023,22.07.2023,-,1,2023-07-22,2023-07-22,,Alex Telles
FC Sevilla,368,04.08.2022,04.08.2022,-,1,2022-08-04,2022-08-04,,Alex Telles
OGC Nizza,417,31.07.2022,01.08.2022,-,1,2022-07-31,2022-08-01,,Alex Telles
FC Porto,720,23.05.2022,30.05.2022,-,1,2022-05-23,2022-05-30,,Alex Telles
FC Barcelona,131,26.04.2022,26.04.2022,-,1,2022-04-26,2022-04-26,,Alex Telles
Inter Mailand,46,03.12.2021,03.12.2021,-,1,2021-12-03,2021-12-03,,Alex Telles
AC Mailand,5,03.12.2021,03.12.2021,-,1,2021-12-03,2021-12-03,,Alex Telles
AS Rom,12,14.07.2021,14.07.2021,-,1,2021-07-14,2021-07-14,,Alex Telles
Manchester United,985,05.10.2020,05.10.2020,-,1,2020-10-05,2020-10-05,,Alex Telles
FC Chelsea,631,01.06.2020,01.06.2020,-,1,2020-06-01,2020-06-01,,Alex Telles
FC Paris Saint-Germain,583,27.05.2020,27.05.2020,-,1,2020-05-27,2020-05-27,,Alex Telles
RB Leipzig,23826,04.05.2020,05.05.2020,-,1,2020-05-04,2020-05-05,,Alex Telles
FC Sevilla,368,04.05.2020,04.05.2020,-,1,2020-05-04,2020-05-04,,Alex Telles
Juventus Turin,506,05.03.2020,09.03.2020,-,1,2020-03-05,2020-03-09,,Alex Telles
Ajax Amsterdam,610,05.03.2020,05.03.2020,-,2,2020-03-05,2020-03-05,,Alex Telles
Atlético Madrid,13,17.04.2019,18.04.2019,-,2,2019-04-17,2019-04-18,,Alex Telles
Real Madrid,418,25.10.2018,25.10.2018,-,2,2018-10-25,2018-10-25,,Alex Telles
FC Bayern München,27,09.07.2018,09.07.2018,-,2,2018-07-09,2018-07-09,,Alex Telles
FC Liverpool,31,18.06.2018,19.06.2018,-,2,2018-06-18,2018-06-19,,Alex Telles
Hamburger SV,41,21.06.2016,14.07.2016,-,2,2016-06-21,2016-07-14,,Alex Telles
FC Porto,720,12.07.2016,12.07.2016,-,2,2016-07-12,2016-07-12,,Alex Telles
Eintracht Frankfurt,24,02.07.2016,03.07.2016,-,2,2016-07-02,2016-07-03,,Alex Telles
FC Porto,720,28.06.2016,28.06.2016,-,2,2016-06-28,2016-06-28,,Alex Telles
VfL Wolfsburg,82,13.06.2016,16.06.2016,-,2,2016-06-13,2016-06-16,,Alex Telles
Inter Mailand,46,04.08.2015,04.08.2015,-,2,2015-08-04,2015-08-04,,Alex Telles
FC Paris Saint-Germain,583,04.08.2015,04.08.2015,-,2,2015-08-04,2015-08-04,,Alex Telles
FC Chelsea,631,28.07.2015,29.07.2015,-,2,2015-07-28,2015-07-29,,Alex Telles
Flamengo Rio de Janeiro,614,18.12.2014,18.12.2014,-,2,2014-12-18,2014-12-18,,Alex Telles
Real Madrid,418,12.03.2014,13.03.2014,-,2,2014-03-12,2014-03-13,,Alex Telles
Galatasaray,141,22.01.2014,22.01.2014,-,3,2014-01-22,2014-01-22,,Alex Telles
FC Villarreal,1050,01.02.2025,01.02.2025,-,1,2025-02-01,2025-02-01,,Alexander Djiku
FC Stade Rennes,273,22.07.2024,22.07.2024,-,1,2024-07-22,2024-07-22,,Alexander Djiku
Besiktas JK,114,08.07.2023,20.07.2023,-,1,2023-07-08,2023-07-20,,Alexander Djiku
1.FSV Mainz 05,39,27.06.2023,10.07.2023,-,1,2023-06-27,2023-07-10,,Alexander Djiku
Fenerbahce,36,09.07.2023,09.07.2023,-,1,2023-07-09,2023-07-09,,Alexander Djiku
VfB Stuttgart,79,07.07.2023,09.07.2023,-,1,2023-07-07,2023-07-09,,Alexander Djiku
Nottingham Forest,703,27.06.2023,27.06.2023,-,1,2023-06-27,2023-06-27,,Alexander Djiku
Trabzonspor,449,25.07.2022,25.07.2022,-,1,2022-07-25,2022-07-25,,Alexander Djiku
TSG 1899 Hoffenheim,533,09.07.2022,09.07.2022,-,1,2022-07-09,2022-07-09,,Alexander Djiku
FC Sevilla,368,02.06.2022,02.06.2022,-,1,2022-06-02,2022-06-02,,Alexander Djiku
Eintracht Frankfurt,24,27.01.2020,28.01.2020,-,1,2020-01-27,2020-01-28,,Alexander Djiku
Al-Qadsiah FC,26069,13.08.2023,14.08.2023,-,1,2023-08-13,2023-08-14,,Alexander Hack
SpVgg Unterhaching,66,17.05.2013,17.05.2013,-,1,2013-05-17,2013-05-17,,Alexander Hack
Bayer 04 Leverkusen,15,21.04.2025,21.04.2025,-,1,2025-04-21,2025-04-21,,Alexander Nübel
Newcastle United,762,28.03.2024,02.04.2024,-,1,2024-03-28,2024-04-02,,Alexander Nübel
AS Rom,12,26.03.2024,26.03.2024,-,1,2024-03-26,2024-03-26,,Alexander Nübel
Sporting Lissabon,336,23.03.2024,24.03.2024,-,1,2024-03-23,2024-03-24,,Alexander Nübel
Leeds United,399,13.07.2023,14.07.2023,-,1,2023-07-13,2023-07-14,,Alexander Nübel
AS Monaco,162,12.05.2023,20.06.2023,-,1,2023-05-12,2023-06-20,,Alexander Nübel
FC Bayern München,27,16.01.2023,16.01.2023,-,1,2023-01-16,2023-01-16,,Alexander Nübel
Tottenham Hotspur,148,14.02.2022,15.02.2022,-,1,2022-02-14,2022-02-15,,Alexander Nübel
LOSC Lille,1082,16.06.2021,25.06.2021,-,1,2021-06-16,2021-06-25,,Alexander Nübel
Borussia Dortmund,16,10.05.2021,17.05.2021,-,1,2021-05-10,2021-05-17,,Alexander Nübel
Olympique Marseille,244,15.05.2021,16.05.2021,-,1,2021-05-15,2021-05-16,,Alexander Nübel
RB Leipzig,23826,29.04.2021,11.05.2021,-,1,2021-04-29,2021-05-11,,Alexander Nübel
1.FC Union Berlin,89,04.05.2021,05.05.2021,-,1,2021-05-04,2021-05-05,,Alexander Nübel
FC Schalke 04,33,31.07.2020,31.07.2020,-,1,2020-07-31,2020-07-31,,Alexander Nübel
FC Bayern München,27,04.01.2020,04.01.2020,-,1,2020-01-04,2020-01-04,,Alexander Nübel
Tottenham Hotspur,148,26.11.2019,03.12.2019,-,2,2019-11-26,2019-12-03,,Alexander Nübel
Atlético Madrid,13,23.10.2019,23.10.2019,-,2,2019-10-23,2019-10-23,,Alexander Nübel
RB Leipzig,23826,27.09.2019,30.09.2019,-,2,2019-09-27,2019-09-30,,Alexander Nübel
Borussia Dortmund,16,31.07.2019,31.07.2019,-,2,2019-07-31,2019-07-31,,Alexander Nübel
AS Rom,12,25.06.2019,25.06.2019,-,2,2019-06-25,2019-06-25,,Alexander Nübel
Fortuna Düsseldorf,38,21.03.2019,05.04.2019,-,2,2019-03-21,2019-04-05,,Alexander Nübel
FC Schalke 04,33,27.08.2015,27.08.2015,-,2,2015-08-27,2015-08-27,,Alexander Nübel
SV Werder Bremen,86,17.08.2025,21.08.2025,50 %,1,2025-08-17,2025-08-21,50.0,Alexander Schwolow
1.FC Köln,3,24.06.2025,13.07.2025,23 %,1,2025-06-24,2025-07-13,23.0,Alexander Schwolow
Karlsruher SC,48,23.06.2025,23.06.2025,17 %,1,2025-06-23,2025-06-23,17.0,Alexander Schwolow
1.FC Union Berlin,89,26.07.2023,26.07.2023,-,1,2023-07-26,2023-07-26,,Alexander Schwolow
SC Freiburg,60,05.06.2023,06.06.2023,-,1,2023-06-05,2023-06-06,,Alexander Schwolow
FC Schalke 04,33,15.06.2022,15.06.2022,-,1,2022-06-15,2022-06-15,,Alexander Schwolow
Hertha BSC,44,04.08.2020,04.08.2020,-,1,2020-08-04,2020-08-04,,Alexander Schwolow
FC Schalke 04,33,04.08.2020,04.08.2020,-,1,2020-08-04,2020-08-04,,Alexander Schwolow
FC Sevilla,368,04.06.2020,06.06.2020,-,1,2020-06-04,2020-06-06,,Alexander Schwolow
Benfica Lissabon,294,23.05.2020,23.05.2020,-,1,2020-05-23,2020-05-23,,Alexander Schwolow
Ajax Amsterdam,610,21.05.2020,22.05.2020,-,1,2020-05-21,2020-05-22,,Alexander Schwolow
VfB Stuttgart,79,14.05.2019,28.05.2019,-,1,2019-05-14,2019-05-28,,Alexander Schwolow
AS Rom,12,22.06.2018,22.06.2018,-,1,2018-06-22,2018-06-22,,Alexander Schwolow
AC Florenz,430,22.06.2018,22.06.2018,-,1,2018-06-22,2018-06-22,,Alexander Schwolow
FC Paris Saint-Germain,583,29.05.2018,30.05.2018,-,1,2018-05-29,2018-05-30,,Alexander Schwolow
Eintracht Frankfurt,24,25.12.2017,25.12.2017,-,2,2017-12-25,2017-12-25,,Alexander Schwolow
Hamburger SV,41,27.03.2017,30.03.2017,-,2,2017-03-27,2017-03-30,,Alexander Schwolow
Bayer 04 Leverkusen,15,09.02.2017,13.02.2017,-,2,2017-02-09,2017-02-13,,Alexander Schwolow
VfL Wolfsburg,82,30.05.2016,30.05.2016,-,2,2016-05-30,2016-05-30,,Alexander Schwolow
RB Leipzig,23826,20.05.2016,20.05.2016,-,2,2016-05-20,2016-05-20,,Alexander Schwolow
Arminia Bielefeld,10,13.06.2014,13.06.2014,-,2,2014-06-13,2014-06-13,,Alexander Schwolow
Atlético Madrid,13,31.07.2024,31.07.2024,-,1,2024-07-31,2024-07-31,,Alexander Sørloth
AS Rom,12,25.07.2024,25.07.2024,-,1,2024-07-25,2024-07-25,,Alexander Sørloth
Borussia Mönchengladbach,18,26.08.2022,27.08.2022,-,1,2022-08-26,2022-08-27,,Alexander Sørloth
1.FC Köln,3,10.08.2022,24.08.2022,-,1,2022-08-10,2022-08-24,,Alexander Sørloth
Fenerbahce,36,18.08.2022,18.08.2022,-,1,2022-08-18,2022-08-18,,Alexander Sørloth
Besiktas JK,114,21.07.2022,21.07.2022,-,1,2022-07-21,2022-07-21,,Alexander Sørloth
Real Sociedad San Sebastián,681,16.02.2022,16.02.2022,-,1,2022-02-16,2022-02-16,,Alexander Sørloth
PSV Eindhoven,383,,22.08.2021,-,1,,2021-08-22,,Alexander Sørloth
Olympique Marseille,244,21.08.2021,21.08.2021,-,1,2021-08-21,2021-08-21,,Alexander Sørloth
Eintracht Frankfurt,24,,10.08.2021,-,1,,2021-08-10,,Alexander Sørloth
FC Southampton,180,,07.08.2021,-,1,,2021-08-07,,Alexander Sørloth
AC Mailand,5,,30.07.2021,-,1,,2021-07-30,,Alexander Sørloth
AS Rom,12,29.07.2021,29.07.2021,-,1,2021-07-29,2021-07-29,,Alexander Sørloth
1.FSV Mainz 05,39,21.07.2021,21.07.2021,-,1,2021-07-21,2021-07-21,,Alexander Sørloth
RB Leipzig,23826,22.09.2020,22.09.2020,-,1,2020-09-22,2020-09-22,,Alexander Sørloth
Tottenham Hotspur,148,14.09.2020,14.09.2020,-,2,2020-09-14,2020-09-14,,Alexander Sørloth
VfL Wolfsburg,82,21.07.2020,21.07.2020,-,2,2020-07-21,2020-07-21,,Alexander Sørloth
AC Mailand,5,09.04.2020,09.04.2020,-,2,2020-04-09,2020-04-09,,Alexander Sørloth
FC Chelsea,631,09.04.2020,09.04.2020,-,2,2020-04-09,2020-04-09,,Alexander Sørloth
FC Bayern München,27,04.03.2020,11.03.2020,-,2,2020-03-04,2020-03-11,,Alexander Sørloth
Borussia Dortmund,16,03.03.2020,03.03.2020,-,2,2020-03-03,2020-03-03,,Alexander Sørloth
Real Madrid,418,26.02.2020,28.02.2020,-,2,2020-02-26,2020-02-28,,Alexander Sørloth
Trabzonspor,449,05.08.2019,05.08.2019,-,2,2019-08-05,2019-08-05,,Alexander Sørloth
Besiktas JK,114,21.05.2025,21.05.2025,-,1,2025-05-21,2025-05-21,,Alexandre Lacazette
Al-Qadsiah FC,26069,03.06.2024,03.06.2024,-,1,2024-06-03,2024-06-03,,Alexandre Lacazette
Olympique Lyon,1041,09.06.2022,09.06.2022,-,1,2022-06-09,2022-06-09,,Alexandre Lacazette
FC Barcelona,131,04.04.2022,04.04.2022,-,1,2022-04-04,2022-04-04,,Alexandre Lacazette
Real Sociedad San Sebastián,681,05.01.2022,05.01.2022,-,1,2022-01-05,2022-01-05,,Alexandre Lacazette
Atlético Madrid,13,12.10.2021,14.10.2021,-,1,2021-10-12,2021-10-14,,Alexandre Lacazette
Juventus Turin,506,12.10.2021,12.10.2021,-,1,2021-10-12,2021-10-12,,Alexandre Lacazette
FC Sevilla,368,12.10.2021,12.10.2021,-,1,2021-10-12,2021-10-12,,Alexandre Lacazette
AC Mailand,5,12.10.2021,12.10.2021,-,1,2021-10-12,2021-10-12,,Alexandre Lacazette
AS Rom,12,07.04.2021,07.04.2021,-,1,2021-04-07,2021-04-07,,Alexandre Lacazette
AS Monaco,162,27.02.2021,28.02.2021,-,1,2021-02-27,2021-02-28,,Alexandre Lacazette
Inter Mailand,46,02.06.2020,02.06.2020,-,1,2020-06-02,2020-06-02,,Alexandre Lacazette
Fenerbahce,36,10.06.2018,10.06.2018,-,1,2018-06-10,2018-06-10,,Alexandre Lacazette
Borussia Dortmund,16,05.07.2017,05.07.2017,-,1,2017-07-05,2017-07-05,,Alexandre Lacazette
FC Arsenal,11,05.07.2017,05.07.2017,-,1,2017-07-05,2017-07-05,,Alexandre Lacazette
Atlético Madrid,13,21.05.2017,21.05.2017,-,2,2017-05-21,2017-05-21,,Alexandre Lacazette
AC Mailand,5,19.04.2017,19.04.2017,-,2,2017-04-19,2017-04-19,,Alexandre Lacazette
Manchester City,281,05.03.2017,05.03.2017,-,2,2017-03-05,2017-03-05,,Alexandre Lacazette
FC Liverpool,31,23.02.2017,23.02.2017,-,2,2017-02-23,2017-02-23,,Alexandre Lacazette
Tottenham Hotspur,148,23.02.2017,23.02.2017,-,2,2017-02-23,2017-02-23,,Alexandre Lacazette
Juventus Turin,506,10.01.2017,10.01.2017,-,2,2017-01-10,2017-01-10,,Alexandre Lacazette
West Ham United,379,09.07.2016,09.07.2016,-,2,2016-07-09,2016-07-09,,Alexandre Lacazette
FC Barcelona,131,27.04.2016,28.04.2016,-,2,2016-04-27,2016-04-28,,Alexandre Lacazette
AS Rom,12,13.04.2016,13.04.2016,-,2,2016-04-13,2016-04-13,,Alexandre Lacazette
FC Everton,29,03.04.2016,03.04.2016,-,2,2016-04-03,2016-04-03,,Alexandre Lacazette
FC Southampton,180,15.03.2016,15.03.2016,-,2,2016-03-15,2016-03-15,,Alexandre Lacazette
Stoke City,512,15.03.2016,15.03.2016,-,2,2016-03-15,2016-03-15,,Alexandre Lacazette
Newcastle United,762,27.01.2016,27.01.2016,-,2,2016-01-27,2016-01-27,,Alexandre Lacazette
VfL Wolfsburg,82,25.01.2016,26.01.2016,-,2,2016-01-25,2016-01-26,,Alexandre Lacazette
Manchester United,985,09.05.2015,09.07.2015,-,2,2015-05-09,2015-07-09,,Alexandre Lacazette
FC Bayern München,27,19.05.2015,25.05.2015,-,3,2015-05-19,2015-05-25,,Alexandre Lacazette
FC Paris Saint-Germain,583,07.06.2015,09.05.2015,-,3,2015-06-07,2015-05-09,,Alexandre Lacazette
FC Chelsea,631,02.05.2015,02.05.2015,-,3,2015-05-02,2015-05-02,,Alexandre Lacazette
Inter Mailand,46,11.01.2015,11.01.2015,-,3,2015-01-11,2015-01-11,,Alexandre Lacazette
FC Watford,1010,01.07.2025,01.07.2025,-,1,2025-07-01,2025-07-01,,Alexandre Mendy
AFC Sunderland,289,16.07.2024,16.07.2024,-,1,2024-07-16,2024-07-16,,Alexandre Mendy
FC Granada,16795,29.08.2023,29.08.2023,-,1,2023-08-29,2023-08-29,,Alexandre Mendy
Besiktas JK,114,15.02.2023,15.02.2023,-,1,2023-02-15,2023-02-15,,Alexandru Maxim
Antalyaspor,589,09.08.2020,10.08.2020,-,1,2020-08-09,2020-08-10,,Alexandru Maxim
Gaziantep FK,2832,28.01.2020,28.01.2020,-,1,2020-01-28,2020-01-28,,Alexandru Maxim
1.FSV Mainz 05,39,27.06.2017,27.06.2017,-,1,2017-06-27,2017-06-27,,Alexandru Maxim
Leeds United,399,13.06.2017,13.06.2017,-,1,2017-06-13,2017-06-13,,Alexandru Maxim
CF América,3631,18.01.2017,18.01.2017,-,1,2017-01-18,2017-01-18,,Alexandru Maxim
Hull City,3008,04.01.2017,04.01.2017,-,1,2017-01-04,2017-01-04,,Alexandru Maxim
SV Werder Bremen,86,30.08.2016,30.08.2016,-,1,2016-08-30,2016-08-30,,Alexandru Maxim
SV Werder Bremen,86,30.08.2016,30.08.2016,-,1,2016-08-30,2016-08-30,,Alexandru Maxim
Hamburger SV,41,11.08.2015,11.08.2015,-,1,2015-08-11,2015-08-11,,Alexandru Maxim
1.FC Köln,3,27.07.2015,27.07.2015,-,1,2015-07-27,2015-07-27,,Alexandru Maxim
Hannover 96,42,27.07.2015,27.07.2015,-,1,2015-07-27,2015-07-27,,Alexandru Maxim
Swansea City,2288,04.06.2015,04.06.2015,-,1,2015-06-04,2015-06-04,,Alexandru Maxim
Lazio Rom,398,31.12.2014,31.12.2014,-,1,2014-12-31,2014-12-31,,Alexandru Maxim
West Ham United,379,22.12.2014,22.12.2014,-,1,2014-12-22,2014-12-22,,Alexandru Maxim
Stoke City,512,22.12.2014,22.12.2014,-,2,2014-12-22,2014-12-22,,Alexandru Maxim
VfL Wolfsburg,82,14.05.2014,14.05.2014,-,2,2014-05-14,2014-05-14,,Alexandru Maxim
AC Mailand,5,14.05.2014,14.05.2014,-,2,2014-05-14,2014-05-14,,Alexandru Maxim
Tottenham Hotspur,148,14.05.2014,14.05.2014,-,2,2014-05-14,2014-05-14,,Alexandru Maxim
Bayer 04 Leverkusen,15,13.05.2014,14.05.2014,-,2,2014-05-13,2014-05-14,,Alexandru Maxim
Fenerbahce,36,16.01.2014,16.01.2014,-,2,2014-01-16,2014-01-16,,Alexandru Maxim
Borussia Dortmund,16,20.11.2013,20.11.2013,-,2,2013-11-20,2013-11-20,,Alexandru Maxim
FC Liverpool,31,10.11.2013,11.11.2013,-,2,2013-11-10,2013-11-11,,Alexandru Maxim
FC Schalke 04,33,28.10.2013,28.10.2013,-,2,2013-10-28,2013-10-28,,Alexandru Maxim
VfB Stuttgart,79,31.01.2013,31.01.2013,-,2,2013-01-31,2013-01-31,,Alexandru Maxim
SC Freiburg,60,30.01.2013,30.01.2013,-,2,2013-01-30,2013-01-30,,Alexandru Maxim
Standard Lüttich,3057,25.01.2013,25.01.2013,-,2,2013-01-25,2013-01-25,,Alexandru Maxim
FCSB,301,03.11.2012,03.11.2012,-,2,2012-11-03,2012-11-03,,Alexandru Maxim
VfB Stuttgart,79,31.08.2025,01.09.2025,24 %,1,2025-08-31,2025-09-01,24.0,Alexis Claude-Maurice
Borussia Mönchengladbach,18,04.06.2025,17.06.2025,22 %,1,2025-06-04,2025-06-17,22.0,Alexis Claude-Maurice
FC Augsburg,167,31.08.2024,31.08.2024,-,1,2024-08-31,2024-08-31,,Alexis Claude-Maurice
RC Lens,826,30.08.2022,30.08.2022,-,1,2022-08-30,2022-08-30,,Alexis Claude-Maurice
OGC Nizza,417,30.08.2019,30.08.2019,-,1,2019-08-30,2019-08-30,,Alexis Claude-Maurice
Borussia Mönchengladbach,18,09.07.2019,09.07.2019,-,1,2019-07-09,2019-07-09,,Alexis Claude-Maurice
Eintracht Frankfurt,24,06.06.2019,06.06.2019,-,1,2019-06-06,2019-06-06,,Alexis Claude-Maurice
FC Arsenal,11,03.06.2019,03.06.2019,-,1,2019-06-03,2019-06-03,,Alexis Claude-Maurice
AS Monaco,162,25.05.2019,25.05.2019,-,1,2019-05-25,2019-05-25,,Alexis Claude-Maurice
RB Leipzig,23826,25.05.2019,25.05.2019,-,1,2019-05-25,2019-05-25,,Alexis Claude-Maurice
FC Paris Saint-Germain,583,25.05.2019,25.05.2019,-,1,2019-05-25,2019-05-25,,Alexis Claude-Maurice
West Ham United,379,25.05.2019,25.05.2019,-,1,2019-05-25,2019-05-25,,Alexis Claude-Maurice
RC Lens,826,06.07.2024,06.07.2024,-,1,2024-07-06,2024-07-06,,Alexis Flips
Stade Reims,1421,26.12.2023,26.12.2023,-,1,2023-12-26,2023-12-26,,Alexis Flips
FC Villarreal,1050,10.01.2022,25.02.2022,-,1,2022-01-10,2022-02-25,,Alexis Flips
FC Liverpool,31,01.06.2023,07.06.2023,-,1,2023-06-01,2023-06-07,,Alexis Mac Allister
Manchester United,985,09.04.2023,09.04.2023,-,1,2023-04-09,2023-04-09,,Alexis Mac Allister
Manchester City,281,17.03.2023,17.03.2023,-,1,2023-03-17,2023-03-17,,Alexis Mac Allister
FC Chelsea,631,01.01.2023,01.01.2023,-,1,2023-01-01,2023-01-01,,Alexis Mac Allister
Borussia Dortmund,16,29.12.2022,29.12.2022,-,1,2022-12-29,2022-12-29,,Alexis Mac Allister
Atlético Madrid,13,27.12.2022,27.12.2022,-,1,2022-12-27,2022-12-27,,Alexis Mac Allister
FC Arsenal,11,27.12.2022,27.12.2022,-,1,2022-12-27,2022-12-27,,Alexis Mac Allister
Brighton & Hove Albion,1237,24.01.2019,24.01.2019,-,1,2019-01-24,2019-01-24,,Alexis Mac Allister
Eintracht Frankfurt,24,29.05.2025,30.05.2025,21 %,1,2025-05-29,2025-05-30,21.0,Alexis Saelemaekers
FC Bologna,1025,29.08.2023,29.08.2023,-,1,2023-08-29,2023-08-29,,Alexis Saelemaekers
SC Freiburg,60,24.08.2023,24.08.2023,-,1,2023-08-24,2023-08-24,,Alexis Saelemaekers
AC Mailand,5,17.05.2020,17.05.2020,-,1,2020-05-17,2020-05-17,,Alexis Saelemaekers
SC Freiburg,60,29.01.2020,29.01.2020,-,1,2020-01-29,2020-01-29,,Alexis Saelemaekers
FC Sevilla,368,01.09.2025,01.09.2025,-,1,2025-09-01,2025-09-01,,Alexis Sánchez
Udinese Calcio,410,05.08.2024,10.08.2024,-,1,2024-08-05,2024-08-10,,Alexis Sánchez
Como 1907,1047,07.06.2024,07.06.2024,-,1,2024-06-07,2024-06-07,,Alexis Sánchez
Al-Ettifaq FC,7732,09.12.2023,09.12.2023,-,1,2023-12-09,2023-12-09,,Alexis Sánchez
Al-Shabab FC,9840,09.12.2023,09.12.2023,-,1,2023-12-09,2023-12-09,,Alexis Sánchez
Inter Mailand,46,24.08.2023,24.08.2023,-,1,2023-08-24,2023-08-24,,Alexis Sánchez
RC Lens,826,20.08.2023,20.08.2023,-,1,2023-08-20,2023-08-20,,Alexis Sánchez
AS Rom,12,04.08.2023,04.08.2023,-,1,2023-08-04,2023-08-04,,Alexis Sánchez
Olympique Marseille,244,11.07.2023,11.07.2023,-,1,2023-07-11,2023-07-11,,Alexis Sánchez
Olympique Marseille,244,08.08.2022,08.08.2022,-,1,2022-08-08,2022-08-08,,Alexis Sánchez
Galatasaray,141,13.07.2022,13.07.2022,-,1,2022-07-13,2022-07-13,,Alexis Sánchez
Aston Villa,405,21.06.2022,21.06.2022,-,1,2022-06-21,2022-06-21,,Alexis Sánchez
Atlético Madrid,13,21.06.2022,21.06.2022,-,1,2022-06-21,2022-06-21,,Alexis Sánchez
FC Arsenal,11,21.06.2022,21.06.2022,-,1,2022-06-21,2022-06-21,,Alexis Sánchez
FC Everton,29,09.01.2022,09.01.2022,-,1,2022-01-09,2022-01-09,,Alexis Sánchez
FC Barcelona,131,16.12.2021,17.12.2021,-,2,2021-12-16,2021-12-17,,Alexis Sánchez
Rayo Vallecano,367,08.10.2021,08.10.2021,-,2,2021-10-08,2021-10-08,,Alexis Sánchez
FC Valencia,1049,08.10.2021,08.10.2021,-,2,2021-10-08,2021-10-08,,Alexis Sánchez
Real Betis Sevilla,150,08.10.2021,08.10.2021,-,2,2021-10-08,2021-10-08,,Alexis Sánchez
Fenerbahce,36,25.08.2021,25.08.2021,-,2,2021-08-25,2021-08-25,,Alexis Sánchez
FC Sevilla,368,03.06.2021,03.06.2021,-,2,2021-06-03,2021-06-03,,Alexis Sánchez
Borussia Dortmund,16,27.05.2020,01.06.2020,-,2,2020-05-27,2020-06-01,,Alexis Sánchez
AS Rom,12,04.05.2020,04.05.2020,-,2,2020-05-04,2020-05-04,,Alexis Sánchez
Inter Mailand,46,30.08.2019,30.08.2019,-,2,2019-08-30,2019-08-30,,Alexis Sánchez
FC Paris Saint-Germain,583,09.11.2018,09.11.2018,-,2,2018-11-09,2018-11-09,,Alexis Sánchez
Manchester United,985,22.01.2018,22.01.2018,-,2,2018-01-22,2018-01-22,,Alexis Sánchez
FC Chelsea,631,15.01.2018,15.01.2018,-,2,2018-01-15,2018-01-15,,Alexis Sánchez
Manchester City,281,15.01.2018,15.01.2018,-,2,2018-01-15,2018-01-15,,Alexis Sánchez
FC Liverpool,31,14.01.2018,14.01.2018,-,2,2018-01-14,2018-01-14,,Alexis Sánchez
FC Paris Saint-Germain,583,21.12.2017,28.12.2017,-,2,2017-12-21,2017-12-28,,Alexis Sánchez
FC Everton,29,29.10.2017,06.11.2017,-,3,2017-10-29,2017-11-06,,Alexis Sánchez
FC Bayern München,27,05.11.2017,05.11.2017,-,3,2017-11-05,2017-11-05,,Alexis Sánchez
Juventus Turin,506,03.03.2017,08.03.2017,-,3,2017-03-03,2017-03-08,,Alexis Sánchez
Atlético Madrid,13,05.02.2017,07.02.2017,-,3,2017-02-05,2017-02-07,,Alexis Sánchez
FC Arsenal,11,10.07.2014,14.05.2014,-,3,2014-07-10,2014-05-14,,Alexis Sánchez
Juventus Turin,506,30.04.2014,30.04.2014,-,3,2014-04-30,2014-04-30,,Alexis Sánchez
SSC Neapel,6195,30.07.2013,30.07.2013,-,3,2013-07-30,2013-07-30,,Alexis Sánchez
Inter Mailand,46,17.03.2013,19.03.2013,-,3,2013-03-17,2013-03-19,,Alexis Sánchez
FC Barcelona,131,21.07.2011,22.07.2011,-,3,2011-07-21,2011-07-22,,Alexis Sánchez
Real Madrid,418,08.06.2011,08.06.2011,-,3,2011-06-08,2011-06-08,,Alexis Sánchez
Hamburger SV,41,24.09.2010,24.09.2010,-,3,2010-09-24,2010-09-24,,Alexis Sánchez
Galatasaray,141,13.07.2010,14.07.2010,-,3,2010-07-13,2010-07-14,,Alexis Sánchez
Fenerbahce,36,18.06.2010,26.06.2010,-,3,2010-06-18,2010-06-26,,Alexis Sánchez
Olympique Lyon,1041,28.05.2010,28.05.2010,-,3,2010-05-28,2010-05-28,,Alexis Sánchez
FC Valencia,1049,16.02.2010,16.02.2010,-,3,2010-02-16,2010-02-16,,Alexis Sánchez
1.FC Nürnberg,4,14.08.2025,14.08.2025,39 %,1,2025-08-14,2025-08-14,39.0,Alexis Tibidi
ESTAC Troyes,1095,25.01.2023,27.01.2023,-,1,2023-01-25,2023-01-27,,Alexis Tibidi
KRC Genk,1184,09.01.2023,11.01.2023,-,1,2023-01-09,2023-01-11,,Alexis Tibidi
SCR Altach,3551,07.07.2022,07.07.2022,-,1,2022-07-07,2022-07-07,,Alexis Tibidi
Derby County,22,05.08.2025,05.08.2025,-,1,2025-08-05,2025-08-05,,Alfie Gilchrist
FC Middlesbrough,641,20.07.2025,20.07.2025,-,1,2025-07-20,2025-07-20,,Alfie Gilchrist
Bristol City,698,06.09.2020,06.09.2020,-,1,2020-09-06,2020-09-06,,Alfie Mawson
FC Fulham,931,30.07.2018,30.07.2018,-,1,2018-07-30,2018-07-30,,Alfie Mawson
FC Burnley,1132,18.07.2018,18.07.2018,-,1,2018-07-18,2018-07-18,,Alfie Mawson
Tottenham Hotspur,148,04.05.2018,04.05.2018,-,1,2018-05-04,2018-05-04,,Alfie Mawson
West Ham United,379,23.12.2017,23.12.2017,-,1,2017-12-23,2017-12-23,,Alfie Mawson
Swansea City,2288,28.08.2016,28.08.2016,-,1,2016-08-28,2016-08-28,,Alfie Mawson
AFC Sunderland,289,30.06.2013,30.06.2013,-,1,2013-06-30,2013-06-30,,Alfred Duncan
US Sassuolo,6574,12.06.2013,14.06.2013,-,1,2013-06-12,2013-06-14,,Alfred Duncan
US Livorno 1915,1210,12.06.2013,12.06.2013,-,1,2013-06-12,2013-06-12,,Alfred Duncan
Spezia Calcio,3522,10.06.2012,10.06.2012,-,1,2012-06-10,2012-06-10,,Alfred Duncan
AS Saint-Étienne,618,15.12.2022,15.12.2022,-,1,2022-12-15,2022-12-15,,Alfred Gomis
FC Middlesbrough,641,01.08.2018,01.08.2018,-,1,2018-08-01,2018-08-01,,Alfred N'Diaye
Cardiff City,603,01.08.2018,01.08.2018,-,1,2018-08-01,2018-08-01,,Alfred N'Diaye
FC Villarreal,1050,04.07.2016,04.07.2016,-,1,2016-07-04,2016-07-04,,Alfred N'Diaye
Real Betis Sevilla,150,31.01.2014,31.01.2014,-,1,2014-01-31,2014-01-31,,Alfred N'Diaye
AFC Sunderland,289,09.01.2013,09.01.2013,-,1,2013-01-09,2013-01-09,,Alfred N'Diaye
AC Florenz,430,26.06.2012,26.06.2012,-,1,2012-06-26,2012-06-26,,Alfred N'Diaye
Bursaspor,20,30.06.2011,30.06.2011,-,1,2011-06-30,2011-06-30,,Alfred N'Diaye
SSC Neapel,6195,17.06.2011,17.06.2011,-,1,2011-06-17,2011-06-17,,Alfred N'Diaye
Feyenoord Rotterdam,234,17.07.2021,17.07.2021,-,1,2021-07-17,2021-07-17,,Alireza Jahanbakhsh
Brighton & Hove Albion,1237,23.07.2018,23.07.2018,-,1,2018-07-23,2018-07-23,,Alireza Jahanbakhsh
Leicester City,1003,13.07.2018,13.07.2018,-,1,2018-07-13,2018-07-13,,Alireza Jahanbakhsh
SSC Neapel,6195,24.02.2018,24.02.2018,-,1,2018-02-24,2018-02-24,,Alireza Jahanbakhsh
FC Groningen,202,27.03.2015,27.03.2015,-,1,2015-03-27,2015-03-27,,Alireza Jahanbakhsh
SC Heerenveen,306,27.03.2015,27.03.2015,-,1,2015-03-27,2015-03-27,,Alireza Jahanbakhsh
Norwich City,1123,27.03.2015,27.03.2015,-,1,2015-03-27,2015-03-27,,Alireza Jahanbakhsh
Club Brügge,2282,27.03.2015,27.03.2015,-,1,2015-03-27,2015-03-27,,Alireza Jahanbakhsh
Standard Lüttich,3057,27.03.2015,27.03.2015,-,1,2015-03-27,2015-03-27,,Alireza Jahanbakhsh
RSC Anderlecht,58,27.03.2015,27.03.2015,-,1,2015-03-27,2015-03-27,,Alireza Jahanbakhsh
Celtic Glasgow,371,27.03.2015,27.03.2015,-,1,2015-03-27,2015-03-27,,Alireza Jahanbakhsh
Manchester United,985,27.03.2014,27.03.2014,-,1,2014-03-27,2014-03-27,,Alireza Jahanbakhsh
FC Bayern München,27,30.09.2024,08.10.2024,-,1,2024-09-30,2024-10-08,,Alisson
FC Liverpool,31,19.07.2018,19.07.2018,-,1,2018-07-19,2018-07-19,,Alisson
Real Madrid,418,15.07.2018,15.07.2018,-,1,2018-07-15,2018-07-15,,Alisson
FC Chelsea,631,04.06.2018,04.06.2018,-,1,2018-06-04,2018-06-04,,Alisson
FC Bayern München,27,15.02.2018,17.02.2018,-,1,2018-02-15,2018-02-17,,Alisson
Borussia Mönchengladbach,18,03.04.2016,05.04.2016,-,1,2016-04-03,2016-04-05,,Alisson
Fenerbahce,36,03.04.2016,03.04.2016,-,1,2016-04-03,2016-04-03,,Alisson
FC Arsenal,11,03.04.2016,03.04.2016,-,1,2016-04-03,2016-04-03,,Alisson
Ajax Amsterdam,610,03.04.2016,03.04.2016,-,1,2016-04-03,2016-04-03,,Alisson
Olympiakos Piräus,683,03.04.2016,03.04.2016,-,1,2016-04-03,2016-04-03,,Alisson
AS Rom,12,18.11.2015,18.11.2015,-,1,2015-11-18,2015-11-18,,Alisson
Real Madrid,418,18.01.2024,18.01.2024,-,1,2024-01-18,2024-01-18,,Allan
Manchester City,281,10.05.2022,10.05.2022,-,1,2022-05-10,2022-05-10,,Allan
FC Bayern München,27,28.04.2022,09.05.2022,-,1,2022-04-28,2022-05-09,,Allan
Real Madrid,418,12.04.2022,09.05.2022,-,1,2022-04-12,2022-05-09,,Allan
FC Barcelona,131,29.03.2022,29.03.2022,-,1,2022-03-29,2022-03-29,,Allan
Manchester United,985,12.02.2022,12.02.2022,-,1,2022-02-12,2022-02-12,,Allan
FC Paris Saint-Germain,583,10.02.2022,11.02.2022,-,1,2022-02-10,2022-02-11,,Allan
FC Chelsea,631,15.01.2022,15.01.2022,-,1,2022-01-15,2022-01-15,,Allan
FC Liverpool,31,14.09.2021,20.09.2021,-,1,2021-09-14,2021-09-20,,Allan
Juventus Turin,506,26.12.2020,12.03.2021,-,1,2020-12-26,2021-03-12,,Allan
Borussia Dortmund,16,29.12.2019,29.12.2019,-,1,2019-12-29,2019-12-29,,Allan
RB Leipzig,23826,29.12.2019,29.12.2019,-,1,2019-12-29,2019-12-29,,Allan
Juventus Turin,506,28.12.2019,29.12.2019,-,1,2019-12-28,2019-12-29,,Allan
AC Mailand,5,19.12.2019,29.12.2019,-,1,2019-12-19,2019-12-29,,Allan
Manchester United,985,25.12.2019,25.12.2019,-,1,2019-12-25,2019-12-25,,Allan
Bayer 04 Leverkusen,15,08.12.2019,13.12.2019,-,2,2019-12-08,2019-12-13,,Allan
Tottenham Hotspur,148,08.12.2019,08.12.2019,-,2,2019-12-08,2019-12-08,,Allan
FC Bayern München,27,02.12.2019,02.12.2019,-,2,2019-12-02,2019-12-02,,Allan
SSC Neapel,6195,13.11.2019,13.11.2019,-,2,2019-11-13,2019-11-13,,Allan
Real Madrid,418,11.10.2019,11.10.2019,-,2,2019-10-11,2019-10-11,,Allan
FC Liverpool,31,05.10.2019,08.10.2019,-,2,2019-10-05,2019-10-08,,Allan
FC Barcelona,131,19.09.2019,19.09.2019,-,2,2019-09-19,2019-09-19,,Allan
Borussia Dortmund,16,18.08.2018,18.08.2018,-,2,2018-08-18,2018-08-18,,Allan
FC Red Bull Salzburg,409,14.08.2018,18.08.2018,-,2,2018-08-14,2018-08-18,,Allan
Juventus Turin,506,10.07.2018,10.07.2018,-,2,2018-07-10,2018-07-10,,Allan
Manchester United,985,08.07.2018,08.07.2018,-,2,2018-07-08,2018-07-08,,Allan
CD Leganés,1244,17.08.2018,17.08.2018,-,1,2018-08-17,2018-08-17,,Allan Nyom
FC Barcelona,131,05.12.2014,05.12.2014,-,1,2014-12-05,2014-12-05,,Allan Nyom
SK Austria Kärnten (-2010),11609,05.08.2009,20.08.2009,-,1,2009-08-05,2009-08-20,,Allan Nyom
SSC Neapel,6195,03.02.2025,03.02.2025,-,1,2025-02-03,2025-02-03,,Allan Saint-Maximin
Fenerbahce,36,16.07.2024,16.07.2024,-,1,2024-07-16,2024-07-16,,Allan Saint-Maximin
Al-Ahli SFC,18487,29.07.2023,29.07.2023,-,1,2023-07-29,2023-07-29,,Allan Saint-Maximin
SSC Neapel,6195,18.07.2023,18.07.2023,-,1,2023-07-18,2023-07-18,,Allan Saint-Maximin
FC Everton,29,11.07.2021,11.07.2021,-,1,2021-07-11,2021-07-11,,Allan Saint-Maximin
Tottenham Hotspur,148,06.07.2020,06.07.2020,-,1,2020-07-06,2020-07-06,,Allan Saint-Maximin
Newcastle United,762,02.08.2019,02.08.2019,-,1,2019-08-02,2019-08-02,,Allan Saint-Maximin
FC Watford,1010,08.07.2019,08.07.2019,-,1,2019-07-08,2019-07-08,,Allan Saint-Maximin
Crystal Palace,873,28.05.2019,28.05.2019,-,1,2019-05-28,2019-05-28,,Allan Saint-Maximin
FC Everton,29,28.05.2019,28.05.2019,-,1,2019-05-28,2019-05-28,,Allan Saint-Maximin
Borussia Dortmund,16,06.05.2019,10.05.2019,-,1,2019-05-06,2019-05-10,,Allan Saint-Maximin
AC Mailand,5,06.02.2019,06.02.2019,-,1,2019-02-06,2019-02-06,,Allan Saint-Maximin
FC Sevilla,368,21.08.2018,24.08.2018,-,1,2018-08-21,2018-08-24,,Allan Saint-Maximin
SC Bastia,595,28.07.2016,28.07.2016,-,1,2016-07-28,2016-07-28,,Allan Saint-Maximin
Hannover 96,42,30.07.2015,31.07.2015,-,1,2015-07-30,2015-07-31,,Allan Saint-Maximin
AS Monaco,162,27.07.2015,27.07.2015,-,2,2015-07-27,2015-07-27,,Allan Saint-Maximin
FC Lorient,1158,24.01.2023,24.01.2023,-,1,2023-01-24,2023-01-24,,Alphonse Areola
Newcastle United,762,15.06.2022,15.06.2022,-,1,2022-06-15,2022-06-15,,Alphonse Areola
West Ham United,379,26.07.2021,26.07.2021,-,1,2021-07-26,2021-07-26,,Alphonse Areola
OGC Nizza,417,26.07.2021,26.07.2021,-,1,2021-07-26,2021-07-26,,Alphonse Areola
Olympiakos Piräus,683,25.06.2021,27.06.2021,-,1,2021-06-25,2021-06-27,,Alphonse Areola
FC Fulham,931,09.09.2020,09.09.2020,-,1,2020-09-09,2020-09-09,,Alphonse Areola
FC Stade Rennes,273,08.09.2020,08.09.2020,-,1,2020-09-08,2020-09-08,,Alphonse Areola
Real Madrid,418,01.09.2019,01.09.2019,-,1,2019-09-01,2019-09-01,,Alphonse Areola
Inter Mailand,46,05.11.2018,05.11.2018,-,1,2018-11-05,2018-11-05,,Alphonse Areola
AS Rom,12,15.07.2018,15.07.2018,-,1,2018-07-15,2018-07-15,,Alphonse Areola
SSC Neapel,6195,24.05.2018,24.05.2018,-,1,2018-05-24,2018-05-24,,Alphonse Areola
FC Chelsea,631,05.06.2017,05.06.2017,-,1,2017-06-05,2017-06-05,,Alphonse Areola
FC Villarreal,1050,17.06.2015,17.06.2015,-,1,2015-06-17,2015-06-17,,Alphonse Areola
RC Lens,826,17.07.2013,17.07.2013,-,1,2013-07-17,2013-07-17,,Alphonse Areola
US Créteil-Lusitanos,2067,29.05.2013,29.05.2013,-,1,2013-05-29,2013-05-29,,Alphonse Areola
Ferencvárosi TC,279,05.01.2025,05.01.2025,-,1,2025-01-05,2025-01-05,,Amadou Diawara
RSC Anderlecht,58,31.08.2022,31.08.2022,-,1,2022-08-31,2022-08-31,,Amadou Diawara
Hertha BSC,44,01.07.2022,01.07.2022,-,1,2022-07-01,2022-07-01,,Amadou Diawara
FC Schalke 04,33,24.06.2022,27.06.2022,-,1,2022-06-24,2022-06-27,,Amadou Diawara
FC Augsburg,167,24.06.2022,25.06.2022,-,1,2022-06-24,2022-06-25,,Amadou Diawara
Borussia Mönchengladbach,18,21.04.2022,03.05.2022,-,1,2022-04-21,2022-05-03,,Amadou Diawara
TSG 1899 Hoffenheim,533,21.04.2022,21.04.2022,-,1,2022-04-21,2022-04-21,,Amadou Diawara
SC Freiburg,60,21.04.2022,21.04.2022,-,1,2022-04-21,2022-04-21,,Amadou Diawara
FC Fulham,931,27.01.2022,27.01.2022,-,1,2022-01-27,2022-01-27,,Amadou Diawara
Eintracht Frankfurt,24,19.11.2021,21.11.2021,-,1,2021-11-19,2021-11-21,,Amadou Diawara
Galatasaray,141,07.09.2021,09.09.2021,-,1,2021-09-07,2021-09-09,,Amadou Diawara
Hertha BSC,44,01.07.2019,01.07.2019,-,1,2019-07-01,2019-07-01,,Amadou Diawara
AS Rom,12,26.06.2019,26.06.2019,-,1,2019-06-26,2019-06-26,,Amadou Diawara
AC Mailand,5,18.06.2019,18.06.2019,-,1,2019-06-18,2019-06-18,,Amadou Diawara
Tottenham Hotspur,148,28.03.2019,28.03.2019,-,1,2019-03-28,2019-03-28,,Amadou Diawara
AC Florenz,430,31.12.2018,31.12.2018,-,2,2018-12-31,2018-12-31,,Amadou Diawara
Wolverhampton Wanderers,543,12.11.2018,12.11.2018,-,2,2018-11-12,2018-11-12,,Amadou Diawara
FC Chelsea,631,15.11.2016,15.11.2016,-,2,2016-11-15,2016-11-15,,Amadou Diawara
FC Schalke 04,33,18.08.2016,27.08.2016,-,2,2016-08-18,2016-08-27,,Amadou Diawara
SSC Neapel,6195,21.08.2016,21.08.2016,-,2,2016-08-21,2016-08-21,,Amadou Diawara
Aston Villa,405,17.08.2016,17.08.2016,-,2,2016-08-17,2016-08-17,,Amadou Diawara
AC Mailand,5,17.08.2016,17.08.2016,-,2,2016-08-17,2016-08-17,,Amadou Diawara
AS Rom,12,20.07.2016,20.07.2016,-,2,2016-07-20,2016-07-20,,Amadou Diawara
FC Valencia,1049,08.06.2016,08.06.2016,-,2,2016-06-08,2016-06-08,,Amadou Diawara
Borussia Dortmund,16,28.03.2016,29.03.2016,-,2,2016-03-28,2016-03-29,,Amadou Diawara
FC Bayern München,27,17.03.2016,17.03.2016,-,2,2016-03-17,2016-03-17,,Amadou Diawara
FC Sevilla,368,17.03.2016,17.03.2016,-,2,2016-03-17,2016-03-17,,Amadou Diawara
Manchester City,281,13.03.2016,13.03.2016,-,2,2016-03-13,2016-03-13,,Amadou Diawara
Juventus Turin,506,13.03.2016,13.03.2016,-,2,2016-03-13,2016-03-13,,Amadou Diawara
Tottenham Hotspur,148,20.11.2015,20.11.2015,-,2,2015-11-20,2015-11-20,,Amadou Diawara
Eintracht Frankfurt,24,28.10.2015,11.11.2015,-,3,2015-10-28,2015-11-11,,Amadou Diawara
AC Florenz,430,28.10.2015,28.10.2015,-,3,2015-10-28,2015-10-28,,Amadou Diawara
Aston Villa,405,18.07.2024,18.07.2024,-,1,2024-07-18,2024-07-18,,Amadou Onana
FC Bayern München,27,26.06.2024,01.07.2024,-,1,2024-06-26,2024-07-01,,Amadou Onana
FC Barcelona,131,20.12.2023,20.12.2023,-,1,2023-12-20,2023-12-20,,Amadou Onana
Manchester United,985,14.08.2023,14.08.2023,-,1,2023-08-14,2023-08-14,,Amadou Onana
FC Arsenal,11,05.04.2023,05.04.2023,-,1,2023-04-05,2023-04-05,,Amadou Onana
FC Chelsea,631,05.04.2023,05.04.2023,-,1,2023-04-05,2023-04-05,,Amadou Onana
FC Everton,29,04.08.2022,07.08.2022,-,1,2022-08-04,2022-08-07,,Amadou Onana
West Ham United,379,03.08.2022,04.08.2022,-,1,2022-08-03,2022-08-04,,Amadou Onana
FC Liverpool,31,18.07.2022,25.07.2022,-,1,2022-07-18,2022-07-25,,Amadou Onana
AS Monaco,162,09.06.2022,09.06.2022,-,1,2022-06-09,2022-06-09,,Amadou Onana
LOSC Lille,1082,05.08.2021,05.08.2021,-,1,2021-08-05,2021-08-05,,Amadou Onana
FC Stade Rennes,273,24.07.2021,26.07.2021,-,1,2021-07-24,2021-07-26,,Amadou Onana
SSC Neapel,6195,01.07.2021,03.07.2021,-,1,2021-07-01,2021-07-03,,Amadou Onana
FC Watford,1010,01.07.2021,02.07.2021,-,1,2021-07-01,2021-07-02,,Amadou Onana
Borussia Dortmund,16,28.06.2021,28.06.2021,-,1,2021-06-28,2021-06-28,,Amadou Onana
Hamburger SV,41,31.01.2020,31.01.2020,-,2,2020-01-31,2020-01-31,,Amadou Onana
SSC Neapel,6195,08.01.2017,08.01.2017,-,1,2017-01-08,2017-01-08,,Amato Ciciretti
VfB Stuttgart,79,27.08.2024,27.08.2024,-,1,2024-08-27,2024-08-27,,Ameen Al-Dakhil
VfL Wolfsburg,82,22.08.2024,22.08.2024,-,1,2024-08-22,2024-08-22,,Ameen Al-Dakhil
Hellas Verona,276,28.05.2025,28.05.2025,-,1,2025-05-28,2025-05-28,,Amin Sarr
FC Basel 1893,26,19.03.2025,19.03.2025,-,1,2025-03-19,2025-03-19,,Amin Sarr
VfL Wolfsburg,82,31.08.2023,31.08.2023,-,1,2023-08-31,2023-08-31,,Amin Sarr
FC Metz,347,30.08.2023,30.08.2023,-,1,2023-08-30,2023-08-30,,Amin Sarr
FC Lorient,1158,30.08.2023,30.08.2023,-,1,2023-08-30,2023-08-30,,Amin Sarr
FC Schalke 04,33,16.05.2024,17.05.2024,-,1,2024-05-16,2024-05-17,,Amin Younes
Standard Lüttich,3057,05.09.2023,05.09.2023,-,1,2023-09-05,2023-09-05,,Amin Younes
Al-Ettifaq FC,7732,14.01.2022,18.01.2022,-,1,2022-01-14,2022-01-18,,Amin Younes
Sivasspor,2381,06.01.2022,06.01.2022,-,1,2022-01-06,2022-01-06,,Amin Younes
Antalyaspor,589,02.01.2022,02.01.2022,-,1,2022-01-02,2022-01-02,,Amin Younes
Genua CFC,252,16.12.2021,16.12.2021,-,1,2021-12-16,2021-12-16,,Amin Younes
Al-Shabab FC,9840,31.08.2021,31.08.2021,-,1,2021-08-31,2021-08-31,,Amin Younes
Al-Shabab Club (Bahrain),26261,17.08.2021,17.08.2021,-,1,2021-08-17,2021-08-17,,Amin Younes
Eintracht Frankfurt,24,20.07.2021,22.07.2021,-,1,2021-07-20,2021-07-22,,Amin Younes
Hellas Verona,276,03.10.2020,03.10.2020,-,1,2020-10-03,2020-10-03,,Amin Younes
Fortuna Düsseldorf,38,03.10.2020,03.10.2020,-,1,2020-10-03,2020-10-03,,Amin Younes
Galatasaray,141,01.09.2020,02.09.2020,-,1,2020-09-01,2020-09-02,,Amin Younes
US Sassuolo,6574,30.07.2020,30.07.2020,-,1,2020-07-30,2020-07-30,,Amin Younes
FK Krasnodar,16704,12.02.2020,12.02.2020,-,1,2020-02-12,2020-02-12,,Amin Younes
1.FSV Mainz 05,39,27.01.2020,27.01.2020,-,1,2020-01-27,2020-01-27,,Amin Younes
Bayer 04 Leverkusen,15,23.01.2020,23.01.2020,-,2,2020-01-23,2020-01-23,,Amin Younes
SV Werder Bremen,86,23.01.2020,23.01.2020,-,2,2020-01-23,2020-01-23,,Amin Younes
1.FC Köln,3,23.01.2020,23.01.2020,-,2,2020-01-23,2020-01-23,,Amin Younes
Sampdoria Genua,1038,23.01.2020,23.01.2020,-,2,2020-01-23,2020-01-23,,Amin Younes
Celta Vigo,940,31.01.2019,31.01.2019,-,2,2019-01-31,2019-01-31,,Amin Younes
VfB Stuttgart,79,28.01.2019,29.01.2019,-,2,2019-01-28,2019-01-29,,Amin Younes
VfL Wolfsburg,82,03.07.2018,03.07.2018,-,2,2018-07-03,2018-07-03,,Amin Younes
Benfica Lissabon,294,18.06.2018,18.06.2018,-,2,2018-06-18,2018-06-18,,Amin Younes
SV Werder Bremen,86,20.04.2018,26.04.2018,-,2,2018-04-20,2018-04-26,,Amin Younes
FC Schalke 04,33,04.04.2018,07.04.2018,-,2,2018-04-04,2018-04-07,,Amin Younes
Borussia Mönchengladbach,18,04.04.2018,04.04.2018,-,2,2018-04-04,2018-04-04,,Amin Younes
FC Bayern München,27,07.02.2018,09.02.2018,-,2,2018-02-07,2018-02-09,,Amin Younes
SSC Neapel,6195,30.01.2018,07.02.2018,-,2,2018-01-30,2018-02-07,,Amin Younes
Swansea City,2288,22.01.2018,22.01.2018,-,2,2018-01-22,2018-01-22,,Amin Younes
Zenit St. Petersburg,964,20.01.2018,20.01.2018,-,2,2018-01-20,2018-01-20,,Amin Younes
Real Betis Sevilla,150,20.12.2017,20.12.2017,-,3,2017-12-20,2017-12-20,,Amin Younes
FC Schalke 04,33,04.07.2017,05.07.2017,-,3,2017-07-04,2017-07-05,,Amin Younes
FC Turin,416,04.07.2017,04.07.2017,-,3,2017-07-04,2017-07-04,,Amin Younes
Borussia Dortmund,16,19.05.2017,20.05.2017,-,3,2017-05-19,2017-05-20,,Amin Younes
RB Leipzig,23826,18.05.2017,20.05.2017,-,3,2017-05-18,2017-05-20,,Amin Younes
Ajax Amsterdam,610,16.07.2015,16.07.2015,-,3,2015-07-16,2015-07-16,,Amin Younes
TSV 1860 München,72,23.06.2015,26.06.2015,-,3,2015-06-23,2015-06-26,,Amin Younes
1.FC Kaiserslautern,2,22.08.2014,22.08.2014,-,3,2014-08-22,2014-08-22,,Amin Younes
Fortuna Düsseldorf,38,04.07.2014,07.07.2014,-,3,2014-07-04,2014-07-07,,Amin Younes
Olympique Marseille,244,24.01.2025,24.01.2025,-,1,2025-01-24,2025-01-24,,Amine Gouiri
Galatasaray,141,09.01.2025,09.01.2025,-,1,2025-01-09,2025-01-09,,Amine Gouiri
Bayer 04 Leverkusen,15,06.06.2024,08.06.2024,-,1,2024-06-06,2024-06-08,,Amine Gouiri
RB Leipzig,23826,06.06.2024,06.06.2024,-,1,2024-06-06,2024-06-06,,Amine Gouiri
FC Stade Rennes,273,28.08.2022,28.08.2022,-,1,2022-08-28,2022-08-28,,Amine Gouiri
Borussia Dortmund,16,02.06.2022,05.07.2022,-,1,2022-06-02,2022-07-05,,Amine Gouiri
FC Paris Saint-Germain,583,03.07.2022,03.07.2022,-,1,2022-07-03,2022-07-03,,Amine Gouiri
Real Madrid,418,03.07.2022,03.07.2022,-,1,2022-07-03,2022-07-03,,Amine Gouiri
Newcastle United,762,03.07.2022,03.07.2022,-,1,2022-07-03,2022-07-03,,Amine Gouiri
OGC Nizza,417,03.07.2020,03.07.2020,-,1,2020-07-03,2020-07-03,,Amine Gouiri
Juventus Turin,506,13.06.2019,13.06.2019,-,1,2019-06-13,2019-06-13,,Amine Gouiri
Hamburger SV,41,24.06.2025,26.06.2025,24 %,1,2025-06-24,2025-06-26,24.0,Amine Harit
VfB Stuttgart,79,22.06.2025,23.06.2025,12 %,1,2025-06-22,2025-06-23,12.0,Amine Harit
VfL Wolfsburg,82,22.06.2025,22.06.2025,47 %,1,2025-06-22,2025-06-22,47.0,Amine Harit
Trabzonspor,449,15.06.2025,15.06.2025,-,1,2025-06-15,2025-06-15,,Amine Harit
Olympique Marseille,244,01.09.2022,01.09.2022,-,1,2022-09-01,2022-09-01,,Amine Harit
Leicester City,1003,30.08.2022,30.08.2022,-,1,2022-08-30,2022-08-30,,Amine Harit
Galatasaray,141,25.07.2022,10.08.2022,-,1,2022-07-25,2022-08-10,,Amine Harit
FC Porto,720,13.07.2022,15.07.2022,-,1,2022-07-13,2022-07-15,,Amine Harit
Trabzonspor,449,13.07.2022,13.07.2022,-,1,2022-07-13,2022-07-13,,Amine Harit
Borussia Mönchengladbach,18,04.07.2022,09.07.2022,-,1,2022-07-04,2022-07-09,,Amine Harit
FC Sevilla,368,19.05.2022,24.06.2022,-,1,2022-05-19,2022-06-24,,Amine Harit
FC Villarreal,1050,19.05.2022,19.05.2022,-,1,2022-05-19,2022-05-19,,Amine Harit
FC Everton,29,26.07.2021,26.07.2021,-,1,2021-07-26,2021-07-26,,Amine Harit
AC Mailand,5,,06.06.2021,-,1,,2021-06-06,,Amine Harit
Atalanta Bergamo,800,01.06.2021,01.06.2021,-,1,2021-06-01,2021-06-01,,Amine Harit
SSC Neapel,6195,01.06.2021,01.06.2021,-,2,2021-06-01,2021-06-01,,Amine Harit
Borussia Dortmund,16,09.08.2020,14.08.2020,-,2,2020-08-09,2020-08-14,,Amine Harit
FC Valencia,1049,09.08.2020,09.08.2020,-,2,2020-08-09,2020-08-09,,Amine Harit
OGC Nizza,417,09.08.2020,09.08.2020,-,2,2020-08-09,2020-08-09,,Amine Harit
FC Barcelona,131,29.04.2020,30.04.2020,-,2,2020-04-29,2020-04-30,,Amine Harit
FC Liverpool,31,19.11.2019,20.11.2019,-,2,2019-11-19,2019-11-20,,Amine Harit
Angers SCO,1420,15.08.2019,16.08.2019,-,2,2019-08-15,2019-08-16,,Amine Harit
Genua CFC,252,17.07.2019,18.07.2019,-,2,2019-07-17,2019-07-18,,Amine Harit
FC Schalke 04,33,08.07.2017,10.07.2017,-,2,2017-07-08,2017-07-10,,Amine Harit
Borussia Dortmund,16,05.05.2017,05.05.2017,-,2,2017-05-05,2017-05-05,,Amine Harit
Bayer 04 Leverkusen,15,05.05.2017,05.05.2017,-,2,2017-05-05,2017-05-05,,Amine Harit
OGC Nizza,417,10.12.2016,10.12.2016,-,2,2016-12-10,2016-12-10,,Amine Harit
FC Bayern München,27,05.08.2016,31.08.2016,-,2,2016-08-05,2016-08-31,,Amine Harit
FC Nantes,995,13.01.2025,13.01.2025,-,1,2025-01-13,2025-01-13,,Amine Salama
VfB Stuttgart,79,01.02.2025,05.02.2025,-,1,2025-02-01,2025-02-05,,Amir Richardson
AC Florenz,430,11.08.2024,12.08.2024,-,1,2024-08-11,2024-08-12,,Amir Richardson
Tottenham Hotspur,148,05.08.2024,05.08.2024,-,1,2024-08-05,2024-08-05,,Amir Richardson
FC Stade Rennes,273,11.01.2024,11.01.2024,-,1,2024-01-11,2024-01-11,,Amir Richardson
Stade Reims,1421,13.07.2022,13.07.2022,-,1,2022-07-13,2022-07-13,,Amir Richardson
SV Werder Bremen,86,18.05.2022,18.05.2022,-,1,2022-05-18,2022-05-18,,Amos Pieper
1.FC Union Berlin,89,16.05.2022,18.05.2022,-,1,2022-05-16,2022-05-18,,Amos Pieper
1.FSV Mainz 05,39,11.05.2022,11.05.2022,-,1,2022-05-11,2022-05-11,,Amos Pieper
FC Bayern München,27,12.02.2022,11.05.2022,-,1,2022-02-12,2022-05-11,,Amos Pieper
Borussia Dortmund,16,27.04.2022,28.04.2022,-,1,2022-04-27,2022-04-28,,Amos Pieper
FC Chelsea,631,27.04.2022,27.04.2022,-,1,2022-04-27,2022-04-27,,Amos Pieper
FC Southampton,180,27.04.2022,27.04.2022,-,1,2022-04-27,2022-04-27,,Amos Pieper
Newcastle United,762,27.04.2022,27.04.2022,-,1,2022-04-27,2022-04-27,,Amos Pieper
RB Leipzig,23826,13.07.2021,26.08.2021,-,1,2021-07-13,2021-08-26,,Amos Pieper
Panathinaikos Athen,265,02.08.2025,02.08.2025,-,1,2025-08-02,2025-08-02,,Anass Zaroury
Norwich City,1123,29.07.2025,29.07.2025,-,1,2025-07-29,2025-07-29,,Anass Zaroury
Coventry City,990,29.07.2025,29.07.2025,-,1,2025-07-29,2025-07-29,,Anass Zaroury
Borussia Dortmund,16,10.04.2023,11.04.2023,-,1,2023-04-10,2023-04-11,,Anass Zaroury
Hamburger SV,41,09.06.2022,11.06.2022,-,1,2022-06-09,2022-06-11,,Anastasios Donis
Genua CFC,252,18.11.2019,18.11.2019,-,1,2019-11-18,2019-11-18,,Anastasios Donis
Stade Reims,1421,03.09.2019,03.09.2019,-,1,2019-09-03,2019-09-03,,Anastasios Donis
Genua CFC,252,01.09.2019,01.09.2019,-,1,2019-09-01,2019-09-01,,Anastasios Donis
FC Bologna,1025,30.08.2019,30.08.2019,-,1,2019-08-30,2019-08-30,,Anastasios Donis
Eintracht Frankfurt,24,20.08.2019,20.08.2019,-,1,2019-08-20,2019-08-20,,Anastasios Donis
Spartak Moskau,232,22.07.2019,24.07.2019,-,1,2019-07-22,2019-07-24,,Anastasios Donis
Dinamo Moskau,121,19.07.2019,23.07.2019,-,1,2019-07-19,2019-07-23,,Anastasios Donis
Borussia Mönchengladbach,18,29.05.2019,30.05.2019,-,1,2019-05-29,2019-05-30,,Anastasios Donis
TSG 1899 Hoffenheim,533,29.05.2019,29.05.2019,-,1,2019-05-29,2019-05-29,,Anastasios Donis
Bayer 04 Leverkusen,15,29.05.2019,29.05.2019,-,1,2019-05-29,2019-05-29,,Anastasios Donis
Olympiakos Piräus,683,13.05.2018,13.05.2018,-,1,2018-05-13,2018-05-13,,Anastasios Donis
VfB Stuttgart,79,01.07.2017,01.07.2017,-,1,2017-07-01,2017-07-01,,Anastasios Donis
CD Leganés,1244,17.06.2016,17.06.2016,-,1,2016-06-17,2016-06-17,,Anastasios Donis
Borussia Dortmund,16,16.01.2015,16.01.2015,-,1,2015-01-16,2015-01-16,,Anastasios Donis
SV Werder Bremen,86,22.05.2014,22.05.2014,-,2,2014-05-22,2014-05-22,,Anastasios Donis
FC Sevilla,368,19.05.2017,19.05.2017,-,1,2017-05-19,2017-05-19,,Ander Capa
Besiktas JK,114,29.12.2016,29.12.2016,-,1,2016-12-29,2016-12-29,,Ander Capa
Athletic Bilbao,621,23.08.2022,23.08.2022,-,1,2022-08-23,2022-08-23,,Ander Herrera
FC Paris Saint-Germain,583,04.07.2019,04.07.2019,-,1,2019-07-04,2019-07-04,,Ander Herrera
FC Arsenal,11,26.03.2019,26.03.2019,-,1,2019-03-26,2019-03-26,,Ander Herrera
Athletic Bilbao,621,25.04.2018,25.04.2018,-,1,2018-04-25,2018-04-25,,Ander Herrera
Atlético Madrid,13,10.11.2017,10.11.2017,-,1,2017-11-10,2017-11-10,,Ander Herrera
FC Barcelona,131,22.10.2017,22.10.2017,-,1,2017-10-22,2017-10-22,,Ander Herrera
Juventus Turin,506,12.03.2016,12.03.2016,-,1,2016-03-12,2016-03-12,,Ander Herrera
FC Bayern München,27,19.11.2014,24.11.2014,-,1,2014-11-19,2014-11-24,,Ander Herrera
Tottenham Hotspur,148,18.04.2014,18.04.2014,-,1,2014-04-18,2014-04-18,,Ander Herrera
FC Liverpool,31,29.03.2014,29.03.2014,-,1,2014-03-29,2014-03-29,,Ander Herrera
Manchester United,985,26.06.2014,03.09.2013,-,1,2014-06-26,2013-09-03,,Ander Herrera
FC Barcelona,131,16.05.2013,16.05.2013,-,1,2013-05-16,2013-05-16,,Ander Herrera
Manchester City,281,15.04.2012,15.04.2012,-,1,2012-04-15,2012-04-15,,Ander Herrera
Inter Mailand,46,03.10.2010,03.10.2010,-,1,2010-10-03,2010-10-03,,Ander Herrera
FC Bayern München,27,27.08.2014,27.08.2014,-,1,2014-08-27,2014-08-27,,Ander Iturraspe
SSC Neapel,6195,26.08.2014,26.08.2014,-,1,2014-08-26,2014-08-26,,Ander Iturraspe
Widzew Lodz,88,07.09.2025,07.09.2025,-,1,2025-09-07,2025-09-07,,Andi Zeqiri
SV Werder Bremen,86,19.08.2025,24.08.2025,22 %,1,2025-08-19,2025-08-24,22.0,Andi Zeqiri
FC St. Gallen 1879,257,15.08.2025,18.08.2025,39 %,1,2025-08-15,2025-08-18,39.0,Andi Zeqiri
Paris FC,10004,21.07.2025,21.07.2025,-,1,2025-07-21,2025-07-21,,Andi Zeqiri
FC Elche,1531,05.07.2025,05.07.2025,-,1,2025-07-05,2025-07-05,,Andi Zeqiri
Borussia Mönchengladbach,18,06.06.2025,09.06.2025,54 %,1,2025-06-06,2025-06-09,54.0,Andi Zeqiri
RSC Anderlecht,58,02.05.2025,02.05.2025,-,1,2025-05-02,2025-05-02,,Andi Zeqiri
Sporting Lissabon,336,29.05.2024,29.05.2024,-,1,2024-05-29,2024-05-29,,Andi Zeqiri
SV Werder Bremen,86,17.07.2023,31.08.2023,-,1,2023-07-17,2023-08-31,,Andi Zeqiri
FC Basel 1893,26,02.08.2022,02.08.2022,-,1,2022-08-02,2022-08-02,,Andi Zeqiri
D.C. United,2440,07.06.2022,07.06.2022,-,1,2022-06-07,2022-06-07,,Andi Zeqiri
FC Augsburg,167,30.08.2021,30.08.2021,-,1,2021-08-30,2021-08-30,,Andi Zeqiri
Brighton & Hove Albion,1237,27.09.2020,27.09.2020,-,1,2020-09-27,2020-09-27,,Andi Zeqiri
Hellas Verona,276,07.09.2020,14.09.2020,-,1,2020-09-07,2020-09-14,,Andi Zeqiri
Udinese Calcio,410,07.09.2020,07.09.2020,-,1,2020-09-07,2020-09-07,,Andi Zeqiri
Olympique Marseille,244,02.09.2020,02.09.2020,-,2,2020-09-02,2020-09-02,,Andi Zeqiri
RC Lens,826,06.07.2020,06.07.2020,-,2,2020-07-06,2020-07-06,,Andi Zeqiri
OGC Nizza,417,12.06.2020,06.07.2020,-,2,2020-06-12,2020-07-06,,Andi Zeqiri
AS Saint-Étienne,618,12.06.2020,06.07.2020,-,2,2020-06-12,2020-07-06,,Andi Zeqiri
FC Basel 1893,26,16.01.2020,16.01.2020,-,2,2020-01-16,2020-01-16,,Andi Zeqiri
Benfica Lissabon,294,02.02.2025,02.02.2025,-,1,2025-02-02,2025-02-02,,Andrea Belotti
Como 1907,1047,25.06.2024,25.06.2024,-,1,2024-06-25,2024-06-25,,Andrea Belotti
AC Florenz,430,31.01.2024,31.01.2024,-,1,2024-01-31,2024-01-31,,Andrea Belotti
Galatasaray,141,29.06.2023,29.06.2023,-,1,2023-06-29,2023-06-29,,Andrea Belotti
AS Rom,12,28.08.2022,28.08.2022,-,1,2022-08-28,2022-08-28,,Andrea Belotti
Galatasaray,141,18.08.2022,18.08.2022,-,1,2022-08-18,2022-08-18,,Andrea Belotti
Fenerbahce,36,21.06.2022,03.08.2022,-,1,2022-06-21,2022-08-03,,Andrea Belotti
Borussia Dortmund,16,22.07.2022,22.07.2022,-,1,2022-07-22,2022-07-22,,Andrea Belotti
FC Everton,29,03.07.2022,03.07.2022,-,1,2022-07-03,2022-07-03,,Andrea Belotti
FC Arsenal,11,02.11.2021,02.11.2021,-,1,2021-11-02,2021-11-02,,Andrea Belotti
Borussia Dortmund,16,25.10.2021,26.10.2021,-,1,2021-10-25,2021-10-26,,Andrea Belotti
Inter Mailand,46,24.08.2021,24.08.2021,-,1,2021-08-24,2021-08-24,,Andrea Belotti
AS Rom,12,12.07.2021,12.07.2021,-,1,2021-07-12,2021-07-12,,Andrea Belotti
Olympique Lyon,1041,15.04.2021,15.04.2021,-,1,2021-04-15,2021-04-15,,Andrea Belotti
AC Mailand,5,08.04.2021,08.04.2021,-,1,2021-04-08,2021-04-08,,Andrea Belotti
FC Chelsea,631,08.04.2021,08.04.2021,-,2,2021-04-08,2021-04-08,,Andrea Belotti
FC Everton,29,08.04.2021,08.04.2021,-,2,2021-04-08,2021-04-08,,Andrea Belotti
Manchester United,985,17.04.2020,17.04.2020,-,2,2020-04-17,2020-04-17,,Andrea Belotti
Real Madrid,418,17.04.2020,17.04.2020,-,2,2020-04-17,2020-04-17,,Andrea Belotti
West Ham United,379,19.01.2019,19.01.2019,-,2,2019-01-19,2019-01-19,,Andrea Belotti
Atlético Madrid,13,13.01.2018,13.01.2018,-,2,2018-01-13,2018-01-13,,Andrea Belotti
AS Monaco,162,23.08.2017,23.08.2017,-,2,2017-08-23,2017-08-23,,Andrea Belotti
Zenit St. Petersburg,964,03.06.2017,03.06.2017,-,2,2017-06-03,2017-06-03,,Andrea Belotti
FC Bayern München,27,23.05.2017,23.05.2017,-,2,2017-05-23,2017-05-23,,Andrea Belotti
Manchester City,281,07.03.2017,08.03.2017,-,2,2017-03-07,2017-03-08,,Andrea Belotti
SSC Neapel,6195,26.11.2016,26.11.2016,-,2,2016-11-26,2016-11-26,,Andrea Belotti
FC Liverpool,31,16.09.2016,16.09.2016,-,2,2016-09-16,2016-09-16,,Andrea Belotti
Manchester City,281,16.01.2025,16.01.2025,-,1,2025-01-16,2025-01-16,,Andrea Cambiaso
Tottenham Hotspur,148,21.07.2023,21.07.2023,-,1,2023-07-21,2023-07-21,,Andrea Cambiaso
Nottingham Forest,703,21.07.2023,21.07.2023,-,1,2023-07-21,2023-07-21,,Andrea Cambiaso
Juventus Turin,506,23.01.2022,23.01.2022,-,1,2022-01-23,2022-01-23,,Andrea Cambiaso
Borussia Dortmund,16,07.11.2021,09.11.2021,-,1,2021-11-07,2021-11-09,,Andrea Cambiaso
Palermo FC,458,05.07.2023,05.07.2023,-,1,2023-07-05,2023-07-05,,Andrea Carboni
Lazio Rom,398,15.05.2024,15.05.2024,-,1,2024-05-15,2024-05-15,,Andrea Colpani
Parma Calcio 1913,130,21.01.2021,21.01.2021,-,1,2021-01-21,2021-01-21,,Andrea Conti
AC Florenz,430,12.01.2021,12.01.2021,-,1,2021-01-12,2021-01-12,,Andrea Conti
SV Werder Bremen,86,14.08.2019,14.08.2019,-,1,2019-08-14,2019-08-14,,Andrea Conti
AC Mailand,5,07.07.2017,07.07.2017,-,1,2017-07-07,2017-07-07,,Andrea Conti
Zenit St. Petersburg,964,03.06.2017,03.06.2017,-,1,2017-06-03,2017-06-03,,Andrea Conti
Borussia Dortmund,16,20.05.2017,20.05.2017,-,1,2017-05-20,2017-05-20,,Andrea Conti
Atlético Madrid,13,17.05.2017,17.05.2017,-,1,2017-05-17,2017-05-17,,Andrea Conti
FC Bayern München,27,30.04.2017,02.05.2017,-,1,2017-04-30,2017-05-02,,Andrea Conti
Inter Mailand,46,30.04.2017,30.04.2017,-,1,2017-04-30,2017-04-30,,Andrea Conti
Juventus Turin,506,30.04.2017,30.04.2017,-,1,2017-04-30,2017-04-30,,Andrea Conti
FC Chelsea,631,17.02.2017,17.02.2017,-,1,2017-02-17,2017-02-17,,Andrea Conti
SSC Neapel,6195,14.02.2017,14.02.2017,-,1,2017-02-14,2017-02-14,,Andrea Conti
Wolverhampton Wanderers,543,28.06.2018,28.06.2018,-,1,2018-06-28,2018-06-28,,Andrea Favilli
Real Madrid Castilla,6767,06.08.2016,06.08.2016,-,1,2016-08-06,2016-08-06,,Andrea Favilli
FC Lugano,2790,31.05.2016,01.06.2016,-,1,2016-05-31,2016-06-01,,Andrea Favilli
Venezia FC,607,23.11.2024,23.11.2024,-,1,2024-11-23,2024-11-23,,Andrea Petagna
AC Monza,2919,11.08.2022,11.08.2022,-,1,2022-08-11,2022-08-11,,Andrea Petagna
Sampdoria Genua,1038,31.08.2021,31.08.2021,-,1,2021-08-31,2021-08-31,,Andrea Petagna
Inter Mailand,46,24.06.2021,24.06.2021,-,1,2021-06-24,2021-06-24,,Andrea Petagna
SSC Neapel,6195,30.01.2020,30.01.2020,-,1,2020-01-30,2020-01-30,,Andrea Petagna
AS Rom,12,18.12.2019,18.12.2019,-,1,2019-12-18,2019-12-18,,Andrea Petagna
Bayer 04 Leverkusen,15,30.04.2019,19.05.2019,-,1,2019-04-30,2019-05-19,,Andrea Petagna
Eintracht Frankfurt,24,30.04.2019,01.05.2019,-,1,2019-04-30,2019-05-01,,Andrea Petagna
Lazio Rom,398,13.07.2018,13.07.2018,-,1,2018-07-13,2018-07-13,,Andrea Petagna
Como 1907,1047,30.06.2015,30.06.2015,-,1,2015-06-30,2015-06-30,,Andrea Petagna
US Livorno 1915,1210,26.06.2015,26.06.2015,-,1,2015-06-26,2015-06-26,,Andrea Petagna
VfB Stuttgart,79,14.08.2024,14.08.2024,-,1,2024-08-14,2024-08-14,,Andrea Pinamonti
Ipswich Town,677,08.07.2024,08.07.2024,-,1,2024-07-08,2024-07-08,,Andrea Pinamonti
Leicester City,1003,08.07.2024,08.07.2024,-,1,2024-07-08,2024-07-08,,Andrea Pinamonti
Inter Mailand,46,03.06.2024,03.06.2024,-,1,2024-06-03,2024-06-03,,Andrea Pinamonti
AC Florenz,430,22.05.2024,22.05.2024,-,1,2024-05-22,2024-05-22,,Andrea Pinamonti
Lazio Rom,398,28.06.2023,28.06.2023,-,1,2023-06-28,2023-06-28,,Andrea Pinamonti
US Sassuolo,6574,10.08.2022,10.08.2022,-,1,2022-08-10,2022-08-10,,Andrea Pinamonti
RB Leipzig,23826,19.06.2022,19.06.2022,-,1,2022-06-19,2022-06-19,,Andrea Pinamonti
OGC Nizza,417,29.04.2022,29.04.2022,-,1,2022-04-29,2022-04-29,,Andrea Pinamonti
FC Empoli,749,25.08.2021,25.08.2021,-,1,2021-08-25,2021-08-25,,Andrea Pinamonti
Eintracht Frankfurt,24,07.01.2021,07.01.2021,-,1,2021-01-07,2021-01-07,,Andrea Pinamonti
Borussia Dortmund,16,19.06.2019,20.06.2019,-,1,2019-06-19,2019-06-20,,Andrea Pinamonti
Eintracht Frankfurt,24,19.06.2019,19.06.2019,-,1,2019-06-19,2019-06-19,,Andrea Pinamonti
FC Paris Saint-Germain,583,05.05.2018,05.05.2018,-,1,2018-05-05,2018-05-05,,Andrea Pinamonti
Atlético Madrid,13,05.05.2018,05.05.2018,-,1,2018-05-05,2018-05-05,,Andrea Pinamonti
FC Liverpool,31,05.05.2018,05.05.2018,-,2,2018-05-05,2018-05-05,,Andrea Pinamonti
FC Valencia,1049,05.05.2018,05.05.2018,-,2,2018-05-05,2018-05-05,,Andrea Pinamonti
FC Chelsea,631,22.01.2017,22.01.2017,-,2,2017-01-22,2017-01-22,,Andrea Pinamonti
Tottenham Hotspur,148,22.01.2017,22.01.2017,-,2,2017-01-22,2017-01-22,,Andrea Pinamonti
Bayer 04 Leverkusen,15,04.12.2016,04.12.2016,-,2,2016-12-04,2016-12-04,,Andrea Pinamonti
Juventus Turin,506,04.12.2016,04.12.2016,-,2,2016-12-04,2016-12-04,,Andrea Pinamonti
FC Chelsea,631,04.12.2016,04.12.2016,-,2,2016-12-04,2016-12-04,,Andrea Pinamonti
Juventus Turin,506,31.12.2024,31.12.2024,-,1,2024-12-31,2024-12-31,,Andreas Christensen
Newcastle United,762,15.12.2024,15.12.2024,-,1,2024-12-15,2024-12-15,,Andreas Christensen
Inter Mailand,46,11.12.2024,11.12.2024,-,1,2024-12-11,2024-12-11,,Andreas Christensen
Manchester United,985,13.01.2024,13.01.2024,-,1,2024-01-13,2024-01-13,,Andreas Christensen
Aston Villa,405,04.05.2023,04.05.2023,-,1,2023-05-04,2023-05-04,,Andreas Christensen
FC Barcelona,131,30.06.2022,30.06.2022,-,1,2022-06-30,2022-06-30,,Andreas Christensen
FC Bayern München,27,08.03.2022,04.06.2022,-,1,2022-03-08,2022-06-04,,Andreas Christensen
Borussia Dortmund,16,20.01.2022,15.02.2022,-,1,2022-01-20,2022-02-15,,Andreas Christensen
RB Leipzig,23826,25.01.2020,25.01.2020,-,1,2020-01-25,2020-01-25,,Andreas Christensen
Borussia Mönchengladbach,18,08.01.2020,10.01.2020,-,1,2020-01-08,2020-01-10,,Andreas Christensen
AC Mailand,5,08.01.2020,08.01.2020,-,1,2020-01-08,2020-01-08,,Andreas Christensen
FC Schalke 04,33,06.02.2019,08.02.2019,-,1,2019-02-06,2019-02-08,,Andreas Christensen
Juventus Turin,506,30.01.2019,30.01.2019,-,1,2019-01-30,2019-01-30,,Andreas Christensen
AS Monaco,162,23.10.2018,23.10.2018,-,1,2018-10-23,2018-10-23,,Andreas Christensen
Inter Mailand,46,03.08.2017,03.08.2017,-,1,2017-08-03,2017-08-03,,Andreas Christensen
FC Southampton,180,02.05.2017,02.05.2017,-,2,2017-05-02,2017-05-02,,Andreas Christensen
FC Chelsea,631,23.03.2017,23.03.2017,-,2,2017-03-23,2017-03-23,,Andreas Christensen
FC Barcelona,131,25.10.2016,25.10.2016,-,2,2016-10-25,2016-10-25,,Andreas Christensen
FC Bayern München,27,10.10.2016,12.10.2016,-,2,2016-10-10,2016-10-12,,Andreas Christensen
Real Madrid,418,10.10.2016,10.10.2016,-,2,2016-10-10,2016-10-10,,Andreas Christensen
FC Paris Saint-Germain,583,10.10.2016,10.10.2016,-,2,2016-10-10,2016-10-10,,Andreas Christensen
Manchester City,281,10.10.2016,10.10.2016,-,2,2016-10-10,2016-10-10,,Andreas Christensen
Borussia Mönchengladbach,18,08.09.2016,09.09.2016,-,2,2016-09-08,2016-09-09,,Andreas Christensen
Borussia Dortmund,16,11.05.2016,12.05.2016,-,2,2016-05-11,2016-05-12,,Andreas Christensen
AS Rom,12,09.04.2016,09.04.2016,-,2,2016-04-09,2016-04-09,,Andreas Christensen
Manchester United,985,06.03.2016,07.03.2016,-,2,2016-03-06,2016-03-07,,Andreas Christensen
FC Liverpool,31,06.03.2016,06.03.2016,-,2,2016-03-06,2016-03-06,,Andreas Christensen
Juventus Turin,506,03.11.2015,03.11.2015,-,2,2015-11-03,2015-11-03,,Andreas Christensen
Borussia Mönchengladbach,18,10.07.2015,11.07.2015,-,2,2015-07-10,2015-07-11,,Andreas Christensen
Sampdoria Genua,1038,04.06.2015,04.06.2015,-,2,2015-06-04,2015-06-04,,Andreas Christensen
Manchester City,281,04.05.2014,04.05.2014,-,3,2014-05-04,2014-05-04,,Andreas Christensen
FC Kopenhagen,190,30.08.2022,30.08.2022,-,1,2022-08-30,2022-08-30,,Andreas Cornelius
FC Brentford,1148,17.06.2022,19.06.2022,-,1,2022-06-17,2022-06-19,,Andreas Cornelius
Genua CFC,252,05.06.2018,05.06.2018,-,1,2018-06-05,2018-06-05,,Andreas Cornelius
FC Kopenhagen,190,29.01.2014,29.01.2014,-,1,2014-01-29,2014-01-29,,Andreas Cornelius
Trabzonspor,449,20.11.2013,22.11.2013,-,1,2013-11-20,2013-11-22,,Andreas Cornelius
Cardiff City,603,27.06.2013,27.06.2013,-,1,2013-06-27,2013-06-27,,Andreas Cornelius
Borussia Dortmund,16,06.06.2013,06.06.2013,-,1,2013-06-06,2013-06-06,,Andreas Cornelius
Galatasaray,141,27.05.2013,27.05.2013,-,1,2013-05-27,2013-05-27,,Andreas Cornelius
Hamburger SV,41,30.04.2013,30.04.2013,-,1,2013-04-30,2013-04-30,,Andreas Cornelius
Stoke City,512,22.04.2013,22.04.2013,-,1,2013-04-22,2013-04-22,,Andreas Cornelius
FC Arsenal,11,19.03.2013,19.03.2013,-,1,2013-03-19,2013-03-19,,Andreas Cornelius
Manchester United,985,07.03.2013,07.03.2013,-,1,2013-03-07,2013-03-07,,Andreas Cornelius
SE Palmeiras São Paulo,1023,07.01.2025,07.01.2025,-,1,2025-01-07,2025-01-07,,Andreas Pereira
Olympique Marseille,244,03.01.2025,03.01.2025,-,1,2025-01-03,2025-01-03,,Andreas Pereira
Atlético Madrid,13,21.03.2023,21.03.2023,-,1,2023-03-21,2023-03-21,,Andreas Pereira
FC Chelsea,631,21.03.2023,21.03.2023,-,1,2023-03-21,2023-03-21,,Andreas Pereira
FC Paris Saint-Germain,583,21.03.2023,21.03.2023,-,1,2023-03-21,2023-03-21,,Andreas Pereira
FC Fulham,931,05.07.2022,11.07.2022,-,1,2022-07-05,2022-07-11,,Andreas Pereira
Flamengo Rio de Janeiro,614,18.08.2021,20.08.2021,-,1,2021-08-18,2021-08-20,,Andreas Pereira
Lazio Rom,398,02.10.2020,02.10.2020,-,1,2020-10-02,2020-10-02,,Andreas Pereira
FC Santos,221,02.05.2020,02.05.2020,-,1,2020-05-02,2020-05-02,,Andreas Pereira
West Ham United,379,15.12.2018,15.12.2018,-,1,2018-12-15,2018-12-15,,Andreas Pereira
FC Valencia,1049,02.09.2017,02.09.2017,-,1,2017-09-02,2017-09-02,,Andreas Pereira
FC Granada,16795,25.08.2016,25.08.2016,-,1,2016-08-25,2016-08-25,,Andreas Pereira
PSV Eindhoven,383,20.01.2016,20.01.2016,-,1,2016-01-20,2016-01-20,,Andreas Pereira
FC Málaga,1084,20.01.2016,20.01.2016,-,1,2016-01-20,2016-01-20,,Andreas Pereira
Leicester City,1003,20.01.2016,20.01.2016,-,1,2016-01-20,2016-01-20,,Andreas Pereira
FC Paris Saint-Germain,583,05.04.2015,05.04.2015,-,2,2015-04-05,2015-04-05,,Andreas Pereira
Manchester United U18,5242,,10.11.2011,-,2,,2011-11-10,,Andreas Pereira
Manchester United U21,9251,08.11.2011,08.11.2011,-,2,2011-11-08,2011-11-08,,Andreas Pereira
Hannover 96,42,01.09.2023,01.09.2023,-,1,2023-09-01,2023-09-01,,Andreas Voglsammer
Eintracht Braunschweig,23,23.08.2023,25.08.2023,-,1,2023-08-23,2023-08-25,,Andreas Voglsammer
FC Millwall,1028,10.08.2022,12.08.2022,-,1,2022-08-10,2022-08-12,,Andreas Voglsammer
1.FC Union Berlin,89,10.06.2021,10.06.2021,-,1,2021-06-10,2021-06-10,,Andreas Voglsammer
FC Ingolstadt 04,4795,05.07.2018,14.07.2018,-,1,2018-07-05,2018-07-14,,Andreas Voglsammer
Arminia Bielefeld,10,20.01.2016,20.01.2016,-,1,2016-01-20,2016-01-20,,Andreas Voglsammer
SG Sonnenhof Großaspach,2589,20.01.2016,20.01.2016,-,1,2016-01-20,2016-01-20,,Andreas Voglsammer
1.FC Heidenheim 1846,2036,23.01.2015,23.01.2015,-,1,2015-01-23,2015-01-23,,Andreas Voglsammer
TSV 1860 München,72,23.01.2015,23.01.2015,-,1,2015-01-23,2015-01-23,,Andreas Voglsammer
VfR Aalen,83,23.05.2014,06.01.2015,-,1,2014-05-23,2015-01-06,,Andreas Voglsammer
FC Energie Cottbus,25,20.05.2014,20.05.2014,-,1,2014-05-20,2014-05-20,,Andreas Voglsammer
Al-Taawoun FC,28844,26.07.2023,26.07.2023,-,1,2023-07-26,2023-07-26,,Andrei Girotto
SV Werder Bremen,86,06.10.2015,13.10.2015,-,1,2015-10-06,2015-10-13,,Andrei Girotto
Shandong Taishan,3182,12.09.2020,12.09.2020,-,1,2020-09-12,2020-09-12,,Andriy Yarmolenko
West Ham United,379,11.07.2018,11.07.2018,-,1,2018-07-11,2018-07-11,,Andriy Yarmolenko
FC Everton,29,26.06.2018,27.06.2018,-,1,2018-06-26,2018-06-27,,Andriy Yarmolenko
Borussia Dortmund,16,28.08.2017,28.08.2017,-,1,2017-08-28,2017-08-28,,Andriy Yarmolenko
FC Bayern München,27,21.06.2017,05.07.2017,-,1,2017-06-21,2017-07-05,,Andriy Yarmolenko
AS Rom,12,,05.07.2017,-,1,,2017-07-05,,Andriy Yarmolenko
FC Everton,29,11.05.2016,11.05.2016,-,1,2016-05-11,2016-05-11,,Andriy Yarmolenko
Manchester City,281,03.04.2016,03.04.2016,-,1,2016-04-03,2016-04-03,,Andriy Yarmolenko
FC Liverpool,31,02.04.2016,02.04.2016,-,1,2016-04-02,2016-04-02,,Andriy Yarmolenko
Espanyol Barcelona,714,24.03.2016,24.03.2016,-,1,2016-03-24,2016-03-24,,Andriy Yarmolenko
FC Arsenal,11,28.01.2016,28.01.2016,-,1,2016-01-28,2016-01-28,,Andriy Yarmolenko
Real Madrid,418,31.12.2015,31.12.2015,-,1,2015-12-31,2015-12-31,,Andriy Yarmolenko
FC Chelsea,631,17.10.2015,19.10.2015,-,1,2015-10-17,2015-10-19,,Andriy Yarmolenko
FC Paris Saint-Germain,583,17.10.2015,17.10.2015,-,1,2015-10-17,2015-10-17,,Andriy Yarmolenko
Lazio Rom,398,17.10.2015,17.10.2015,-,1,2015-10-17,2015-10-17,,Andriy Yarmolenko
FC Barcelona,131,26.08.2015,27.08.2015,-,2,2015-08-26,2015-08-27,,Andriy Yarmolenko
Stoke City,512,19.07.2015,19.07.2015,-,2,2015-07-19,2015-07-19,,Andriy Yarmolenko
Borussia Mönchengladbach,18,06.06.2015,07.06.2015,-,2,2015-06-06,2015-06-07,,Andriy Yarmolenko
Inter Mailand,46,23.04.2015,23.04.2015,-,2,2015-04-23,2015-04-23,,Andriy Yarmolenko
Zenit St. Petersburg,964,11.01.2014,12.01.2014,-,2,2014-01-11,2014-01-12,,Andriy Yarmolenko
AC Mailand,5,04.10.2012,05.10.2012,-,2,2012-10-04,2012-10-05,,Andriy Yarmolenko
SSC Neapel,6195,12.10.2011,15.10.2011,-,2,2011-10-12,2011-10-15,,Andriy Yarmolenko
Rubin Kazan,2698,21.06.2011,22.06.2011,-,2,2011-06-21,2011-06-22,,Andriy Yarmolenko
1.FC Köln,3,20.11.2010,20.11.2010,-,2,2010-11-20,2010-11-20,,Andriy Yarmolenko
FC Everton,29,20.07.2021,20.07.2021,-,1,2021-07-20,2021-07-20,,Andros Townsend
Leicester City,1003,02.06.2019,02.06.2019,-,1,2019-06-02,2019-06-02,,Andros Townsend
Newcastle United,762,08.07.2018,08.07.2018,-,1,2018-07-08,2018-07-08,,Andros Townsend
Stoke City,512,06.08.2017,06.08.2017,-,1,2017-08-06,2017-08-06,,Andros Townsend
Crystal Palace,873,28.06.2016,28.06.2016,-,1,2016-06-28,2016-06-28,,Andros Townsend
Swansea City,2288,25.06.2016,25.06.2016,-,1,2016-06-25,2016-06-25,,Andros Townsend
Stoke City,512,25.06.2016,25.06.2016,-,1,2016-06-25,2016-06-25,,Andros Townsend
FC Southampton,180,25.06.2016,25.06.2016,-,1,2016-06-25,2016-06-25,,Andros Townsend
FC Everton,29,25.06.2016,25.06.2016,-,1,2016-06-25,2016-06-25,,Andros Townsend
FC Watford,1010,24.06.2016,24.06.2016,-,1,2016-06-24,2016-06-24,,Andros Townsend
Manchester City,281,21.06.2016,21.06.2016,-,1,2016-06-21,2016-06-21,,Andros Townsend
FC Liverpool,31,21.06.2016,21.06.2016,-,1,2016-06-21,2016-06-21,,Andros Townsend
Sporting Lissabon,336,24.05.2016,24.05.2016,-,1,2016-05-24,2016-05-24,,Andros Townsend
Newcastle United,762,27.01.2016,27.01.2016,-,1,2016-01-27,2016-01-27,,Andros Townsend
Crystal Palace,873,15.01.2016,15.01.2016,-,1,2016-01-15,2016-01-15,,Andros Townsend
FC Watford,1010,05.01.2016,05.01.2016,-,2,2016-01-05,2016-01-05,,Andros Townsend
Aston Villa,405,16.12.2015,16.12.2015,-,2,2015-12-16,2015-12-16,,Andros Townsend
West Bromwich Albion,984,05.11.2015,05.11.2015,-,2,2015-11-05,2015-11-05,,Andros Townsend
AFC Sunderland,289,05.11.2015,05.11.2015,-,2,2015-11-05,2015-11-05,,Andros Townsend
Swansea City,2288,20.06.2015,20.06.2015,-,2,2015-06-20,2015-06-20,,Andros Townsend
FC Southampton,180,18.06.2015,22.04.2015,-,2,2015-06-18,2015-04-22,,Andros Townsend
Queens Park Rangers,1039,20.12.2014,20.12.2014,-,2,2014-12-20,2014-12-20,,Andros Townsend
FC Everton,29,16.05.2014,16.05.2014,-,2,2014-05-16,2014-05-16,,Andros Townsend
Manchester United,985,31.01.2014,01.02.2014,-,2,2014-01-31,2014-02-01,,Andros Townsend
Fenerbahce,36,11.09.2023,11.09.2023,-,1,2023-09-11,2023-09-11,,André Gomes
LOSC Lille,1082,01.09.2022,01.09.2022,-,1,2022-09-01,2022-09-01,,André Gomes
West Ham United,379,25.06.2019,25.06.2019,-,1,2019-06-25,2019-06-25,,André Gomes
Inter Mailand,46,21.03.2019,21.03.2019,-,1,2019-03-21,2019-03-21,,André Gomes
Lazio Rom,398,25.01.2019,25.01.2019,-,1,2019-01-25,2019-01-25,,André Gomes
AS Rom,12,25.01.2019,25.01.2019,-,1,2019-01-25,2019-01-25,,André Gomes
Tottenham Hotspur,148,13.12.2018,13.12.2018,-,1,2018-12-13,2018-12-13,,André Gomes
FC Everton,29,09.08.2018,09.08.2018,-,1,2018-08-09,2018-08-09,,André Gomes
West Ham United,379,06.08.2018,06.08.2018,-,1,2018-08-06,2018-08-06,,André Gomes
FC Chelsea,631,14.07.2018,14.07.2018,-,1,2018-07-14,2018-07-14,,André Gomes
FC Arsenal,11,13.07.2018,13.07.2018,-,1,2018-07-13,2018-07-13,,André Gomes
Tottenham Hotspur,148,03.07.2018,03.07.2018,-,1,2018-07-03,2018-07-03,,André Gomes
FC Bayern München,27,06.04.2018,08.04.2018,-,1,2018-04-06,2018-04-08,,André Gomes
Juventus Turin,506,24.08.2017,24.08.2017,-,1,2017-08-24,2017-08-24,,André Gomes
FC Liverpool,31,29.07.2017,29.07.2017,-,1,2017-07-29,2017-07-29,,André Gomes
FC Barcelona,131,02.07.2016,22.07.2016,-,2,2016-07-02,2016-07-22,,André Gomes
Real Madrid,418,19.07.2016,20.07.2016,-,2,2016-07-19,2016-07-20,,André Gomes
FC Chelsea,631,08.07.2016,09.07.2016,-,2,2016-07-08,2016-07-09,,André Gomes
Borussia Dortmund,16,28.06.2016,29.06.2016,-,2,2016-06-28,2016-06-29,,André Gomes
Juventus Turin,506,15.06.2016,15.06.2016,-,2,2016-06-15,2016-06-15,,André Gomes
Manchester United,985,29.03.2016,30.03.2016,-,2,2016-03-29,2016-03-30,,André Gomes
SSC Neapel,6195,05.01.2016,06.01.2016,-,2,2016-01-05,2016-01-06,,André Gomes
Manchester City,281,18.12.2015,18.12.2015,-,2,2015-12-18,2015-12-18,,André Gomes
AS Monaco,162,16.12.2015,16.12.2015,-,2,2015-12-16,2015-12-16,,André Gomes
FC Liverpool,31,16.12.2015,16.12.2015,-,2,2015-12-16,2015-12-16,,André Gomes
FC Chelsea,631,27.03.2015,27.03.2015,-,2,2015-03-27,2015-03-27,,André Gomes
FC Valencia,1049,17.07.2014,18.05.2014,-,2,2014-07-17,2014-05-18,,André Gomes
AS Monaco,162,12.04.2014,14.04.2014,-,2,2014-04-12,2014-04-14,,André Gomes
FC Liverpool,31,26.01.2014,26.01.2014,-,2,2014-01-26,2014-01-26,,André Gomes
FC Augsburg,167,25.04.2018,30.05.2018,-,1,2018-04-25,2018-05-30,,André Hahn
VfL Wolfsburg,82,26.01.2018,27.01.2018,-,1,2018-01-26,2018-01-27,,André Hahn
Hertha BSC,44,13.06.2017,30.06.2017,-,1,2017-06-13,2017-06-30,,André Hahn
Hamburger SV,41,29.06.2017,29.06.2017,-,1,2017-06-29,2017-06-29,,André Hahn
Eintracht Frankfurt,24,19.06.2017,19.06.2017,-,1,2017-06-19,2017-06-19,,André Hahn
FC Augsburg,167,13.06.2017,13.06.2017,-,1,2017-06-13,2017-06-13,,André Hahn
SV Werder Bremen,86,04.06.2017,04.06.2017,-,1,2017-06-04,2017-06-04,,André Hahn
Borussia Mönchengladbach,18,30.03.2014,30.03.2014,-,1,2014-03-30,2014-03-30,,André Hahn
Borussia Dortmund,16,29.03.2014,29.03.2014,-,1,2014-03-29,2014-03-29,,André Hahn
FC Schalke 04,33,21.03.2014,24.03.2014,-,1,2014-03-21,2014-03-24,,André Hahn
Aston Villa,405,23.03.2014,23.03.2014,-,1,2014-03-23,2014-03-23,,André Hahn
Bayer 04 Leverkusen,15,17.03.2014,17.03.2014,-,1,2014-03-17,2014-03-17,,André Hahn
FC Augsburg,167,18.01.2013,18.01.2013,-,1,2013-01-18,2013-01-18,,André Hahn
Kickers Offenbach,107,18.06.2011,18.06.2011,-,1,2011-06-18,2011-06-18,,André Hahn
TuS Koblenz,996,20.12.2010,20.12.2010,-,1,2010-12-20,2010-12-20,,André Hahn
Trabzonspor,449,07.09.2025,07.09.2025,97 %,1,2025-09-07,2025-09-07,97.0,André Onana
NEOM SC,34911,15.04.2025,15.04.2025,-,1,2025-04-15,2025-04-15,,André Onana
OGC Nizza,417,17.12.2024,17.12.2024,-,1,2024-12-17,2024-12-17,,André Onana
Manchester United,985,18.07.2023,18.07.2023,-,1,2023-07-18,2023-07-18,,André Onana
Al-Nassr FC,18544,03.07.2023,03.07.2023,-,1,2023-07-03,2023-07-03,,André Onana
FC Chelsea,631,17.06.2023,17.06.2023,-,1,2023-06-17,2023-06-17,,André Onana
Tottenham Hotspur,148,02.06.2023,02.06.2023,-,1,2023-06-02,2023-06-02,,André Onana
Inter Mailand,46,04.01.2022,04.01.2022,-,1,2022-01-04,2022-01-04,,André Onana
AS Monaco,162,17.06.2021,17.06.2021,-,1,2021-06-17,2021-06-17,,André Onana
FC Arsenal,11,07.05.2021,07.05.2021,-,1,2021-05-07,2021-05-07,,André Onana
Borussia Dortmund,16,19.04.2021,04.05.2021,-,1,2021-04-19,2021-05-04,,André Onana
Bayer 04 Leverkusen,15,27.07.2020,27.07.2020,-,1,2020-07-27,2020-07-27,,André Onana
FC Chelsea,631,13.07.2020,13.07.2020,-,1,2020-07-13,2020-07-13,,André Onana
FC Barcelona,131,01.05.2020,01.05.2020,-,1,2020-05-01,2020-05-01,,André Onana
AC Mailand,5,,30.04.2020,-,1,,2020-04-30,,André Onana
FC Paris Saint-Germain,583,04.11.2019,04.11.2019,-,2,2019-11-04,2019-11-04,,André Onana
Manchester United,985,04.11.2019,04.11.2019,-,2,2019-11-04,2019-11-04,,André Onana
Tottenham Hotspur,148,04.11.2019,04.11.2019,-,2,2019-11-04,2019-11-04,,André Onana
FC Bayern München,27,20.04.2017,22.04.2017,-,2,2017-04-20,2017-04-22,,André Onana
Benevento Calcio,4171,30.06.2020,01.07.2020,-,1,2020-06-30,2020-07-01,,André Schürrle
Besiktas JK,114,07.04.2020,07.04.2020,-,1,2020-04-07,2020-04-07,,André Schürrle
Spartak Moskau,232,31.07.2019,31.07.2019,-,1,2019-07-31,2019-07-31,,André Schürrle
Lokomotiv Moskau,932,25.07.2019,25.07.2019,-,1,2019-07-25,2019-07-25,,André Schürrle
Eintracht Frankfurt,24,16.07.2019,16.07.2019,-,1,2019-07-16,2019-07-16,,André Schürrle
Besiktas JK,114,05.07.2019,06.07.2019,-,1,2019-07-05,2019-07-06,,André Schürrle
Lazio Rom,398,17.06.2019,17.06.2019,-,1,2019-06-17,2019-06-17,,André Schürrle
Fenerbahce,36,31.05.2019,04.06.2019,-,1,2019-05-31,2019-06-04,,André Schürrle
West Ham United,379,14.05.2019,14.05.2019,-,1,2019-05-14,2019-05-14,,André Schürrle
Fenerbahce,36,18.04.2019,22.04.2019,-,1,2019-04-18,2019-04-22,,André Schürrle
Besiktas JK,114,18.04.2019,18.04.2019,-,1,2019-04-18,2019-04-18,,André Schürrle
FC Fulham,931,25.07.2018,25.07.2018,-,1,2018-07-25,2018-07-25,,André Schürrle
FC Everton,29,23.07.2018,23.07.2018,-,1,2018-07-23,2018-07-23,,André Schürrle
Crystal Palace,873,22.07.2018,22.07.2018,-,1,2018-07-22,2018-07-22,,André Schürrle
Inter Mailand,46,13.02.2018,13.02.2018,-,1,2018-02-13,2018-02-13,,André Schürrle
West Bromwich Albion,984,31.01.2018,31.01.2018,-,2,2018-01-31,2018-01-31,,André Schürrle
Newcastle United,762,21.01.2018,25.01.2018,-,2,2018-01-21,2018-01-25,,André Schürrle
Stoke City,512,21.01.2018,22.01.2018,-,2,2018-01-21,2018-01-22,,André Schürrle
West Ham United,379,10.01.2018,10.01.2018,-,2,2018-01-10,2018-01-10,,André Schürrle
Hamburger SV,41,31.12.2017,02.01.2018,-,2,2017-12-31,2018-01-02,,André Schürrle
VfB Stuttgart,79,27.12.2017,28.12.2017,-,2,2017-12-27,2017-12-28,,André Schürrle
1.FC Köln,3,26.10.2017,27.10.2017,-,2,2017-10-26,2017-10-27,,André Schürrle
Borussia Dortmund,16,22.07.2016,22.07.2016,-,2,2016-07-22,2016-07-22,,André Schürrle
Tottenham Hotspur,148,25.04.2016,18.05.2016,-,2,2016-04-25,2016-05-18,,André Schürrle
FC Liverpool,31,25.04.2016,25.04.2016,-,2,2016-04-25,2016-04-25,,André Schürrle
VfL Wolfsburg,82,02.02.2015,02.02.2015,-,2,2015-02-02,2015-02-02,,André Schürrle
Borussia Dortmund,16,29.01.2015,30.01.2015,-,2,2015-01-29,2015-01-30,,André Schürrle
FC Schalke 04,33,12.11.2014,15.11.2014,-,2,2014-11-12,2014-11-15,,André Schürrle
Atlético Madrid,13,14.08.2014,14.08.2014,-,2,2014-08-14,2014-08-14,,André Schürrle
FC Paris Saint-Germain,583,12.08.2014,12.08.2014,-,2,2014-08-12,2014-08-12,,André Schürrle
FC Chelsea,631,13.06.2013,13.06.2013,-,3,2013-06-13,2013-06-13,,André Schürrle
FC Arsenal,11,17.11.2012,17.11.2012,-,3,2012-11-17,2012-11-17,,André Schürrle
FC Liverpool,31,25.06.2012,25.06.2012,-,3,2012-06-25,2012-06-25,,André Schürrle
Inter Mailand,46,29.12.2011,30.12.2011,-,3,2011-12-29,2011-12-30,,André Schürrle
Bayer 04 Leverkusen,15,14.09.2010,16.09.2010,-,3,2010-09-14,2010-09-16,,André Schürrle
FC Bayern München,27,09.09.2010,14.09.2010,-,3,2010-09-09,2010-09-14,,André Schürrle
Manchester United,985,10.09.2010,11.09.2010,-,3,2010-09-10,2010-09-11,,André Schürrle
TSG 1899 Hoffenheim,533,26.05.2010,27.05.2010,-,3,2010-05-26,2010-05-27,,André Schürrle
FC Elche,1531,18.08.2025,18.08.2025,91 %,1,2025-08-18,2025-08-18,91.0,André Silva
SV Werder Bremen,86,15.08.2025,18.08.2025,46 %,1,2025-08-15,2025-08-18,46.0,André Silva
Celta Vigo,940,06.08.2025,06.08.2025,66 %,1,2025-08-06,2025-08-06,66.0,André Silva
West Ham United,379,14.01.2025,16.01.2025,-,1,2025-01-14,2025-01-16,,André Silva
Tigres UANL,7055,27.12.2024,27.12.2024,-,1,2024-12-27,2024-12-27,,André Silva
FC Red Bull Salzburg,409,06.12.2024,06.12.2024,-,1,2024-12-06,2024-12-06,,André Silva
Eintracht Frankfurt,24,22.08.2024,23.08.2024,-,1,2024-08-22,2024-08-23,,André Silva
VfB Stuttgart,79,09.07.2024,09.07.2024,-,1,2024-07-09,2024-07-09,,André Silva
Olympiakos Piräus,683,10.12.2023,10.12.2023,-,1,2023-12-10,2023-12-10,,André Silva
Real Sociedad San Sebastián,681,02.08.2023,02.08.2023,-,1,2023-08-02,2023-08-02,,André Silva
Atlético Madrid,13,31.05.2023,13.07.2023,-,1,2023-05-31,2023-07-13,,André Silva
Lazio Rom,398,05.07.2023,05.07.2023,-,1,2023-07-05,2023-07-05,,André Silva
Benfica Lissabon,294,23.05.2023,05.06.2023,-,1,2023-05-23,2023-06-05,,André Silva
Eintracht Frankfurt,24,30.05.2023,31.05.2023,-,1,2023-05-30,2023-05-31,,André Silva
Atlético Madrid,13,30.05.2023,30.05.2023,-,1,2023-05-30,2023-05-30,,André Silva
Tottenham Hotspur,148,,24.09.2021,-,2,,2021-09-24,,André Silva
FC Arsenal,11,21.06.2021,06.07.2021,-,2,2021-06-21,2021-07-06,,André Silva
RB Leipzig,23826,02.07.2021,02.07.2021,-,2,2021-07-02,2021-07-02,,André Silva
Manchester City,281,03.06.2021,03.06.2021,-,2,2021-06-03,2021-06-03,,André Silva
Borussia Dortmund,16,17.05.2021,17.05.2021,-,2,2021-05-17,2021-05-17,,André Silva
Manchester United,985,07.05.2021,07.05.2021,-,2,2021-05-07,2021-05-07,,André Silva
Real Madrid,418,03.05.2021,03.05.2021,-,2,2021-05-03,2021-05-03,,André Silva
FC Barcelona,131,15.04.2021,21.04.2021,-,2,2021-04-15,2021-04-21,,André Silva
AC Mailand,5,26.03.2021,16.04.2021,-,2,2021-03-26,2021-04-16,,André Silva
Wolverhampton Wanderers,543,08.02.2021,16.04.2021,-,2,2021-02-08,2021-04-16,,André Silva
Eintracht Frankfurt,24,19.06.2020,08.07.2020,-,2,2020-06-19,2020-07-08,,André Silva
Eintracht Frankfurt,24,02.03.2020,04.03.2020,-,2,2020-03-02,2020-03-04,,André Silva
Tottenham Hotspur,148,10.01.2020,13.01.2020,-,2,2020-01-10,2020-01-13,,André Silva
FC Schalke 04,33,29.08.2019,01.09.2019,-,2,2019-08-29,2019-09-01,,André Silva
AS Monaco,162,24.07.2019,24.07.2019,-,2,2019-07-24,2019-07-24,,André Silva
Wolverhampton Wanderers,543,18.04.2019,19.04.2019,-,3,2019-04-18,2019-04-19,,André Silva
FC Barcelona,131,21.02.2019,21.02.2019,-,3,2019-02-21,2019-02-21,,André Silva
Galatasaray,141,28.07.2018,07.08.2018,-,3,2018-07-28,2018-08-07,,André Silva
Huddersfield Town,1110,03.06.2018,03.06.2018,-,3,2018-06-03,2018-06-03,,André Silva
Wolverhampton Wanderers,543,08.05.2018,08.05.2018,-,3,2018-05-08,2018-05-08,,André Silva
FC Everton,29,23.02.2018,23.02.2018,-,3,2018-02-23,2018-02-23,,André Silva
Swansea City,2288,17.01.2018,17.01.2018,-,3,2018-01-17,2018-01-17,,André Silva
FC Arsenal,11,21.10.2017,21.10.2017,-,3,2017-10-21,2017-10-21,,André Silva
FC Barcelona,131,08.10.2017,08.10.2017,-,3,2017-10-08,2017-10-08,,André Silva
AC Mailand,5,12.06.2017,12.06.2017,-,3,2017-06-12,2017-06-12,,André Silva
Manchester United,985,14.11.2016,14.11.2016,-,3,2016-11-14,2016-11-14,,André Silva
Juventus Turin,506,05.11.2016,05.11.2016,-,3,2016-11-05,2016-11-05,,André Silva
FC Barcelona,131,05.11.2016,05.11.2016,-,3,2016-11-05,2016-11-05,,André Silva
FC Arsenal,11,05.10.2016,18.10.2016,-,3,2016-10-05,2016-10-18,,André Silva
Atlético Madrid,13,24.07.2016,24.07.2016,-,3,2016-07-24,2016-07-24,,André Silva
Ras Al-Khaima,54535,07.08.2023,07.08.2023,-,1,2023-08-07,2023-08-07,,Andrés Iniesta
Argentinos Juniors,1030,06.06.2023,06.06.2023,-,1,2023-06-06,2023-06-06,,Andrés Iniesta
Club Estudiantes de La Plata,288,21.12.2019,21.12.2019,-,1,2019-12-21,2019-12-21,,Andrés Iniesta
Vissel Kobe,3958,24.05.2018,24.05.2018,-,1,2018-05-24,2018-05-24,,Andrés Iniesta
Chongqing Liangjiang Athletic,1326,07.05.2018,07.05.2018,-,1,2018-05-07,2018-05-07,,Andrés Iniesta
Manchester City,281,25.04.2018,25.04.2018,-,1,2018-04-25,2018-04-25,,Andrés Iniesta
Tianjin Tianhai (-2019),33714,12.04.2018,12.04.2018,-,1,2018-04-12,2018-04-12,,Andrés Iniesta
Juventus Turin,506,05.09.2017,05.09.2017,-,1,2017-09-05,2017-09-05,,Andrés Iniesta
FC Paris Saint-Germain,583,31.10.2013,01.11.2013,-,1,2013-10-31,2013-11-01,,Andrés Iniesta
Manchester United,985,16.10.2013,16.10.2013,-,1,2013-10-16,2013-10-16,,Andrés Iniesta
Amiens SC,1416,30.08.2023,30.08.2023,-,1,2023-08-30,2023-08-30,,Andy Carroll
Wolverhampton Wanderers,543,06.09.2022,06.09.2022,-,1,2022-09-06,2022-09-06,,Andy Carroll
FC Burnley,1132,14.01.2022,14.01.2022,-,1,2022-01-14,2022-01-14,,Andy Carroll
West Bromwich Albion,984,31.12.2020,31.12.2020,-,1,2020-12-31,2020-12-31,,Andy Carroll
Newcastle United,762,08.08.2019,08.08.2019,-,1,2019-08-08,2019-08-08,,Andy Carroll
Glasgow Rangers,124,11.06.2019,11.06.2019,-,1,2019-06-11,2019-06-11,,Andy Carroll
New England Revolution,626,11.04.2019,11.04.2019,-,1,2019-04-11,2019-04-11,,Andy Carroll
Galatasaray,141,03.01.2019,03.01.2019,-,1,2019-01-03,2019-01-03,,Andy Carroll
Celtic Glasgow,371,03.01.2019,03.01.2019,-,1,2019-01-03,2019-01-03,,Andy Carroll
Besiktas JK,114,16.07.2018,19.07.2018,-,1,2018-07-16,2018-07-19,,Andy Carroll
FC Chelsea,631,15.01.2018,15.01.2018,-,1,2018-01-15,2018-01-15,,Andy Carroll
Newcastle United,762,21.08.2017,21.08.2017,-,1,2017-08-21,2017-08-21,,Andy Carroll
AFC Sunderland,289,19.11.2015,19.11.2015,-,1,2015-11-19,2015-11-19,,Andy Carroll
FC Sevilla,368,22.08.2015,22.08.2015,-,1,2015-08-22,2015-08-22,,Andy Carroll
West Ham United,379,18.06.2013,19.06.2013,-,1,2013-06-18,2013-06-19,,Andy Carroll
AS Monaco,162,19.05.2013,20.05.2013,-,2,2013-05-19,2013-05-20,,Andy Carroll
AC Mailand,5,19.07.2012,19.07.2012,-,2,2012-07-19,2012-07-19,,Andy Carroll
FC Valencia,1049,18.07.2012,18.07.2012,-,2,2012-07-18,2012-07-18,,Andy Carroll
FC Fulham,931,14.07.2012,15.07.2012,-,2,2012-07-14,2012-07-15,,Andy Carroll
FC Liverpool,31,01.02.2011,01.02.2011,-,2,2011-02-01,2011-02-01,,Andy Carroll
Tottenham Hotspur,148,29.01.2011,29.01.2011,-,2,2011-01-29,2011-01-29,,Andy Carroll
Manchester United,985,23.12.2010,23.12.2010,-,2,2010-12-23,2010-12-23,,Andy Carroll
Stoke City,512,15.12.2009,15.12.2009,-,2,2009-12-15,2009-12-15,,Andy Carroll
Wolverhampton Wanderers,543,31.08.2009,31.08.2009,-,2,2009-08-31,2009-08-31,,Andy Carroll
Bolton Wanderers,355,31.08.2009,31.08.2009,-,2,2009-08-31,2009-08-31,,Andy Carroll
RC Lens,826,13.06.2024,13.06.2024,-,1,2024-06-13,2024-06-13,,Andy Delort
FC Nantes,995,28.01.2023,28.01.2023,-,1,2023-01-28,2023-01-28,,Andy Delort
OGC Nizza,417,20.08.2021,20.08.2021,-,1,2021-08-20,2021-08-20,,Andy Delort
Wolverhampton Wanderers,543,13.01.2021,13.01.2021,-,1,2021-01-13,2021-01-13,,Andy Delort
Newcastle United,762,13.01.2021,13.01.2021,-,1,2021-01-13,2021-01-13,,Andy Delort
FC Toulouse,415,26.01.2017,26.01.2017,-,1,2017-01-26,2017-01-26,,Andy Delort
AS Saint-Étienne,618,18.01.2017,18.01.2017,-,1,2017-01-18,2017-01-18,,Andy Delort
FC Girondins Bordeaux,40,10.01.2017,10.01.2017,-,1,2017-01-10,2017-01-10,,Andy Delort
VfL Wolfsburg,82,18.01.2016,18.01.2016,-,1,2016-01-18,2016-01-18,,Andy Delort
Olympique Lyon,1041,02.12.2015,02.12.2015,-,1,2015-12-02,2015-12-02,,Andy Delort
Leicester City,1003,02.12.2015,02.12.2015,-,1,2015-12-02,2015-12-02,,Andy Delort
Borussia Mönchengladbach,18,22.07.2014,01.08.2014,-,1,2014-07-22,2014-08-01,,Andy Delort
VfB Stuttgart,79,17.06.2014,01.08.2014,-,1,2014-06-17,2014-08-01,,Andy Delort
FC Schalke 04,33,22.07.2014,22.07.2014,-,1,2014-07-22,2014-07-22,,Andy Delort
Atlético Madrid,13,19.07.2014,19.07.2014,-,1,2014-07-19,2014-07-19,,Andy Delort
Feyenoord Rotterdam,234,18.07.2014,18.07.2014,-,2,2014-07-18,2014-07-18,,Andy Delort
Standard Lüttich,3057,09.07.2014,09.07.2014,-,2,2014-07-09,2014-07-09,,Andy Delort
FC Southampton,180,09.07.2014,09.07.2014,-,2,2014-07-09,2014-07-09,,Andy Delort
Leicester City,1003,09.07.2014,09.07.2014,-,2,2014-07-09,2014-07-09,,Andy Delort
SV Werder Bremen,86,10.06.2014,13.06.2014,-,2,2014-06-10,2014-06-13,,Andy Delort
Montpellier HSC,969,05.05.2014,05.05.2014,-,2,2014-05-05,2014-05-05,,Andy Delort
FC Stade Rennes,273,01.01.2014,01.01.2014,-,2,2014-01-01,2014-01-01,,Andy Delort
Huddersfield Town,1110,14.01.2020,14.01.2020,-,1,2020-01-14,2020-01-14,,Andy King
Glasgow Rangers,124,16.08.2019,16.08.2019,-,1,2019-08-16,2019-08-16,,Andy King
Derby County,22,31.01.2019,31.01.2019,-,1,2019-01-31,2019-01-31,,Andy King
Wigan Athletic,1071,28.01.2019,28.01.2019,-,1,2019-01-28,2019-01-28,,Andy King
Nottingham Forest,703,22.01.2019,22.01.2019,-,1,2019-01-22,2019-01-22,,Andy King
West Bromwich Albion,984,10.12.2018,10.12.2018,-,1,2018-12-10,2018-12-10,,Andy King
Cardiff City,603,09.08.2018,09.08.2018,-,1,2018-08-09,2018-08-09,,Andy King
FC Watford,1010,22.07.2014,22.07.2014,-,1,2014-07-22,2014-07-22,,Andy King
Clermont Foot 63,3524,09.07.2023,11.07.2023,-,1,2023-07-09,2023-07-11,,Andy Pelmard
US Cremonese,2239,15.12.2022,15.12.2022,-,1,2022-12-15,2022-12-15,,Andy Pelmard
FC Basel 1893,26,19.07.2021,20.07.2021,-,1,2021-07-19,2021-07-20,,Andy Pelmard
AFC Sunderland,289,25.06.2025,25.06.2025,-,1,2025-06-25,2025-06-25,,Angeliño
Al-Hilal SFC,1114,09.06.2025,09.06.2025,-,1,2025-06-09,2025-06-09,,Angeliño
AS Rom,12,31.05.2024,08.07.2024,-,1,2024-05-31,2024-07-08,,Angeliño
Olympique Marseille,244,23.01.2024,23.01.2024,-,1,2024-01-23,2024-01-23,,Angeliño
FC Turin,416,23.01.2024,23.01.2024,-,1,2024-01-23,2024-01-23,,Angeliño
Galatasaray,141,12.07.2023,12.07.2023,-,1,2023-07-12,2023-07-12,,Angeliño
TSG 1899 Hoffenheim,533,30.05.2023,30.05.2023,-,1,2023-05-30,2023-05-30,,Angeliño
Nottingham Forest,703,06.08.2022,06.08.2022,-,1,2022-08-06,2022-08-06,,Angeliño
Brighton & Hove Albion,1237,04.08.2022,04.08.2022,-,1,2022-08-04,2022-08-04,,Angeliño
FC Barcelona,131,01.08.2022,01.08.2022,-,1,2022-08-01,2022-08-01,,Angeliño
West Ham United,379,31.07.2022,31.07.2022,-,1,2022-07-31,2022-07-31,,Angeliño
FC Sevilla,368,17.02.2022,17.02.2022,-,1,2022-02-17,2022-02-17,,Angeliño
Real Madrid,418,15.02.2022,15.02.2022,-,1,2022-02-15,2022-02-15,,Angeliño
FC Barcelona,131,22.08.2020,23.08.2020,-,1,2020-08-22,2020-08-23,,Angeliño
RB Leipzig,23826,16.06.2020,16.06.2020,-,1,2020-06-16,2020-06-16,,Angeliño
RB Leipzig,23826,31.01.2020,31.01.2020,-,2,2020-01-31,2020-01-31,,Angeliño
Borussia Dortmund,16,17.06.2019,03.07.2019,-,2,2019-06-17,2019-07-03,,Angeliño
PSV Eindhoven,383,25.05.2018,25.05.2018,-,2,2018-05-25,2018-05-25,,Angeliño
Kocaelispor,120,26.06.2025,26.06.2025,-,1,2025-06-26,2025-06-26,,Angelo Fulgini
RC Lens,826,01.02.2023,01.02.2023,-,1,2023-02-01,2023-02-01,,Angelo Fulgini
ESTAC Troyes,1095,31.01.2023,31.01.2023,-,1,2023-01-31,2023-01-31,,Angelo Fulgini
RC Straßburg Alsace,667,08.01.2023,25.01.2023,-,1,2023-01-08,2023-01-25,,Angelo Fulgini
1.FSV Mainz 05,39,12.07.2022,12.07.2022,-,1,2022-07-12,2022-07-12,,Angelo Fulgini
Borussia Mönchengladbach,18,10.07.2022,11.07.2022,-,1,2022-07-10,2022-07-11,,Angelo Fulgini
Benfica Lissabon,294,28.06.2022,28.06.2022,-,1,2022-06-28,2022-06-28,,Angelo Fulgini
FC Sevilla,368,01.02.2022,01.02.2022,-,1,2022-02-01,2022-02-01,,Angelo Fulgini
Newcastle United,762,29.07.2021,29.07.2021,-,1,2021-07-29,2021-07-29,,Angelo Fulgini
Crystal Palace,873,29.07.2021,29.07.2021,-,1,2021-07-29,2021-07-29,,Angelo Fulgini
AS Monaco,162,06.05.2021,06.05.2021,-,1,2021-05-06,2021-05-06,,Angelo Fulgini
FC Everton,29,29.05.2020,29.05.2020,-,1,2020-05-29,2020-05-29,,Angelo Fulgini
FC Barcelona,131,05.03.2015,05.03.2015,-,1,2015-03-05,2015-03-05,,Angelo Fulgini
Manchester United,985,05.03.2015,05.03.2015,-,1,2015-03-05,2015-03-05,,Angelo Fulgini
FC Everton,29,13.01.2015,13.01.2015,-,1,2015-01-13,2015-01-13,,Angelo Fulgini
SSC Neapel,6195,13.01.2015,13.01.2015,-,2,2015-01-13,2015-01-13,,Angelo Fulgini
AC Mailand,5,19.03.2014,19.03.2014,-,2,2014-03-19,2014-03-19,,Angelo Fulgini
AS Monaco,162,18.03.2014,18.03.2014,-,2,2014-03-18,2014-03-18,,Angelo Fulgini
Nottingham Forest,703,05.08.2025,05.08.2025,-,1,2025-08-05,2025-08-05,,Angus Gunn
Norwich City,1123,23.06.2021,23.06.2021,-,1,2021-06-23,2021-06-23,,Angus Gunn
FC Southampton,180,10.07.2018,10.07.2018,-,1,2018-07-10,2018-07-10,,Angus Gunn
Leeds United,399,21.05.2018,21.05.2018,-,1,2018-05-21,2018-05-21,,Angus Gunn
Stoke City,512,19.03.2018,19.03.2018,-,1,2018-03-19,2018-03-19,,Angus Gunn
Celtic Glasgow,371,19.03.2018,19.03.2018,-,1,2018-03-19,2018-03-19,,Angus Gunn
Aberdeen FC,370,20.05.2015,20.05.2015,-,1,2015-05-20,2015-05-20,,Angus Gunn
FC Liverpool,31,15.03.2025,18.03.2025,-,1,2025-03-15,2025-03-18,,Ansgar Knauff
Eintracht Frankfurt,24,02.06.2023,09.06.2023,-,1,2023-06-02,2023-06-09,,Ansgar Knauff
Newcastle United,762,02.08.2022,08.09.2022,-,1,2022-08-02,2022-09-08,,Ansgar Knauff
AS Monaco,162,03.06.2025,25.06.2025,94 %,1,2025-06-03,2025-06-25,94.0,Ansu Fati
Borussia Dortmund,16,07.04.2025,09.04.2025,-,1,2025-04-07,2025-04-09,,Ansu Fati
Besiktas JK,114,01.02.2025,01.02.2025,-,1,2025-02-01,2025-02-01,,Ansu Fati
West Ham United,379,17.01.2025,17.01.2025,-,1,2025-01-17,2025-01-17,,Ansu Fati
FC Girona,12321,04.01.2025,07.01.2025,-,1,2025-01-04,2025-01-07,,Ansu Fati
Juventus Turin,506,03.01.2025,03.01.2025,-,1,2025-01-03,2025-01-03,,Ansu Fati
Al-Hilal SFC,1114,25.11.2024,25.11.2024,-,1,2024-11-25,2024-11-25,,Ansu Fati
Al-Nassr FC,18544,25.11.2024,25.11.2024,-,1,2024-11-25,2024-11-25,,Ansu Fati
Fenerbahce,36,13.11.2024,13.11.2024,-,1,2024-11-13,2024-11-13,,Ansu Fati
Bayer 04 Leverkusen,15,11.06.2024,12.06.2024,-,1,2024-06-11,2024-06-12,,Ansu Fati
FC Sevilla,368,14.05.2024,14.05.2024,-,1,2024-05-14,2024-05-14,,Ansu Fati
Brighton & Hove Albion,1237,30.08.2023,31.08.2023,-,1,2023-08-30,2023-08-31,,Ansu Fati
Tottenham Hotspur,148,30.08.2023,30.08.2023,-,1,2023-08-30,2023-08-30,,Ansu Fati
Newcastle United,762,,16.06.2023,-,1,,2023-06-16,,Ansu Fati
Wolverhampton Wanderers,543,11.06.2023,11.06.2023,-,1,2023-06-11,2023-06-11,,Ansu Fati
FC Paris Saint-Germain,583,11.06.2023,11.06.2023,-,2,2023-06-11,2023-06-11,,Ansu Fati
FC Bayern München,27,10.02.2023,15.02.2023,-,2,2023-02-10,2023-02-15,,Ansu Fati
Manchester United,985,15.06.2020,15.06.2020,-,2,2020-06-15,2020-06-15,,Ansu Fati
Borussia Dortmund,16,28.05.2020,28.05.2020,-,2,2020-05-28,2020-05-28,,Ansu Fati
Besiktas JK,114,03.06.2025,03.06.2025,-,1,2025-06-03,2025-06-03,,Ante Budimir
Real Madrid,418,24.05.2025,24.05.2025,-,1,2025-05-24,2025-05-24,,Ante Budimir
Fenerbahce,36,27.12.2024,27.12.2024,-,1,2024-12-27,2024-12-27,,Ante Budimir
Atalanta Bergamo,800,01.05.2016,01.05.2016,-,1,2016-05-01,2016-05-01,,Ante Budimir
Sampdoria Genua,1038,01.05.2016,01.05.2016,-,1,2016-05-01,2016-05-01,,Ante Budimir
Inter Mailand,46,01.05.2016,01.05.2016,-,1,2016-05-01,2016-05-01,,Ante Budimir
FC Crotone,4083,30.03.2016,30.03.2016,-,1,2016-03-30,2016-03-30,,Ante Budimir
FC Arsenal,11,28.12.2015,28.12.2015,-,1,2015-12-28,2015-12-28,,Ante Budimir
FC Energie Cottbus,25,04.08.2015,04.08.2015,-,1,2015-08-04,2015-08-04,,Ante Budimir
FC St. Pauli,35,04.08.2014,04.08.2014,-,1,2014-08-04,2014-08-04,,Ante Budimir
SK Sturm Graz,122,25.06.2013,25.06.2013,-,1,2013-06-25,2013-06-25,,Ante Budimir
HNK Hajduk Split,447,26.08.2024,26.08.2024,-,1,2024-08-26,2024-08-26,,Ante Rebić
FC Schalke 04,33,24.08.2024,24.08.2024,-,1,2024-08-24,2024-08-24,,Ante Rebić
Hellas Verona,276,03.04.2024,03.04.2024,-,1,2024-04-03,2024-04-03,,Ante Rebić
Besiktas JK,114,28.07.2023,30.07.2023,-,1,2023-07-28,2023-07-30,,Ante Rebić
VfL Wolfsburg,82,31.05.2022,01.06.2022,-,1,2022-05-31,2022-06-01,,Ante Rebić
Eintracht Frankfurt,24,22.01.2020,22.01.2020,-,1,2020-01-22,2020-01-22,,Ante Rebić
AC Mailand,5,01.09.2019,01.09.2019,-,1,2019-09-01,2019-09-01,,Ante Rebić
Inter Mailand,46,18.08.2019,01.09.2019,-,1,2019-08-18,2019-09-01,,Ante Rebić
FC Bayern München,27,29.08.2019,29.08.2019,-,1,2019-08-29,2019-08-29,,Ante Rebić
Atlético Madrid,13,03.07.2019,10.07.2019,-,1,2019-07-03,2019-07-10,,Ante Rebić
AS Rom,12,13.06.2019,13.06.2019,-,1,2019-06-13,2019-06-13,,Ante Rebić
Wolverhampton Wanderers,543,31.05.2019,31.05.2019,-,1,2019-05-31,2019-05-31,,Ante Rebić
Manchester United,985,16.10.2018,16.10.2018,-,1,2018-10-16,2018-10-16,,Ante Rebić
FC Sevilla,368,10.08.2018,10.08.2018,-,2,2018-08-10,2018-08-10,,Ante Rebić
FC Arsenal,11,11.07.2018,10.08.2018,-,1,2018-07-11,2018-08-10,,Ante Rebić
FC Liverpool,31,11.07.2018,10.08.2018,-,1,2018-07-11,2018-08-10,,Ante Rebić
SSC Neapel,6195,18.07.2018,18.07.2018,-,2,2018-07-18,2018-07-18,,Ante Rebić
FC Everton,29,27.06.2018,28.06.2018,-,2,2018-06-27,2018-06-28,,Ante Rebić
Tottenham Hotspur,148,26.06.2018,26.06.2018,-,2,2018-06-26,2018-06-26,,Ante Rebić
Huddersfield Town,1110,20.06.2018,22.06.2018,-,2,2018-06-20,2018-06-22,,Ante Rebić
Borussia Dortmund,16,13.06.2018,15.06.2018,-,2,2018-06-13,2018-06-15,,Ante Rebić
Eintracht Frankfurt,24,31.08.2017,31.08.2017,-,2,2017-08-31,2017-08-31,,Ante Rebić
Hannover 96,42,04.06.2017,07.06.2017,-,2,2017-06-04,2017-06-07,,Ante Rebić
SV Werder Bremen,86,05.06.2017,06.06.2017,-,2,2017-06-05,2017-06-06,,Ante Rebić
Hertha BSC,44,28.06.2016,28.06.2016,-,2,2016-06-28,2016-06-28,,Ante Rebić
TSG 1899 Hoffenheim,533,27.06.2016,27.06.2016,-,2,2016-06-27,2016-06-27,,Ante Rebić
AC Carpi,4102,04.01.2016,04.01.2016,-,2,2016-01-04,2016-01-04,,Ante Rebić
FC Bologna,1025,06.11.2015,06.11.2015,-,2,2015-11-06,2015-11-06,,Ante Rebić
HNK Rijeka,144,03.12.2014,04.12.2014,-,2,2014-12-03,2014-12-04,,Ante Rebić
RB Leipzig,23826,03.08.2014,03.08.2014,-,2,2014-08-03,2014-08-03,,Ante Rebić
VfL Wolfsburg,82,23.06.2014,23.06.2014,-,3,2014-06-23,2014-06-23,,Ante Rebić
FC Schalke 04,33,15.06.2014,15.06.2014,-,3,2014-06-15,2014-06-15,,Ante Rebić
AC Florenz,430,27.08.2013,28.08.2013,-,3,2013-08-27,2013-08-28,,Ante Rebić
SSC Neapel,6195,09.08.2013,09.08.2013,-,3,2013-08-09,2013-08-09,,Ante Rebić
Zenit St. Petersburg,964,23.06.2013,23.06.2013,-,3,2013-06-23,2013-06-23,,Ante Rebić
FC Paris Saint-Germain,583,23.06.2013,23.06.2013,-,3,2013-06-23,2013-06-23,,Ante Rebić
Tottenham Hotspur,148,12.10.2014,15.05.2013,-,3,2014-10-12,2013-05-15,,Ante Rebić
FC Bayern München,27,09.05.2013,09.05.2013,-,3,2013-05-09,2013-05-09,,Ante Rebić
AS Rom,12,28.03.2013,28.03.2013,-,3,2013-03-28,2013-03-28,,Ante Rebić
AS Rom,12,28.03.2013,28.03.2013,-,3,2013-03-28,2013-03-28,,Ante Rebić
AS Rom,12,28.03.2013,28.03.2013,-,3,2013-03-28,2013-03-28,,Ante Rebić
Borussia Dortmund,16,29.10.2012,30.10.2012,-,3,2012-10-29,2012-10-30,,Ante Rebić
Bayer 04 Leverkusen,15,21.06.2012,21.06.2012,-,3,2012-06-21,2012-06-21,,Ante Rebić
FC Stade Rennes,273,24.06.2025,24.06.2025,44 %,1,2025-06-24,2025-06-24,44.0,Anthony Caci
FC Everton,29,15.06.2025,15.06.2025,53 %,1,2025-06-15,2025-06-15,53.0,Anthony Caci
FC Fulham,931,15.06.2025,15.06.2025,-,1,2025-06-15,2025-06-15,,Anthony Caci
Borussia Dortmund,16,06.06.2025,06.06.2025,2 %,1,2025-06-06,2025-06-06,2.0,Anthony Caci
Leeds United,399,06.06.2025,06.06.2025,-,1,2025-06-06,2025-06-06,,Anthony Caci
OGC Nizza,417,19.05.2025,06.06.2025,56 %,1,2025-05-19,2025-06-06,56.0,Anthony Caci
Benfica Lissabon,294,14.01.2025,25.02.2025,-,1,2025-01-14,2025-02-25,,Anthony Caci
Aston Villa,405,14.01.2025,14.01.2025,-,1,2025-01-14,2025-01-14,,Anthony Caci
SC Freiburg,60,13.08.2024,15.08.2024,-,1,2024-08-13,2024-08-15,,Anthony Caci
1.FSV Mainz 05,39,10.01.2022,10.01.2022,-,1,2022-01-10,2022-01-10,,Anthony Caci
Eintracht Frankfurt,24,10.01.2022,10.01.2022,-,1,2022-01-10,2022-01-10,,Anthony Caci
Bayer 04 Leverkusen,15,14.06.2021,14.06.2021,-,1,2021-06-14,2021-06-14,,Anthony Caci
VfL Wolfsburg,82,10.04.2021,12.04.2021,-,1,2021-04-10,2021-04-12,,Anthony Caci
Newcastle United,762,11.07.2025,11.07.2025,74 %,1,2025-07-11,2025-07-11,74.0,Anthony Elanga
Nottingham Forest,703,22.07.2023,22.07.2023,-,1,2023-07-22,2023-07-22,,Anthony Elanga
FC Everton,29,12.07.2023,12.07.2023,-,1,2023-07-12,2023-07-12,,Anthony Elanga
RB Leipzig,23826,25.06.2023,25.06.2023,-,1,2023-06-25,2023-06-25,,Anthony Elanga
Borussia Dortmund,16,10.06.2023,24.06.2023,-,1,2023-06-10,2023-06-24,,Anthony Elanga
PSV Eindhoven,383,28.01.2023,28.01.2023,-,1,2023-01-28,2023-01-28,,Anthony Elanga
FC Liverpool,31,13.05.2024,13.05.2024,-,1,2024-05-13,2024-05-13,,Anthony Gordon
Newcastle United,762,29.01.2023,29.01.2023,-,1,2023-01-29,2023-01-29,,Anthony Gordon
FC Chelsea,631,28.08.2022,31.08.2022,-,1,2022-08-28,2022-08-31,,Anthony Gordon
Tottenham Hotspur,148,29.06.2022,29.06.2022,-,1,2022-06-29,2022-06-29,,Anthony Gordon
Preston North End,466,02.02.2021,02.02.2021,-,1,2021-02-02,2021-02-02,,Anthony Gordon
VfL Wolfsburg,82,29.01.2021,29.01.2021,-,1,2021-01-29,2021-01-29,,Anthony Gordon
Blackburn Rovers,164,29.01.2021,29.01.2021,-,1,2021-01-29,2021-01-29,,Anthony Gordon
FC Bayern München,27,11.01.2020,11.01.2020,-,1,2020-01-11,2020-01-11,,Anthony Gordon
Borussia Dortmund,16,12.11.2019,12.11.2019,-,1,2019-11-12,2019-11-12,,Anthony Gordon
FC Arsenal,11,23.11.2018,23.11.2018,-,1,2018-11-23,2018-11-23,,Anthony Gordon
Huddersfield Town,1110,13.08.2023,13.08.2023,-,1,2023-08-13,2023-08-13,,Anthony Knockaert
Nottingham Forest,703,17.10.2020,17.10.2020,-,1,2020-10-17,2020-10-17,,Anthony Knockaert
FC Fulham,931,22.07.2019,22.07.2019,-,1,2019-07-22,2019-07-22,,Anthony Knockaert
FC Everton,29,11.05.2017,11.05.2017,-,1,2017-05-11,2017-05-11,,Anthony Knockaert
FC Toulouse,415,20.07.2016,20.07.2016,-,1,2016-07-20,2016-07-20,,Anthony Knockaert
FC Watford,1010,05.04.2016,05.04.2016,-,1,2016-04-05,2016-04-05,,Anthony Knockaert
FC Arsenal,11,27.12.2012,27.12.2012,-,1,2012-12-27,2012-12-27,,Anthony Knockaert
Montpellier HSC,969,16.05.2012,16.05.2012,-,1,2012-05-16,2012-05-16,,Anthony Knockaert
Benfica Lissabon,294,05.04.2012,05.04.2012,-,1,2012-04-05,2012-04-05,,Anthony Knockaert
Newcastle United,762,12.12.2011,12.12.2011,-,1,2011-12-12,2011-12-12,,Anthony Knockaert
Newcastle United,762,31.01.2019,31.01.2019,-,1,2019-01-31,2019-01-31,,Anthony Limbombe
VfL Wolfsburg,82,09.08.2018,10.08.2018,-,1,2018-08-09,2018-08-10,,Anthony Limbombe
FC Nantes,995,09.08.2018,09.08.2018,-,1,2018-08-09,2018-08-09,,Anthony Limbombe
FC Schalke 04,33,19.06.2018,20.06.2018,-,1,2018-06-19,2018-06-20,,Anthony Limbombe
Olympique Marseille,244,19.06.2018,19.06.2018,-,1,2018-06-19,2018-06-19,,Anthony Limbombe
Huddersfield Town,1110,19.06.2018,19.06.2018,-,1,2018-06-19,2018-06-19,,Anthony Limbombe
Newcastle United,762,19.06.2018,19.06.2018,-,1,2018-06-19,2018-06-19,,Anthony Limbombe
FC Southampton,180,19.06.2018,19.06.2018,-,1,2018-06-19,2018-06-19,,Anthony Limbombe
RB Leipzig,23826,19.06.2018,19.06.2018,-,1,2018-06-19,2018-06-19,,Anthony Limbombe
Borussia Dortmund,16,26.04.2018,26.04.2018,-,1,2018-04-26,2018-04-26,,Anthony Limbombe
Olympique Lyon,1041,25.04.2018,25.04.2018,-,1,2018-04-25,2018-04-25,,Anthony Limbombe
Feyenoord Rotterdam,234,05.08.2017,05.08.2017,-,1,2017-08-05,2017-08-05,,Anthony Limbombe
Hamburger SV,41,27.06.2016,27.06.2016,-,1,2016-06-27,2016-06-27,,Anthony Limbombe
VfB Stuttgart,79,13.04.2015,13.04.2015,-,1,2015-04-13,2015-04-13,,Anthony Limbombe
FC Twente Enschede,317,27.03.2015,27.03.2015,-,1,2015-03-27,2015-03-27,,Anthony Limbombe
Besiktas JK,114,26.05.2025,26.05.2025,-,1,2025-05-26,2025-05-26,,Anthony Martial
AEK Athen,2441,17.09.2024,17.09.2024,-,1,2024-09-17,2024-09-17,,Anthony Martial
Flamengo Rio de Janeiro,614,06.09.2024,06.09.2024,-,1,2024-09-06,2024-09-06,,Anthony Martial
LOSC Lille,1082,02.09.2024,02.09.2024,-,1,2024-09-02,2024-09-02,,Anthony Martial
Como 1907,1047,12.07.2024,12.07.2024,-,1,2024-07-12,2024-07-12,,Anthony Martial
Galatasaray,141,05.06.2024,07.06.2024,-,1,2024-06-05,2024-06-07,,Anthony Martial
Olympique Marseille,244,31.12.2023,03.01.2024,-,1,2023-12-31,2024-01-03,,Anthony Martial
Fenerbahce,36,14.08.2023,30.08.2023,-,1,2023-08-14,2023-08-30,,Anthony Martial
Inter Mailand,46,14.08.2023,14.08.2023,-,1,2023-08-14,2023-08-14,,Anthony Martial
West Ham United,379,14.08.2023,14.08.2023,-,1,2023-08-14,2023-08-14,,Anthony Martial
Juventus Turin,506,27.07.2022,27.07.2022,-,1,2022-07-27,2022-07-27,,Anthony Martial
FC Sevilla,368,25.01.2022,25.01.2022,-,1,2022-01-25,2022-01-25,,Anthony Martial
Newcastle United,762,18.01.2022,18.01.2022,-,1,2022-01-18,2022-01-18,,Anthony Martial
FC Barcelona,131,18.01.2022,18.01.2022,-,1,2022-01-18,2022-01-18,,Anthony Martial
FC Arsenal,11,11.12.2021,11.12.2021,-,1,2021-12-11,2021-12-11,,Anthony Martial
FC Paris Saint-Germain,583,11.12.2021,11.12.2021,-,2,2021-12-11,2021-12-11,,Anthony Martial
Borussia Dortmund,16,29.09.2021,03.10.2021,-,2,2021-09-29,2021-10-03,,Anthony Martial
FC Bayern München,27,25.10.2018,16.11.2018,-,2,2018-10-25,2018-11-16,,Anthony Martial
AC Mailand,5,13.08.2018,13.08.2018,-,2,2018-08-13,2018-08-13,,Anthony Martial
FC Chelsea,631,23.07.2018,23.07.2018,-,2,2018-07-23,2018-07-23,,Anthony Martial
Tottenham Hotspur,148,06.06.2018,06.06.2018,-,2,2018-06-06,2018-06-06,,Anthony Martial
Atlético Madrid,13,17.04.2018,17.04.2018,-,2,2018-04-17,2018-04-17,,Anthony Martial
Real Madrid,418,26.11.2017,26.11.2017,-,2,2017-11-26,2017-11-26,,Anthony Martial
VfL Wolfsburg,82,19.07.2017,21.07.2017,-,2,2017-07-19,2017-07-21,,Anthony Martial
AS Rom,12,11.07.2017,11.07.2017,-,2,2017-07-11,2017-07-11,,Anthony Martial
Olympique Lyon,1041,26.04.2017,26.04.2017,-,2,2017-04-26,2017-04-26,,Anthony Martial
Manchester United,985,31.08.2015,01.09.2015,-,2,2015-08-31,2015-09-01,,Anthony Martial
FC Barcelona,131,29.08.2015,29.08.2015,-,2,2015-08-29,2015-08-29,,Anthony Martial
VfL Wolfsburg,82,23.08.2015,23.08.2015,-,2,2015-08-23,2015-08-23,,Anthony Martial
Tottenham Hotspur,148,10.06.2015,08.06.2015,-,2,2015-06-10,2015-06-08,,Anthony Martial
FC Valencia,1049,12.08.2014,11.08.2014,-,3,2014-08-12,2014-08-11,,Anthony Martial
Atlético Madrid,13,11.08.2014,11.08.2014,-,3,2014-08-11,2014-08-11,,Anthony Martial
FC Schalke 04,33,22.05.2014,22.05.2014,-,3,2014-05-22,2014-05-22,,Anthony Martial
AS Monaco,162,28.06.2013,29.06.2013,-,3,2013-06-28,2013-06-29,,Anthony Martial
Juventus Turin,506,16.05.2013,16.05.2013,-,3,2013-05-16,2013-05-16,,Anthony Martial
Hertha BSC,44,28.11.2024,02.12.2024,-,1,2024-11-28,2024-12-02,,Anthony Modeste
FC Schalke 04,33,10.11.2024,10.11.2024,-,1,2024-11-10,2024-11-10,,Anthony Modeste
Eintracht Frankfurt,24,02.09.2023,12.09.2023,-,1,2023-09-02,2023-09-12,,Anthony Modeste
Al Ahly FC,7,10.09.2023,10.09.2023,-,1,2023-09-10,2023-09-10,,Anthony Modeste
FC Girondins Bordeaux,40,16.06.2023,25.07.2023,-,1,2023-06-16,2023-07-25,,Anthony Modeste
Le Havre AC,738,16.06.2023,16.06.2023,-,1,2023-06-16,2023-06-16,,Anthony Modeste
Al-Hilal SFC,1114,16.03.2023,16.03.2023,-,1,2023-03-16,2023-03-16,,Anthony Modeste
Borussia Dortmund,16,08.08.2022,08.08.2022,-,1,2022-08-08,2022-08-08,,Anthony Modeste
Galatasaray,141,30.01.2022,30.01.2022,-,1,2022-01-30,2022-01-30,,Anthony Modeste
Al-Hilal SFC,1114,18.01.2022,18.01.2022,-,1,2022-01-18,2022-01-18,,Anthony Modeste
AS Saint-Étienne,618,01.02.2021,01.02.2021,-,1,2021-02-01,2021-02-01,,Anthony Modeste
1.FC Köln,3,17.11.2018,17.11.2018,-,1,2018-11-17,2018-11-17,,Anthony Modeste
FC Schalke 04,33,17.11.2018,17.11.2018,-,1,2018-11-17,2018-11-17,,Anthony Modeste
VfB Stuttgart,79,08.11.2018,10.11.2018,-,1,2018-11-08,2018-11-10,,Anthony Modeste
Borussia Dortmund,16,29.08.2018,30.08.2018,-,1,2018-08-29,2018-08-30,,Anthony Modeste
Galatasaray,141,26.08.2018,27.08.2018,-,2,2018-08-26,2018-08-27,,Anthony Modeste
OGC Nizza,417,12.08.2018,12.08.2018,-,2,2018-08-12,2018-08-12,,Anthony Modeste
Lokomotiv Moskau,932,07.08.2018,07.08.2018,-,2,2018-08-07,2018-08-07,,Anthony Modeste
VfL Wolfsburg,82,30.05.2018,31.05.2018,-,2,2018-05-30,2018-05-31,,Anthony Modeste
VfL Wolfsburg,82,30.05.2018,31.05.2018,-,2,2018-05-30,2018-05-31,,Anthony Modeste
Tianjin Tianhai (-2019),33714,12.07.2017,12.07.2017,-,2,2017-07-12,2017-07-12,,Anthony Modeste
FC Everton,29,09.07.2017,09.07.2017,-,2,2017-07-09,2017-07-09,,Anthony Modeste
West Ham United,379,01.07.2017,01.07.2017,-,2,2017-07-01,2017-07-01,,Anthony Modeste
Olympique Marseille,244,07.06.2017,07.06.2017,-,2,2017-06-07,2017-06-07,,Anthony Modeste
West Bromwich Albion,984,03.05.2017,03.05.2017,-,2,2017-05-03,2017-05-03,,Anthony Modeste
FC Burnley,1132,14.04.2017,19.04.2017,-,2,2017-04-14,2017-04-19,,Anthony Modeste
Stoke City,512,14.04.2017,14.04.2017,-,2,2017-04-14,2017-04-14,,Anthony Modeste
Sporting Lissabon,336,15.08.2016,16.08.2016,-,2,2016-08-15,2016-08-16,,Anthony Modeste
Hamburger SV,41,22.06.2016,04.07.2016,-,2,2016-06-22,2016-07-04,,Anthony Modeste
Beijing Guoan,3176,22.06.2016,04.07.2016,-,2,2016-06-22,2016-07-04,,Anthony Modeste
FC Arsenal,11,30.10.2015,03.11.2015,-,3,2015-10-30,2015-11-03,,Anthony Modeste
Sampdoria Genua,1038,31.10.2015,02.11.2015,-,3,2015-10-31,2015-11-02,,Anthony Modeste
1.FC Köln,3,19.06.2015,19.06.2015,-,3,2015-06-19,2015-06-19,,Anthony Modeste
Eintracht Frankfurt,24,16.06.2015,16.06.2015,-,3,2015-06-16,2015-06-16,,Anthony Modeste
Hannover 96,42,10.06.2015,10.06.2015,-,3,2015-06-10,2015-06-10,,Anthony Modeste
Bayer 04 Leverkusen,15,18.05.2015,18.05.2015,-,3,2015-05-18,2015-05-18,,Anthony Modeste
Crystal Palace,873,20.01.2015,20.01.2015,-,3,2015-01-20,2015-01-20,,Anthony Modeste
West Bromwich Albion,984,20.01.2015,20.01.2015,-,3,2015-01-20,2015-01-20,,Anthony Modeste
Hamburger SV,41,11.01.2015,11.01.2015,-,3,2015-01-11,2015-01-11,,Anthony Modeste
Hull City,3008,11.01.2015,11.01.2015,-,3,2015-01-11,2015-01-11,,Anthony Modeste
Swansea City,2288,11.01.2015,11.01.2015,-,3,2015-01-11,2015-01-11,,Anthony Modeste
Hertha BSC,44,26.08.2014,30.08.2014,-,3,2014-08-26,2014-08-30,,Anthony Modeste
Lokomotiv Moskau,932,03.08.2014,04.08.2014,-,3,2014-08-03,2014-08-04,,Anthony Modeste
Trabzonspor,449,26.12.2013,26.12.2013,-,3,2013-12-26,2013-12-26,,Anthony Modeste
TSG 1899 Hoffenheim,533,08.07.2013,08.07.2013,-,3,2013-07-08,2013-07-08,,Anthony Modeste
VfB Stuttgart,79,05.06.2013,05.06.2013,-,4,2013-06-05,2013-06-05,,Anthony Modeste
Genclerbirligi Ankara,820,30.05.2013,30.05.2013,-,4,2013-05-30,2013-05-30,,Anthony Modeste
SC Freiburg,60,18.07.2010,18.07.2010,-,4,2010-07-18,2010-07-18,,Anthony Modeste
FC St. Pauli,35,18.07.2010,18.07.2010,-,4,2010-07-18,2010-07-18,,Anthony Modeste
SV Werder Bremen,86,06.06.2010,07.06.2010,-,4,2010-06-06,2010-06-07,,Anthony Modeste
FC Stade Rennes,273,03.02.2025,03.02.2025,-,1,2025-02-03,2025-02-03,,Anthony Rouault
VfB Stuttgart,79,01.09.2023,01.09.2023,-,1,2023-09-01,2023-09-01,,Anthony Rouault
AC Florenz,430,07.07.2023,07.07.2023,-,1,2023-07-07,2023-07-07,,Anthony Rouault
1.FSV Mainz 05,39,06.07.2022,06.07.2022,-,1,2022-07-06,2022-07-06,,Anthony Rouault
Borussia Mönchengladbach,18,20.04.2022,21.04.2022,-,1,2022-04-20,2022-04-21,,Anthony Rouault
Botev Plovdiv,2531,19.06.2024,29.06.2024,-,1,2024-06-19,2024-06-29,,Anthony Ujah
Hannover 96,42,01.08.2022,03.08.2022,-,1,2022-08-01,2022-08-03,,Anthony Ujah
Eintracht Braunschweig,23,02.08.2022,02.08.2022,-,1,2022-08-02,2022-08-02,,Anthony Ujah
Karlsruher SC,48,16.06.2022,28.06.2022,-,1,2022-06-16,2022-06-28,,Anthony Ujah
SV Werder Bremen,86,28.12.2021,29.12.2021,-,1,2021-12-28,2021-12-29,,Anthony Ujah
1.FC Union Berlin,89,20.06.2019,20.06.2019,-,1,2019-06-20,2019-06-20,,Anthony Ujah
Caykur Rizespor,126,24.01.2019,24.01.2019,-,1,2019-01-24,2019-01-24,,Anthony Ujah
1.FSV Mainz 05,39,20.12.2017,20.12.2017,-,1,2017-12-20,2017-12-20,,Anthony Ujah
Los Angeles Galaxy,1061,13.12.2017,13.12.2017,-,1,2017-12-13,2017-12-13,,Anthony Ujah
TSG 1899 Hoffenheim,533,13.12.2017,13.12.2017,-,1,2017-12-13,2017-12-13,,Anthony Ujah
Hannover 96,42,01.09.2017,01.09.2017,-,1,2017-09-01,2017-09-01,,Anthony Ujah
Liaoning FC (- 2019),1079,05.07.2016,05.07.2016,-,1,2016-07-05,2016-07-05,,Anthony Ujah
Guangzhou FC (1954 - 2024),10948,18.05.2016,18.05.2016,-,1,2016-05-18,2016-05-18,,Anthony Ujah
Stoke City,512,11.11.2015,11.11.2015,-,1,2015-11-11,2015-11-11,,Anthony Ujah
SV Werder Bremen,86,05.05.2015,05.05.2015,-,1,2015-05-05,2015-05-05,,Anthony Ujah
1.FC Köln,3,08.07.2013,08.07.2013,-,2,2013-07-08,2013-07-08,,Anthony Ujah
GNK Dinamo Zagreb,419,17.05.2013,17.05.2013,-,2,2013-05-17,2013-05-17,,Anthony Ujah
Molde FK,687,21.03.2012,21.03.2012,-,2,2012-03-21,2012-03-21,,Anthony Ujah
1.FSV Mainz 05,39,28.06.2011,28.06.2011,-,2,2011-06-28,2011-06-28,,Anthony Ujah
FC Bologna,1025,24.06.2011,25.06.2011,-,2,2011-06-24,2011-06-25,,Anthony Ujah
TSG 1899 Hoffenheim,533,20.06.2011,20.06.2011,-,2,2011-06-20,2011-06-20,,Anthony Ujah
Los Angeles FC,51828,16.04.2025,16.04.2025,-,1,2025-04-16,2025-04-16,,Antoine Griezmann
Al-Nassr FC,18544,24.06.2023,24.06.2023,-,1,2023-06-24,2023-06-24,,Antoine Griezmann
Manchester United,985,17.08.2022,17.08.2022,-,1,2022-08-17,2022-08-17,,Antoine Griezmann
Tottenham Hotspur,148,01.01.2022,01.01.2022,-,1,2022-01-01,2022-01-01,,Antoine Griezmann
Atlético Madrid,13,01.09.2021,01.09.2021,-,1,2021-09-01,2021-09-01,,Antoine Griezmann
FC Chelsea,631,14.07.2021,22.07.2021,-,1,2021-07-14,2021-07-22,,Antoine Griezmann
Manchester City,281,06.07.2021,06.07.2021,-,1,2021-07-06,2021-07-06,,Antoine Griezmann
Juventus Turin,506,04.07.2020,04.07.2020,-,1,2020-07-04,2020-07-04,,Antoine Griezmann
FC Paris Saint-Germain,583,01.04.2020,01.04.2020,-,1,2020-04-01,2020-04-01,,Antoine Griezmann
FC Barcelona,131,07.07.2019,12.07.2019,-,1,2019-07-07,2019-07-12,,Antoine Griezmann
FC Paris Saint-Germain,583,09.06.2019,09.06.2019,-,1,2019-06-09,2019-06-09,,Antoine Griezmann
Manchester United,985,25.05.2019,25.05.2019,-,1,2019-05-25,2019-05-25,,Antoine Griezmann
FC Bayern München,27,19.03.2019,26.03.2019,-,1,2019-03-19,2019-03-26,,Antoine Griezmann
Juventus Turin,506,05.04.2018,05.04.2018,-,1,2018-04-05,2018-04-05,,Antoine Griezmann
Real Madrid,418,03.02.2017,03.02.2017,-,1,2017-02-03,2017-02-03,,Antoine Griezmann
Manchester City,281,06.11.2016,06.11.2016,-,2,2016-11-06,2016-11-06,,Antoine Griezmann
FC Chelsea,631,08.09.2016,08.09.2016,-,2,2016-09-08,2016-09-08,,Antoine Griezmann
FC Arsenal,11,19.10.2015,19.10.2015,-,2,2015-10-19,2015-10-19,,Antoine Griezmann
FC Chelsea,631,06.05.2015,06.05.2015,-,2,2015-05-06,2015-05-06,,Antoine Griezmann
AS Monaco,162,20.07.2014,20.07.2014,-,2,2014-07-20,2014-07-20,,Antoine Griezmann
FC Arsenal,11,26.05.2014,26.04.2014,-,2,2014-05-26,2014-04-26,,Antoine Griezmann
FC Everton,29,20.04.2014,22.04.2014,-,2,2014-04-20,2014-04-22,,Antoine Griezmann
FC Paris Saint-Germain,583,20.06.2015,20.04.2014,-,2,2015-06-20,2014-04-20,,Antoine Griezmann
FC Liverpool,31,30.03.2014,30.03.2014,-,2,2014-03-30,2014-03-30,,Antoine Griezmann
FC Schalke 04,33,06.08.2013,06.08.2013,-,2,2013-08-06,2013-08-06,,Antoine Griezmann
Tottenham Hotspur,148,27.02.2013,27.02.2013,-,2,2013-02-27,2013-02-27,,Antoine Griezmann
Athletic Bilbao,621,04.02.2012,05.02.2012,-,2,2012-02-04,2012-02-05,,Antoine Griezmann
FC Valencia,1049,29.10.2011,30.10.2011,-,2,2011-10-29,2011-10-30,,Antoine Griezmann
Atlético Madrid,13,28.07.2014,28.07.2011,-,2,2014-07-28,2011-07-28,,Antoine Griezmann
Olympique Marseille,244,09.01.2011,09.01.2011,-,2,2011-01-09,2011-01-09,,Antoine Griezmann
Olympique Lyon,1041,28.09.2010,28.09.2010,-,3,2010-09-28,2010-09-28,,Antoine Griezmann
SC Braga,1075,25.03.2016,25.03.2016,-,1,2016-03-25,2016-03-25,,Antonino La Gumina
West Ham United,379,19.08.2016,19.08.2016,-,1,2016-08-19,2016-08-19,,Antonino Ragusa
FC Barcelona,131,02.07.2018,02.07.2018,-,1,2018-07-02,2018-07-02,,Antonio Adán
Atlético Madrid,13,29.06.2018,29.06.2018,-,1,2018-06-29,2018-06-29,,Antonio Adán
Olympique Marseille,244,02.04.2016,02.04.2016,-,1,2016-04-02,2016-04-02,,Antonio Adán
Real Betis Sevilla,150,27.01.2014,27.01.2014,-,1,2014-01-27,2014-01-27,,Antonio Adán
Cagliari Calcio,1390,19.11.2013,19.11.2013,-,1,2013-11-19,2013-11-19,,Antonio Adán
Sporting Lissabon,336,01.08.2013,01.08.2013,-,1,2013-08-01,2013-08-01,,Antonio Adán
UD Levante,3368,07.05.2013,07.05.2013,-,1,2013-05-07,2013-05-07,,Antonio Adán
Borussia Mönchengladbach,18,04.05.2013,05.05.2013,-,1,2013-05-04,2013-05-05,,Antonio Adán
Deportivo La Coruña,897,10.05.2012,10.05.2012,-,1,2012-05-10,2012-05-10,,Antonio Adán
Bayer 04 Leverkusen,15,29.06.2017,29.06.2017,-,1,2017-06-29,2017-06-29,,Antonio Barragán
FC Middlesbrough,641,13.07.2016,13.07.2016,-,1,2016-07-13,2016-07-13,,Antonio Barragán
FC Schalke 04,33,23.12.2014,24.12.2014,-,1,2014-12-23,2014-12-24,,Antonio Barragán
Bayer 04 Leverkusen,15,23.12.2014,23.12.2014,-,1,2014-12-23,2014-12-23,,Antonio Barragán
FC Liverpool,31,26.03.2014,26.03.2014,-,1,2014-03-26,2014-03-26,,Antonio Barragán
Newcastle United,762,30.01.2019,30.01.2019,-,1,2019-01-30,2019-01-30,,Antonio Barreca
AC Mailand,5,30.09.2016,30.09.2016,-,1,2016-09-30,2016-09-30,,Antonio Barreca
AS Rom,12,30.09.2016,30.09.2016,-,1,2016-09-30,2016-09-30,,Antonio Barreca
Juventus Turin,506,30.09.2016,30.09.2016,-,1,2016-09-30,2016-09-30,,Antonio Barreca
Novara FC,6692,27.12.2015,27.12.2015,-,1,2015-12-27,2015-12-27,,Antonio Barreca
Cagliari Calcio,1390,17.06.2015,17.06.2015,-,1,2015-06-17,2015-06-17,,Antonio Barreca
AC Florenz,430,29.06.2024,29.06.2024,-,1,2024-06-29,2024-06-29,,Antonio Blanco
SD Eibar,1533,29.12.2022,29.12.2022,-,1,2022-12-29,2022-12-29,,Antonio Blanco
FC Getafe,3709,28.07.2022,28.07.2022,-,1,2022-07-28,2022-07-28,,Antonio Blanco
West Ham United,379,06.01.2019,06.01.2019,-,1,2019-01-06,2019-01-06,,Antonio Candreva
FC Chelsea,631,02.08.2017,02.08.2017,-,1,2017-08-02,2017-08-02,,Antonio Candreva
Inter Mailand,46,31.07.2016,31.07.2016,-,1,2016-07-31,2016-07-31,,Antonio Candreva
Atlético Madrid,13,22.05.2016,22.05.2016,-,1,2016-05-22,2016-05-22,,Antonio Candreva
AC Florenz,430,23.03.2016,23.03.2016,-,1,2016-03-23,2016-03-23,,Antonio Candreva
SSC Neapel,6195,23.03.2016,23.03.2016,-,1,2016-03-23,2016-03-23,,Antonio Candreva
Tottenham Hotspur,148,23.03.2016,23.03.2016,-,1,2016-03-23,2016-03-23,,Antonio Candreva
Borussia Dortmund,16,30.12.2015,01.01.2016,-,1,2015-12-30,2016-01-01,,Antonio Candreva
FC Chelsea,631,15.11.2015,15.11.2015,-,1,2015-11-15,2015-11-15,,Antonio Candreva
FC Liverpool,31,17.01.2014,17.01.2014,-,1,2014-01-17,2014-01-17,,Antonio Candreva
Manchester United,985,13.07.2013,13.07.2013,-,1,2013-07-13,2013-07-13,,Antonio Candreva
Bayer 04 Leverkusen,15,14.05.2013,14.05.2013,-,1,2013-05-14,2013-05-14,,Antonio Candreva
Fenerbahce,36,05.05.2013,05.05.2013,-,1,2013-05-05,2013-05-05,,Antonio Candreva
FC Villarreal,1050,04.07.2011,04.07.2011,-,1,2011-07-04,2011-07-04,,Antonio Candreva
AS Rom,12,15.05.2010,15.05.2010,-,1,2010-05-15,2010-05-15,,Antonio Candreva
Juventus Turin,506,21.01.2010,21.01.2010,-,2,2010-01-21,2010-01-21,,Antonio Candreva
West Ham United,379,26.09.2009,26.09.2009,-,2,2009-09-26,2009-09-26,,Antonio Candreva
AC Mailand,5,25.09.2009,25.09.2009,-,2,2009-09-25,2009-09-25,,Antonio Candreva
FC Bologna,1025,30.06.2015,30.06.2015,-,1,2015-06-30,2015-06-30,,Antonio Mirante
AC Florenz,430,27.06.2015,27.06.2015,-,1,2015-06-27,2015-06-27,,Antonio Mirante
Trabzonspor,449,24.06.2015,24.06.2015,-,1,2015-06-24,2015-06-24,,Antonio Mirante
Sampdoria Genua,1038,24.06.2015,24.06.2015,-,1,2015-06-24,2015-06-24,,Antonio Mirante
Inter Mailand,46,21.05.2015,21.05.2015,-,1,2015-05-21,2015-05-21,,Antonio Mirante
Al-Hilal SFC,1114,13.07.2024,13.07.2024,-,1,2024-07-13,2024-07-13,,Antonio Rüdiger
Al-Nassr FC,18544,13.07.2024,13.07.2024,-,1,2024-07-13,2024-07-13,,Antonio Rüdiger
Real Madrid,418,20.05.2022,20.05.2022,-,1,2022-05-20,2022-05-20,,Antonio Rüdiger
FC Barcelona,131,31.03.2022,04.04.2022,-,1,2022-03-31,2022-04-04,,Antonio Rüdiger
FC Bayern München,27,19.03.2022,20.03.2022,-,1,2022-03-19,2022-03-20,,Antonio Rüdiger
Juventus Turin,506,19.03.2022,19.03.2022,-,1,2022-03-19,2022-03-19,,Antonio Rüdiger
Newcastle United,762,08.03.2022,08.03.2022,-,1,2022-03-08,2022-03-08,,Antonio Rüdiger
FC Paris Saint-Germain,583,01.03.2022,01.03.2022,-,1,2022-03-01,2022-03-01,,Antonio Rüdiger
Manchester United,985,25.02.2022,25.02.2022,-,1,2022-02-25,2022-02-25,,Antonio Rüdiger
Inter Mailand,46,07.09.2021,07.09.2021,-,1,2021-09-07,2021-09-07,,Antonio Rüdiger
Tottenham Hotspur,148,07.03.2021,29.03.2021,-,1,2021-03-07,2021-03-29,,Antonio Rüdiger
RB Leipzig,23826,27.12.2020,27.12.2020,-,1,2020-12-27,2020-12-27,,Antonio Rüdiger
AC Mailand,5,04.10.2020,04.10.2020,-,1,2020-10-04,2020-10-04,,Antonio Rüdiger
West Ham United,379,27.09.2020,27.09.2020,-,1,2020-09-27,2020-09-27,,Antonio Rüdiger
AS Rom,12,23.09.2020,23.09.2020,-,1,2020-09-23,2020-09-23,,Antonio Rüdiger
Borussia Dortmund,16,08.04.2020,09.04.2020,-,2,2020-04-08,2020-04-09,,Antonio Rüdiger
FC Chelsea,631,09.07.2017,09.07.2017,-,2,2017-07-09,2017-07-09,,Antonio Rüdiger
Inter Mailand,46,07.06.2017,07.06.2017,-,2,2017-06-07,2017-06-07,,Antonio Rüdiger
Manchester City,281,18.03.2017,18.03.2017,-,2,2017-03-18,2017-03-18,,Antonio Rüdiger
FC Arsenal,11,02.06.2016,02.06.2016,-,2,2016-06-02,2016-06-02,,Antonio Rüdiger
FC Paris Saint-Germain,583,02.06.2016,02.06.2016,-,2,2016-06-02,2016-06-02,,Antonio Rüdiger
Manchester United,985,02.06.2016,02.06.2016,-,2,2016-06-02,2016-06-02,,Antonio Rüdiger
Borussia Dortmund,16,31.05.2016,31.05.2016,-,2,2016-05-31,2016-05-31,,Antonio Rüdiger
FC Liverpool,31,31.05.2016,31.05.2016,-,2,2016-05-31,2016-05-31,,Antonio Rüdiger
FC Chelsea,631,06.04.2016,06.04.2016,-,2,2016-04-06,2016-04-06,,Antonio Rüdiger
FC Bayern München,27,18.11.2015,19.11.2015,-,2,2015-11-18,2015-11-19,,Antonio Rüdiger
AS Rom,12,19.08.2015,19.08.2015,-,2,2015-08-19,2015-08-19,,Antonio Rüdiger
VfL Wolfsburg,82,16.08.2015,16.08.2015,-,2,2015-08-16,2015-08-16,,Antonio Rüdiger
FC Arsenal,11,14.08.2015,15.08.2015,-,2,2015-08-14,2015-08-15,,Antonio Rüdiger
FC Porto,720,07.08.2015,09.08.2015,-,2,2015-08-07,2015-08-09,,Antonio Rüdiger
Atlético Madrid,13,20.07.2015,21.07.2015,-,3,2015-07-20,2015-07-21,,Antonio Rüdiger
Newcastle United,762,17.07.2015,17.07.2015,-,3,2015-07-17,2015-07-17,,Antonio Rüdiger
Juventus Turin,506,15.07.2015,15.07.2015,-,3,2015-07-15,2015-07-15,,Antonio Rüdiger
SSC Neapel,6195,14.07.2015,14.07.2015,-,3,2015-07-14,2015-07-14,,Antonio Rüdiger
Manchester City,281,09.07.2015,09.07.2015,-,3,2015-07-09,2015-07-09,,Antonio Rüdiger
Manchester United,985,09.07.2015,09.07.2015,-,3,2015-07-09,2015-07-09,,Antonio Rüdiger
FC Valencia,1049,30.06.2015,30.06.2015,-,3,2015-06-30,2015-06-30,,Antonio Rüdiger
Galatasaray,141,01.06.2015,28.06.2015,-,3,2015-06-01,2015-06-28,,Antonio Rüdiger
Tottenham Hotspur,148,16.06.2015,16.06.2015,-,3,2015-06-16,2015-06-16,,Antonio Rüdiger
Inter Mailand,46,15.06.2015,15.06.2015,-,3,2015-06-15,2015-06-15,,Antonio Rüdiger
Bayer 04 Leverkusen,15,13.06.2015,13.06.2015,-,3,2015-06-13,2015-06-13,,Antonio Rüdiger
West Ham United,379,11.06.2015,11.06.2015,-,3,2015-06-11,2015-06-11,,Antonio Rüdiger
FC Liverpool,31,02.06.2015,02.06.2015,-,3,2015-06-02,2015-06-02,,Antonio Rüdiger
AS Monaco,162,31.05.2015,31.05.2015,-,3,2015-05-31,2015-05-31,,Antonio Rüdiger
Borussia Mönchengladbach,18,28.05.2015,31.05.2015,-,3,2015-05-28,2015-05-31,,Antonio Rüdiger
FC Bayern München,27,18.07.2014,05.08.2014,-,4,2014-07-18,2014-08-05,,Antonio Rüdiger
FC Paris Saint-Germain,583,18.07.2014,18.07.2014,-,4,2014-07-18,2014-07-18,,Antonio Rüdiger
FC Schalke 04,33,14.05.2014,14.05.2014,-,4,2014-05-14,2014-05-14,,Antonio Rüdiger
Borussia Dortmund,16,17.10.2013,17.10.2013,-,4,2013-10-17,2013-10-17,,Antonio Rüdiger
VfB Stuttgart,79,18.12.2023,18.12.2023,-,1,2023-12-18,2023-12-18,,Antonio Sanabria
FC Arsenal,11,24.05.2023,24.05.2023,-,1,2023-05-24,2023-05-24,,Antonio Sanabria
Hellas Verona,276,12.12.2022,12.12.2022,-,1,2022-12-12,2022-12-12,,Antonio Sanabria
ZSKA Moskau,2410,23.05.2020,23.05.2020,-,1,2020-05-23,2020-05-23,,Antonio Sanabria
Genua CFC,252,22.01.2019,22.01.2019,-,1,2019-01-22,2019-01-22,,Antonio Sanabria
West Ham United,379,07.08.2018,07.08.2018,-,1,2018-08-07,2018-08-07,,Antonio Sanabria
VfL Wolfsburg,82,22.06.2016,15.07.2016,-,1,2016-06-22,2016-07-15,,Antonio Sanabria
Real Betis Sevilla,150,14.07.2016,14.07.2016,-,1,2016-07-14,2016-07-14,,Antonio Sanabria
Rubin Kazan,2698,25.06.2016,25.06.2016,-,1,2016-06-25,2016-06-25,,Antonio Sanabria
Tottenham Hotspur,148,25.06.2016,25.06.2016,-,1,2016-06-25,2016-06-25,,Antonio Sanabria
FC Schalke 04,33,22.06.2016,24.06.2016,-,1,2016-06-22,2016-06-24,,Antonio Sanabria
Borussia Mönchengladbach,18,23.06.2016,23.06.2016,-,1,2016-06-23,2016-06-23,,Antonio Sanabria
FC Valencia,1049,09.05.2016,09.05.2016,-,1,2016-05-09,2016-05-09,,Antonio Sanabria
Atlético Madrid,13,20.02.2016,20.02.2016,-,1,2016-02-20,2016-02-20,,Antonio Sanabria
Real Madrid,418,20.02.2016,20.02.2016,-,1,2016-02-20,2016-02-20,,Antonio Sanabria
AFC Sunderland,289,23.01.2016,23.01.2016,-,2,2016-01-23,2016-01-23,,Antonio Sanabria
AS Rom,12,29.01.2014,29.01.2014,-,2,2014-01-29,2014-01-29,,Antonio Sanabria
FC Arsenal,11,13.12.2013,13.12.2013,-,2,2013-12-13,2013-12-13,,Antonio Sanabria
FC Chelsea,631,11.10.2013,11.10.2013,-,2,2013-10-11,2013-10-11,,Antonio Sanabria
Inter Mailand,46,01.05.2013,01.05.2013,-,2,2013-05-01,2013-05-01,,Antonio Sanabria
Juventus Turin,506,01.05.2013,01.05.2013,-,2,2013-05-01,2013-05-01,,Antonio Sanabria
Udinese Calcio,410,01.05.2013,01.05.2013,-,2,2013-05-01,2013-05-01,,Antonio Sanabria
Bayer 04 Leverkusen,15,11.10.2020,12.10.2020,-,1,2020-10-11,2020-10-12,,Antonio Valencia
D.C. United,2440,21.04.2019,21.04.2019,-,1,2019-04-21,2019-04-21,,Antonio Valencia
Inter Mailand,46,17.03.2019,17.03.2019,-,1,2019-03-17,2019-03-17,,Antonio Valencia
FC Arsenal,11,17.03.2019,17.03.2019,-,1,2019-03-17,2019-03-17,,Antonio Valencia
West Ham United,379,17.02.2019,01.03.2019,-,1,2019-02-17,2019-03-01,,Antonio Valencia
Newcastle United,762,27.01.2019,27.01.2019,-,1,2019-01-27,2019-01-27,,Antonio Valencia
FC Fulham,931,27.01.2019,27.01.2019,-,1,2019-01-27,2019-01-27,,Antonio Valencia
FC Valencia,1049,24.05.2015,24.05.2015,-,1,2015-05-24,2015-05-24,,Antonio Valencia
Galatasaray,141,13.05.2014,13.05.2014,-,1,2014-05-13,2014-05-13,,Antonio Valencia
FC Everton,29,06.10.2013,07.10.2013,-,1,2013-10-06,2013-10-07,,Antonio Valencia
FC Bayern München,27,12.04.2012,12.04.2012,-,1,2012-04-12,2012-04-12,,Antonio Valencia
Juventus Turin,506,30.05.2011,30.05.2011,-,1,2011-05-30,2011-05-30,,Antonio Valencia
Real Betis Sevilla,150,01.09.2025,01.09.2025,-,1,2025-09-01,2025-09-01,,Antony
Besiktas JK,114,21.06.2025,22.06.2025,-,1,2025-06-21,2025-06-22,,Antony
Fenerbahce,36,15.06.2025,15.06.2025,-,1,2025-06-15,2025-06-15,,Antony
Bayer 04 Leverkusen,15,03.06.2025,06.06.2025,-,1,2025-06-03,2025-06-06,,Antony
FC Bayern München,27,,19.03.2025,-,1,,2025-03-19,,Antony
Flamengo Rio de Janeiro,614,05.11.2023,05.11.2023,-,1,2023-11-05,2023-11-05,,Antony
Manchester United,985,31.08.2022,31.08.2022,-,1,2022-08-31,2022-08-31,,Antony
FC Liverpool,31,17.05.2022,17.05.2022,-,1,2022-05-17,2022-05-17,,Antony
FC Bayern München,27,14.04.2022,15.04.2022,-,1,2022-04-14,2022-04-15,,Antony
FC Barcelona,131,24.03.2022,24.03.2022,-,1,2022-03-24,2022-03-24,,Antony
Borussia Dortmund,16,05.05.2020,05.05.2020,-,1,2020-05-05,2020-05-05,,Antony
Ajax Amsterdam,610,22.02.2020,22.02.2020,-,1,2020-02-22,2020-02-22,,Antony
RB Leipzig,23826,04.12.2019,04.12.2019,-,1,2019-12-04,2019-12-04,,Antony
AC Florenz,430,23.08.2022,24.08.2022,-,1,2022-08-23,2022-08-24,,Antonín Barák
SSC Neapel,6195,09.05.2022,29.07.2022,-,1,2022-05-09,2022-07-29,,Antonín Barák
Tottenham Hotspur,148,09.05.2022,09.05.2022,-,1,2022-05-09,2022-05-09,,Antonín Barák
Eintracht Frankfurt,24,02.07.2021,03.07.2021,-,1,2021-07-02,2021-07-03,,Antonín Barák
Eintracht Frankfurt,24,30.06.2021,30.06.2021,-,1,2021-06-30,2021-06-30,,Antonín Barák
AS Monaco,162,11.05.2021,11.05.2021,-,1,2021-05-11,2021-05-11,,Antonín Barák
1.FSV Mainz 05,39,21.09.2023,22.09.2023,-,1,2023-09-21,2023-09-22,,Anwar El Ghazi
Manchester United,985,11.09.2023,11.09.2023,-,1,2023-09-11,2023-09-11,,Anwar El Ghazi
PSV Eindhoven,383,28.08.2022,28.08.2022,-,1,2022-08-28,2022-08-28,,Anwar El Ghazi
FC Everton,29,11.01.2022,11.01.2022,-,1,2022-01-11,2022-01-11,,Anwar El Ghazi
LOSC Lille,1082,24.01.2017,24.01.2017,-,1,2017-01-24,2017-01-24,,Anwar El Ghazi
Olympique Marseille,244,14.01.2017,14.01.2017,-,1,2017-01-14,2017-01-14,,Anwar El Ghazi
AS Rom,12,04.01.2017,04.01.2017,-,1,2017-01-04,2017-01-04,,Anwar El Ghazi
Lazio Rom,398,14.08.2016,14.08.2016,-,1,2016-08-14,2016-08-14,,Anwar El Ghazi
VfL Wolfsburg,82,09.08.2016,11.08.2016,-,1,2016-08-09,2016-08-11,,Anwar El Ghazi
Aston Villa,405,04.06.2016,04.06.2016,-,1,2016-06-04,2016-06-04,,Anwar El Ghazi
Crystal Palace,873,04.06.2016,04.06.2016,-,1,2016-06-04,2016-06-04,,Anwar El Ghazi
FC Liverpool,31,04.06.2016,04.06.2016,-,1,2016-06-04,2016-06-04,,Anwar El Ghazi
Inter Mailand,46,29.04.2016,29.04.2016,-,1,2016-04-29,2016-04-29,,Anwar El Ghazi
AC Mailand,5,29.04.2016,29.04.2016,-,1,2016-04-29,2016-04-29,,Anwar El Ghazi
Tottenham Hotspur,148,03.04.2016,03.04.2016,-,1,2016-04-03,2016-04-03,,Anwar El Ghazi
Newcastle United,762,06.11.2015,06.11.2015,-,2,2015-11-06,2015-11-06,,Anwar El Ghazi
FC Barcelona,131,09.10.2015,09.10.2015,-,2,2015-10-09,2015-10-09,,Anwar El Ghazi
FC Southampton,180,07.10.2015,07.10.2015,-,2,2015-10-07,2015-10-07,,Anwar El Ghazi
FC Everton,29,07.10.2015,07.10.2015,-,2,2015-10-07,2015-10-07,,Anwar El Ghazi
Atlético Madrid,13,16.05.2015,16.05.2015,-,2,2015-05-16,2015-05-16,,Anwar El Ghazi
FC Chelsea,631,16.05.2015,16.05.2015,-,2,2015-05-16,2015-05-16,,Anwar El Ghazi
FC Bayern München,27,15.05.2015,15.05.2015,-,2,2015-05-15,2015-05-15,,Anwar El Ghazi
Real Betis Sevilla,150,17.11.2024,17.11.2024,-,1,2024-11-17,2024-11-17,,Arkadiusz Milik
AC Mailand,5,20.08.2024,20.08.2024,-,1,2024-08-20,2024-08-20,,Arkadiusz Milik
Lazio Rom,398,20.08.2024,20.08.2024,-,1,2024-08-20,2024-08-20,,Arkadiusz Milik
FC Bologna,1025,04.06.2024,04.06.2024,-,1,2024-06-04,2024-06-04,,Arkadiusz Milik
Besiktas JK,114,03.06.2024,03.06.2024,-,1,2024-06-03,2024-06-03,,Arkadiusz Milik
Fenerbahce,36,01.06.2024,01.06.2024,-,1,2024-06-01,2024-06-01,,Arkadiusz Milik
Juventus Turin,506,21.06.2023,21.06.2023,-,1,2023-06-21,2023-06-21,,Arkadiusz Milik
Lazio Rom,398,20.06.2023,20.06.2023,-,1,2023-06-20,2023-06-20,,Arkadiusz Milik
Eintracht Frankfurt,24,31.05.2023,31.05.2023,-,1,2023-05-31,2023-05-31,,Arkadiusz Milik
FC Everton,29,17.08.2022,17.08.2022,-,1,2022-08-17,2022-08-17,,Arkadiusz Milik
Manchester United,985,17.08.2022,17.08.2022,-,1,2022-08-17,2022-08-17,,Arkadiusz Milik
Borussia Dortmund,16,26.07.2022,27.07.2022,-,1,2022-07-26,2022-07-27,,Arkadiusz Milik
Borussia Dortmund,16,27.04.2021,27.04.2021,-,1,2021-04-27,2021-04-27,,Arkadiusz Milik
FC Sevilla,368,03.04.2021,03.04.2021,-,1,2021-04-03,2021-04-03,,Arkadiusz Milik
Juventus Turin,506,01.03.2021,01.03.2021,-,1,2021-03-01,2021-03-01,,Arkadiusz Milik
Olympique Marseille,244,21.01.2021,21.01.2021,-,2,2021-01-21,2021-01-21,,Arkadiusz Milik
FC Bayern München,27,19.01.2021,19.01.2021,-,2,2021-01-19,2021-01-19,,Arkadiusz Milik
Atlético Madrid,13,30.12.2020,30.12.2020,-,2,2020-12-30,2020-12-30,,Arkadiusz Milik
AC Florenz,430,05.10.2020,05.10.2020,-,2,2020-10-05,2020-10-05,,Arkadiusz Milik
Tottenham Hotspur,148,01.10.2020,01.10.2020,-,2,2020-10-01,2020-10-01,,Arkadiusz Milik
FC Everton,29,29.09.2020,29.09.2020,-,2,2020-09-29,2020-09-29,,Arkadiusz Milik
Newcastle United,762,24.09.2020,24.09.2020,-,2,2020-09-24,2020-09-24,,Arkadiusz Milik
AS Rom,12,21.09.2020,22.09.2020,-,2,2020-09-21,2020-09-22,,Arkadiusz Milik
RB Leipzig,23826,14.09.2020,14.09.2020,-,2,2020-09-14,2020-09-14,,Arkadiusz Milik
Bayer 04 Leverkusen,15,05.06.2020,05.06.2020,-,2,2020-06-05,2020-06-05,,Arkadiusz Milik
FC Schalke 04,33,31.03.2020,09.04.2020,-,2,2020-03-31,2020-04-09,,Arkadiusz Milik
FC Arsenal,11,11.03.2020,11.03.2020,-,2,2020-03-11,2020-03-11,,Arkadiusz Milik
Manchester United,985,10.01.2020,15.01.2020,-,2,2020-01-10,2020-01-15,,Arkadiusz Milik
Inter Mailand,46,17.08.2019,17.08.2019,-,2,2019-08-17,2019-08-17,,Arkadiusz Milik
Galatasaray,141,21.06.2018,21.06.2018,-,2,2018-06-21,2018-06-21,,Arkadiusz Milik
SSC Neapel,6195,26.07.2016,29.07.2016,-,3,2016-07-26,2016-07-29,,Arkadiusz Milik
FC Schalke 04,33,15.06.2016,15.06.2016,-,3,2016-06-15,2016-06-15,,Arkadiusz Milik
FC Sevilla,368,09.06.2016,10.06.2016,-,3,2016-06-09,2016-06-10,,Arkadiusz Milik
Lazio Rom,398,22.05.2016,22.05.2016,-,3,2016-05-22,2016-05-22,,Arkadiusz Milik
AS Rom,12,22.05.2016,22.05.2016,-,3,2016-05-22,2016-05-22,,Arkadiusz Milik
Leicester City,1003,18.05.2016,18.05.2016,-,3,2016-05-18,2016-05-18,,Arkadiusz Milik
FC Barcelona,131,26.03.2016,26.03.2016,-,3,2016-03-26,2016-03-26,,Arkadiusz Milik
FC Everton,29,26.03.2016,26.03.2016,-,3,2016-03-26,2016-03-26,,Arkadiusz Milik
FC Liverpool,31,26.03.2016,26.03.2016,-,3,2016-03-26,2016-03-26,,Arkadiusz Milik
FC Arsenal,11,26.03.2016,26.03.2016,-,3,2016-03-26,2016-03-26,,Arkadiusz Milik
Inter Mailand,46,21.03.2016,21.03.2016,-,3,2016-03-21,2016-03-21,,Arkadiusz Milik
Olympique Marseille,244,22.08.2015,22.08.2015,-,3,2015-08-22,2015-08-22,,Arkadiusz Milik
Juventus Turin,506,11.11.2014,11.11.2014,-,3,2014-11-11,2014-11-11,,Arkadiusz Milik
Ajax Amsterdam,610,15.05.2014,15.05.2014,-,3,2014-05-15,2014-05-15,,Arkadiusz Milik
Real Sociedad San Sebastián,681,10.05.2014,10.05.2014,-,3,2014-05-10,2014-05-10,,Arkadiusz Milik
FC Augsburg,167,30.08.2013,30.08.2013,-,4,2013-08-30,2013-08-30,,Arkadiusz Milik
Anorthosis Famagusta,3899,30.04.2013,30.04.2013,-,4,2013-04-30,2013-04-30,,Arkadiusz Milik
FC Sevilla,368,21.01.2013,21.01.2013,-,4,2013-01-21,2013-01-21,,Arkadiusz Milik
Bayer 04 Leverkusen,15,17.12.2012,17.12.2012,-,4,2012-12-17,2012-12-17,,Arkadiusz Milik
VfB Stuttgart,79,13.12.2012,17.12.2012,-,4,2012-12-13,2012-12-17,,Arkadiusz Milik
Borussia Dortmund,16,14.12.2012,16.12.2012,-,4,2012-12-14,2012-12-16,,Arkadiusz Milik
Celtic Glasgow,371,15.12.2012,15.12.2012,-,4,2012-12-15,2012-12-15,,Arkadiusz Milik
Grasshopper Club Zürich,504,24.11.2012,28.11.2012,-,4,2012-11-24,2012-11-28,,Arkadiusz Milik
Olympique Lyon,1041,16.11.2012,17.11.2012,-,4,2012-11-16,2012-11-17,,Arkadiusz Milik
FC Liverpool,31,04.11.2012,05.11.2012,-,4,2012-11-04,2012-11-05,,Arkadiusz Milik
FC Arsenal,11,04.11.2012,04.11.2012,-,4,2012-11-04,2012-11-04,,Arkadiusz Milik
Hannover 96,42,01.11.2012,03.11.2012,-,4,2012-11-01,2012-11-03,,Arkadiusz Milik
Aston Villa,405,02.11.2012,02.11.2012,-,4,2012-11-02,2012-11-02,,Arkadiusz Milik
FC Schalke 04,33,02.11.2012,02.11.2012,-,4,2012-11-02,2012-11-02,,Arkadiusz Milik
Inter Mailand,46,01.11.2012,01.11.2012,-,4,2012-11-01,2012-11-01,,Arkadiusz Milik
RSC Anderlecht,58,30.10.2012,30.10.2012,-,5,2012-10-30,2012-10-30,,Arkadiusz Milik
FC Everton,29,18.10.2012,18.10.2012,-,5,2012-10-18,2012-10-18,,Arkadiusz Milik
Udinese Calcio,410,18.10.2012,18.10.2012,-,5,2012-10-18,2012-10-18,,Arkadiusz Milik
1.FC Union Berlin,89,25.04.2012,25.04.2012,-,5,2012-04-25,2012-04-25,,Arkadiusz Milik
1.FC Kaiserslautern,2,16.08.2024,17.08.2024,-,1,2024-08-16,2024-08-17,,Arkadiusz Reca
Legia Warschau,255,31.05.2024,31.05.2024,-,1,2024-05-31,2024-05-31,,Arkadiusz Reca
1.FC Köln,3,14.05.2024,15.05.2024,-,1,2024-05-14,2024-05-15,,Arkadiusz Reca
1.FC Union Berlin,89,14.05.2024,14.05.2024,-,1,2024-05-14,2024-05-14,,Arkadiusz Reca
Atalanta Bergamo,800,09.06.2018,09.06.2018,-,1,2018-06-09,2018-06-09,,Arkadiusz Reca
RB Leipzig,23826,03.08.2025,03.08.2025,22 %,1,2025-08-03,2025-08-03,22.0,Armando Broja
FC Burnley,1132,02.08.2025,02.08.2025,-,1,2025-08-02,2025-08-02,,Armando Broja
VfB Stuttgart,79,15.07.2025,18.07.2025,20 %,1,2025-07-15,2025-07-18,20.0,Armando Broja
Ipswich Town,677,25.08.2024,25.08.2024,-,1,2024-08-25,2024-08-25,,Armando Broja
VfL Wolfsburg,82,10.06.2024,22.08.2024,-,1,2024-06-10,2024-08-22,,Armando Broja
AC Mailand,5,06.06.2024,06.06.2024,-,1,2024-06-06,2024-06-06,,Armando Broja
AS Monaco,162,30.05.2024,30.05.2024,-,1,2024-05-30,2024-05-30,,Armando Broja
FC Fulham,931,02.02.2024,02.02.2024,-,1,2024-02-02,2024-02-02,,Armando Broja
West Ham United,379,17.01.2024,17.01.2024,-,1,2024-01-17,2024-01-17,,Armando Broja
Wolverhampton Wanderers,543,17.01.2024,17.01.2024,-,1,2024-01-17,2024-01-17,,Armando Broja
Eintracht Frankfurt,24,03.01.2024,03.01.2024,-,1,2024-01-03,2024-01-03,,Armando Broja
FC Everton,29,17.08.2022,17.08.2022,-,1,2022-08-17,2022-08-17,,Armando Broja
Real Madrid,418,,29.07.2022,-,1,,2022-07-29,,Armando Broja
West Ham United,379,21.06.2022,21.06.2022,-,1,2022-06-21,2022-06-21,,Armando Broja
Borussia Dortmund,16,15.02.2022,16.02.2022,-,1,2022-02-15,2022-02-16,,Armando Broja
FC Bayern München,27,15.02.2022,15.02.2022,-,2,2022-02-15,2022-02-15,,Armando Broja
FC Arsenal,11,14.02.2022,14.02.2022,-,2,2022-02-14,2022-02-14,,Armando Broja
Newcastle United,762,27.01.2022,27.01.2022,-,2,2022-01-27,2022-01-27,,Armando Broja
FC Southampton,180,17.01.2022,17.01.2022,-,2,2022-01-17,2022-01-17,,Armando Broja
FC Sevilla,368,16.06.2019,16.06.2019,-,1,2019-06-16,2019-06-16,,Armando Izzo
West Ham United,379,29.05.2018,29.05.2018,-,1,2018-05-29,2018-05-29,,Armando Izzo
VfB Stuttgart,79,09.01.2018,09.01.2018,-,1,2018-01-09,2018-01-09,,Armando Izzo
FC Schalke 04,33,,04.01.2018,-,1,,2018-01-04,,Armando Izzo
Inter Mailand,46,18.04.2016,18.04.2016,-,1,2016-04-18,2016-04-18,,Armando Izzo
SSC Neapel,6195,18.04.2016,18.04.2016,-,1,2016-04-18,2016-04-18,,Armando Izzo
AC Mailand,5,18.04.2016,18.04.2016,-,1,2016-04-18,2016-04-18,,Armando Izzo
FC Arsenal,11,19.11.2015,19.11.2015,-,1,2015-11-19,2015-11-19,,Armando Izzo
Nottingham Forest,703,16.08.2025,16.08.2025,-,1,2025-08-16,2025-08-16,,Arnaud Kalimuendo
FC Brentford,1148,11.08.2025,11.08.2025,-,1,2025-08-11,2025-08-11,,Arnaud Kalimuendo
Leeds United,399,31.07.2025,31.07.2025,-,1,2025-07-31,2025-07-31,,Arnaud Kalimuendo
RB Leipzig,23826,24.07.2025,24.07.2025,31 %,1,2025-07-24,2025-07-24,31.0,Arnaud Kalimuendo
FC Villarreal,1050,24.07.2025,24.07.2025,-,1,2025-07-24,2025-07-24,,Arnaud Kalimuendo
Tottenham Hotspur,148,24.07.2025,24.07.2025,-,1,2025-07-24,2025-07-24,,Arnaud Kalimuendo
Sporting Lissabon,336,16.06.2025,16.06.2025,-,1,2025-06-16,2025-06-16,,Arnaud Kalimuendo
Bayer 04 Leverkusen,15,28.05.2025,02.06.2025,48 %,1,2025-05-28,2025-06-02,48.0,Arnaud Kalimuendo
Borussia Dortmund,16,28.05.2025,28.05.2025,-,1,2025-05-28,2025-05-28,,Arnaud Kalimuendo
Newcastle United,762,24.05.2025,24.05.2025,-,1,2025-05-24,2025-05-24,,Arnaud Kalimuendo
Eintracht Frankfurt,24,09.01.2025,10.01.2025,-,1,2025-01-09,2025-01-10,,Arnaud Kalimuendo
Juventus Turin,506,21.10.2024,21.10.2024,-,1,2024-10-21,2024-10-21,,Arnaud Kalimuendo
VfB Stuttgart,79,07.08.2024,07.08.2024,-,1,2024-08-07,2024-08-07,,Arnaud Kalimuendo
AS Monaco,162,17.06.2024,17.06.2024,-,1,2024-06-17,2024-06-17,,Arnaud Kalimuendo
FC Stade Rennes,273,10.08.2022,11.08.2022,-,1,2022-08-10,2022-08-11,,Arnaud Kalimuendo
Leeds United,399,16.06.2022,16.06.2022,-,2,2022-06-16,2022-06-16,,Arnaud Kalimuendo
Atalanta Bergamo,800,25.08.2021,25.08.2021,-,2,2021-08-25,2021-08-25,,Arnaud Kalimuendo
AS Saint-Étienne,618,21.08.2021,21.08.2021,-,2,2021-08-21,2021-08-21,,Arnaud Kalimuendo
1.FSV Mainz 05,39,27.01.2025,28.01.2025,-,1,2025-01-27,2025-01-28,,Arnaud Nordin
Borussia Mönchengladbach,18,27.01.2025,28.01.2025,-,1,2025-01-27,2025-01-28,,Arnaud Nordin
LOSC Lille,1082,13.07.2024,13.07.2024,-,1,2024-07-13,2024-07-13,,Arnaud Nordin
Montpellier HSC,969,18.06.2022,18.06.2022,-,1,2022-06-18,2022-06-18,,Arnaud Nordin
RC Straßburg Alsace,667,15.07.2021,15.07.2021,-,1,2021-07-15,2021-07-15,,Arnaud Nordin
1.FSV Mainz 05,39,23.02.2020,23.02.2020,-,1,2020-02-23,2020-02-23,,Arnaud Nordin
Chicago Fire FC,432,30.12.2022,30.12.2022,-,1,2022-12-30,2022-12-30,,Arnaud Souquet
FC Nantes,995,22.04.2015,22.04.2015,-,1,2015-04-22,2015-04-22,,Arnaud Souquet
SM Caen,1162,22.04.2015,22.04.2015,-,1,2015-04-22,2015-04-22,,Arnaud Souquet
FC Stade Rennes,273,22.04.2015,22.04.2015,-,1,2015-04-22,2015-04-22,,Arnaud Souquet
Besiktas JK,114,01.08.2025,01.08.2025,-,1,2025-08-01,2025-08-01,,Arnaut Danjuma
Olympique Lyon,1041,18.01.2024,18.01.2024,-,1,2024-01-18,2024-01-18,,Arnaut Danjuma
FC Everton,29,22.07.2023,22.07.2023,-,1,2023-07-22,2023-07-22,,Arnaut Danjuma
Tottenham Hotspur,148,24.01.2023,24.01.2023,-,1,2023-01-24,2023-01-24,,Arnaut Danjuma
FC Stade Rennes,273,20.01.2023,20.01.2023,-,1,2023-01-20,2023-01-20,,Arnaut Danjuma
AFC Bournemouth,989,15.01.2023,15.01.2023,-,1,2023-01-15,2023-01-15,,Arnaut Danjuma
West Ham United,379,30.06.2022,30.06.2022,-,1,2022-06-30,2022-06-30,,Arnaut Danjuma
Manchester United,985,01.06.2022,08.06.2022,-,1,2022-06-01,2022-06-08,,Arnaut Danjuma
FC Paris Saint-Germain,583,13.05.2022,13.05.2022,-,1,2022-05-13,2022-05-13,,Arnaut Danjuma
FC Liverpool,31,29.09.2021,29.09.2021,-,1,2021-09-29,2021-09-29,,Arnaut Danjuma
VfL Wolfsburg,82,19.08.2021,19.08.2021,-,1,2021-08-19,2021-08-19,,Arnaut Danjuma
FC Villarreal,1050,18.08.2021,18.08.2021,-,1,2021-08-18,2021-08-18,,Arnaut Danjuma
Aston Villa,405,20.07.2021,20.07.2021,-,1,2021-07-20,2021-07-20,,Arnaut Danjuma
Leicester City,1003,06.06.2021,06.06.2021,-,1,2021-06-06,2021-06-06,,Arnaut Danjuma
AFC Bournemouth,989,01.08.2019,01.08.2019,-,1,2019-08-01,2019-08-01,,Arnaut Danjuma
AC Mailand,5,15.01.2019,15.01.2019,-,2,2019-01-15,2019-01-15,,Arnaut Danjuma
Tottenham Hotspur,148,15.01.2019,15.01.2019,-,2,2019-01-15,2019-01-15,,Arnaut Danjuma
FC Everton,29,15.01.2019,15.01.2019,-,2,2019-01-15,2019-01-15,,Arnaut Danjuma
FC Liverpool,31,15.01.2019,15.01.2019,-,2,2019-01-15,2019-01-15,,Arnaut Danjuma
Atalanta Bergamo,800,07.01.2025,07.01.2025,-,1,2025-01-07,2025-01-07,,Arne Engels
Celtic Glasgow,371,29.08.2024,30.08.2024,-,1,2024-08-29,2024-08-30,,Arne Engels
FC Stade Rennes,273,15.08.2024,15.08.2024,-,1,2024-08-15,2024-08-15,,Arne Engels
FC Augsburg,167,02.01.2023,03.01.2023,-,1,2023-01-02,2023-01-03,,Arne Engels
FC Augsburg,167,17.05.2022,17.05.2022,-,1,2022-05-17,2022-05-17,,Arne Maier
Arminia Bielefeld,10,04.07.2021,04.07.2021,-,1,2021-07-04,2021-07-04,,Arne Maier
VfL Wolfsburg,82,04.10.2020,04.10.2020,-,1,2020-10-04,2020-10-04,,Arne Maier
FC Barcelona,131,14.12.2018,01.01.2019,-,1,2018-12-14,2019-01-01,,Arne Maier
FC Arsenal,11,19.09.2018,20.09.2018,-,1,2018-09-19,2018-09-20,,Arne Maier
Manchester United,985,19.09.2018,19.09.2018,-,1,2018-09-19,2018-09-19,,Arne Maier
Atlético Madrid,13,12.06.2024,24.07.2024,-,1,2024-06-12,2024-07-24,,Artem Dovbyk
AC Mailand,5,19.06.2024,19.06.2024,-,1,2024-06-19,2024-06-19,,Artem Dovbyk
FC Arsenal,11,15.06.2024,15.06.2024,-,1,2024-06-15,2024-06-15,,Artem Dovbyk
SSC Neapel,6195,14.06.2024,14.06.2024,-,1,2024-06-14,2024-06-14,,Artem Dovbyk
FC Chelsea,631,,01.01.2024,-,1,,2024-01-01,,Artem Dovbyk
FC Barcelona,131,,26.12.2023,-,1,,2023-12-26,,Artem Dovbyk
Juventus Turin,506,,12.12.2023,-,1,,2023-12-12,,Artem Dovbyk
Inter Mailand,46,,12.12.2023,-,1,,2023-12-12,,Artem Dovbyk
AS Rom,12,,12.12.2023,-,1,,2023-12-12,,Artem Dovbyk
FC Girona,12321,06.08.2023,06.08.2023,-,1,2023-08-06,2023-08-06,,Artem Dovbyk
Lazio Rom,398,25.06.2023,25.06.2023,-,1,2023-06-25,2023-06-25,,Artem Dovbyk
FC Augsburg,167,01.09.2022,01.09.2022,-,1,2022-09-01,2022-09-01,,Artem Dovbyk
Trabzonspor,449,30.08.2022,30.08.2022,-,1,2022-08-30,2022-08-30,,Artem Dovbyk
US Salernitana 1919,380,17.08.2022,17.08.2022,-,1,2022-08-17,2022-08-17,,Artem Dovbyk
Galatasaray,141,14.07.2022,14.07.2022,-,1,2022-07-14,2022-07-14,,Artem Dovbyk
FC Turin,416,09.06.2022,09.06.2022,-,2,2022-06-09,2022-06-09,,Artem Dovbyk
FC Augsburg,167,,16.11.2017,-,2,,2017-11-16,,Artem Dovbyk
Celtic Glasgow,371,13.11.2017,13.11.2017,-,2,2017-11-13,2017-11-13,,Artem Dovbyk
Botafogo Rio de Janeiro,537,07.06.2025,07.06.2025,-,1,2025-06-07,2025-06-07,,Arthur Cabral
FC Turin,416,06.01.2025,06.01.2025,-,1,2025-01-06,2025-01-06,,Arthur Cabral
Atlanta United FC,51663,13.12.2024,13.12.2024,-,1,2024-12-13,2024-12-13,,Arthur Cabral
Benfica Lissabon,294,07.08.2023,07.08.2023,-,1,2023-08-07,2023-08-07,,Arthur Cabral
US Cremonese,2239,04.01.2023,04.01.2023,-,1,2023-01-04,2023-01-04,,Arthur Cabral
AC Florenz,430,27.01.2022,29.01.2022,-,1,2022-01-27,2022-01-29,,Arthur Cabral
VfL Wolfsburg,82,28.01.2022,28.01.2022,-,1,2022-01-28,2022-01-28,,Arthur Cabral
FC Paris Saint-Germain,583,09.01.2022,10.01.2022,-,1,2022-01-09,2022-01-10,,Arthur Cabral
Atalanta Bergamo,800,07.01.2022,07.01.2022,-,1,2022-01-07,2022-01-07,,Arthur Cabral
Zenit St. Petersburg,964,18.12.2021,28.12.2021,-,1,2021-12-18,2021-12-28,,Arthur Cabral
FC Barcelona,131,25.11.2021,05.12.2021,-,1,2021-11-25,2021-12-05,,Arthur Cabral
Newcastle United,762,03.12.2021,03.12.2021,-,1,2021-12-03,2021-12-03,,Arthur Cabral
AC Mailand,5,,18.10.2021,-,1,,2021-10-18,,Arthur Cabral
Royal Antwerpen FC,1096,31.08.2021,31.08.2021,-,1,2021-08-31,2021-08-31,,Arthur Cabral
Hertha BSC,44,27.08.2021,31.08.2021,-,1,2021-08-27,2021-08-31,,Arthur Cabral
Bayer 04 Leverkusen,15,02.08.2021,03.08.2021,-,2,2021-08-02,2021-08-03,,Arthur Cabral
Olympique Marseille,244,22.07.2021,26.07.2021,-,2,2021-07-22,2021-07-26,,Arthur Cabral
FC Bologna,1025,22.07.2021,22.07.2021,-,2,2021-07-22,2021-07-22,,Arthur Cabral
OGC Nizza,417,05.06.2021,21.06.2021,-,2,2021-06-05,2021-06-21,,Arthur Cabral
Leeds United,399,16.08.2020,29.08.2020,-,2,2020-08-16,2020-08-29,,Arthur Cabral
FC Red Bull Salzburg,409,20.07.2020,23.07.2020,-,2,2020-07-20,2020-07-23,,Arthur Cabral
FC Stade Rennes,273,08.05.2020,08.05.2020,-,2,2020-05-08,2020-05-08,,Arthur Cabral
AS Saint-Étienne,618,17.01.2020,17.01.2020,-,2,2020-01-17,2020-01-17,,Arthur Cabral
FC Basel 1893,26,31.08.2019,31.08.2019,-,2,2019-08-31,2019-08-31,,Arthur Cabral
AFC Sunderland,289,08.08.2025,08.08.2025,-,1,2025-08-08,2025-08-08,,Arthur Masuaku
Stade Brest 29,3911,16.06.2025,16.06.2025,-,1,2025-06-16,2025-06-16,,Arthur Masuaku
Galatasaray,141,12.06.2025,12.06.2025,-,1,2025-06-12,2025-06-12,,Arthur Masuaku
Al-Hilal SFC,1114,12.06.2025,12.06.2025,-,1,2025-06-12,2025-06-12,,Arthur Masuaku
Besiktas JK,114,28.05.2025,28.05.2025,-,1,2025-05-28,2025-05-28,,Arthur Masuaku
FC Nantes,995,15.12.2024,15.12.2024,-,1,2024-12-15,2024-12-15,,Arthur Masuaku
Besiktas JK,114,29.07.2022,29.07.2022,-,1,2022-07-29,2022-07-29,,Arthur Masuaku
Fenerbahce,36,05.09.2021,06.09.2021,-,1,2021-09-05,2021-09-06,,Arthur Masuaku
Borussia Dortmund,16,14.05.2019,15.05.2019,-,1,2019-05-14,2019-05-15,,Arthur Masuaku
West Ham United,379,06.08.2016,06.08.2016,-,1,2016-08-06,2016-08-06,,Arthur Masuaku
TSG 1899 Hoffenheim,533,06.07.2016,15.07.2016,-,1,2016-07-06,2016-07-15,,Arthur Masuaku
Olympique Lyon,1041,06.07.2016,06.07.2016,-,1,2016-07-06,2016-07-06,,Arthur Masuaku
AS Monaco,162,04.06.2016,04.06.2016,-,1,2016-06-04,2016-06-04,,Arthur Masuaku
AFC Sunderland,289,30.11.2015,30.11.2015,-,1,2015-11-30,2015-11-30,,Arthur Masuaku
Olympique Marseille,244,09.10.2015,09.10.2015,-,1,2015-10-09,2015-10-09,,Arthur Masuaku
AS Rom,12,27.07.2015,27.07.2015,-,2,2015-07-27,2015-07-27,,Arthur Masuaku
Genua CFC,252,14.07.2015,14.07.2015,-,2,2015-07-14,2015-07-14,,Arthur Masuaku
Juventus Turin,506,05.03.2015,05.03.2015,-,2,2015-03-05,2015-03-05,,Arthur Masuaku
FC Valencia,1049,29.01.2015,29.01.2015,-,2,2015-01-29,2015-01-29,,Arthur Masuaku
AC Mailand,5,29.01.2015,29.01.2015,-,2,2015-01-29,2015-01-29,,Arthur Masuaku
Inter Mailand,46,05.05.2015,02.01.2015,-,2,2015-05-05,2015-01-02,,Arthur Masuaku
FC Girona,12321,30.01.2025,30.01.2025,-,1,2025-01-30,2025-01-30,,Arthur Melo
FC Santos,221,29.01.2025,29.01.2025,-,1,2025-01-29,2025-01-29,,Arthur Melo
Olympique Marseille,244,24.12.2024,24.12.2024,-,1,2024-12-24,2024-12-24,,Arthur Melo
Real Betis Sevilla,150,19.12.2024,19.12.2024,-,1,2024-12-19,2024-12-19,,Arthur Melo
FC Valencia,1049,19.12.2024,19.12.2024,-,1,2024-12-19,2024-12-19,,Arthur Melo
Como 1907,1047,30.11.2024,30.11.2024,-,1,2024-11-30,2024-11-30,,Arthur Melo
FC Bologna,1025,28.11.2024,28.11.2024,-,1,2024-11-28,2024-11-28,,Arthur Melo
SSC Neapel,6195,29.08.2024,29.08.2024,-,1,2024-08-29,2024-08-29,,Arthur Melo
FC Everton,29,14.07.2024,14.07.2024,-,1,2024-07-14,2024-07-14,,Arthur Melo
AC Florenz,430,20.07.2023,20.07.2023,-,1,2023-07-20,2023-07-20,,Arthur Melo
Wolverhampton Wanderers,543,20.07.2023,20.07.2023,-,1,2023-07-20,2023-07-20,,Arthur Melo
Aston Villa,405,19.06.2023,19.06.2023,-,1,2023-06-19,2023-06-19,,Arthur Melo
FC Liverpool,31,01.09.2022,01.09.2022,-,1,2022-09-01,2022-09-01,,Arthur Melo
FC Porto,720,28.08.2022,28.08.2022,-,1,2022-08-28,2022-08-28,,Arthur Melo
Olympique Lyon,1041,28.08.2022,28.08.2022,-,1,2022-08-28,2022-08-28,,Arthur Melo
FC Arsenal,11,22.01.2022,24.01.2022,-,2,2022-01-22,2022-01-24,,Arthur Melo
Juventus Turin,506,25.06.2020,27.06.2020,-,2,2020-06-25,2020-06-27,,Arthur Melo
Tottenham Hotspur,148,23.04.2020,23.04.2020,-,2,2020-04-23,2020-04-23,,Arthur Melo
FC Barcelona,131,11.03.2018,11.03.2018,-,2,2018-03-11,2018-03-11,,Arthur Melo
FC Chelsea,631,07.12.2017,07.12.2017,-,2,2017-12-07,2017-12-07,,Arthur Melo
Al-Nassr FC,18544,21.06.2025,21.06.2025,11 %,1,2025-06-21,2025-06-21,11.0,Arthur Theate
Atlético Madrid,13,17.06.2025,17.06.2025,16 %,1,2025-06-17,2025-06-17,16.0,Arthur Theate
VfB Stuttgart,79,18.08.2024,18.08.2024,-,1,2024-08-18,2024-08-18,,Arthur Theate
Eintracht Frankfurt,24,18.08.2024,18.08.2024,-,1,2024-08-18,2024-08-18,,Arthur Theate
Al-Ittihad Club,8023,03.07.2024,03.07.2024,-,1,2024-07-03,2024-07-03,,Arthur Theate
RB Leipzig,23826,28.05.2024,28.05.2024,-,1,2024-05-28,2024-05-28,,Arthur Theate
SSC Neapel,6195,14.01.2024,14.01.2024,-,1,2024-01-14,2024-01-14,,Arthur Theate
FC Liverpool,31,18.08.2023,24.08.2023,-,1,2023-08-18,2023-08-24,,Arthur Theate
FC Fulham,931,18.08.2023,18.08.2023,-,1,2023-08-18,2023-08-18,,Arthur Theate
FC Stade Rennes,273,25.07.2022,26.07.2022,-,1,2022-07-25,2022-07-26,,Arthur Theate
West Ham United,379,27.05.2022,27.05.2022,-,1,2022-05-27,2022-05-27,,Arthur Theate
FC Bologna,1025,30.07.2021,30.07.2021,-,1,2021-07-30,2021-07-30,,Arthur Theate
1.FC Köln,3,01.07.2021,20.07.2021,-,1,2021-07-01,2021-07-20,,Arthur Theate
Olympique Marseille,244,30.08.2025,30.08.2025,84 %,1,2025-08-30,2025-08-30,84.0,Arthur Vermeeren
RB Leipzig,23826,26.08.2024,26.08.2024,-,1,2024-08-26,2024-08-26,,Arthur Vermeeren
Bayer 04 Leverkusen,15,23.08.2024,23.08.2024,-,1,2024-08-23,2024-08-23,,Arthur Vermeeren
Olympique Marseille,244,20.08.2024,20.08.2024,-,1,2024-08-20,2024-08-20,,Arthur Vermeeren
Atlético Madrid,13,26.01.2024,26.01.2024,-,1,2024-01-26,2024-01-26,,Arthur Vermeeren
Manchester United,985,13.01.2024,13.01.2024,-,1,2024-01-13,2024-01-13,,Arthur Vermeeren
Tottenham Hotspur,148,27.12.2023,27.12.2023,-,1,2023-12-27,2023-12-27,,Arthur Vermeeren
FC Liverpool,31,03.11.2023,03.11.2023,-,1,2023-11-03,2023-11-03,,Arthur Vermeeren
Manchester City,281,13.10.2023,13.10.2023,-,1,2023-10-13,2023-10-13,,Arthur Vermeeren
FC Arsenal,11,12.10.2023,12.10.2023,-,1,2023-10-12,2023-10-12,,Arthur Vermeeren
Borussia Dortmund,16,15.09.2023,16.09.2023,-,1,2023-09-15,2023-09-16,,Arthur Vermeeren
RB Leipzig,23826,15.09.2023,15.09.2023,-,1,2023-09-15,2023-09-15,,Arthur Vermeeren
FC Barcelona,131,15.09.2023,15.09.2023,-,1,2023-09-15,2023-09-15,,Arthur Vermeeren
VfB Stuttgart,79,03.05.2018,03.05.2018,-,1,2018-05-03,2018-05-03,,Artur Ioniță
VfB Stuttgart,79,27.10.2014,27.10.2014,-,1,2014-10-27,2014-10-27,,Artur Ioniță
Flamengo Rio de Janeiro,614,14.07.2022,14.07.2022,-,1,2022-07-14,2022-07-14,,Arturo Vidal
CA Boca Juniors,189,30.06.2022,03.07.2022,-,1,2022-06-30,2022-07-03,,Arturo Vidal
Clube Atlético Mineiro,330,28.12.2021,28.12.2021,-,1,2021-12-28,2021-12-28,,Arturo Vidal
Fenerbahce,36,24.08.2021,24.08.2021,-,1,2021-08-24,2021-08-24,,Arturo Vidal
Galatasaray,141,26.03.2021,29.07.2021,-,1,2021-03-26,2021-07-29,,Arturo Vidal
Olympique Marseille,244,17.03.2021,21.03.2021,-,1,2021-03-17,2021-03-21,,Arturo Vidal
Inter Mailand,46,03.09.2020,08.09.2020,-,1,2020-09-03,2020-09-08,,Arturo Vidal
Inter Miami CF,69261,01.05.2020,01.05.2020,-,1,2020-05-01,2020-05-01,,Arturo Vidal
Newcastle United,762,19.04.2020,19.04.2020,-,1,2020-04-19,2020-04-19,,Arturo Vidal
Manchester United,985,02.12.2019,02.12.2019,-,1,2019-12-02,2019-12-02,,Arturo Vidal
China,5598,18.06.2019,18.06.2019,-,1,2019-06-18,2019-06-18,,Arturo Vidal
CA Boca Juniors,189,03.04.2019,03.04.2019,-,1,2019-04-03,2019-04-03,,Arturo Vidal
Juventus Turin,506,15.11.2018,15.11.2018,-,1,2018-11-15,2018-11-15,,Arturo Vidal
FC Barcelona,131,03.08.2018,03.08.2018,-,1,2018-08-03,2018-08-03,,Arturo Vidal
Inter Mailand,46,02.08.2018,03.08.2018,-,1,2018-08-02,2018-08-03,,Arturo Vidal
AC Mailand,5,23.07.2018,23.07.2018,-,2,2018-07-23,2018-07-23,,Arturo Vidal
Atlético Madrid,13,02.07.2018,04.07.2018,-,2,2018-07-02,2018-07-04,,Arturo Vidal
SSC Neapel,6195,30.06.2018,30.06.2018,-,2,2018-06-30,2018-06-30,,Arturo Vidal
Manchester United,985,25.05.2018,25.05.2018,-,2,2018-05-25,2018-05-25,,Arturo Vidal
Juventus Turin,506,25.05.2018,25.05.2018,-,2,2018-05-25,2018-05-25,,Arturo Vidal
FC Chelsea,631,20.01.2018,22.01.2018,-,2,2018-01-20,2018-01-22,,Arturo Vidal
Manchester City,281,07.10.2016,08.10.2016,-,2,2016-10-07,2016-10-08,,Arturo Vidal
FC Valencia,1049,07.03.2016,09.03.2016,-,2,2016-03-07,2016-03-09,,Arturo Vidal
FC Bayern München,27,28.07.2015,28.07.2015,-,2,2015-07-28,2015-07-28,,Arturo Vidal
Real Madrid,418,15.07.2015,15.07.2015,-,2,2015-07-15,2015-07-15,,Arturo Vidal
FC Arsenal,11,29.06.2015,29.06.2015,-,2,2015-06-29,2015-06-29,,Arturo Vidal
FC Liverpool,31,18.05.2015,18.05.2015,-,2,2015-05-18,2015-05-18,,Arturo Vidal
Manchester United,985,11.08.2014,11.08.2014,-,2,2014-08-11,2014-08-11,,Arturo Vidal
FC Chelsea,631,28.04.2014,28.04.2014,-,2,2014-04-28,2014-04-28,,Arturo Vidal
Juventus Turin,506,21.07.2011,21.07.2011,-,2,2011-07-21,2011-07-21,,Arturo Vidal
SSC Neapel,6195,23.06.2011,29.06.2011,-,3,2011-06-23,2011-06-29,,Arturo Vidal
AC Mailand,5,22.06.2011,22.06.2011,-,3,2011-06-22,2011-06-22,,Arturo Vidal
FC Barcelona,131,22.05.2011,22.05.2011,-,3,2011-05-22,2011-05-22,,Arturo Vidal
Borussia Dortmund,16,10.05.2011,10.05.2011,-,3,2011-05-10,2011-05-10,,Arturo Vidal
Tottenham Hotspur,148,05.05.2011,06.05.2011,-,3,2011-05-05,2011-05-06,,Arturo Vidal
Atlético Madrid,13,07.03.2011,10.03.2011,-,3,2011-03-07,2011-03-10,,Arturo Vidal
FC Valencia,1049,08.02.2011,08.02.2011,-,3,2011-02-08,2011-02-08,,Arturo Vidal
FC Schalke 04,33,18.10.2010,19.10.2010,-,3,2010-10-18,2010-10-19,,Arturo Vidal
RSC Anderlecht,58,05.10.2019,05.10.2019,-,1,2019-10-05,2019-10-05,,Ashley Williams
Huddersfield Town,1110,30.04.2019,30.04.2019,-,1,2019-04-30,2019-04-30,,Ashley Williams
Aston Villa,405,30.04.2019,30.04.2019,-,1,2019-04-30,2019-04-30,,Ashley Williams
D.C. United,2440,30.04.2019,30.04.2019,-,1,2019-04-30,2019-04-30,,Ashley Williams
Stoke City,512,01.08.2018,01.08.2018,-,1,2018-08-01,2018-08-01,,Ashley Williams
FC Everton,29,09.08.2016,09.08.2016,-,1,2016-08-09,2016-08-09,,Ashley Williams
Crystal Palace,873,26.06.2015,26.06.2015,-,1,2015-06-26,2015-06-26,,Ashley Williams
FC Arsenal,11,29.03.2014,31.03.2014,-,1,2014-03-29,2014-03-31,,Ashley Williams
FC Liverpool,31,08.05.2013,08.05.2013,-,1,2013-05-08,2013-05-08,,Ashley Williams
Manchester United,985,26.02.2013,26.02.2013,-,1,2013-02-26,2013-02-26,,Ashley Williams
Newcastle United,762,04.01.2012,04.01.2012,-,1,2012-01-04,2012-01-04,,Ashley Williams
Legia Warschau,255,27.11.2024,27.11.2024,-,1,2024-11-27,2024-11-27,,Asier Villalibre
Al-Fayha FC,50531,21.07.2023,21.07.2023,-,1,2023-07-21,2023-07-21,,Assan Ceesay
US Lecce,1005,15.06.2022,15.06.2022,-,1,2022-06-15,2022-06-15,,Assan Ceesay
AS Monaco,162,13.06.2022,14.06.2022,-,1,2022-06-13,2022-06-14,,Assan Ceesay
Wolverhampton Wanderers,543,13.06.2022,13.06.2022,-,1,2022-06-13,2022-06-13,,Assan Ceesay
Atalanta Bergamo,800,13.06.2022,13.06.2022,-,1,2022-06-13,2022-06-13,,Assan Ceesay
FC Basel 1893,26,12.05.2022,05.06.2022,-,1,2022-05-12,2022-06-05,,Assan Ceesay
Sporting Kansas City,4284,30.01.2022,30.01.2022,-,1,2022-01-30,2022-01-30,,Assan Ceesay
FC Nantes,995,18.11.2021,18.11.2021,-,1,2021-11-18,2021-11-18,,Assan Ceesay
FC Lorient,1158,18.11.2021,18.11.2021,-,1,2021-11-18,2021-11-18,,Assan Ceesay
Angers SCO,1420,18.11.2021,18.11.2021,-,1,2021-11-18,2021-11-18,,Assan Ceesay
FC Zürich,260,27.08.2018,30.08.2018,-,1,2018-08-27,2018-08-30,,Assan Ceesay
AS Rom,12,09.11.2016,09.11.2016,-,1,2016-11-09,2016-11-09,,Assane Dioussé
Inter Mailand,46,23.09.2016,23.09.2016,-,1,2016-09-23,2016-09-23,,Assane Dioussé
SSC Neapel,6195,07.09.2015,07.09.2015,-,1,2015-09-07,2015-09-07,,Assane Dioussé
Real Madrid,418,14.03.2015,14.03.2015,-,1,2015-03-14,2015-03-14,,Augusto Batalla
FC Paris Saint-Germain,583,08.12.2024,10.12.2024,-,1,2024-12-08,2024-12-10,,Aurélien Tchouaméni
FC Liverpool,31,08.11.2024,08.11.2024,-,1,2024-11-08,2024-11-08,,Aurélien Tchouaméni
FC Bayern München,27,03.08.2023,05.08.2023,-,1,2023-08-03,2023-08-05,,Aurélien Tchouaméni
FC Arsenal,11,04.07.2023,04.07.2023,-,1,2023-07-04,2023-07-04,,Aurélien Tchouaméni
Real Madrid,418,01.06.2022,11.06.2022,-,1,2022-06-01,2022-06-11,,Aurélien Tchouaméni
FC Paris Saint-Germain,583,25.05.2022,25.05.2022,-,1,2022-05-25,2022-05-25,,Aurélien Tchouaméni
FC Liverpool,31,23.05.2022,23.05.2022,-,1,2022-05-23,2022-05-23,,Aurélien Tchouaméni
FC Chelsea,631,01.12.2021,01.12.2021,-,1,2021-12-01,2021-12-01,,Aurélien Tchouaméni
Juventus Turin,506,12.11.2021,16.11.2021,-,1,2021-11-12,2021-11-16,,Aurélien Tchouaméni
Manchester United,985,12.11.2021,12.11.2021,-,1,2021-11-12,2021-11-12,,Aurélien Tchouaméni
FC Bayern München,27,22.10.2021,03.11.2021,-,1,2021-10-22,2021-11-03,,Aurélien Tchouaméni
Manchester City,281,14.10.2021,14.10.2021,-,1,2021-10-14,2021-10-14,,Aurélien Tchouaméni
AS Monaco,162,30.01.2020,30.01.2020,-,1,2020-01-30,2020-01-30,,Aurélien Tchouaméni
Borussia Dortmund,16,25.12.2019,03.01.2020,-,1,2019-12-25,2020-01-03,,Aurélien Tchouaméni
FC Bayern München,27,04.01.2019,04.01.2019,-,1,2019-01-04,2019-01-04,,Aurélien Tchouaméni
Borussia Dortmund,16,26.07.2018,27.07.2018,-,2,2018-07-26,2018-07-27,,Aurélien Tchouaméni
Stade Reims,1421,29.08.2024,29.08.2024,-,1,2024-08-29,2024-08-29,,Aurélio Buta
Eintracht Frankfurt,24,03.06.2022,03.06.2022,-,1,2022-06-03,2022-06-03,,Aurélio Buta
Celtic Glasgow,371,06.08.2021,06.08.2021,-,1,2021-08-06,2021-08-06,,Aurélio Buta
FC Watford,1010,01.11.2019,01.11.2019,-,1,2019-11-01,2019-11-01,,Aurélio Buta
Wolverhampton Wanderers,543,01.11.2019,01.11.2019,-,1,2019-11-01,2019-11-01,,Aurélio Buta
Aston Villa,405,03.02.2025,03.02.2025,-,1,2025-02-03,2025-02-03,,Axel Disasi
Tottenham Hotspur,148,01.02.2025,01.02.2025,-,1,2025-02-01,2025-02-01,,Axel Disasi
Bayer 04 Leverkusen,15,21.01.2025,22.01.2025,-,1,2025-01-21,2025-01-22,,Axel Disasi
FC Villarreal,1050,16.01.2025,16.01.2025,-,1,2025-01-16,2025-01-16,,Axel Disasi
Juventus Turin,506,16.01.2025,16.01.2025,-,1,2025-01-16,2025-01-16,,Axel Disasi
West Ham United,379,19.12.2024,19.12.2024,-,1,2024-12-19,2024-12-19,,Axel Disasi
FC Chelsea,631,04.08.2023,04.08.2023,-,1,2023-08-04,2023-08-04,,Axel Disasi
Newcastle United,762,11.07.2023,11.07.2023,-,1,2023-07-11,2023-07-11,,Axel Disasi
Manchester United,985,18.06.2023,19.06.2023,-,1,2023-06-18,2023-06-19,,Axel Disasi
FC Bayern München,27,23.01.2023,23.01.2023,-,1,2023-01-23,2023-01-23,,Axel Disasi
FC Paris Saint-Germain,583,26.08.2022,26.08.2022,-,1,2022-08-26,2022-08-26,,Axel Disasi
AS Monaco,162,04.08.2020,04.08.2020,-,1,2020-08-04,2020-08-04,,Axel Disasi
Wolverhampton Wanderers,543,12.06.2020,12.06.2020,-,1,2020-06-12,2020-06-12,,Axel Disasi
FC Southampton,180,03.05.2020,03.05.2020,-,1,2020-05-03,2020-05-03,,Axel Disasi
FC Arsenal,11,16.04.2020,16.04.2020,-,1,2020-04-16,2020-04-16,,Axel Disasi
Norwich City,1123,16.11.2019,16.11.2019,-,2,2019-11-16,2019-11-16,,Axel Disasi
FC Burnley,1132,26.06.2025,26.06.2025,-,1,2025-06-26,2025-06-26,,Axel Tuanzebe
Trabzonspor,449,16.06.2025,16.06.2025,-,1,2025-06-16,2025-06-16,,Axel Tuanzebe
FC Watford,1010,10.01.2023,10.01.2023,-,1,2023-01-10,2023-01-10,,Axel Tuanzebe
Trabzonspor,449,08.07.2022,08.07.2022,-,1,2022-07-08,2022-07-08,,Axel Tuanzebe
Brighton & Hove Albion,1237,03.06.2022,03.06.2022,-,1,2022-06-03,2022-06-03,,Axel Tuanzebe
SSC Neapel,6195,07.01.2022,07.01.2022,-,1,2022-01-07,2022-01-07,,Axel Tuanzebe
Aston Villa,405,03.08.2021,04.08.2021,-,1,2021-08-03,2021-08-04,,Axel Tuanzebe
Newcastle United,762,27.07.2021,27.07.2021,-,1,2021-07-27,2021-07-27,,Axel Tuanzebe
Aston Villa,405,02.05.2021,02.05.2021,-,1,2021-05-02,2021-05-02,,Axel Tuanzebe
Standard Lüttich,3057,27.05.2025,27.05.2025,-,1,2025-05-27,2025-05-27,,Axel Witsel
Atlético Madrid,13,30.06.2022,06.07.2022,-,1,2022-06-30,2022-07-06,,Axel Witsel
Olympique Marseille,244,16.06.2022,16.06.2022,-,1,2022-06-16,2022-06-16,,Axel Witsel
Galatasaray,141,04.06.2022,04.06.2022,-,1,2022-06-04,2022-06-04,,Axel Witsel
Manchester United,985,16.05.2022,16.05.2022,-,1,2022-05-16,2022-05-16,,Axel Witsel
Tottenham Hotspur,148,15.05.2022,15.05.2022,-,1,2022-05-15,2022-05-15,,Axel Witsel
Los Angeles FC,51828,09.04.2022,09.04.2022,-,1,2022-04-09,2022-04-09,,Axel Witsel
Los Angeles Galaxy,1061,09.04.2022,09.04.2022,-,1,2022-04-09,2022-04-09,,Axel Witsel
Benfica Lissabon,294,04.02.2022,05.02.2022,-,1,2022-02-04,2022-02-05,,Axel Witsel
Standard Lüttich,3057,04.02.2022,04.02.2022,-,1,2022-02-04,2022-02-04,,Axel Witsel
FC Barcelona,131,17.12.2021,17.12.2021,-,1,2021-12-17,2021-12-17,,Axel Witsel
Juventus Turin,506,15.12.2021,15.12.2021,-,1,2021-12-15,2021-12-15,,Axel Witsel
Newcastle United,762,17.11.2021,23.11.2021,-,1,2021-11-17,2021-11-23,,Axel Witsel
Real Madrid,418,19.11.2021,19.11.2021,-,1,2021-11-19,2021-11-19,,Axel Witsel
AS Rom,12,,29.08.2021,-,1,,2021-08-29,,Axel Witsel
Aston Villa,405,,27.08.2021,-,2,,2021-08-27,,Axel Witsel
Borussia Dortmund,16,06.08.2018,06.08.2018,-,2,2018-08-06,2018-08-06,,Axel Witsel
FC Burnley,1132,23.07.2018,23.07.2018,-,2,2018-07-23,2018-07-23,,Axel Witsel
FC Paris Saint-Germain,583,23.07.2018,23.07.2018,-,2,2018-07-23,2018-07-23,,Axel Witsel
FC Bayern München,27,05.07.2017,05.07.2017,-,2,2017-07-05,2017-07-05,,Axel Witsel
Tianjin Tianhai (-2019),33714,02.01.2017,02.01.2017,-,2,2017-01-02,2017-01-02,,Axel Witsel
Shanghai Port,27190,31.12.2016,31.12.2016,-,2,2016-12-31,2016-12-31,,Axel Witsel
Juventus Turin,506,30.12.2016,31.12.2016,-,2,2016-12-30,2016-12-31,,Axel Witsel
FC Liverpool,31,19.08.2016,19.08.2016,-,2,2016-08-19,2016-08-19,,Axel Witsel
FC Chelsea,631,11.08.2016,11.08.2016,-,2,2016-08-11,2016-08-11,,Axel Witsel
Leicester City,1003,15.07.2016,15.07.2016,-,2,2016-07-15,2016-07-15,,Axel Witsel
SSC Neapel,6195,10.07.2016,10.07.2016,-,2,2016-07-10,2016-07-10,,Axel Witsel
FC Everton,29,10.07.2016,10.07.2016,-,2,2016-07-10,2016-07-10,,Axel Witsel
AS Rom,12,16.06.2016,16.06.2016,-,2,2016-06-16,2016-06-16,,Axel Witsel
Stoke City,512,07.06.2016,07.06.2016,-,2,2016-06-07,2016-06-07,,Axel Witsel
FC Bayern München,27,29.03.2016,30.03.2016,-,3,2016-03-29,2016-03-30,,Axel Witsel
Manchester City,281,19.11.2015,19.11.2015,-,3,2015-11-19,2015-11-19,,Axel Witsel
Tottenham Hotspur,148,30.08.2015,30.08.2015,-,3,2015-08-30,2015-08-30,,Axel Witsel
AC Mailand,5,29.08.2015,29.08.2015,-,3,2015-08-29,2015-08-29,,Axel Witsel
FC Paris Saint-Germain,583,24.06.2013,24.06.2013,-,3,2013-06-24,2013-06-24,,Axel Witsel
Zenit St. Petersburg,964,03.09.2012,04.09.2012,-,3,2012-09-03,2012-09-04,,Axel Witsel
Anzhi Makhachkala,2700,02.09.2012,02.09.2012,-,3,2012-09-02,2012-09-02,,Axel Witsel
AS Rom,12,26.07.2012,26.07.2012,-,3,2012-07-26,2012-07-26,,Axel Witsel
Real Madrid,418,16.06.2012,17.06.2012,-,3,2012-06-16,2012-06-17,,Axel Witsel
Manchester United,985,11.03.2012,11.03.2012,-,3,2012-03-11,2012-03-11,,Axel Witsel
Benfica Lissabon,294,08.07.2011,10.07.2011,-,3,2011-07-08,2011-07-10,,Axel Witsel
Blackburn Rovers,164,08.07.2011,08.07.2011,-,3,2011-07-08,2011-07-08,,Axel Witsel
FC Porto,720,29.05.2011,29.05.2011,-,3,2011-05-29,2011-05-29,,Axel Witsel
Borussia Dortmund,16,30.03.2011,31.03.2011,-,3,2011-03-30,2011-03-31,,Axel Witsel
SV Werder Bremen,86,08.10.2010,09.10.2010,-,3,2010-10-08,2010-10-09,,Axel Witsel
Aston Villa,405,09.03.2010,09.03.2010,-,4,2010-03-09,2010-03-09,,Axel Witsel
FC Schalke 04,33,03.02.2025,03.02.2025,-,1,2025-02-03,2025-02-03,,Aymen Barkok
FK Austria Wien,14,19.12.2024,30.12.2024,-,1,2024-12-19,2024-12-30,,Aymen Barkok
VfL Bochum,80,08.07.2024,08.07.2024,-,1,2024-07-08,2024-07-08,,Aymen Barkok
Hertha BSC,44,18.01.2024,18.01.2024,-,1,2024-01-18,2024-01-18,,Aymen Barkok
1.FSV Mainz 05,39,31.01.2022,31.01.2022,-,1,2022-01-31,2022-01-31,,Aymen Barkok
VfL Bochum,80,29.12.2021,29.01.2022,-,1,2021-12-29,2022-01-29,,Aymen Barkok
SpVgg Greuther Fürth,65,29.12.2021,30.12.2021,-,1,2021-12-29,2021-12-30,,Aymen Barkok
FC Sevilla,368,17.12.2020,17.12.2020,-,1,2020-12-17,2020-12-17,,Aymen Barkok
AS Rom,12,17.12.2020,17.12.2020,-,1,2020-12-17,2020-12-17,,Aymen Barkok
Fortuna Düsseldorf,38,09.03.2019,09.03.2019,-,1,2019-03-09,2019-03-09,,Aymen Barkok
Fortuna Düsseldorf,38,20.06.2018,20.06.2018,-,1,2018-06-20,2018-06-20,,Aymen Barkok
FC Turin,416,19.06.2018,19.06.2018,-,1,2018-06-19,2018-06-19,,Aymen Barkok
Besiktas JK,114,05.06.2018,05.06.2018,-,1,2018-06-05,2018-06-05,,Aymen Barkok
FC Arsenal,11,06.07.2017,09.07.2017,-,1,2017-07-06,2017-07-09,,Aymen Barkok
FC Barcelona,131,21.05.2024,21.05.2024,-,1,2024-05-21,2024-05-21,,Ayoze Pérez
FC Villarreal,1050,27.01.2023,27.01.2023,-,1,2023-01-27,2023-01-27,,Ayoze Pérez
Real Betis Sevilla,150,26.01.2023,26.01.2023,-,1,2023-01-26,2023-01-26,,Ayoze Pérez
Leicester City,1003,04.07.2019,04.07.2019,-,1,2019-07-04,2019-07-04,,Ayoze Pérez
Tottenham Hotspur,148,27.05.2019,27.05.2019,-,1,2019-05-27,2019-05-27,,Ayoze Pérez
SSC Neapel,6195,08.05.2019,08.05.2019,-,1,2019-05-08,2019-05-08,,Ayoze Pérez
Inter Mailand,46,01.06.2016,01.06.2016,-,1,2016-06-01,2016-06-01,,Ayoze Pérez
West Ham United,379,01.06.2016,01.06.2016,-,1,2016-06-01,2016-06-01,,Ayoze Pérez
FC Everton,29,01.06.2016,01.06.2016,-,1,2016-06-01,2016-06-01,,Ayoze Pérez
FC Barcelona,131,05.05.2016,05.05.2016,-,1,2016-05-05,2016-05-05,,Ayoze Pérez
Manchester United,985,09.11.2015,09.11.2015,-,1,2015-11-09,2015-11-09,,Ayoze Pérez
FC Valencia,1049,08.04.2014,08.04.2014,-,1,2014-04-08,2014-04-08,,Ayoze Pérez
FC Porto,720,08.04.2014,08.04.2014,-,1,2014-04-08,2014-04-08,,Ayoze Pérez
FC Schalke 04,33,26.11.2013,26.11.2013,-,1,2013-11-26,2013-11-26,,Ayoze Pérez
FC Stade Rennes,273,17.01.2024,17.01.2024,-,1,2024-01-17,2024-01-17,,Azor Matusiwa
RC Lens,826,28.06.2020,28.06.2020,-,1,2020-06-28,2020-06-28,,Azor Matusiwa
FC Augsburg,167,09.04.2020,09.04.2020,-,1,2020-04-09,2020-04-09,,Azor Matusiwa
FC Girona,12321,27.08.2025,27.08.2025,-,1,2025-08-27,2025-08-27,,Azzedine Ounahi
Trabzonspor,449,12.08.2025,12.08.2025,-,1,2025-08-12,2025-08-12,,Azzedine Ounahi
Spartak Moskau,232,28.06.2025,28.06.2025,-,1,2025-06-28,2025-06-28,,Azzedine Ounahi
Brighton & Hove Albion,1237,06.06.2025,09.06.2025,-,1,2025-06-06,2025-06-09,,Azzedine Ounahi
FC Brentford,1148,30.08.2023,30.08.2023,-,1,2023-08-30,2023-08-30,,Azzedine Ounahi
Olympique Marseille,244,28.01.2023,28.01.2023,-,1,2023-01-28,2023-01-28,,Azzedine Ounahi
Leeds United,399,27.01.2023,27.01.2023,-,1,2023-01-27,2023-01-27,,Azzedine Ounahi
FC Paris Saint-Germain,583,10.01.2023,10.01.2023,-,1,2023-01-10,2023-01-10,,Azzedine Ounahi
SSC Neapel,6195,07.01.2023,07.01.2023,-,1,2023-01-07,2023-01-07,,Azzedine Ounahi
UD Almería,3302,02.01.2023,02.01.2023,-,1,2023-01-02,2023-01-02,,Azzedine Ounahi
Leicester City,1003,02.01.2023,02.01.2023,-,1,2023-01-02,2023-01-02,,Azzedine Ounahi
FC Turin,416,18.12.2022,18.12.2022,-,1,2022-12-18,2022-12-18,,Azzedine Ounahi
AC Florenz,430,09.12.2022,18.12.2022,-,1,2022-12-09,2022-12-18,,Azzedine Ounahi
FC Barcelona,131,12.12.2022,12.12.2022,-,1,2022-12-12,2022-12-12,,Azzedine Ounahi
LOSC Lille,1082,09.12.2022,09.12.2022,-,1,2022-12-09,2022-12-09,,Azzedine Ounahi
Al-Ahli SFC,18487,16.08.2023,16.08.2023,-,1,2023-08-16,2023-08-16,,Aïssa Laïdouni
Al-Shabab FC,9840,16.08.2023,16.08.2023,-,1,2023-08-16,2023-08-16,,Aïssa Laïdouni
1.FC Union Berlin,89,26.01.2023,27.01.2023,-,1,2023-01-26,2023-01-27,,Aïssa Laïdouni
Hertha BSC,44,12.01.2023,26.01.2023,-,1,2023-01-12,2023-01-26,,Aïssa Laïdouni
FC Toulouse,415,22.01.2023,22.01.2023,-,1,2023-01-22,2023-01-22,,Aïssa Laïdouni
FC Liverpool,31,,08.12.2022,-,1,,2022-12-08,,Aïssa Laïdouni
Montpellier HSC,969,06.07.2022,06.07.2022,-,1,2022-07-06,2022-07-06,,Aïssa Laïdouni
Besiktas JK,114,06.07.2022,06.07.2022,-,1,2022-07-06,2022-07-06,,Aïssa Laïdouni
Inter Mailand,46,11.03.2021,11.03.2021,-,1,2021-03-11,2021-03-11,,Aïssa Mandi
FC Liverpool,31,03.08.2020,03.08.2020,-,1,2020-08-03,2020-08-03,,Aïssa Mandi
FC Barcelona,131,15.01.2020,15.01.2020,-,1,2020-01-15,2020-01-15,,Aïssa Mandi
FC Stade Rennes,273,11.07.2017,11.07.2017,-,1,2017-07-11,2017-07-11,,Aïssa Mandi
VfL Wolfsburg,82,16.04.2016,09.06.2016,-,1,2016-04-16,2016-06-09,,Aïssa Mandi
FC Middlesbrough,641,28.05.2016,28.05.2016,-,1,2016-05-28,2016-05-28,,Aïssa Mandi
AS Saint-Étienne,618,25.04.2016,25.04.2016,-,1,2016-04-25,2016-04-25,,Aïssa Mandi
AC Florenz,430,28.01.2016,28.01.2016,-,1,2016-01-28,2016-01-28,,Aïssa Mandi
West Bromwich Albion,984,02.10.2018,02.10.2018,-,1,2018-10-02,2018-10-02,,Bakary Sako
Nottingham Forest,703,10.09.2018,10.09.2018,-,1,2018-09-10,2018-09-10,,Bakary Sako
FC Arsenal,11,06.05.2016,07.05.2016,-,1,2016-05-06,2016-05-07,,Bakary Sako
Crystal Palace,873,05.08.2015,05.08.2015,-,1,2015-08-05,2015-08-05,,Bakary Sako
West Bromwich Albion,984,24.01.2015,24.01.2015,-,1,2015-01-24,2015-01-24,,Bakary Sako
Aston Villa,405,29.10.2014,29.10.2014,-,1,2014-10-29,2014-10-29,,Bakary Sako
FC Stade Rennes,273,17.01.2014,17.01.2014,-,1,2014-01-17,2014-01-17,,Bakary Sako
FC Fulham,931,28.08.2013,31.08.2013,-,1,2013-08-28,2013-08-31,,Bakary Sako
Wolverhampton Wanderers,543,29.08.2012,30.08.2012,-,1,2012-08-29,2012-08-30,,Bakary Sako
West Ham United,379,28.08.2012,28.08.2012,-,1,2012-08-28,2012-08-28,,Bakary Sako
Elazigspor,2292,04.07.2012,04.07.2012,-,1,2012-07-04,2012-07-04,,Bakary Sako
VfB Stuttgart,79,04.06.2012,05.06.2012,-,1,2012-06-04,2012-06-05,,Bakary Sako
FC Schalke 04,33,03.06.2012,03.06.2012,-,1,2012-06-03,2012-06-03,,Bakary Sako
LOSC Lille,1082,28.12.2011,28.12.2011,-,1,2011-12-28,2011-12-28,,Bakary Sako
VfL Wolfsburg,82,19.08.2011,20.08.2011,-,1,2011-08-19,2011-08-20,,Bakary Sako
1.FC Köln,3,21.05.2010,21.05.2010,-,2,2010-05-21,2010-05-21,,Bakary Sako
FC Lorient,1158,24.01.2023,24.01.2023,-,1,2023-01-24,2023-01-24,,Bamba Dieng
SC Freiburg,60,01.09.2022,06.09.2022,-,1,2022-09-01,2022-09-06,,Bamba Dieng
Leeds United,399,,01.09.2022,-,1,,2022-09-01,,Bamba Dieng
FC Fulham,931,12.08.2022,12.08.2022,-,1,2022-08-12,2022-08-12,,Bamba Dieng
Newcastle United,762,06.01.2022,06.01.2022,-,1,2022-01-06,2022-01-06,,Bamba Dieng
FC Stade Rennes,273,16.07.2024,16.07.2024,-,1,2024-07-16,2024-07-16,,Bamo Meïté
Olympique Lyon,1041,28.08.2023,28.08.2023,-,1,2023-08-28,2023-08-28,,Bamo Meïté
LOSC Lille,1082,16.07.2015,16.07.2015,-,1,2015-07-16,2015-07-16,,Baptiste Guillaume
Nîmes Olympique,1160,20.06.2020,20.06.2020,-,1,2020-06-20,2020-06-20,,Baptiste Reynet
EA Guingamp,855,25.05.2020,25.05.2020,-,1,2020-05-25,2020-05-25,,Baptiste Reynet
Olympique Lyon,1041,21.11.2023,21.11.2023,-,1,2023-11-21,2023-11-21,,Baptiste Santamaria
FC Stade Rennes,273,17.08.2021,17.08.2021,-,1,2021-08-17,2021-08-17,,Baptiste Santamaria
SC Freiburg,60,17.09.2020,17.09.2020,-,1,2020-09-17,2020-09-17,,Baptiste Santamaria
Leicester City,1003,06.04.2020,06.04.2020,-,1,2020-04-06,2020-04-06,,Baptiste Santamaria
Benevento Calcio,4171,17.08.2018,17.08.2018,-,1,2018-08-17,2018-08-17,,Bartosz Kapustka
Legia Warschau,255,05.06.2018,05.06.2018,-,1,2018-06-05,2018-06-05,,Bartosz Kapustka
SC Freiburg,60,14.07.2017,14.07.2017,-,1,2017-07-14,2017-07-14,,Bartosz Kapustka
AS Rom,12,20.04.2017,20.04.2017,-,1,2017-04-20,2017-04-20,,Bartosz Kapustka
1.FC Köln,3,13.04.2017,13.04.2017,-,1,2017-04-13,2017-04-13,,Bartosz Kapustka
Lazio Rom,398,25.03.2017,25.03.2017,-,1,2017-03-25,2017-03-25,,Bartosz Kapustka
Leicester City,1003,23.07.2016,03.08.2016,-,1,2016-07-23,2016-08-03,,Bartosz Kapustka
1.FC Köln,3,12.07.2016,12.07.2016,-,1,2016-07-12,2016-07-12,,Bartosz Kapustka
Borussia Dortmund,16,20.11.2015,20.11.2015,-,1,2015-11-20,2015-11-20,,Bartosz Kapustka
RC Straßburg Alsace,667,01.09.2025,01.09.2025,-,1,2025-09-01,2025-09-01,,Ben Chilwell
Crystal Palace,873,02.02.2025,02.02.2025,-,1,2025-02-02,2025-02-02,,Ben Chilwell
VfB Stuttgart,79,23.01.2025,26.01.2025,-,1,2025-01-23,2025-01-26,,Ben Chilwell
Borussia Dortmund,16,23.01.2025,24.01.2025,-,1,2025-01-23,2025-01-24,,Ben Chilwell
FC Everton,29,17.01.2025,17.01.2025,-,1,2025-01-17,2025-01-17,,Ben Chilwell
Fenerbahce,36,03.09.2024,03.09.2024,-,1,2024-09-03,2024-09-03,,Ben Chilwell
Real Madrid,418,14.03.2023,14.03.2023,-,1,2023-03-14,2023-03-14,,Ben Chilwell
Manchester City,281,12.03.2023,12.03.2023,-,1,2023-03-12,2023-03-12,,Ben Chilwell
FC Chelsea,631,22.08.2020,22.08.2020,-,1,2020-08-22,2020-08-22,,Ben Chilwell
Manchester City,281,09.06.2020,09.06.2020,-,1,2020-06-09,2020-06-09,,Ben Chilwell
Atlético Madrid,13,30.05.2019,30.05.2019,-,1,2019-05-30,2019-05-30,,Ben Chilwell
Tottenham Hotspur,148,11.09.2018,11.09.2018,-,1,2018-09-11,2018-09-11,,Ben Chilwell
FC Liverpool,31,22.05.2016,22.05.2016,-,1,2016-05-22,2016-05-22,,Ben Chilwell
FC Arsenal,11,04.05.2016,04.05.2016,-,1,2016-05-04,2016-05-04,,Ben Chilwell
FC Arsenal,11,03.02.2016,03.02.2016,-,1,2016-02-03,2016-02-03,,Ben Chilwell
FC Liverpool,31,30.12.2015,30.12.2015,-,2,2015-12-30,2015-12-30,,Ben Chilwell
Huddersfield Town,1110,18.11.2015,18.11.2015,-,2,2015-11-18,2015-11-18,,Ben Chilwell
Manchester United,985,01.11.2015,01.11.2015,-,2,2015-11-01,2015-11-01,,Ben Chilwell
AFC Bournemouth,989,15.08.2025,15.08.2025,-,1,2025-08-15,2025-08-15,,Ben Doak
Crystal Palace,873,03.01.2025,03.01.2025,-,1,2025-01-03,2025-01-03,,Ben Doak
Ipswich Town,677,03.01.2025,03.01.2025,-,1,2025-01-03,2025-01-03,,Ben Doak
FC Liverpool,31,01.04.2022,21.04.2022,-,1,2022-04-01,2022-04-21,,Ben Doak
Tottenham Hotspur,148,09.02.2023,09.02.2023,-,1,2023-02-09,2023-02-09,,Ben Foster
Celtic Glasgow,371,29.07.2021,29.07.2021,-,1,2021-07-29,2021-07-29,,Ben Foster
Manchester City,281,16.05.2021,16.05.2021,-,1,2021-05-16,2021-05-16,,Ben Foster
FC Watford,1010,05.07.2018,05.07.2018,-,1,2018-07-05,2018-07-05,,Ben Foster
Tottenham Hotspur,148,14.04.2014,14.04.2014,-,1,2014-04-14,2014-04-14,,Ben Foster
Aston Villa,405,27.06.2011,27.06.2011,-,1,2011-06-27,2011-06-27,,Ben Foster
Birmingham City,337,19.05.2010,19.05.2010,-,1,2010-05-19,2010-05-19,,Ben Foster
Stoke City,512,18.01.2010,18.01.2010,-,1,2010-01-18,2010-01-18,,Ben Foster
AFC Sunderland,289,22.11.2009,22.11.2009,-,1,2009-11-22,2009-11-22,,Ben Foster
Ipswich Town,677,05.01.2025,05.01.2025,-,1,2025-01-05,2025-01-05,,Ben Godfrey
Nottingham Forest,703,02.01.2025,02.01.2025,-,1,2025-01-02,2025-01-02,,Ben Godfrey
Wolverhampton Wanderers,543,15.12.2024,15.12.2024,-,1,2024-12-15,2024-12-15,,Ben Godfrey
Atalanta Bergamo,800,28.06.2024,28.06.2024,-,1,2024-06-28,2024-06-28,,Ben Godfrey
Borussia Dortmund,16,04.06.2024,05.06.2024,-,1,2024-06-04,2024-06-05,,Ben Godfrey
Tottenham Hotspur,148,06.12.2023,06.12.2023,-,1,2023-12-06,2023-12-06,,Ben Godfrey
Bayer 04 Leverkusen,15,03.10.2020,05.10.2020,-,1,2020-10-03,2020-10-05,,Ben Godfrey
FC Everton,29,03.10.2020,03.10.2020,-,1,2020-10-03,2020-10-03,,Ben Godfrey
Borussia Dortmund,16,05.07.2020,13.07.2020,-,1,2020-07-05,2020-07-13,,Ben Godfrey
RB Leipzig,23826,05.07.2020,05.07.2020,-,1,2020-07-05,2020-07-05,,Ben Godfrey
Tottenham Hotspur,148,12.09.2019,12.09.2019,-,1,2019-09-12,2019-09-12,,Ben Godfrey
Olympique Lyon,1041,26.04.2019,26.04.2019,-,1,2019-04-26,2019-04-26,,Ben Godfrey
Manchester United,985,25.03.2019,25.03.2019,-,1,2019-03-25,2019-03-25,,Ben Godfrey
Norwich City,1123,15.01.2016,15.01.2016,-,1,2016-01-15,2016-01-15,,Ben Godfrey
Cardiff City,603,19.11.2015,19.11.2015,-,1,2015-11-19,2015-11-19,,Ben Godfrey
Hull City,3008,19.11.2015,19.11.2015,-,2,2015-11-19,2015-11-19,,Ben Godfrey
West Bromwich Albion,984,19.11.2015,19.11.2015,-,2,2015-11-19,2015-11-19,,Ben Godfrey
Glasgow Rangers,124,04.06.2024,04.06.2024,-,1,2024-06-04,2024-06-04,,Ben Johnson
Leeds United,399,04.06.2024,04.06.2024,-,1,2024-06-04,2024-06-04,,Ben Johnson
FC Everton,29,03.06.2022,03.06.2022,-,1,2022-06-03,2022-06-03,,Ben Mee
Newcastle United,762,07.12.2021,07.12.2021,-,1,2021-12-07,2021-12-07,,Ben Mee
FC Arsenal,11,27.07.2021,28.07.2021,-,1,2021-07-27,2021-07-28,,Ben White
FC Everton,29,08.07.2021,08.07.2021,-,1,2021-07-08,2021-07-08,,Ben White
AS Rom,12,12.05.2021,23.06.2021,-,1,2021-05-12,2021-06-23,,Ben White
Borussia Dortmund,16,30.04.2021,30.04.2021,-,1,2021-04-30,2021-04-30,,Ben White
Manchester United,985,02.04.2021,02.04.2021,-,1,2021-04-02,2021-04-02,,Ben White
FC Liverpool,31,21.02.2021,21.02.2021,-,1,2021-02-21,2021-02-21,,Ben White
FC Chelsea,631,01.12.2020,01.12.2020,-,1,2020-12-01,2020-12-01,,Ben White
Tottenham Hotspur,148,01.12.2020,01.12.2020,-,1,2020-12-01,2020-12-01,,Ben White
Leeds United,399,01.09.2020,01.09.2020,-,1,2020-09-01,2020-09-01,,Ben White
Manchester City,281,28.04.2020,28.04.2020,-,1,2020-04-28,2020-04-28,,Ben White
Leicester City,1003,13.02.2020,13.02.2020,-,1,2020-02-13,2020-02-13,,Ben White
FC Chelsea,631,06.01.2020,06.01.2020,-,1,2020-01-06,2020-01-06,,Ben White
FC Liverpool,31,06.01.2020,06.01.2020,-,1,2020-01-06,2020-01-06,,Ben White
Tottenham Hotspur,148,06.01.2020,06.01.2020,-,1,2020-01-06,2020-01-06,,Ben White
Manchester United,985,11.11.2019,11.11.2019,-,1,2019-11-11,2019-11-11,,Ben White
Heart of Midlothian FC,43,29.07.2021,29.07.2021,-,1,2021-07-29,2021-07-29,,Beni Baningime
Persepolis FC,6079,27.07.2023,27.07.2023,-,1,2023-07-27,2023-07-27,,Benik Afobe
Trabzonspor,449,16.09.2020,16.09.2020,-,1,2020-09-16,2020-09-16,,Benik Afobe
Stoke City,512,04.06.2018,04.06.2018,-,1,2018-06-04,2018-06-04,,Benik Afobe
West Bromwich Albion,984,01.02.2018,01.02.2018,-,1,2018-02-01,2018-02-01,,Benik Afobe
West Bromwich Albion,984,11.12.2016,11.12.2016,-,1,2016-12-11,2016-12-11,,Benik Afobe
AFC Bournemouth,989,10.01.2016,10.01.2016,-,1,2016-01-10,2016-01-10,,Benik Afobe
Aston Villa,405,06.10.2015,06.10.2015,-,1,2015-10-06,2015-10-06,,Benik Afobe
Norwich City,1123,26.08.2015,26.08.2015,-,1,2015-08-26,2015-08-26,,Benik Afobe
West Ham United,379,16.08.2015,16.08.2015,-,1,2015-08-16,2015-08-16,,Benik Afobe
Wolverhampton Wanderers,543,14.01.2015,14.01.2015,-,1,2015-01-14,2015-01-14,,Benik Afobe
Fortuna Düsseldorf,38,15.08.2024,23.08.2024,-,1,2024-08-15,2024-08-23,,Benito Raman
VfL Bochum,80,19.01.2024,21.01.2024,-,1,2024-01-19,2024-01-21,,Benito Raman
KV Mechelen,354,19.01.2024,19.01.2024,-,1,2024-01-19,2024-01-19,,Benito Raman
Oud-Heverlee Leuven,2727,19.01.2024,19.01.2024,-,1,2024-01-19,2024-01-19,,Benito Raman
RSC Anderlecht,58,15.07.2021,15.07.2021,-,1,2021-07-15,2021-07-15,,Benito Raman
Beerschot VA,41274,13.07.2021,14.07.2021,-,1,2021-07-13,2021-07-14,,Benito Raman
Standard Lüttich,3057,08.05.2021,08.05.2021,-,1,2021-05-08,2021-05-08,,Benito Raman
Royal Antwerpen FC,1096,,08.05.2021,-,1,,2021-05-08,,Benito Raman
KAA Gent,157,,08.05.2021,-,1,,2021-05-08,,Benito Raman
FC Schalke 04,33,05.07.2019,05.07.2019,-,1,2019-07-05,2019-07-05,,Benito Raman
Bayer 04 Leverkusen,15,08.06.2019,10.06.2019,-,1,2019-06-08,2019-06-10,,Benito Raman
Borussia Mönchengladbach,18,09.06.2019,09.06.2019,-,1,2019-06-09,2019-06-09,,Benito Raman
FC Arsenal,11,17.04.2019,17.04.2019,-,1,2019-04-17,2019-04-17,,Benito Raman
FC Everton,29,13.04.2019,14.04.2019,-,1,2019-04-13,2019-04-14,,Benito Raman
Eintracht Frankfurt,24,07.04.2019,09.04.2019,-,1,2019-04-07,2019-04-09,,Benito Raman
Fortuna Düsseldorf,38,31.08.2017,31.08.2017,-,2,2017-08-31,2017-08-31,,Benito Raman
SK Rapid Wien,170,07.06.2016,08.06.2016,-,2,2016-06-07,2016-06-08,,Benito Raman
Paris FC,10004,26.06.2025,26.06.2025,-,1,2025-06-26,2025-06-26,,Benjamin André
FC Liverpool,31,04.08.2017,04.08.2017,-,1,2017-08-04,2017-08-04,,Benjamin André
PAOK Thessaloniki,1091,24.06.2017,30.06.2017,-,1,2017-06-24,2017-06-30,,Benjamin André
Atlético Madrid,13,26.08.2022,26.08.2022,-,1,2022-08-26,2022-08-26,,Benjamin Bourigeaud
SSC Neapel,6195,28.05.2022,28.05.2022,-,1,2022-05-28,2022-05-28,,Benjamin Bourigeaud
AS Rom,12,04.04.2022,04.04.2022,-,1,2022-04-04,2022-04-04,,Benjamin Bourigeaud
SC Freiburg,60,15.07.2021,20.07.2021,-,1,2021-07-15,2021-07-20,,Benjamin Bourigeaud
Hertha BSC,44,03.01.2020,04.01.2020,-,1,2020-01-03,2020-01-04,,Benjamin Bourigeaud
FC Sevilla,368,09.06.2019,09.06.2019,-,1,2019-06-09,2019-06-09,,Benjamin Bourigeaud
Borussia Dortmund,16,26.07.2018,27.07.2018,-,1,2018-07-26,2018-07-27,,Benjamin Bourigeaud
Hamburger SV,41,24.05.2016,24.05.2016,-,1,2016-05-24,2016-05-24,,Benjamin Bourigeaud
AS Rom,12,24.05.2016,24.05.2016,-,1,2016-05-24,2016-05-24,,Benjamin Bourigeaud
FC Sevilla,368,24.05.2016,24.05.2016,-,1,2016-05-24,2016-05-24,,Benjamin Bourigeaud
SV Werder Bremen,86,24.11.2013,25.11.2013,-,1,2013-11-24,2013-11-25,,Benjamin Bourigeaud
SC Freiburg,60,24.11.2013,25.11.2013,-,1,2013-11-24,2013-11-25,,Benjamin Bourigeaud
FC Arsenal,11,03.07.2023,05.07.2023,-,1,2023-07-03,2023-07-05,,Benjamin Henrichs
Juventus Turin,506,27.01.2023,27.01.2023,-,1,2023-01-27,2023-01-27,,Benjamin Henrichs
AS Rom,12,22.12.2021,09.01.2022,-,1,2021-12-22,2022-01-09,,Benjamin Henrichs
RB Leipzig,23826,07.07.2020,07.07.2020,-,1,2020-07-07,2020-07-07,,Benjamin Henrichs
FC Bayern München,27,08.04.2020,09.04.2020,-,1,2020-04-08,2020-04-09,,Benjamin Henrichs
Manchester United,985,08.04.2020,09.04.2020,-,1,2020-04-08,2020-04-09,,Benjamin Henrichs
Inter Mailand,46,08.04.2020,08.04.2020,-,1,2020-04-08,2020-04-08,,Benjamin Henrichs
Benfica Lissabon,294,28.12.2019,30.12.2019,-,1,2019-12-28,2019-12-30,,Benjamin Henrichs
SV Werder Bremen,86,16.08.2019,16.08.2019,-,1,2019-08-16,2019-08-16,,Benjamin Henrichs
FC Schalke 04,33,18.07.2019,18.07.2019,-,1,2019-07-18,2019-07-18,,Benjamin Henrichs
AS Monaco,162,28.08.2018,28.08.2018,-,1,2018-08-28,2018-08-28,,Benjamin Henrichs
SSC Neapel,6195,30.07.2018,30.07.2018,-,1,2018-07-30,2018-07-30,,Benjamin Henrichs
Inter Mailand,46,18.07.2018,18.07.2018,-,1,2018-07-18,2018-07-18,,Benjamin Henrichs
Borussia Mönchengladbach,18,05.06.2018,05.06.2018,-,1,2018-06-05,2018-06-05,,Benjamin Henrichs
FC Chelsea,631,02.05.2018,02.05.2018,-,1,2018-05-02,2018-05-02,,Benjamin Henrichs
Manchester City,281,02.05.2018,02.05.2018,-,2,2018-05-02,2018-05-02,,Benjamin Henrichs
Manchester United,985,02.05.2018,02.05.2018,-,2,2018-05-02,2018-05-02,,Benjamin Henrichs
Tottenham Hotspur,148,01.08.2017,02.08.2017,-,2,2017-08-01,2017-08-02,,Benjamin Henrichs
FC Barcelona,131,02.05.2017,17.05.2017,-,2,2017-05-02,2017-05-17,,Benjamin Henrichs
FC Bayern München,27,05.04.2017,05.04.2017,-,2,2017-04-05,2017-04-05,,Benjamin Henrichs
FC Fulham,931,22.07.2025,22.07.2025,-,1,2025-07-22,2025-07-22,,Benjamin Lecomte
Montpellier HSC,969,18.01.2023,18.01.2023,-,1,2023-01-18,2023-01-18,,Benjamin Lecomte
Espanyol Barcelona,714,13.07.2022,13.07.2022,-,1,2022-07-13,2022-07-13,,Benjamin Lecomte
Olympique Marseille,244,17.12.2018,17.12.2018,-,1,2018-12-17,2018-12-17,,Benjamin Lecomte
Olympique Marseille,244,01.09.2025,01.09.2025,-,1,2025-09-01,2025-09-01,,Benjamin Pavard
Inter Mailand,46,30.08.2023,30.08.2023,-,1,2023-08-30,2023-08-30,,Benjamin Pavard
Manchester United,985,16.08.2023,16.08.2023,-,1,2023-08-16,2023-08-16,,Benjamin Pavard
Manchester City,281,14.07.2023,14.07.2023,-,1,2023-07-14,2023-07-14,,Benjamin Pavard
FC Liverpool,31,10.06.2023,06.06.2023,-,1,2023-06-10,2023-06-06,,Benjamin Pavard
Real Madrid,418,06.06.2023,06.06.2023,-,1,2023-06-06,2023-06-06,,Benjamin Pavard
FC Barcelona,131,30.05.2023,30.05.2023,-,1,2023-05-30,2023-05-30,,Benjamin Pavard
AC Mailand,5,25.04.2023,25.04.2023,-,1,2023-04-25,2023-04-25,,Benjamin Pavard
FC Chelsea,631,14.03.2023,14.03.2023,-,1,2023-03-14,2023-03-14,,Benjamin Pavard
Juventus Turin,506,05.07.2022,07.08.2022,-,1,2022-07-05,2022-08-07,,Benjamin Pavard
Atlético Madrid,13,05.07.2022,07.08.2022,-,1,2022-07-05,2022-08-07,,Benjamin Pavard
FC Paris Saint-Germain,583,22.08.2020,22.09.2020,-,1,2020-08-22,2020-09-22,,Benjamin Pavard
FC Bayern München,27,28.01.2019,01.02.2019,-,1,2019-01-28,2019-02-01,,Benjamin Pavard
SSC Neapel,6195,20.12.2018,22.12.2018,-,1,2018-12-20,2018-12-22,,Benjamin Pavard
FC Liverpool,31,25.08.2018,20.09.2018,-,1,2018-08-25,2018-09-20,,Benjamin Pavard
FC Barcelona,131,10.09.2018,10.09.2018,-,2,2018-09-10,2018-09-10,,Benjamin Pavard
Tottenham Hotspur,148,07.08.2018,08.08.2018,-,2,2018-08-07,2018-08-08,,Benjamin Pavard
FC Paris Saint-Germain,583,28.07.2018,04.08.2018,-,2,2018-07-28,2018-08-04,,Benjamin Pavard
Borussia Dortmund,16,20.07.2018,21.07.2018,-,2,2018-07-20,2018-07-21,,Benjamin Pavard
Real Madrid,418,16.07.2018,16.07.2018,-,2,2018-07-16,2018-07-16,,Benjamin Pavard
Juventus Turin,506,16.07.2018,16.07.2018,-,2,2018-07-16,2018-07-16,,Benjamin Pavard
Manchester United,985,14.07.2018,15.07.2018,-,2,2018-07-14,2018-07-15,,Benjamin Pavard
Manchester City,281,14.07.2018,14.07.2018,-,2,2018-07-14,2018-07-14,,Benjamin Pavard
Atlético Madrid,13,04.07.2018,04.07.2018,-,2,2018-07-04,2018-07-04,,Benjamin Pavard
AS Rom,12,04.07.2018,04.07.2018,-,2,2018-07-04,2018-07-04,,Benjamin Pavard
FC Arsenal,11,04.07.2018,04.07.2018,-,2,2018-07-04,2018-07-04,,Benjamin Pavard
RB Leipzig,23826,03.07.2018,03.07.2018,-,2,2018-07-03,2018-07-03,,Benjamin Pavard
OGC Nizza,417,21.06.2017,22.06.2017,-,2,2017-06-21,2017-06-22,,Benjamin Pavard
1.FC Köln,3,15.05.2017,25.05.2017,-,2,2017-05-15,2017-05-25,,Benjamin Pavard
TSG 1899 Hoffenheim,533,15.05.2017,15.05.2017,-,2,2017-05-15,2017-05-15,,Benjamin Pavard
FC Metz,347,15.05.2017,15.05.2017,-,3,2017-05-15,2017-05-15,,Benjamin Pavard
VfB Stuttgart,79,30.08.2016,30.08.2016,-,3,2016-08-30,2016-08-30,,Benjamin Pavard
West Ham United,379,17.11.2015,17.11.2015,-,3,2015-11-17,2015-11-17,,Benjamin Pavard
FC Arsenal,11,04.12.2020,04.12.2020,-,1,2020-12-04,2020-12-04,,Berkay Özcan
Basaksehir FK,6890,03.07.2020,03.07.2020,-,1,2020-07-03,2020-07-03,,Berkay Özcan
Basaksehir FK,6890,02.09.2019,02.09.2019,-,1,2019-09-02,2019-09-02,,Berkay Özcan
Besiktas JK,114,30.08.2019,30.08.2019,-,1,2019-08-30,2019-08-30,,Berkay Özcan
Trabzonspor,449,18.07.2019,18.07.2019,-,1,2019-07-18,2019-07-18,,Berkay Özcan
Fenerbahce,36,16.07.2019,16.07.2019,-,1,2019-07-16,2019-07-16,,Berkay Özcan
Hamburger SV,41,24.01.2019,24.01.2019,-,1,2019-01-24,2019-01-24,,Berkay Özcan
Besiktas JK,114,13.11.2018,21.11.2018,-,1,2018-11-13,2018-11-21,,Berkay Özcan
Fenerbahce,36,13.11.2018,13.11.2018,-,1,2018-11-13,2018-11-13,,Berkay Özcan
1.FC Nürnberg,4,30.08.2018,30.08.2018,-,1,2018-08-30,2018-08-30,,Berkay Özcan
FC Arsenal,11,28.10.2017,28.10.2017,-,1,2017-10-28,2017-10-28,,Berkay Özcan
Galatasaray,141,09.06.2015,09.06.2015,-,1,2015-06-09,2015-06-09,,Berkay Özcan
FC Paris Saint-Germain,583,04.07.2023,09.07.2023,-,1,2023-07-04,2023-07-09,,Bernard
FC Barcelona,131,28.04.2022,28.04.2022,-,1,2022-04-28,2022-04-28,,Bernard
Real Madrid,418,17.03.2022,05.04.2022,-,1,2022-03-17,2022-04-05,,Bernard
Atlético Madrid,13,08.04.2021,16.04.2021,-,1,2021-04-08,2021-04-16,,Bernard
Newcastle United,762,17.06.2020,17.06.2020,-,1,2020-06-17,2020-06-17,,Bernard
Inter Mailand,46,17.06.2020,17.06.2020,-,1,2020-06-17,2020-06-17,,Bernard
Manchester City,281,17.06.2020,17.06.2020,-,1,2020-06-17,2020-06-17,,Bernard
FC Bayern München,27,27.03.2019,27.03.2019,-,1,2019-03-27,2019-03-27,,Bernard
Manchester United,985,05.09.2018,05.09.2018,-,1,2018-09-05,2018-09-05,,Bernard
Olympique Lyon,1041,28.03.2017,28.03.2017,-,1,2017-03-28,2017-03-28,,Bernard
FC Barcelona,131,05.10.2016,05.10.2016,-,1,2016-10-05,2016-10-05,,Bernard
Manchester City,281,12.07.2016,12.07.2016,-,1,2016-07-12,2016-07-12,,Bernard
FC Arsenal,11,05.05.2016,05.05.2016,-,1,2016-05-05,2016-05-05,,Bernard
Bayer 04 Leverkusen,15,30.06.2015,30.06.2015,-,1,2015-06-30,2015-06-30,,Bernard
Shakhtar Donetsk,660,14.02.2023,14.02.2023,-,1,2023-02-14,2023-02-14,,Bernard Tekpetey
GNK Dinamo Zagreb,419,14.02.2023,14.02.2023,-,1,2023-02-14,2023-02-14,,Bernard Tekpetey
Ludogorets Razgrad,31614,30.07.2020,30.07.2020,-,1,2020-07-30,2020-07-30,,Bernard Tekpetey
1.FC Nürnberg,4,04.03.2020,05.03.2020,-,1,2020-03-04,2020-03-05,,Bernard Tekpetey
Fortuna Düsseldorf,38,05.07.2019,05.07.2019,-,1,2019-07-05,2019-07-05,,Bernard Tekpetey
FC Schalke 04,33,25.05.2019,25.05.2019,-,1,2019-05-25,2019-05-25,,Bernard Tekpetey
SC Paderborn 07,127,25.07.2018,25.07.2018,-,1,2018-07-25,2018-07-25,,Bernard Tekpetey
SCR Altach,3551,17.08.2017,18.08.2017,-,1,2017-08-17,2017-08-18,,Bernard Tekpetey
VfL Bochum,80,12.08.2017,12.08.2017,-,1,2017-08-12,2017-08-12,,Bernard Tekpetey
Al-Hilal SFC,1114,18.06.2025,18.06.2025,47 %,1,2025-06-18,2025-06-18,47.0,Bernardo
FC Barcelona,131,07.08.2023,08.08.2023,-,1,2023-08-07,2023-08-08,,Bernardo
FC Paris Saint-Germain,583,06.08.2023,06.08.2023,-,1,2023-08-06,2023-08-06,,Bernardo
Real Madrid,418,21.03.2023,21.03.2023,-,1,2023-03-21,2023-03-21,,Bernardo
Juventus Turin,506,13.10.2021,13.10.2021,-,1,2021-10-13,2021-10-13,,Bernardo
FC Arsenal,11,02.10.2021,02.10.2021,-,1,2021-10-02,2021-10-02,,Bernardo
AC Mailand,5,22.08.2021,23.08.2021,-,1,2021-08-22,2021-08-23,,Bernardo
Tottenham Hotspur,148,30.07.2021,01.08.2021,-,1,2021-07-30,2021-08-01,,Bernardo
Atlético Madrid,13,03.06.2021,04.06.2021,-,1,2021-06-03,2021-06-04,,Bernardo
Manchester City,281,26.05.2017,26.05.2017,-,1,2017-05-26,2017-05-26,,Bernardo
Real Madrid,418,26.05.2017,26.05.2017,-,1,2017-05-26,2017-05-26,,Bernardo
FC Bayern München,27,02.05.2017,02.05.2017,-,1,2017-05-02,2017-05-02,,Bernardo
FC Chelsea,631,19.03.2017,19.03.2017,-,1,2017-03-19,2017-03-19,,Bernardo
Atlético Madrid,13,22.08.2016,22.08.2016,-,1,2016-08-22,2016-08-22,,Bernardo
Juventus Turin,506,04.05.2016,04.05.2016,-,1,2016-05-04,2016-05-04,,Bernardo
Manchester United,985,28.03.2016,28.03.2016,-,2,2016-03-28,2016-03-28,,Bernardo
FC Middlesbrough,641,29.05.2016,29.05.2016,-,1,2016-05-29,2016-05-29,,Bernardo Espinosa
Bayer 04 Leverkusen,15,04.04.2022,02.08.2022,-,1,2022-04-04,2022-08-02,,Bernd Leno
FC Fulham,931,31.07.2022,01.08.2022,-,1,2022-07-31,2022-08-01,,Bernd Leno
Leicester City,1003,27.07.2022,27.07.2022,-,1,2022-07-27,2022-07-27,,Bernd Leno
Hertha BSC,44,,07.06.2022,-,1,,2022-06-07,,Bernd Leno
Benfica Lissabon,294,23.05.2022,24.05.2022,-,1,2022-05-23,2022-05-24,,Bernd Leno
Newcastle United,762,20.01.2022,20.01.2022,-,1,2022-01-20,2022-01-20,,Bernd Leno
Inter Mailand,46,30.09.2021,30.09.2021,-,1,2021-09-30,2021-09-30,,Bernd Leno
FC Bayern München,27,10.11.2019,12.11.2019,-,1,2019-11-10,2019-11-12,,Bernd Leno
FC Arsenal,11,19.06.2018,19.06.2018,-,1,2018-06-19,2018-06-19,,Bernd Leno
SSC Neapel,6195,13.06.2018,13.06.2018,-,1,2018-06-13,2018-06-13,,Bernd Leno
FC Liverpool,31,07.06.2018,10.06.2018,-,1,2018-06-07,2018-06-10,,Bernd Leno
AS Rom,12,01.06.2018,01.06.2018,-,1,2018-06-01,2018-06-01,,Bernd Leno
Wolverhampton Wanderers,543,20.05.2018,01.06.2018,-,1,2018-05-20,2018-06-01,,Bernd Leno
Atlético Madrid,13,27.04.2018,27.04.2018,-,1,2018-04-27,2018-04-27,,Bernd Leno
FC Bayern München,27,11.12.2017,11.12.2017,-,1,2017-12-11,2017-12-11,,Bernd Leno
FC Barcelona,131,05.10.2017,05.10.2017,-,2,2017-10-05,2017-10-05,,Bernd Leno
AC Mailand,5,19.06.2017,20.06.2017,-,2,2017-06-19,2017-06-20,,Bernd Leno
Real Madrid,418,30.03.2017,30.03.2017,-,2,2017-03-30,2017-03-30,,Bernd Leno
RB Leipzig,23826,28.02.2017,02.03.2017,-,2,2017-02-28,2017-03-02,,Bernd Leno
Tottenham Hotspur,148,28.04.2016,28.04.2016,-,2,2016-04-28,2016-04-28,,Bernd Leno
Inter Mailand,46,30.09.2015,30.09.2015,-,2,2015-09-30,2015-09-30,,Bernd Leno
Zenit St. Petersburg,964,30.10.2012,30.10.2012,-,2,2012-10-30,2012-10-30,,Bernd Leno
Bayer 04 Leverkusen,15,30.11.2011,30.11.2011,-,2,2011-11-30,2011-11-30,,Bernd Leno
Basaksehir FK,6890,20.08.2022,20.08.2022,-,1,2022-08-20,2022-08-20,,Bertrand Traoré
Fenerbahce,36,16.06.2022,23.06.2022,-,1,2022-06-16,2022-06-23,,Bertrand Traoré
Aston Villa,405,16.09.2020,16.09.2020,-,1,2020-09-16,2020-09-16,,Bertrand Traoré
FC Fulham,931,01.09.2020,01.09.2020,-,1,2020-09-01,2020-09-01,,Bertrand Traoré
Real Betis Sevilla,150,14.05.2020,14.05.2020,-,1,2020-05-14,2020-05-14,,Bertrand Traoré
Newcastle United,762,14.05.2020,14.05.2020,-,1,2020-05-14,2020-05-14,,Bertrand Traoré
Bayer 04 Leverkusen,15,14.05.2020,14.05.2020,-,1,2020-05-14,2020-05-14,,Bertrand Traoré
AFC Bournemouth,989,21.01.2020,22.01.2020,-,1,2020-01-21,2020-01-22,,Bertrand Traoré
Eintracht Frankfurt,24,06.06.2019,06.06.2019,-,1,2019-06-06,2019-06-06,,Bertrand Traoré
FC Everton,29,01.06.2019,01.06.2019,-,1,2019-06-01,2019-06-01,,Bertrand Traoré
Leicester City,1003,27.05.2019,27.05.2019,-,1,2019-05-27,2019-05-27,,Bertrand Traoré
FC Arsenal,11,27.05.2019,27.05.2019,-,1,2019-05-27,2019-05-27,,Bertrand Traoré
Borussia Mönchengladbach,18,26.06.2017,27.06.2017,-,1,2017-06-26,2017-06-27,,Bertrand Traoré
Olympique Lyon,1041,17.06.2017,17.06.2017,-,1,2017-06-17,2017-06-17,,Bertrand Traoré
LOSC Lille,1082,07.06.2017,07.06.2017,-,1,2017-06-07,2017-06-07,,Bertrand Traoré
West Ham United,379,07.06.2017,07.06.2017,-,2,2017-06-07,2017-06-07,,Bertrand Traoré
FC Everton,29,07.06.2017,07.06.2017,-,2,2017-06-07,2017-06-07,,Bertrand Traoré
TSG 1899 Hoffenheim,533,30.05.2017,30.05.2017,-,2,2017-05-30,2017-05-30,,Bertrand Traoré
FC Schalke 04,33,29.05.2017,30.05.2017,-,2,2017-05-29,2017-05-30,,Bertrand Traoré
RB Leipzig,23826,18.05.2017,18.05.2017,-,2,2017-05-18,2017-05-18,,Bertrand Traoré
Borussia Dortmund,16,04.05.2017,04.05.2017,-,2,2017-05-04,2017-05-04,,Bertrand Traoré
Ajax Amsterdam,610,12.08.2016,12.08.2016,-,2,2016-08-12,2016-08-12,,Bertrand Traoré
Hamburger SV,41,27.05.2016,28.05.2016,-,2,2016-05-27,2016-05-28,,Bertrand Traoré
FC Paris Saint-Germain,583,26.05.2016,26.05.2016,-,2,2016-05-26,2016-05-26,,Bertrand Traoré
AS Monaco,162,26.05.2016,26.05.2016,-,2,2016-05-26,2016-05-26,,Bertrand Traoré
AC Mailand,5,26.05.2016,26.05.2016,-,2,2016-05-26,2016-05-26,,Bertrand Traoré
Borussia Dortmund,16,27.01.2016,27.01.2016,-,2,2016-01-27,2016-01-27,,Bertrand Traoré
Olympique Marseille,244,26.01.2016,26.01.2016,-,2,2016-01-26,2016-01-26,,Bertrand Traoré
FC Everton,29,17.01.2016,17.01.2016,-,2,2016-01-17,2016-01-17,,Bertrand Traoré
Borussia Dortmund,16,13.05.2015,24.06.2015,-,2,2015-05-13,2015-06-24,,Bertrand Traoré
SK Sturm Graz,122,14.08.2025,16.08.2025,40 %,1,2025-08-14,2025-08-16,40.0,Bertuğ Yıldırım
Norwich City,1123,15.08.2024,15.08.2024,-,1,2024-08-15,2024-08-15,,Bertuğ Yıldırım
FC Getafe,3709,04.08.2024,04.08.2024,-,1,2024-08-04,2024-08-04,,Bertuğ Yıldırım
Fenerbahce,36,09.07.2024,12.07.2024,-,1,2024-07-09,2024-07-12,,Bertuğ Yıldırım
Antalyaspor,589,18.02.2023,18.02.2023,-,1,2023-02-18,2023-02-18,,Bertuğ Yıldırım
Fenerbahce,36,16.02.2023,16.02.2023,-,1,2023-02-16,2023-02-16,,Bertuğ Yıldırım
SSC Neapel,6195,30.08.2024,30.08.2024,-,1,2024-08-30,2024-08-30,,Billy Gilmour
FC Villarreal,1050,01.12.2022,01.12.2022,-,1,2022-12-01,2022-12-01,,Billy Gilmour
Brighton & Hove Albion,1237,02.09.2022,02.09.2022,-,1,2022-09-02,2022-09-02,,Billy Gilmour
FC Everton,29,24.02.2022,24.02.2022,-,1,2022-02-24,2022-02-24,,Billy Gilmour
Norwich City,1123,23.06.2021,05.07.2021,-,1,2021-06-23,2021-07-05,,Billy Gilmour
Wolverhampton Wanderers,543,23.06.2021,23.06.2021,-,1,2021-06-23,2021-06-23,,Billy Gilmour
Glasgow Rangers,124,09.12.2020,11.12.2020,-,1,2020-12-09,2020-12-11,,Billy Gilmour
SSC Neapel,6195,05.12.2020,05.12.2020,-,1,2020-12-05,2020-12-05,,Billy Gilmour
FC Bayern München,27,06.11.2016,06.11.2016,-,1,2016-11-06,2016-11-06,,Billy Gilmour
USL Dunkerque,9202,27.05.2020,27.05.2020,-,1,2020-05-27,2020-05-27,,Billy Ketkeophomphone
Neuchâtel Xamax FCS,625,31.03.2011,02.04.2011,-,1,2011-03-31,2011-04-02,,Billy Ketkeophomphone
FC Stade Rennes,273,20.07.2021,20.07.2021,-,1,2021-07-20,2021-07-20,,Birger Meling
Besiktas JK,114,18.07.2021,18.07.2021,-,1,2021-07-18,2021-07-18,,Birger Meling
Nîmes Olympique,1160,08.07.2020,08.07.2020,-,1,2020-07-08,2020-07-08,,Birger Meling
Celtic Glasgow,371,26.08.2019,26.08.2019,-,1,2019-08-26,2019-08-26,,Birger Meling
Royal Antwerpen FC,1096,20.06.2020,20.06.2020,-,1,2020-06-20,2020-06-20,,Birger Verstraete
1.FC Köln,3,17.06.2019,17.06.2019,-,1,2019-06-17,2019-06-17,,Birger Verstraete
FC Watford,1010,12.06.2019,12.06.2019,-,1,2019-06-12,2019-06-12,,Birger Verstraete
Royal Antwerpen FC,1096,19.06.2021,19.06.2021,-,1,2021-06-19,2021-06-19,,Björn Engels
Aston Villa,405,16.07.2019,16.07.2019,-,1,2019-07-16,2019-07-16,,Björn Engels
Olympiakos Piräus,683,31.08.2017,31.08.2017,-,1,2017-08-31,2017-08-31,,Björn Engels
Stoke City,512,24.08.2017,24.08.2017,-,1,2017-08-24,2017-08-24,,Björn Engels
Borussia Dortmund,16,04.08.2016,04.08.2016,-,1,2016-08-04,2016-08-04,,Björn Engels
FC Everton,29,06.05.2016,06.05.2016,-,1,2016-05-06,2016-05-06,,Björn Engels
Genua CFC,252,06.04.2014,06.04.2014,-,1,2014-04-06,2014-04-06,,Björn Engels
ESTAC Troyes,1095,08.07.2021,08.07.2021,-,1,2021-07-08,2021-07-08,,Blaise Matuidi
Inter Miami CF,69261,10.08.2020,10.08.2020,-,1,2020-08-10,2020-08-10,,Blaise Matuidi
Olympique Lyon,1041,23.06.2020,23.06.2020,-,1,2020-06-23,2020-06-23,,Blaise Matuidi
FC Bayern München,27,15.08.2019,16.08.2019,-,1,2019-08-15,2019-08-16,,Blaise Matuidi
Juventus Turin,506,16.08.2017,16.08.2017,-,1,2017-08-16,2017-08-16,,Blaise Matuidi
Real Madrid,418,20.08.2016,20.08.2016,-,1,2016-08-20,2016-08-20,,Blaise Matuidi
Manchester United,985,10.07.2016,10.07.2016,-,1,2016-07-10,2016-07-10,,Blaise Matuidi
FC Bayern München,27,06.07.2016,06.07.2016,-,1,2016-07-06,2016-07-06,,Blaise Matuidi
AC Mailand,5,24.06.2015,05.07.2015,-,1,2015-06-24,2015-07-05,,Blaise Matuidi
Manchester City,281,20.02.2014,20.02.2014,-,1,2014-02-20,2014-02-20,,Blaise Matuidi
FC Chelsea,631,17.11.2013,17.11.2013,-,1,2013-11-17,2013-11-17,,Blaise Matuidi
SSC Neapel,6195,08.03.2012,08.03.2012,-,1,2012-03-08,2012-03-08,,Blaise Matuidi
FC Paris Saint-Germain,583,24.07.2011,24.07.2011,-,1,2011-07-24,2011-07-24,,Blaise Matuidi
Olympique Lyon,1041,16.06.2011,17.06.2011,-,1,2011-06-16,2011-06-17,,Blaise Matuidi
Genua CFC,252,13.04.2011,13.04.2011,-,1,2011-04-13,2011-04-13,,Blaise Matuidi
FC Liverpool,31,20.03.2011,20.03.2011,-,2,2011-03-20,2011-03-20,,Blaise Matuidi
Newcastle United,762,10.03.2011,10.03.2011,-,2,2011-03-10,2011-03-10,,Blaise Matuidi
FC Schalke 04,33,17.02.2011,17.02.2011,-,2,2011-02-17,2011-02-17,,Blaise Matuidi
Fenerbahce,36,12.01.2011,19.01.2011,-,2,2011-01-12,2011-01-19,,Blaise Matuidi
Palermo FC,458,17.08.2010,17.08.2010,-,2,2010-08-17,2010-08-17,,Blaise Matuidi
FC Girondins Bordeaux,40,10.07.2010,10.07.2010,-,2,2010-07-10,2010-07-10,,Blaise Matuidi
FC Sevilla,368,17.04.2010,17.04.2010,-,2,2010-04-17,2010-04-17,,Blaise Matuidi
FC Arsenal,11,12.10.2009,12.10.2009,-,2,2009-10-12,2009-10-12,,Blaise Matuidi
Derby County,22,05.08.2025,05.08.2025,-,1,2025-08-05,2025-08-05,,Bobby Clark
KAA Gent,157,08.07.2025,08.07.2025,-,1,2025-07-08,2025-07-08,,Bobby Clark
FC Southampton,180,01.07.2025,02.07.2025,-,1,2025-07-01,2025-07-02,,Bobby Clark
Glasgow Rangers,124,29.01.2025,30.01.2025,-,1,2025-01-29,2025-01-30,,Bobby Clark
Swansea City,2288,29.01.2025,29.01.2025,-,1,2025-01-29,2025-01-29,,Bobby Clark
Hull City,3008,29.01.2025,29.01.2025,-,1,2025-01-29,2025-01-29,,Bobby Clark
FC Red Bull Salzburg,409,18.08.2024,22.08.2024,-,1,2024-08-18,2024-08-22,,Bobby Clark
RB Leipzig,23826,23.06.2024,23.06.2024,-,1,2024-06-23,2024-06-23,,Bobby Clark
Leicester City,1003,06.07.2024,06.07.2024,-,1,2024-07-06,2024-07-06,,Bobby De Cordova-Reid
Cardiff City,603,28.06.2018,28.06.2018,-,1,2018-06-28,2018-06-28,,Bobby De Cordova-Reid
FC Burnley,1132,07.11.2017,07.11.2017,-,1,2017-11-07,2017-11-07,,Bobby De Cordova-Reid
Brighton & Hove Albion,1237,07.11.2017,07.11.2017,-,1,2017-11-07,2017-11-07,,Bobby De Cordova-Reid
FC Middlesbrough,641,07.11.2017,07.11.2017,-,1,2017-11-07,2017-11-07,,Bobby De Cordova-Reid
Leicester City,1003,07.11.2017,07.11.2017,-,1,2017-11-07,2017-11-07,,Bobby De Cordova-Reid
Real Salt Lake City,6643,20.01.2021,24.01.2021,-,1,2021-01-20,2021-01-24,,Bobby Wood
Karlsruher SC,48,30.09.2020,21.01.2021,-,1,2020-09-30,2021-01-21,,Bobby Wood
D.C. United,2440,12.03.2020,12.03.2020,-,1,2020-03-12,2020-03-12,,Bobby Wood
FC Cincinnati,51772,02.02.2020,02.02.2020,-,1,2020-02-02,2020-02-02,,Bobby Wood
Hannover 96,42,09.07.2018,09.07.2018,-,1,2018-07-09,2018-07-09,,Bobby Wood
Dynamo Kyiv,338,04.07.2018,05.07.2018,-,1,2018-07-04,2018-07-05,,Bobby Wood
Borussia Mönchengladbach,18,20.06.2018,20.06.2018,-,1,2018-06-20,2018-06-20,,Bobby Wood
1.FC Köln,3,24.06.2017,24.06.2017,-,1,2017-06-24,2017-06-24,,Bobby Wood
FC Schalke 04,33,13.06.2017,14.06.2017,-,1,2017-06-13,2017-06-14,,Bobby Wood
Borussia Dortmund,16,21.04.2017,03.05.2017,-,1,2017-04-21,2017-05-03,,Bobby Wood
Bayer 04 Leverkusen,15,05.04.2017,07.04.2017,-,1,2017-04-05,2017-04-07,,Bobby Wood
Leicester City,1003,22.03.2017,22.03.2017,-,1,2017-03-22,2017-03-22,,Bobby Wood
Hamburger SV,41,15.05.2016,15.05.2016,-,1,2016-05-15,2016-05-15,,Bobby Wood
SV Werder Bremen,86,05.05.2016,10.05.2016,-,1,2016-05-05,2016-05-10,,Bobby Wood
VfB Stuttgart,79,05.05.2016,05.05.2016,-,1,2016-05-05,2016-05-05,,Bobby Wood
Eintracht Frankfurt,24,05.05.2016,05.05.2016,-,2,2016-05-05,2016-05-05,,Bobby Wood
Bayer 04 Leverkusen,15,25.04.2016,25.04.2016,-,2,2016-04-25,2016-04-25,,Bobby Wood
FC Red Bull Salzburg,409,23.03.2016,23.03.2016,-,2,2016-03-23,2016-03-23,,Bobby Wood
FC Liverpool,31,22.03.2016,23.03.2016,-,2,2016-03-22,2016-03-23,,Bobby Wood
1.FC Union Berlin,89,06.07.2015,06.07.2015,-,2,2015-07-06,2015-07-06,,Bobby Wood
SV Darmstadt 98,105,30.06.2015,06.07.2015,-,2,2015-06-30,2015-07-06,,Bobby Wood
VfB Stuttgart,79,18.06.2015,18.06.2015,-,2,2015-06-18,2015-06-18,,Bobby Wood
FC Ingolstadt 04,4795,15.06.2015,15.06.2015,-,2,2015-06-15,2015-06-15,,Bobby Wood
Fortuna Düsseldorf,38,13.06.2015,13.06.2015,-,2,2015-06-13,2015-06-13,,Bobby Wood
Eintracht Braunschweig,23,11.06.2015,12.06.2015,-,2,2015-06-11,2015-06-12,,Bobby Wood
1.FC Kaiserslautern,2,04.06.2015,04.06.2015,-,2,2015-06-04,2015-06-04,,Bobby Wood
FC Erzgebirge Aue,94,02.02.2015,02.02.2015,-,2,2015-02-02,2015-02-02,,Bobby Wood
SV Sandhausen,254,27.01.2015,01.02.2015,-,2,2015-01-27,2015-02-01,,Bobby Wood
Lierse SK (-2018),204,28.12.2014,28.12.2014,-,2,2014-12-28,2014-12-28,,Bobby Wood
TSV 1860 München,72,14.06.2012,14.06.2012,-,2,2012-06-14,2012-06-14,,Bobby Wood
VfL Wolfsburg,82,30.06.2011,01.07.2011,-,3,2011-06-30,2011-07-01,,Bobby Wood
1.FC Köln,3,10.02.2011,14.02.2011,-,3,2011-02-10,2011-02-14,,Bobby Wood
FC Schalke 04,33,10.02.2011,13.02.2011,-,3,2011-02-10,2011-02-13,,Bobby Wood
Real Saragossa,142,,27.04.2020,-,1,,2020-04-27,,Borja Bastón
FC Valencia,1049,10.01.2017,12.01.2017,-,1,2017-01-10,2017-01-12,,Borja Bastón
Swansea City,2288,09.08.2016,09.08.2016,-,1,2016-08-09,2016-08-09,,Borja Bastón
West Bromwich Albion,984,30.06.2016,30.06.2016,-,1,2016-06-30,2016-06-30,,Borja Bastón
FC Everton,29,05.05.2016,05.05.2016,-,1,2016-05-05,2016-05-05,,Borja Bastón
Tottenham Hotspur,148,28.04.2016,28.04.2016,-,1,2016-04-28,2016-04-28,,Borja Bastón
AC Florenz,430,28.03.2016,28.03.2016,-,1,2016-03-28,2016-03-28,,Borja Bastón
FC Villarreal,1050,27.05.2015,27.05.2015,-,1,2015-05-27,2015-05-27,,Borja Bastón
Real Betis Sevilla,150,27.05.2015,27.05.2015,-,1,2015-05-27,2015-05-27,,Borja Bastón
FC Getafe,3709,27.05.2015,27.05.2015,-,1,2015-05-27,2015-05-27,,Borja Bastón
VfL Wolfsburg,82,16.07.2024,16.07.2024,-,1,2024-07-16,2024-07-16,,Borja Iglesias
VfB Stuttgart,79,10.07.2024,11.07.2024,-,1,2024-07-10,2024-07-11,,Borja Iglesias
Rayo Vallecano,367,05.04.2024,05.04.2024,-,1,2024-04-05,2024-04-05,,Borja Iglesias
Bayer 04 Leverkusen,15,27.01.2024,27.01.2024,-,1,2024-01-27,2024-01-27,,Borja Iglesias
FC Brentford,1148,24.01.2023,24.01.2023,-,1,2023-01-24,2023-01-24,,Borja Iglesias
FC Fulham,931,24.01.2023,24.01.2023,-,1,2023-01-24,2023-01-24,,Borja Iglesias
Brighton & Hove Albion,1237,24.01.2023,24.01.2023,-,1,2023-01-24,2023-01-24,,Borja Iglesias
Atlético Madrid,13,26.12.2022,26.12.2022,-,1,2022-12-26,2022-12-26,,Borja Iglesias
FC Arsenal,11,11.01.2024,11.01.2024,-,1,2024-01-11,2024-01-11,,Borja Mayoral
Genua CFC,252,09.07.2023,09.07.2023,-,1,2023-07-09,2023-07-09,,Borja Mayoral
Cagliari Calcio,1390,06.07.2023,06.07.2023,-,1,2023-07-06,2023-07-06,,Borja Mayoral
FC Getafe,3709,25.07.2022,30.07.2022,-,1,2022-07-25,2022-07-30,,Borja Mayoral
AS Rom,12,01.10.2020,01.10.2020,-,1,2020-10-01,2020-10-01,,Borja Mayoral
Lazio Rom,398,28.07.2020,28.07.2020,-,1,2020-07-28,2020-07-28,,Borja Mayoral
FC Valencia,1049,28.06.2020,28.06.2020,-,1,2020-06-28,2020-06-28,,Borja Mayoral
FC Villarreal,1050,28.06.2020,28.06.2020,-,1,2020-06-28,2020-06-28,,Borja Mayoral
Hamburger SV,41,24.08.2017,26.08.2017,-,1,2017-08-24,2017-08-26,,Borja Mayoral
VfL Wolfsburg,82,17.04.2017,19.04.2017,-,1,2017-04-17,2017-04-19,,Borja Mayoral
VfL Wolfsburg,82,24.07.2016,24.07.2016,-,1,2016-07-24,2016-07-24,,Borja Mayoral
FC Porto,720,08.07.2025,08.07.2025,-,1,2025-07-08,2025-07-08,,Borja Sainz
Athletic Bilbao,621,31.12.2024,31.12.2024,-,1,2024-12-31,2024-12-31,,Borja Sainz
Galatasaray,141,11.11.2024,12.11.2024,-,1,2024-11-11,2024-11-12,,Borja Sainz
Atlético Madrid,13,11.11.2024,11.11.2024,-,1,2024-11-11,2024-11-11,,Borja Sainz
FC Villarreal,1050,11.11.2024,11.11.2024,-,1,2024-11-11,2024-11-11,,Borja Sainz
AC Florenz,430,21.06.2019,21.06.2019,-,1,2019-06-21,2019-06-21,,Borja Valero
Inter Mailand,46,09.07.2017,10.07.2017,-,1,2017-07-09,2017-07-10,,Borja Valero
Manchester United,985,30.11.2015,30.11.2015,-,1,2015-11-30,2015-11-30,,Borja Valero
FC Schalke 04,33,19.04.2013,19.04.2013,-,1,2013-04-19,2013-04-19,,Borja Valero
Tottenham Hotspur,148,17.04.2013,17.04.2013,-,1,2013-04-17,2013-04-17,,Borja Valero
Fenerbahce,36,29.07.2012,01.08.2012,-,1,2012-07-29,2012-08-01,,Borja Valero
Spartak Moskau,232,14.06.2012,15.06.2012,-,1,2012-06-14,2012-06-15,,Borja Valero
FC Málaga,1084,26.05.2012,28.05.2012,-,1,2012-05-26,2012-05-28,,Borja Valero
Atlético Madrid,13,22.05.2012,22.05.2012,-,1,2012-05-22,2012-05-22,,Borja Valero
AC Florenz,430,07.01.2012,07.01.2012,-,1,2012-01-07,2012-01-07,,Borja Valero
SSC Neapel,6195,18.04.2011,19.04.2011,-,1,2011-04-18,2011-04-19,,Borja Valero
FC Barcelona,131,22.11.2010,23.11.2010,-,1,2010-11-22,2010-11-23,,Borja Valero
FC Sevilla,368,05.06.2010,05.06.2010,-,1,2010-06-05,2010-06-05,,Borja Valero
Crystal Palace,873,06.07.2025,06.07.2025,-,1,2025-07-06,2025-07-06,,Borna Sosa
FC Turin,416,15.08.2024,15.08.2024,-,1,2024-08-15,2024-08-15,,Borna Sosa
Borussia Dortmund,16,29.06.2024,05.07.2024,-,1,2024-06-29,2024-07-05,,Borna Sosa
Ajax Amsterdam,610,01.09.2023,01.09.2023,-,1,2023-09-01,2023-09-01,,Borna Sosa
FC Sevilla,368,01.09.2023,01.09.2023,-,1,2023-09-01,2023-09-01,,Borna Sosa
AC Mailand,5,31.08.2023,31.08.2023,-,1,2023-08-31,2023-08-31,,Borna Sosa
AS Rom,12,30.08.2023,30.08.2023,-,1,2023-08-30,2023-08-30,,Borna Sosa
Al-Hilal SFC,1114,16.08.2023,16.08.2023,-,1,2023-08-16,2023-08-16,,Borna Sosa
FC Turin,416,11.08.2023,12.08.2023,-,1,2023-08-11,2023-08-12,,Borna Sosa
Nottingham Forest,703,07.08.2023,07.08.2023,-,1,2023-08-07,2023-08-07,,Borna Sosa
Galatasaray,141,11.07.2023,13.07.2023,-,1,2023-07-11,2023-07-13,,Borna Sosa
Real Sociedad San Sebastián,681,15.03.2023,15.03.2023,-,1,2023-03-15,2023-03-15,,Borna Sosa
Tottenham Hotspur,148,15.03.2023,15.03.2023,-,1,2023-03-15,2023-03-15,,Borna Sosa
Bayer 04 Leverkusen,15,30.01.2023,31.01.2023,-,1,2023-01-30,2023-01-31,,Borna Sosa
Inter Mailand,46,28.11.2022,28.11.2022,-,1,2022-11-28,2022-11-28,,Borna Sosa
Newcastle United,762,17.11.2022,17.11.2022,-,2,2022-11-17,2022-11-17,,Borna Sosa
Atalanta Bergamo,800,17.11.2022,17.11.2022,-,2,2022-11-17,2022-11-17,,Borna Sosa
Manchester City,281,11.08.2022,12.08.2022,-,2,2022-08-11,2022-08-12,,Borna Sosa
West Ham United,379,11.08.2022,11.08.2022,-,2,2022-08-11,2022-08-11,,Borna Sosa
Juventus Turin,506,19.07.2022,19.07.2022,-,2,2022-07-19,2022-07-19,,Borna Sosa
FC Bayern München,27,18.07.2022,19.07.2022,-,2,2022-07-18,2022-07-19,,Borna Sosa
FC Chelsea,631,20.06.2022,21.06.2022,-,2,2022-06-20,2022-06-21,,Borna Sosa
Borussia Dortmund,16,31.05.2022,02.06.2022,-,2,2022-05-31,2022-06-02,,Borna Sosa
FC Barcelona,131,16.05.2022,16.05.2022,-,2,2022-05-16,2022-05-16,,Borna Sosa
Manchester United,985,10.05.2022,11.05.2022,-,2,2022-05-10,2022-05-11,,Borna Sosa
Aston Villa,405,22.11.2021,23.11.2021,-,2,2021-11-22,2021-11-23,,Borna Sosa
SSC Neapel,6195,01.07.2021,02.07.2021,-,2,2021-07-01,2021-07-02,,Borna Sosa
West Bromwich Albion,984,23.09.2020,24.09.2020,-,2,2020-09-23,2020-09-24,,Borna Sosa
Olympiakos Piräus,683,23.09.2020,24.09.2020,-,2,2020-09-23,2020-09-24,,Borna Sosa
VfB Stuttgart,79,12.05.2018,14.05.2018,-,2,2018-05-12,2018-05-14,,Borna Sosa
LASK,413,02.08.2025,02.08.2025,53 %,1,2025-08-02,2025-08-02,53.0,Bosko Sutalo
GNK Dinamo Zagreb,419,21.06.2022,21.06.2022,-,1,2022-06-21,2022-06-21,,Bosko Sutalo
Atalanta Bergamo,800,30.01.2020,30.01.2020,-,1,2020-01-30,2020-01-30,,Bosko Sutalo
FC Liverpool,31,17.08.2023,17.08.2023,-,1,2023-08-17,2023-08-17,,Boubacar Kamara
Aston Villa,405,22.05.2022,23.05.2022,-,1,2022-05-22,2022-05-23,,Boubacar Kamara
Borussia Dortmund,16,22.05.2022,23.05.2022,-,1,2022-05-22,2022-05-23,,Boubacar Kamara
Atlético Madrid,13,24.03.2022,24.03.2022,-,1,2022-03-24,2022-03-24,,Boubacar Kamara
FC Bayern München,27,30.01.2022,01.02.2022,-,1,2022-01-30,2022-02-01,,Boubacar Kamara
Manchester United,985,05.01.2022,05.01.2022,-,1,2022-01-05,2022-01-05,,Boubacar Kamara
Newcastle United,762,20.12.2021,20.12.2021,-,1,2021-12-20,2021-12-20,,Boubacar Kamara
RB Leipzig,23826,29.11.2021,29.11.2021,-,1,2021-11-29,2021-11-29,,Boubacar Kamara
Juventus Turin,506,09.09.2021,09.09.2021,-,1,2021-09-09,2021-09-09,,Boubacar Kamara
Wolverhampton Wanderers,543,31.08.2021,31.08.2021,-,1,2021-08-31,2021-08-31,,Boubacar Kamara
FC Arsenal,11,06.05.2020,06.05.2020,-,1,2020-05-06,2020-05-06,,Boubacar Kamara
Manchester City,281,06.05.2020,06.05.2020,-,1,2020-05-06,2020-05-06,,Boubacar Kamara
AC Mailand,5,06.02.2019,06.02.2019,-,1,2019-02-06,2019-02-06,,Boubacar Kamara
Real Madrid,418,02.02.2019,02.02.2019,-,1,2019-02-02,2019-02-02,,Boubacar Kamara
FC Arsenal,11,27.11.2016,27.11.2016,-,1,2016-11-27,2016-11-27,,Boubacar Kamara
Borussia Dortmund,16,06.11.2016,06.11.2016,-,2,2016-11-06,2016-11-06,,Boubacar Kamara
FC Metz,347,23.07.2025,23.07.2025,-,1,2025-07-23,2025-07-23,,Boubacar Traoré
Borussia Mönchengladbach,18,06.03.2025,06.03.2025,-,1,2025-03-06,2025-03-06,,Boubacar Traoré
RC Lens,826,08.07.2024,08.07.2024,-,1,2024-07-08,2024-07-08,,Boubacar Traoré
SC Freiburg,60,01.08.2022,20.08.2022,-,1,2022-08-01,2022-08-20,,Boubacar Traoré
AS Monaco,162,28.08.2024,28.08.2024,-,1,2024-08-28,2024-08-28,,Boubakary Soumaré
FC Turin,416,20.07.2023,20.07.2023,-,1,2023-07-20,2023-07-20,,Boubakary Soumaré
SSC Neapel,6195,20.07.2023,20.07.2023,-,1,2023-07-20,2023-07-20,,Boubakary Soumaré
AS Rom,12,28.08.2022,28.08.2022,-,1,2022-08-28,2022-08-28,,Boubakary Soumaré
Leicester City,1003,27.05.2021,27.05.2021,-,1,2021-05-27,2021-05-27,,Boubakary Soumaré
AC Mailand,5,21.12.2020,21.12.2020,-,1,2020-12-21,2020-12-21,,Boubakary Soumaré
Hertha BSC,44,04.09.2020,30.09.2020,-,1,2020-09-04,2020-09-30,,Boubakary Soumaré
SSC Neapel,6195,29.09.2020,29.09.2020,-,1,2020-09-29,2020-09-29,,Boubakary Soumaré
FC Chelsea,631,15.07.2020,15.07.2020,-,1,2020-07-15,2020-07-15,,Boubakary Soumaré
Newcastle United,762,15.07.2020,15.07.2020,-,1,2020-07-15,2020-07-15,,Boubakary Soumaré
Tottenham Hotspur,148,14.07.2020,14.07.2020,-,1,2020-07-14,2020-07-14,,Boubakary Soumaré
FC Liverpool,31,13.04.2020,13.04.2020,-,1,2020-04-13,2020-04-13,,Boubakary Soumaré
Real Madrid,418,06.01.2020,06.01.2020,-,1,2020-01-06,2020-01-06,,Boubakary Soumaré
FC Arsenal,11,06.01.2020,06.01.2020,-,1,2020-01-06,2020-01-06,,Boubakary Soumaré
FC Valencia,1049,06.01.2020,06.01.2020,-,1,2020-01-06,2020-01-06,,Boubakary Soumaré
Manchester United,985,06.01.2020,06.01.2020,-,2,2020-01-06,2020-01-06,,Boubakary Soumaré
FC Everton,29,26.04.2019,26.04.2019,-,2,2019-04-26,2019-04-26,,Boubakary Soumaré
Manchester City,281,26.04.2019,26.04.2019,-,2,2019-04-26,2019-04-26,,Boubakary Soumaré
Borussia Dortmund,16,23.03.2019,23.03.2019,-,2,2019-03-23,2019-03-23,,Boubakary Soumaré
Manchester City,281,21.01.2018,21.01.2018,-,2,2018-01-21,2018-01-21,,Boubakary Soumaré
Lazio Rom,398,16.08.2024,16.08.2024,-,1,2024-08-16,2024-08-16,,Boulaye Dia
Newcastle United,762,25.12.2023,25.12.2023,-,1,2023-12-25,2023-12-25,,Boulaye Dia
Wolverhampton Wanderers,543,21.11.2023,21.11.2023,-,1,2023-11-21,2023-11-21,,Boulaye Dia
AC Mailand,5,04.07.2023,04.07.2023,-,1,2023-07-04,2023-07-04,,Boulaye Dia
FC Everton,29,18.06.2023,18.06.2023,-,1,2023-06-18,2023-06-18,,Boulaye Dia
West Ham United,379,18.06.2023,18.06.2023,-,1,2023-06-18,2023-06-18,,Boulaye Dia
FC Burnley,1132,18.06.2023,18.06.2023,-,1,2023-06-18,2023-06-18,,Boulaye Dia
SSC Neapel,6195,18.06.2023,18.06.2023,-,1,2023-06-18,2023-06-18,,Boulaye Dia
Lazio Rom,398,15.06.2023,15.06.2023,-,1,2023-06-15,2023-06-15,,Boulaye Dia
FC Villarreal,1050,11.07.2021,11.07.2021,-,1,2021-07-11,2021-07-11,,Boulaye Dia
Eintracht Frankfurt,24,19.03.2021,19.03.2021,-,1,2021-03-19,2021-03-19,,Boulaye Dia
RB Leipzig,23826,24.02.2021,26.02.2021,-,1,2021-02-24,2021-02-26,,Boulaye Dia
West Ham United,379,14.01.2021,16.01.2021,-,1,2021-01-14,2021-01-16,,Boulaye Dia
Olympique Marseille,244,23.12.2019,23.12.2019,-,1,2019-12-23,2019-12-23,,Boulaye Dia
FC Paris Saint-Germain,583,31.08.2023,31.08.2023,-,1,2023-08-31,2023-08-31,,Bradley Barcola
FC Brentford,1148,29.08.2023,29.08.2023,-,1,2023-08-29,2023-08-29,,Bradley Barcola
RB Leipzig,23826,13.07.2023,14.07.2023,-,1,2023-07-13,2023-07-14,,Bradley Barcola
FC St. Gallen 1879,257,06.01.2023,24.01.2023,-,1,2023-01-06,2023-01-24,,Bradley Barcola
LOSC Lille,1082,08.06.2024,08.06.2024,-,1,2024-06-08,2024-06-08,,Bradley Locko
Manchester United,985,21.05.2024,21.05.2024,-,1,2024-05-21,2024-05-21,,Bradley Locko
Aston Villa,405,13.05.2024,13.05.2024,-,1,2024-05-13,2024-05-13,,Bradley Locko
Manchester City,281,13.05.2024,13.05.2024,-,1,2024-05-13,2024-05-13,,Bradley Locko
Stade Brest 29,3911,30.01.2023,31.01.2023,-,1,2023-01-30,2023-01-31,,Bradley Locko
Borussia Dortmund,16,20.01.2025,22.01.2025,-,1,2025-01-20,2025-01-22,,Brahim Díaz
Newcastle United,762,22.11.2024,22.11.2024,-,1,2024-11-22,2024-11-22,,Brahim Díaz
Bayer 04 Leverkusen,15,29.05.2024,27.08.2024,-,1,2024-05-29,2024-08-27,,Brahim Díaz
Real Madrid,418,08.06.2023,08.06.2023,-,1,2023-06-08,2023-06-08,,Brahim Díaz
FC Arsenal,11,24.03.2023,24.03.2023,-,1,2023-03-24,2023-03-24,,Brahim Díaz
AC Mailand,5,14.01.2021,14.01.2021,-,1,2021-01-14,2021-01-14,,Brahim Díaz
FC Getafe,3709,06.08.2020,06.08.2020,-,1,2020-08-06,2020-08-06,,Brahim Díaz
Borussia Dortmund,16,04.05.2020,05.05.2020,-,1,2020-05-04,2020-05-05,,Brahim Díaz
Real Madrid,418,06.01.2019,06.01.2019,-,1,2019-01-06,2019-01-06,,Brahim Díaz
FC Girona,12321,31.07.2018,31.07.2018,-,1,2018-07-31,2018-07-31,,Brahim Díaz
FC Bayern München,27,18.07.2019,18.07.2019,-,1,2019-07-18,2019-07-18,,Brais Méndez
Leicester City,1003,20.11.2018,20.11.2018,-,1,2018-11-20,2018-11-20,,Brais Méndez
Brighton & Hove Albion,1237,14.08.2024,14.08.2024,-,1,2024-08-14,2024-08-14,,Brajan Gruda
Bayer 04 Leverkusen,15,03.07.2024,13.08.2024,-,1,2024-07-03,2024-08-13,,Brajan Gruda
Aston Villa,405,21.05.2024,08.07.2024,-,1,2024-05-21,2024-07-08,,Brajan Gruda
RB Leipzig,23826,24.05.2024,03.07.2024,-,1,2024-05-24,2024-07-03,,Brajan Gruda
FC Bayern München,27,06.06.2024,29.06.2024,-,1,2024-06-06,2024-06-29,,Brajan Gruda
Borussia Dortmund,16,31.05.2024,09.06.2024,-,1,2024-05-31,2024-06-09,,Brajan Gruda
FC Liverpool,31,21.05.2024,22.05.2024,-,1,2024-05-21,2024-05-22,,Brajan Gruda
Newcastle United,762,21.05.2024,21.05.2024,-,1,2024-05-21,2024-05-21,,Brajan Gruda
VfB Stuttgart,79,31.01.2024,31.01.2024,-,1,2024-01-31,2024-01-31,,Brajan Gruda
LOSC Lille,1082,13.07.2024,13.07.2024,-,1,2024-07-13,2024-07-13,,Branco van den Boomen
VfL Wolfsburg,82,05.05.2023,29.05.2023,-,1,2023-05-05,2023-05-29,,Branco van den Boomen
PSV Eindhoven,383,08.04.2023,08.04.2023,-,1,2023-04-08,2023-04-08,,Branco van den Boomen
FC Lausanne-Sport,527,11.01.2025,11.01.2025,-,1,2025-01-11,2025-01-11,,Brandon Soppy
FC Schalke 04,33,31.01.2024,31.01.2024,-,1,2024-01-31,2024-01-31,,Brandon Soppy
FC Turin,416,08.08.2023,08.08.2023,-,1,2023-08-08,2023-08-08,,Brandon Soppy
Atalanta Bergamo,800,18.08.2022,18.08.2022,-,1,2022-08-18,2022-08-18,,Brandon Soppy
Borussia Dortmund,16,03.01.2021,13.01.2021,-,1,2021-01-03,2021-01-13,,Brandon Soppy
AS Rom,12,03.01.2021,03.01.2021,-,1,2021-01-03,2021-01-03,,Brandon Soppy
Celtic Glasgow,371,20.04.2020,20.04.2020,-,1,2020-04-20,2020-04-20,,Brandon Soppy
Celtic Glasgow,371,25.03.2020,25.03.2020,-,1,2020-03-25,2020-03-25,,Brandon Soppy
RB Leipzig,23826,24.03.2020,24.03.2020,-,1,2020-03-24,2020-03-24,,Brandon Soppy
AS Monaco,162,23.11.2019,25.11.2019,-,1,2019-11-23,2019-11-25,,Brandon Soppy
Wolverhampton Wanderers,543,23.11.2019,23.11.2019,-,1,2019-11-23,2019-11-23,,Brandon Soppy
Besiktas JK,114,02.07.2025,02.07.2025,-,1,2025-07-02,2025-07-02,,Brandon Williams
Glasgow Rangers,124,16.08.2024,16.08.2024,-,1,2024-08-16,2024-08-16,,Brandon Williams
AC Florenz,430,23.05.2023,23.05.2023,-,1,2023-05-23,2023-05-23,,Brandon Williams
Brighton & Hove Albion,1237,25.07.2022,25.07.2022,-,1,2022-07-25,2022-07-25,,Brandon Williams
Norwich City,1123,23.08.2021,23.08.2021,-,1,2021-08-23,2021-08-23,,Brandon Williams
FC Southampton,180,06.07.2021,06.07.2021,-,1,2021-07-06,2021-07-06,,Brandon Williams
Bayer 04 Leverkusen,15,26.12.2020,30.01.2021,-,1,2020-12-26,2021-01-30,,Brandon Williams
Newcastle United,762,05.01.2021,05.01.2021,-,1,2021-01-05,2021-01-05,,Brandon Williams
FC Stade Rennes,273,30.08.2025,30.08.2025,-,1,2025-08-30,2025-08-30,,Breel Embolo
West Ham United,379,22.05.2025,17.08.2025,-,1,2025-05-22,2025-08-17,,Breel Embolo
Besiktas JK,114,20.06.2025,24.06.2025,20 %,1,2025-06-20,2025-06-24,20.0,Breel Embolo
FC Bayern München,27,19.07.2024,19.07.2024,-,1,2024-07-19,2024-07-19,,Breel Embolo
AS Monaco,162,15.07.2022,15.07.2022,-,1,2022-07-15,2022-07-15,,Breel Embolo
Olympique Lyon,1041,09.07.2022,09.07.2022,-,1,2022-07-09,2022-07-09,,Breel Embolo
Brighton & Hove Albion,1237,02.01.2022,02.01.2022,-,1,2022-01-02,2022-01-02,,Breel Embolo
West Ham United,379,02.01.2022,02.01.2022,-,1,2022-01-02,2022-01-02,,Breel Embolo
AC Mailand,5,13.06.2021,08.07.2021,-,1,2021-06-13,2021-07-08,,Breel Embolo
Borussia Mönchengladbach,18,28.06.2019,28.06.2019,-,1,2019-06-28,2019-06-28,,Breel Embolo
Lazio Rom,398,16.08.2018,16.08.2018,-,1,2018-08-16,2018-08-16,,Breel Embolo
Lokomotiv Moskau,932,05.08.2018,09.08.2018,-,1,2018-08-05,2018-08-09,,Breel Embolo
Grasshopper Club Zürich,504,30.01.2018,03.02.2018,-,1,2018-01-30,2018-02-03,,Breel Embolo
Tottenham Hotspur,148,26.11.2017,27.11.2017,-,1,2017-11-26,2017-11-27,,Breel Embolo
FC Chelsea,631,27.02.2017,27.02.2017,-,1,2017-02-27,2017-02-27,,Breel Embolo
FC Schalke 04,33,26.06.2016,26.06.2016,-,2,2016-06-26,2016-06-26,,Breel Embolo
Manchester United,985,09.06.2016,23.06.2016,-,2,2016-06-09,2016-06-23,,Breel Embolo
RB Leipzig,23826,20.06.2016,21.06.2016,-,2,2016-06-20,2016-06-21,,Breel Embolo
Borussia Mönchengladbach,18,10.06.2016,13.06.2016,-,2,2016-06-10,2016-06-13,,Breel Embolo
Tottenham Hotspur,148,31.05.2016,31.05.2016,-,2,2016-05-31,2016-05-31,,Breel Embolo
FC Liverpool,31,11.05.2016,15.05.2016,-,2,2016-05-11,2016-05-15,,Breel Embolo
VfL Wolfsburg,82,29.01.2016,29.01.2016,-,2,2016-01-29,2016-01-29,,Breel Embolo
Borussia Dortmund,16,18.01.2016,20.01.2016,-,2,2016-01-18,2016-01-20,,Breel Embolo
FC Arsenal,11,19.12.2015,19.12.2015,-,2,2015-12-19,2015-12-19,,Breel Embolo
Juventus Turin,506,15.10.2015,15.10.2015,-,2,2015-10-15,2015-10-15,,Breel Embolo
West Bromwich Albion,984,12.08.2015,12.08.2015,-,2,2015-08-12,2015-08-12,,Breel Embolo
West Ham United,379,07.07.2015,07.07.2015,-,2,2015-07-07,2015-07-07,,Breel Embolo
Aston Villa,405,07.07.2015,07.07.2015,-,2,2015-07-07,2015-07-07,,Breel Embolo
FC Sion,321,27.06.2015,27.06.2015,-,2,2015-06-27,2015-06-27,,Breel Embolo
AC Mailand,5,07.06.2015,07.06.2015,-,2,2015-06-07,2015-06-07,,Breel Embolo
AS Rom,12,07.06.2015,07.06.2015,-,3,2015-06-07,2015-06-07,,Breel Embolo
Inter Mailand,46,07.05.2015,08.05.2015,-,3,2015-05-07,2015-05-08,,Breel Embolo
Inter Mailand,46,,07.05.2015,-,3,,2015-05-07,,Breel Embolo
Real Madrid,418,09.12.2014,10.12.2014,-,3,2014-12-09,2014-12-10,,Breel Embolo
FC Chelsea,631,09.12.2014,09.12.2014,-,3,2014-12-09,2014-12-09,,Breel Embolo
FC Southampton,180,09.12.2014,09.12.2014,-,3,2014-12-09,2014-12-09,,Breel Embolo
Newcastle United,762,09.12.2014,09.12.2014,-,3,2014-12-09,2014-12-09,,Breel Embolo
FC Everton,29,09.12.2014,09.12.2014,-,3,2014-12-09,2014-12-09,,Breel Embolo
FC Barcelona,131,09.12.2014,09.12.2014,-,3,2014-12-09,2014-12-09,,Breel Embolo
FC Barcelona,131,09.12.2014,09.12.2014,-,3,2014-12-09,2014-12-09,,Breel Embolo
Manchester City,281,09.12.2014,09.12.2014,-,3,2014-12-09,2014-12-09,,Breel Embolo
FC Bayern München,27,23.11.2014,23.11.2014,-,3,2014-11-23,2014-11-23,,Breel Embolo
SC Freiburg,60,23.11.2014,23.11.2014,-,3,2014-11-23,2014-11-23,,Breel Embolo
Lokomotiv Moskau,932,15.11.2014,15.11.2014,-,3,2014-11-15,2014-11-15,,Breel Embolo
Spartak Moskau,232,15.11.2014,15.11.2014,-,3,2014-11-15,2014-11-15,,Breel Embolo
ZSKA Moskau,2410,15.11.2014,15.11.2014,-,4,2014-11-15,2014-11-15,,Breel Embolo
Holstein Kiel,269,22.05.2024,22.06.2024,-,1,2024-05-22,2024-06-22,,Brenden Aaronson
1.FC Union Berlin,89,09.07.2023,09.07.2023,-,1,2023-07-09,2023-07-09,,Brenden Aaronson
Leeds United,399,26.05.2022,26.05.2022,-,1,2022-05-26,2022-05-26,,Brenden Aaronson
SC Freiburg,60,16.02.2022,21.02.2022,-,1,2022-02-16,2022-02-21,,Brenden Aaronson
Borussia Mönchengladbach,18,16.02.2022,19.02.2022,-,1,2022-02-16,2022-02-19,,Brenden Aaronson
Eintracht Frankfurt,24,18.02.2022,18.02.2022,-,1,2022-02-18,2022-02-18,,Brenden Aaronson
TSG 1899 Hoffenheim,533,17.02.2022,17.02.2022,-,1,2022-02-17,2022-02-17,,Brenden Aaronson
RB Leipzig,23826,23.01.2022,23.01.2022,-,1,2022-01-23,2022-01-23,,Brenden Aaronson
FC Red Bull Salzburg,409,05.10.2020,05.10.2020,-,1,2020-10-05,2020-10-05,,Brenden Aaronson
Borussia Mönchengladbach,18,24.07.2020,06.08.2020,-,1,2020-07-24,2020-08-06,,Brenden Aaronson
Eintracht Frankfurt,24,23.07.2020,03.08.2020,-,1,2020-07-23,2020-08-03,,Brenden Aaronson
TSG 1899 Hoffenheim,533,21.07.2020,21.07.2020,-,1,2020-07-21,2020-07-21,,Brenden Aaronson
SC Freiburg,60,21.07.2020,21.07.2020,-,1,2020-07-21,2020-07-21,,Brenden Aaronson
AFC Sunderland,289,01.09.2025,01.09.2025,-,1,2025-09-01,2025-09-01,,Brian Brobbey
VfB Stuttgart,79,20.08.2025,31.08.2025,23 %,1,2025-08-20,2025-08-31,23.0,Brian Brobbey
FC Stade Rennes,273,20.08.2025,20.08.2025,-,1,2025-08-20,2025-08-20,,Brian Brobbey
Atalanta Bergamo,800,25.07.2025,25.07.2025,-,1,2025-07-25,2025-07-25,,Brian Brobbey
West Ham United,379,25.01.2025,25.01.2025,-,1,2025-01-25,2025-01-25,,Brian Brobbey
Tottenham Hotspur,148,24.01.2025,24.01.2025,-,1,2025-01-24,2025-01-24,,Brian Brobbey
Olympique Marseille,244,21.01.2025,21.01.2025,-,1,2025-01-21,2025-01-21,,Brian Brobbey
FC Arsenal,11,21.05.2024,21.05.2024,-,1,2024-05-21,2024-05-21,,Brian Brobbey
Manchester United,985,20.01.2024,20.01.2024,-,1,2024-01-20,2024-01-20,,Brian Brobbey
FC Everton,29,20.07.2023,20.07.2023,-,1,2023-07-20,2023-07-20,,Brian Brobbey
Ajax Amsterdam,610,22.07.2022,22.07.2022,-,1,2022-07-22,2022-07-22,,Brian Brobbey
Manchester United,985,17.07.2022,17.07.2022,-,1,2022-07-17,2022-07-17,,Brian Brobbey
Ajax Amsterdam,610,07.05.2021,16.05.2021,-,1,2021-05-07,2021-05-16,,Brian Brobbey
RB Leipzig,23826,12.03.2021,12.03.2021,-,1,2021-03-12,2021-03-12,,Brian Brobbey
FC Bayern München,27,05.02.2021,08.02.2021,-,1,2021-02-05,2021-02-08,,Brian Brobbey
Borussia Dortmund,16,03.02.2021,05.02.2021,-,2,2021-02-03,2021-02-05,,Brian Brobbey
FC Stade Rennes,273,07.01.2025,07.01.2025,-,1,2025-01-07,2025-01-07,,Brice Samba
Olympique Marseille,244,28.06.2024,28.06.2024,-,1,2024-06-28,2024-06-28,,Brice Samba
RC Lens,826,28.06.2022,05.07.2022,-,1,2022-06-28,2022-07-05,,Brice Samba
Olympique Marseille,244,02.01.2013,02.01.2013,-,1,2013-01-02,2013-01-02,,Brice Samba
Fenerbahce,36,14.06.2022,16.06.2022,-,1,2022-06-14,2022-06-16,,Bruma
Olympique Marseille,244,29.05.2022,29.05.2022,-,1,2022-05-29,2022-05-29,,Bruma
FC Porto,720,28.06.2019,28.06.2019,-,1,2019-06-28,2019-06-28,,Bruma
PSV Eindhoven,383,28.06.2019,28.06.2019,-,1,2019-06-28,2019-06-28,,Bruma
SC Paderborn 07,127,05.06.2019,05.06.2019,-,1,2019-06-05,2019-06-05,,Bruma
Wolverhampton Wanderers,543,28.12.2018,28.12.2018,-,1,2018-12-28,2018-12-28,,Bruma
Inter Mailand,46,11.09.2018,12.09.2018,-,1,2018-09-11,2018-09-12,,Bruma
Inter Mailand,46,16.04.2018,16.04.2018,-,1,2018-04-16,2018-04-16,,Bruma
RB Leipzig,23826,14.06.2017,17.06.2017,-,1,2017-06-14,2017-06-17,,Bruma
AS Monaco,162,23.02.2017,23.02.2017,-,1,2017-02-23,2017-02-23,,Bruma
Manchester United,985,15.11.2016,15.11.2016,-,1,2016-11-15,2016-11-15,,Bruma
FC Chelsea,631,18.09.2016,09.10.2016,-,1,2016-09-18,2016-10-09,,Bruma
West Ham United,379,18.09.2016,18.09.2016,-,1,2016-09-18,2016-09-18,,Bruma
Tottenham Hotspur,148,18.09.2016,18.09.2016,-,1,2016-09-18,2016-09-18,,Bruma
FC Arsenal,11,18.09.2016,18.09.2016,-,1,2016-09-18,2016-09-18,,Bruma
PSV Eindhoven,383,04.07.2016,04.07.2016,-,2,2016-07-04,2016-07-04,,Bruma
PSV Eindhoven,383,12.06.2016,12.06.2016,-,2,2016-06-12,2016-06-12,,Bruma
Borussia Dortmund,16,13.01.2016,13.01.2016,-,2,2016-01-13,2016-01-13,,Bruma
Real Sociedad San Sebastián,681,11.07.2015,11.07.2015,-,2,2015-07-11,2015-07-11,,Bruma
FC Porto,720,20.05.2015,20.05.2015,-,2,2015-05-20,2015-05-20,,Bruma
VfL Wolfsburg,82,28.03.2015,01.04.2015,-,2,2015-03-28,2015-04-01,,Bruma
Gaziantepspor (-2020),524,28.01.2014,28.01.2014,-,2,2014-01-28,2014-01-28,,Bruma
Galatasaray,141,03.09.2013,03.09.2013,-,2,2013-09-03,2013-09-03,,Bruma
Benfica Lissabon,294,03.08.2013,05.08.2013,-,2,2013-08-03,2013-08-05,,Bruma
FC Bayern München,27,04.06.2013,04.06.2013,-,2,2013-06-04,2013-06-04,,Bruma
FC Schalke 04,33,27.05.2013,29.05.2013,-,2,2013-05-27,2013-05-29,,Bruma
FC Schalke 04,33,27.05.2013,27.05.2013,-,2,2013-05-27,2013-05-27,,Bruma
FC Sevilla,368,13.05.2016,13.05.2016,-,1,2016-05-13,2016-05-13,,Bruno Ecuele Manga
Lazio Rom,398,13.05.2016,13.05.2016,-,1,2016-05-13,2016-05-13,,Bruno Ecuele Manga
Crystal Palace,873,13.05.2016,13.05.2016,-,1,2016-05-13,2016-05-13,,Bruno Ecuele Manga
Swansea City,2288,13.05.2016,13.05.2016,-,1,2016-05-13,2016-05-13,,Bruno Ecuele Manga
West Ham United,379,13.05.2016,13.05.2016,-,1,2016-05-13,2016-05-13,,Bruno Ecuele Manga
FC Toulouse,415,02.12.2015,02.12.2015,-,1,2015-12-02,2015-12-02,,Bruno Ecuele Manga
AS Rom,12,27.08.2014,27.08.2014,-,1,2014-08-27,2014-08-27,,Bruno Ecuele Manga
Borussia Mönchengladbach,18,07.07.2014,27.07.2014,-,1,2014-07-07,2014-07-27,,Bruno Ecuele Manga
Lazio Rom,398,08.07.2014,08.07.2014,-,1,2014-07-08,2014-07-08,,Bruno Ecuele Manga
FC Southampton,180,08.07.2014,08.07.2014,-,1,2014-07-08,2014-07-08,,Bruno Ecuele Manga
Olympique Lyon,1041,31.12.2011,31.12.2011,-,1,2011-12-31,2011-12-31,,Bruno Ecuele Manga
AC Florenz,430,10.11.2011,10.11.2011,-,1,2011-11-10,2011-11-10,,Bruno Ecuele Manga
SV Werder Bremen,86,08.01.2010,10.01.2010,-,1,2010-01-08,2010-01-10,,Bruno Ecuele Manga
FC Liverpool,31,02.12.2009,02.12.2009,-,1,2009-12-02,2009-12-02,,Bruno Ecuele Manga
1.FC Köln,3,10.03.2021,10.03.2021,-,1,2021-03-10,2021-03-10,,Bruno Gaspar
Arminia Bielefeld,10,10.03.2021,10.03.2021,-,1,2021-03-10,2021-03-10,,Bruno Gaspar
FC Getafe,3709,13.06.2019,13.06.2019,-,1,2019-06-13,2019-06-13,,Bruno Gaspar
Sporting Lissabon,336,07.06.2018,07.06.2018,-,1,2018-06-07,2018-06-07,,Bruno Gaspar
Wolverhampton Wanderers,543,08.05.2018,08.05.2018,-,1,2018-05-08,2018-05-08,,Bruno Gaspar
Shakhtar Donetsk,660,,16.11.2017,-,1,,2017-11-16,,Bruno Gaspar
Grasshopper Club Zürich,504,31.01.2022,31.01.2022,-,1,2022-01-31,2022-01-31,,Bruno Jordão
Trabzonspor,449,26.05.2021,26.05.2021,-,1,2021-05-26,2021-05-26,,Bruno Peres
FC Turin,416,07.07.2018,07.07.2018,-,1,2018-07-07,2018-07-07,,Bruno Peres
FC Porto,720,04.06.2018,04.06.2018,-,1,2018-06-04,2018-06-04,,Bruno Peres
Galatasaray,141,12.01.2018,13.01.2018,-,1,2018-01-12,2018-01-13,,Bruno Peres
Benfica Lissabon,294,12.01.2018,12.01.2018,-,1,2018-01-12,2018-01-12,,Bruno Peres
Brighton & Hove Albion,1237,09.01.2018,09.01.2018,-,1,2018-01-09,2018-01-09,,Bruno Peres
AS Rom,12,16.08.2016,16.08.2016,-,1,2016-08-16,2016-08-16,,Bruno Peres
FC Arsenal,11,01.08.2016,01.08.2016,-,1,2016-08-01,2016-08-01,,Bruno Peres
Bayer 04 Leverkusen,15,15.07.2016,17.07.2016,-,1,2016-07-15,2016-07-17,,Bruno Peres
Manchester City,281,12.07.2016,12.07.2016,-,1,2016-07-12,2016-07-12,,Bruno Peres
FC Watford,1010,30.06.2016,30.06.2016,-,1,2016-06-30,2016-06-30,,Bruno Peres
FC Paris Saint-Germain,583,09.06.2016,09.06.2016,-,1,2016-06-09,2016-06-09,,Bruno Peres
FC Barcelona,131,09.06.2016,09.06.2016,-,1,2016-06-09,2016-06-09,,Bruno Peres
FC Bayern München,27,07.06.2016,09.06.2016,-,1,2016-06-07,2016-06-09,,Bruno Peres
Borussia Dortmund,16,15.05.2016,16.05.2016,-,1,2016-05-15,2016-05-16,,Bruno Peres
FC Chelsea,631,22.04.2016,22.04.2016,-,2,2016-04-22,2016-04-22,,Bruno Peres
Atlético Madrid,13,22.04.2016,22.04.2016,-,2,2016-04-22,2016-04-22,,Bruno Peres
VfL Wolfsburg,82,05.03.2016,07.03.2016,-,2,2016-03-05,2016-03-07,,Bruno Peres
FC Schalke 04,33,12.10.2015,12.10.2015,-,2,2015-10-12,2015-10-12,,Bruno Peres
FC Porto,720,26.06.2015,28.06.2015,-,2,2015-06-26,2015-06-28,,Bruno Peres
FC Villarreal,1050,26.06.2015,26.06.2015,-,2,2015-06-26,2015-06-26,,Bruno Peres
Inter Mailand,46,26.06.2015,26.06.2015,-,2,2015-06-26,2015-06-26,,Bruno Peres
Sporting Lissabon,336,06.04.2015,06.04.2015,-,2,2015-04-06,2015-04-06,,Bruno Peres
SSC Neapel,6195,06.04.2015,06.04.2015,-,2,2015-04-06,2015-04-06,,Bruno Peres
Tottenham Hotspur,148,20.11.2023,20.11.2023,-,1,2023-11-20,2023-11-20,,Bryan Cristante
AS Rom,12,08.06.2018,08.06.2018,-,1,2018-06-08,2018-06-08,,Bryan Cristante
Inter Mailand,46,24.05.2018,24.05.2018,-,1,2018-05-24,2018-05-24,,Bryan Cristante
Juventus Turin,506,24.05.2018,24.05.2018,-,1,2018-05-24,2018-05-24,,Bryan Cristante
Borussia Dortmund,16,01.05.2018,09.05.2018,-,1,2018-05-01,2018-05-09,,Bryan Cristante
US Sassuolo,6574,16.11.2015,16.11.2015,-,1,2015-11-16,2015-11-16,,Bryan Cristante
Benfica Lissabon,294,01.09.2014,01.09.2014,-,1,2014-09-01,2014-09-01,,Bryan Cristante
Bayer 04 Leverkusen,15,11.11.2013,11.11.2013,-,1,2013-11-11,2013-11-11,,Bryan Cristante
VfB Stuttgart,79,09.11.2013,09.11.2013,-,1,2013-11-09,2013-11-09,,Bryan Cristante
FC Chelsea,631,30.09.2012,03.10.2012,-,1,2012-09-30,2012-10-03,,Bryan Cristante
Hannover 96,42,10.01.2019,11.01.2019,-,1,2019-01-10,2019-01-11,,Bryan Dabo
Olympique Marseille,244,19.06.2015,19.06.2015,-,1,2015-06-19,2015-06-19,,Bryan Dabo
FC Girona,12321,01.09.2025,01.09.2025,-,1,2025-09-01,2025-09-01,,Bryan Gil
Besiktas JK,114,18.07.2025,18.07.2025,-,1,2025-07-18,2025-07-18,,Bryan Gil
Feyenoord Rotterdam,234,24.04.2024,24.04.2024,-,1,2024-04-24,2024-04-24,,Bryan Gil
AC Florenz,430,01.02.2024,01.02.2024,-,1,2024-02-01,2024-02-01,,Bryan Gil
FC Sevilla,368,27.01.2023,27.01.2023,-,1,2023-01-27,2023-01-27,,Bryan Gil
Real Sociedad San Sebastián,681,09.08.2022,09.08.2022,-,1,2022-08-09,2022-08-09,,Bryan Gil
Olympique Marseille,244,21.06.2022,21.06.2022,-,1,2022-06-21,2022-06-21,,Bryan Gil
FC Valencia,1049,31.01.2022,31.01.2022,-,1,2022-01-31,2022-01-31,,Bryan Gil
OGC Nizza,417,22.01.2022,22.01.2022,-,1,2022-01-22,2022-01-22,,Bryan Gil
Tottenham Hotspur,148,20.07.2021,20.07.2021,-,1,2021-07-20,2021-07-20,,Bryan Gil
Real Madrid,418,01.04.2021,01.04.2021,-,1,2021-04-01,2021-04-01,,Bryan Gil
FC Arsenal,11,20.02.2021,01.04.2021,-,1,2021-02-20,2021-04-01,,Bryan Gil
FC Barcelona,131,20.02.2021,01.04.2021,-,1,2021-02-20,2021-04-01,,Bryan Gil
Eintracht Frankfurt,24,24.10.2019,24.10.2019,-,1,2019-10-24,2019-10-24,,Bryan Gil
AC Sparta Prag,197,25.12.2024,25.12.2024,-,1,2024-12-25,2024-12-25,,Bryan Reynolds
SK Sturm Graz,122,08.06.2023,25.07.2023,-,1,2023-06-08,2023-07-25,,Bryan Reynolds
KV Kortrijk,601,23.01.2022,23.01.2022,-,1,2022-01-23,2022-01-23,,Bryan Reynolds
RSC Anderlecht,58,02.01.2022,02.01.2022,-,1,2022-01-02,2022-01-02,,Bryan Reynolds
AS Rom,12,27.01.2021,27.01.2021,-,1,2021-01-27,2021-01-27,,Bryan Reynolds
Juventus Turin,506,13.01.2021,13.01.2021,-,1,2021-01-13,2021-01-13,,Bryan Reynolds
Club Brügge,2282,20.12.2020,20.12.2020,-,1,2020-12-20,2020-12-20,,Bryan Reynolds
FC Bayern München II,28,16.11.2019,16.11.2019,-,1,2019-11-16,2019-11-16,,Bryan Reynolds
FC Bayern München U19,1462,04.11.2019,04.11.2019,-,1,2019-11-04,2019-11-04,,Bryan Reynolds
Celta Vigo,940,29.07.2025,29.07.2025,73 %,1,2025-07-29,2025-07-29,73.0,Bryan Zaragoza
FC Porto,720,27.07.2025,27.07.2025,33 %,1,2025-07-27,2025-07-27,33.0,Bryan Zaragoza
AFC Bournemouth,989,27.07.2025,27.07.2025,33 %,1,2025-07-27,2025-07-27,33.0,Bryan Zaragoza
Real Betis Sevilla,150,27.07.2025,27.07.2025,28 %,1,2025-07-27,2025-07-27,28.0,Bryan Zaragoza
Olympiakos Piräus,683,17.07.2025,20.07.2025,38 %,1,2025-07-17,2025-07-20,38.0,Bryan Zaragoza
FC Barcelona,131,14.07.2025,18.07.2025,30 %,1,2025-07-14,2025-07-18,30.0,Bryan Zaragoza
Besiktas JK,114,16.06.2025,16.06.2025,29 %,1,2025-06-16,2025-06-16,29.0,Bryan Zaragoza
FC Villarreal,1050,02.06.2025,02.06.2025,24 %,1,2025-06-02,2025-06-02,24.0,Bryan Zaragoza
CA Osasuna,331,26.12.2024,26.12.2024,-,1,2024-12-26,2024-12-26,,Bryan Zaragoza
Atlético Madrid,13,06.12.2024,06.12.2024,-,1,2024-12-06,2024-12-06,,Bryan Zaragoza
FC Sevilla,368,06.12.2024,06.12.2024,-,1,2024-12-06,2024-12-06,,Bryan Zaragoza
FC Valencia,1049,09.08.2024,09.08.2024,-,1,2024-08-09,2024-08-09,,Bryan Zaragoza
FC Girona,12321,09.08.2024,09.08.2024,-,1,2024-08-09,2024-08-09,,Bryan Zaragoza
Rayo Vallecano,367,28.03.2024,28.03.2024,-,1,2024-03-28,2024-03-28,,Bryan Zaragoza
FC Bayern München,27,31.01.2024,01.02.2024,-,1,2024-01-31,2024-02-01,,Bryan Zaragoza
RB Leipzig,23826,24.11.2023,06.12.2023,-,2,2023-11-24,2023-12-06,,Bryan Zaragoza
Besiktas JK,114,13.06.2019,13.06.2019,-,1,2019-06-13,2019-06-13,,Caiuby
Grasshopper Club Zürich,504,14.02.2019,14.02.2019,-,1,2019-02-14,2019-02-14,,Caiuby
VfB Stuttgart,79,11.07.2014,11.07.2014,-,1,2014-07-11,2014-07-11,,Caiuby
FC Augsburg,167,11.07.2014,11.07.2014,-,1,2014-07-11,2014-07-11,,Caiuby
Hertha BSC,44,15.05.2014,15.05.2014,-,1,2014-05-15,2014-05-15,,Caiuby
FC Ingolstadt 04,4795,18.06.2012,20.06.2012,-,1,2012-06-18,2012-06-20,,Caiuby
Arminia Bielefeld,10,22.12.2010,22.12.2010,-,1,2010-12-22,2010-12-22,,Caiuby
FC Energie Cottbus,25,30.08.2010,31.08.2010,-,1,2010-08-30,2010-08-31,,Caiuby
Leicester City,1003,06.07.2024,06.07.2024,-,1,2024-07-06,2024-07-06,,Caleb Okoli
FC Red Bull Salzburg,409,15.06.2024,16.06.2024,-,1,2024-06-15,2024-06-16,,Caleb Okoli
RB Leipzig,23826,15.06.2024,15.06.2024,-,1,2024-06-15,2024-06-15,,Caleb Okoli
Nottingham Forest,703,01.09.2023,01.09.2023,-,1,2023-09-01,2023-09-01,,Callum Hudson-Odoi
FC Fulham,931,31.08.2023,31.08.2023,-,1,2023-08-31,2023-08-31,,Callum Hudson-Odoi
Lazio Rom,398,24.07.2023,24.07.2023,-,1,2023-07-24,2023-07-24,,Callum Hudson-Odoi
Al-Hilal SFC,1114,21.06.2023,21.06.2023,-,1,2023-06-21,2023-06-21,,Callum Hudson-Odoi
FC Chelsea,631,22.09.2022,22.09.2022,-,1,2022-09-22,2022-09-22,,Callum Hudson-Odoi
Bayer 04 Leverkusen,15,29.08.2022,30.08.2022,-,1,2022-08-29,2022-08-30,,Callum Hudson-Odoi
Borussia Dortmund,16,18.08.2022,18.08.2022,-,1,2022-08-18,2022-08-18,,Callum Hudson-Odoi
FC Southampton,180,08.08.2022,08.08.2022,-,1,2022-08-08,2022-08-08,,Callum Hudson-Odoi
Leicester City,1003,08.08.2022,08.08.2022,-,1,2022-08-08,2022-08-08,,Callum Hudson-Odoi
Juventus Turin,506,08.08.2022,08.08.2022,-,1,2022-08-08,2022-08-08,,Callum Hudson-Odoi
FC Bayern München,27,15.05.2022,16.05.2022,-,1,2022-05-15,2022-05-16,,Callum Hudson-Odoi
Borussia Dortmund,16,03.07.2021,03.07.2021,-,1,2021-07-03,2021-07-03,,Callum Hudson-Odoi
Manchester United,985,02.08.2020,02.08.2020,-,1,2020-08-02,2020-08-02,,Callum Hudson-Odoi
Manchester City,281,02.01.2020,02.01.2020,-,1,2020-01-02,2020-01-02,,Callum Hudson-Odoi
Real Madrid,418,16.11.2019,16.11.2019,-,1,2019-11-16,2019-11-16,,Callum Hudson-Odoi
FC Bayern München,27,09.08.2019,09.08.2019,-,2,2019-08-09,2019-08-09,,Callum Hudson-Odoi
FC Barcelona,131,27.03.2019,27.03.2019,-,2,2019-03-27,2019-03-27,,Callum Hudson-Odoi
FC Paris Saint-Germain,583,21.02.2019,22.02.2019,-,2,2019-02-21,2019-02-22,,Callum Hudson-Odoi
RB Leipzig,23826,27.01.2019,27.01.2019,-,2,2019-01-27,2019-01-27,,Callum Hudson-Odoi
FC Liverpool,31,23.01.2019,23.01.2019,-,2,2019-01-23,2019-01-23,,Callum Hudson-Odoi
West Bromwich Albion,984,09.09.2020,09.09.2020,-,1,2020-09-09,2020-09-09,,Callum Robinson
West Ham United,379,02.08.2025,02.08.2025,-,1,2025-08-02,2025-08-02,,Callum Wilson
FC Everton,29,05.07.2025,05.07.2025,-,1,2025-07-05,2025-07-05,,Callum Wilson
FC Burnley,1132,05.07.2025,05.07.2025,-,1,2025-07-05,2025-07-05,,Callum Wilson
Udinese Calcio,410,05.07.2025,05.07.2025,-,1,2025-07-05,2025-07-05,,Callum Wilson
West Ham United,379,30.06.2024,30.06.2024,-,1,2024-06-30,2024-06-30,,Callum Wilson
Newcastle United,762,05.09.2020,05.09.2020,-,1,2020-09-05,2020-09-05,,Callum Wilson
Aston Villa,405,31.08.2020,31.08.2020,-,1,2020-08-31,2020-08-31,,Callum Wilson
West Ham United,379,02.08.2020,02.08.2020,-,1,2020-08-02,2020-08-02,,Callum Wilson
Manchester United,985,03.10.2019,03.10.2019,-,1,2019-10-03,2019-10-03,,Callum Wilson
FC Chelsea,631,14.01.2019,14.01.2019,-,1,2019-01-14,2019-01-14,,Callum Wilson
FC Everton,29,16.12.2016,16.12.2016,-,1,2016-12-16,2016-12-16,,Callum Wilson
FC Liverpool,31,21.04.2016,21.04.2016,-,1,2016-04-21,2016-04-21,,Callum Wilson
Tottenham Hotspur,148,13.04.2016,13.04.2016,-,1,2016-04-13,2016-04-13,,Callum Wilson
FC Southampton,180,05.05.2015,05.05.2015,-,1,2015-05-05,2015-05-05,,Callum Wilson
Nottingham Forest,703,26.04.2014,26.04.2014,-,1,2014-04-26,2014-04-26,,Callum Wilson
FC Everton,29,17.11.2021,17.11.2021,-,1,2021-11-17,2021-11-17,,Calum Chambers
AS Rom,12,15.11.2021,15.11.2021,-,1,2021-11-15,2021-11-15,,Calum Chambers
FC Fulham,931,07.08.2018,07.08.2018,-,1,2018-08-07,2018-08-07,,Calum Chambers
Crystal Palace,873,17.07.2017,17.07.2017,-,1,2017-07-17,2017-07-17,,Calum Chambers
RB Leipzig,23826,17.06.2017,18.06.2017,-,1,2017-06-17,2017-06-18,,Calum Chambers
Hull City,3008,26.08.2016,26.08.2016,-,1,2016-08-26,2016-08-26,,Calum Chambers
FC Middlesbrough,641,26.08.2016,26.08.2016,-,1,2016-08-26,2016-08-26,,Calum Chambers
Stoke City,512,26.08.2016,26.08.2016,-,1,2016-08-26,2016-08-26,,Calum Chambers
West Ham United,379,26.08.2016,26.08.2016,-,1,2016-08-26,2016-08-26,,Calum Chambers
FC Watford,1010,06.06.2016,07.06.2016,-,1,2016-06-06,2016-06-07,,Calum Chambers
FC Southampton,180,28.07.2015,28.07.2015,-,1,2015-07-28,2015-07-28,,Calum Chambers
FC Arsenal,11,26.07.2014,24.04.2014,-,1,2014-07-26,2014-04-24,,Calum Chambers
Manchester United,985,19.03.2014,19.03.2014,-,1,2014-03-19,2014-03-19,,Calum Chambers
Pisa Sporting Club,4172,26.08.2025,28.08.2025,-,1,2025-08-26,2025-08-28,,Calvin Stengs
Charlotte FC,78435,10.08.2024,10.08.2024,-,1,2024-08-10,2024-08-10,,Calvin Stengs
Lazio Rom,398,14.06.2024,14.06.2024,-,1,2024-06-14,2024-06-14,,Calvin Stengs
Royal Antwerpen FC,1096,30.08.2022,30.08.2022,-,1,2022-08-30,2022-08-30,,Calvin Stengs
PSV Eindhoven,383,27.08.2022,27.08.2022,-,1,2022-08-27,2022-08-27,,Calvin Stengs
Ajax Amsterdam,610,22.06.2022,22.06.2022,-,1,2022-06-22,2022-06-22,,Calvin Stengs
FC Barcelona,131,23.08.2020,23.08.2020,-,1,2020-08-23,2020-08-23,,Calvin Stengs
Borussia Dortmund,16,20.01.2020,21.01.2020,-,1,2020-01-20,2020-01-21,,Calvin Stengs
1.FC Union Berlin,89,15.08.2024,16.08.2024,-,1,2024-08-15,2024-08-16,,Cameron Archer
Sheffield United,350,24.08.2023,27.08.2023,-,1,2023-08-24,2023-08-27,,Cameron Archer
FC Middlesbrough,641,06.01.2023,06.01.2023,-,1,2023-01-06,2023-01-06,,Cameron Archer
FC Valencia,1049,01.07.2021,01.07.2021,-,1,2021-07-01,2021-07-01,,Carles Aleñá
FC Barcelona,131,22.04.2021,22.04.2021,-,1,2021-04-22,2021-04-22,,Carles Aleñá
Bayer 04 Leverkusen,15,18.05.2020,18.05.2020,-,1,2020-05-18,2020-05-18,,Carles Aleñá
FC Getafe,3709,25.11.2019,25.11.2019,-,1,2019-11-25,2019-11-25,,Carles Aleñá
Tottenham Hotspur,148,23.10.2019,23.10.2019,-,1,2019-10-23,2019-10-23,,Carles Aleñá
Ajax Amsterdam,610,09.04.2019,09.04.2019,-,1,2019-04-09,2019-04-09,,Carles Aleñá
Bayer 04 Leverkusen,15,05.06.2022,15.08.2022,-,1,2022-06-05,2022-08-15,,Carles Pérez
Celta Vigo,940,28.07.2022,05.08.2022,-,1,2022-07-28,2022-08-05,,Carles Pérez
Borussia Dortmund,16,30.01.2020,30.01.2020,-,1,2020-01-30,2020-01-30,,Carles Pérez
FC Bayern München,27,30.01.2020,30.01.2020,-,1,2020-01-30,2020-01-30,,Carles Pérez
AS Rom,12,30.01.2020,30.01.2020,-,1,2020-01-30,2020-01-30,,Carles Pérez
FC Everton,29,31.01.2025,31.01.2025,-,1,2025-01-31,2025-01-31,,Carlos Alcaraz
Flamengo Rio de Janeiro,614,11.08.2024,11.08.2024,-,1,2024-08-11,2024-08-11,,Carlos Alcaraz
Juventus Turin,506,31.01.2024,31.01.2024,-,1,2024-01-31,2024-01-31,,Carlos Alcaraz
Newcastle United,762,,24.12.2023,-,1,,2023-12-24,,Carlos Alcaraz
SSC Neapel,6195,04.07.2023,04.07.2023,-,1,2023-07-04,2023-07-04,,Carlos Alcaraz
RB Leipzig,23826,16.06.2023,16.06.2023,-,1,2023-06-16,2023-06-16,,Carlos Alcaraz
FC Southampton,180,09.01.2023,09.01.2023,-,1,2023-01-09,2023-01-09,,Carlos Alcaraz
Inter Mailand,46,12.08.2023,12.08.2023,-,1,2023-08-12,2023-08-12,,Carlos Augusto
Juventus Turin,506,07.08.2023,07.08.2023,-,1,2023-08-07,2023-08-07,,Carlos Augusto
Atalanta Bergamo,800,07.08.2023,07.08.2023,-,1,2023-08-07,2023-08-07,,Carlos Augusto
AC Mailand,5,21.03.2023,22.03.2023,-,1,2023-03-21,2023-03-22,,Carlos Augusto
Sporting Lissabon,336,15.08.2018,15.08.2018,-,1,2018-08-15,2018-08-15,,Carlos Bacca
FC Valencia,1049,01.07.2018,05.07.2018,-,1,2018-07-01,2018-07-05,,Carlos Bacca
Galatasaray,141,01.07.2018,02.07.2018,-,1,2018-07-01,2018-07-02,,Carlos Bacca
Trabzonspor,449,01.07.2018,01.07.2018,-,1,2018-07-01,2018-07-01,,Carlos Bacca
Galatasaray,141,20.06.2018,20.06.2018,-,1,2018-06-20,2018-06-20,,Carlos Bacca
FC Villarreal,1050,16.08.2017,16.08.2017,-,1,2017-08-16,2017-08-16,,Carlos Bacca
FC Sevilla,368,09.08.2017,09.08.2017,-,1,2017-08-09,2017-08-09,,Carlos Bacca
Lazio Rom,398,20.07.2017,20.07.2017,-,1,2017-07-20,2017-07-20,,Carlos Bacca
Olympique Marseille,244,10.07.2017,10.07.2017,-,1,2017-07-10,2017-07-10,,Carlos Bacca
Beijing Guoan,3176,23.02.2017,23.02.2017,-,1,2017-02-23,2017-02-23,,Carlos Bacca
Tianjin Tianhai (-2019),33714,23.02.2017,23.02.2017,-,1,2017-02-23,2017-02-23,,Carlos Bacca
FC Sevilla,368,11.12.2016,11.12.2016,-,1,2016-12-11,2016-12-11,,Carlos Bacca
AC Mailand,5,14.08.2016,14.08.2016,-,1,2016-08-14,2016-08-14,,Carlos Bacca
West Ham United,379,09.08.2016,09.08.2016,-,1,2016-08-09,2016-08-09,,Carlos Bacca
FC Barcelona,131,26.07.2016,26.07.2016,-,1,2016-07-26,2016-07-26,,Carlos Bacca
SSC Neapel,6195,24.07.2016,24.07.2016,-,2,2016-07-24,2016-07-24,,Carlos Bacca
Atlético Madrid,13,18.07.2016,18.07.2016,-,2,2016-07-18,2016-07-18,,Carlos Bacca
FC Bayern München,27,31.03.2016,31.03.2016,-,2,2016-03-31,2016-03-31,,Carlos Bacca
FC Arsenal,11,23.03.2016,23.03.2016,-,2,2016-03-23,2016-03-23,,Carlos Bacca
FC Chelsea,631,10.01.2016,10.01.2016,-,2,2016-01-10,2016-01-10,,Carlos Bacca
FC Liverpool,31,24.06.2015,06.07.2015,-,2,2015-06-24,2015-07-06,,Carlos Bacca
AC Mailand,5,02.07.2015,02.07.2015,-,2,2015-07-02,2015-07-02,,Carlos Bacca
AS Rom,12,24.06.2015,24.06.2015,-,2,2015-06-24,2015-06-24,,Carlos Bacca
Borussia Mönchengladbach,18,19.06.2015,19.06.2015,-,2,2015-06-19,2015-06-19,,Carlos Bacca
Beijing Guoan,3176,19.06.2015,13.06.2015,-,2,2015-06-19,2015-06-13,,Carlos Bacca
Manchester United,985,19.06.2015,21.04.2015,-,2,2015-06-19,2015-04-21,,Carlos Bacca
Tottenham Hotspur,148,19.06.2015,17.04.2015,-,2,2015-06-19,2015-04-17,,Carlos Bacca
SSC Neapel,6195,19.06.2015,29.03.2015,-,2,2015-06-19,2015-03-29,,Carlos Bacca
AS Monaco,162,30.01.2015,30.01.2015,-,2,2015-01-30,2015-01-30,,Carlos Bacca
Atlético Madrid,13,11.08.2014,11.08.2014,-,2,2014-08-11,2014-08-11,,Carlos Bacca
Inter Mailand,46,21.07.2014,21.07.2014,-,3,2014-07-21,2014-07-21,,Carlos Bacca
FC Everton,29,03.04.2014,03.04.2014,-,3,2014-04-03,2014-04-03,,Carlos Bacca
FC Valencia,1049,16.05.2013,16.05.2013,-,3,2013-05-16,2013-05-16,,Carlos Bacca
Fenerbahce,36,22.01.2013,22.01.2013,-,3,2013-01-22,2013-01-22,,Carlos Bacca
Lokomotiv Moskau,932,22.01.2013,22.01.2013,-,3,2013-01-22,2013-01-22,,Carlos Bacca
Kasimpasa,10484,22.01.2013,22.01.2013,-,3,2013-01-22,2013-01-22,,Carlos Bacca
Club Brügge,2282,31.12.2011,31.12.2011,-,3,2011-12-31,2011-12-31,,Carlos Bacca
Hertha BSC,44,30.05.2010,31.05.2010,-,3,2010-05-30,2010-05-31,,Carlos Bacca
AEK Athen,2441,18.06.2017,18.06.2017,-,1,2017-06-18,2017-06-18,,Carlos Clerc
CE Sabadell FC,11422,31.01.2014,31.01.2014,-,1,2014-01-31,2014-01-31,,Carlos Clerc
Bayer 04 Leverkusen,15,05.10.2020,05.10.2020,-,1,2020-10-05,2020-10-05,,Carlos Fernández
SSC Neapel,6195,04.06.2025,04.06.2025,-,1,2025-06-04,2025-06-04,,Carlos Soler
West Ham United,379,22.08.2024,22.08.2024,-,1,2024-08-22,2024-08-22,,Carlos Soler
Brighton & Hove Albion,1237,15.07.2024,15.07.2024,-,1,2024-07-15,2024-07-15,,Carlos Soler
Aston Villa,405,15.05.2024,15.05.2024,-,1,2024-05-15,2024-05-15,,Carlos Soler
Atlético Madrid,13,31.05.2023,31.05.2023,-,1,2023-05-31,2023-05-31,,Carlos Soler
FC Paris Saint-Germain,583,23.08.2022,31.08.2022,-,1,2022-08-23,2022-08-31,,Carlos Soler
SSC Neapel,6195,06.06.2022,07.06.2022,-,1,2022-06-06,2022-06-07,,Carlos Soler
FC Barcelona,131,13.05.2022,13.05.2022,-,1,2022-05-13,2022-05-13,,Carlos Soler
FC Liverpool,31,07.09.2021,07.09.2021,-,1,2021-09-07,2021-09-07,,Carlos Soler
FC Arsenal,11,29.03.2020,29.03.2020,-,1,2020-03-29,2020-03-29,,Carlos Soler
Tottenham Hotspur,148,29.01.2019,29.01.2019,-,1,2019-01-29,2019-01-29,,Carlos Soler
Real Madrid,418,29.03.2018,29.03.2018,-,1,2018-03-29,2018-03-29,,Carlos Soler
Manchester City,281,19.02.2018,19.02.2018,-,1,2018-02-19,2018-02-19,,Carlos Soler
Manchester United,985,19.02.2018,19.02.2018,-,1,2018-02-19,2018-02-19,,Carlos Soler
FC Bayern München,27,09.04.2017,12.04.2017,-,1,2017-04-09,2017-04-12,,Carlos Soler
Corinthians São Paulo,199,19.08.2024,19.08.2024,-,1,2024-08-19,2024-08-19,,Carlos Vinícius
UD Las Palmas,472,19.08.2024,19.08.2024,-,1,2024-08-19,2024-08-19,,Carlos Vinícius
Galatasaray,141,02.02.2024,02.02.2024,-,1,2024-02-02,2024-02-02,,Carlos Vinícius
FC Augsburg,167,31.01.2024,01.02.2024,-,1,2024-01-31,2024-02-01,,Carlos Vinícius
CF Monterrey,2407,28.12.2023,28.12.2023,-,1,2023-12-28,2023-12-28,,Carlos Vinícius
Eintracht Frankfurt,24,30.08.2021,31.08.2021,-,1,2021-08-30,2021-08-31,,Carlos Vinícius
PSV Eindhoven,383,30.08.2021,30.08.2021,-,1,2021-08-30,2021-08-30,,Carlos Vinícius
Tottenham Hotspur,148,02.10.2020,02.10.2020,-,1,2020-10-02,2020-10-02,,Carlos Vinícius
Wolverhampton Wanderers,543,16.05.2020,16.05.2020,-,1,2020-05-16,2020-05-16,,Carlos Vinícius
Manchester United,985,16.05.2020,16.05.2020,-,1,2020-05-16,2020-05-16,,Carlos Vinícius
FC Liverpool,31,12.02.2020,12.02.2020,-,1,2020-02-12,2020-02-12,,Carlos Vinícius
AS Monaco,162,31.01.2019,31.01.2019,-,1,2019-01-31,2019-01-31,,Carlos Vinícius
Borussia Dortmund,16,26.08.2025,26.08.2025,69 %,1,2025-08-26,2025-08-26,69.0,Carney Chukwuemeka
RB Leipzig,23826,03.08.2025,03.08.2025,29 %,1,2025-08-03,2025-08-03,29.0,Carney Chukwuemeka
Juventus Turin,506,27.01.2025,27.01.2025,-,1,2025-01-27,2025-01-27,,Carney Chukwuemeka
Lazio Rom,398,11.01.2025,11.01.2025,-,1,2025-01-11,2025-01-11,,Carney Chukwuemeka
West Ham United,379,05.01.2025,05.01.2025,-,1,2025-01-05,2025-01-05,,Carney Chukwuemeka
Crystal Palace,873,19.12.2024,02.01.2025,-,1,2024-12-19,2025-01-02,,Carney Chukwuemeka
FC Barcelona,131,22.10.2024,22.10.2024,-,1,2024-10-22,2024-10-22,,Carney Chukwuemeka
Galatasaray,141,12.09.2024,13.09.2024,-,1,2024-09-12,2024-09-13,,Carney Chukwuemeka
AC Mailand,5,27.06.2024,27.06.2024,-,1,2024-06-27,2024-06-27,,Carney Chukwuemeka
Borussia Dortmund,16,02.08.2022,02.08.2022,-,1,2022-08-02,2022-08-02,,Carney Chukwuemeka
FC Barcelona,131,12.07.2022,12.07.2022,-,1,2022-07-12,2022-07-12,,Carney Chukwuemeka
Borussia Dortmund,16,20.05.2021,25.05.2021,-,1,2021-05-20,2021-05-25,,Carney Chukwuemeka
Manchester United,985,21.05.2021,21.05.2021,-,1,2021-05-21,2021-05-21,,Carney Chukwuemeka
Manchester City,281,21.05.2021,21.05.2021,-,1,2021-05-21,2021-05-21,,Carney Chukwuemeka
FC Bayern München,27,20.05.2021,20.05.2021,-,1,2021-05-20,2021-05-20,,Carney Chukwuemeka
FC Liverpool,31,16.05.2021,16.05.2021,-,2,2021-05-16,2021-05-16,,Carney Chukwuemeka
RB Leipzig,23826,24.04.2021,24.04.2021,-,2,2021-04-24,2021-04-24,,Carney Chukwuemeka
Manchester United,985,11.04.2020,11.04.2020,-,2,2020-04-11,2020-04-11,,Carney Chukwuemeka
AS Rom,12,28.01.2025,28.01.2025,-,1,2025-01-28,2025-01-28,,Casemiro
Besiktas JK,114,20.01.2025,20.01.2025,-,1,2025-01-20,2025-01-20,,Casemiro
Al-Nassr FC,18544,07.01.2025,07.01.2025,-,1,2025-01-07,2025-01-07,,Casemiro
Galatasaray,141,05.09.2024,05.09.2024,-,1,2024-09-05,2024-09-05,,Casemiro
Al-Ittihad Club,8023,12.07.2024,12.07.2024,-,1,2024-07-12,2024-07-12,,Casemiro
Al-Qadisiyah,98723,15.05.2024,15.05.2024,-,1,2024-05-15,2024-05-15,,Casemiro
Al-Ahli SC,3612,15.05.2024,15.05.2024,-,1,2024-05-15,2024-05-15,,Casemiro
Real Madrid,418,25.02.2024,26.02.2024,-,1,2024-02-25,2024-02-26,,Casemiro
FC Bayern München,27,27.04.2023,29.04.2023,-,1,2023-04-27,2023-04-29,,Casemiro
Manchester United,985,19.08.2022,19.08.2022,-,1,2022-08-19,2022-08-19,,Casemiro
Juventus Turin,506,06.05.2022,06.05.2022,-,1,2022-05-06,2022-05-06,,Casemiro
FC Paris Saint-Germain,583,17.04.2018,17.04.2018,-,1,2018-04-17,2018-04-17,,Casemiro
FC Everton,29,20.02.2015,20.02.2015,-,1,2015-02-20,2015-02-20,,Casemiro
Real Sociedad San Sebastián,681,07.10.2013,07.10.2013,-,1,2013-10-07,2013-10-07,,Casemiro
Lazio Rom,398,08.01.2013,09.01.2013,-,1,2013-01-08,2013-01-09,,Casemiro
Genua CFC,252,15.04.2012,15.04.2012,-,2,2012-04-15,2012-04-15,,Casemiro
FC Villarreal,1050,21.01.2012,23.01.2012,-,2,2012-01-21,2012-01-23,,Casemiro
FC Arsenal,11,25.12.2011,31.12.2011,-,2,2011-12-25,2011-12-31,,Casemiro
AS Rom,12,23.12.2011,27.12.2011,-,2,2011-12-23,2011-12-27,,Casemiro
Juventus Turin,506,25.12.2011,25.12.2011,-,2,2011-12-25,2011-12-25,,Casemiro
AC Mailand,5,23.12.2011,23.12.2011,-,2,2011-12-23,2011-12-23,,Casemiro
Inter Mailand,46,23.12.2011,23.12.2011,-,2,2011-12-23,2011-12-23,,Casemiro
Tottenham Hotspur,148,18.10.2011,18.10.2011,-,2,2011-10-18,2011-10-18,,Casemiro
FC Bayern München,27,04.08.2011,05.08.2011,-,2,2011-08-04,2011-08-05,,Casemiro
FC Chelsea,631,16.02.2011,19.02.2011,-,2,2011-02-16,2011-02-19,,Casemiro
Quevilly - Rouen Métropole,7124,09.01.2022,09.01.2022,-,1,2022-01-09,2022-01-09,,Casimir Ninga
FC Liverpool,31,27.05.2025,27.05.2025,-,1,2025-05-27,2025-05-27,,Castello Lukeba
Manchester City,281,20.11.2024,20.11.2024,-,1,2024-11-20,2024-11-20,,Castello Lukeba
Real Madrid,418,19.11.2024,19.11.2024,-,1,2024-11-19,2024-11-19,,Castello Lukeba
FC Chelsea,631,23.04.2024,22.08.2024,-,1,2024-04-23,2024-08-22,,Castello Lukeba
Manchester United,985,23.04.2024,23.04.2024,-,1,2024-04-23,2024-04-23,,Castello Lukeba
RB Leipzig,23826,10.08.2023,11.08.2023,-,1,2023-08-10,2023-08-11,,Castello Lukeba
FC Chelsea,631,31.12.2022,31.12.2022,-,1,2022-12-31,2022-12-31,,Castello Lukeba
St. Louis CITY SC,82686,29.05.2024,29.05.2024,-,1,2024-05-29,2024-05-29,,Cedric Teuchert
1.FC Union Berlin,89,01.08.2020,01.08.2020,-,1,2020-08-01,2020-08-01,,Cedric Teuchert
Hannover 96,42,05.06.2020,06.06.2020,-,1,2020-06-05,2020-06-06,,Cedric Teuchert
Hannover 96,42,18.02.2020,19.02.2020,-,1,2020-02-18,2020-02-19,,Cedric Teuchert
Hannover 96,42,01.07.2019,02.07.2019,-,1,2019-07-01,2019-07-02,,Cedric Teuchert
VfB Stuttgart,79,24.06.2019,25.06.2019,-,1,2019-06-24,2019-06-25,,Cedric Teuchert
FC Schalke 04,33,02.01.2018,03.01.2018,-,1,2018-01-02,2018-01-03,,Cedric Teuchert
SV Werder Bremen,86,02.01.2018,02.01.2018,-,1,2018-01-02,2018-01-02,,Cedric Teuchert
1.FSV Mainz 05,39,20.12.2017,02.01.2018,-,1,2017-12-20,2018-01-02,,Cedric Teuchert
VfL Wolfsburg,82,23.12.2017,27.12.2017,-,1,2017-12-23,2017-12-27,,Cedric Teuchert
VfB Stuttgart,79,22.12.2017,23.12.2017,-,1,2017-12-22,2017-12-23,,Cedric Teuchert
Hertha BSC,44,12.12.2017,18.12.2017,-,1,2017-12-12,2017-12-18,,Cedric Teuchert
Los Angeles FC,51828,15.02.2025,15.02.2025,-,1,2025-02-15,2025-02-15,,Cengiz Ünder
Besiktas JK,114,28.01.2025,28.01.2025,-,1,2025-01-28,2025-01-28,,Cengiz Ünder
FC Turin,416,17.01.2025,17.01.2025,-,1,2025-01-17,2025-01-17,,Cengiz Ünder
Al-Shabab FC,9840,29.12.2024,29.12.2024,-,1,2024-12-29,2024-12-29,,Cengiz Ünder
Fenerbahce,36,15.08.2023,15.08.2023,-,1,2023-08-15,2023-08-15,,Cengiz Ünder
Bayer 04 Leverkusen,15,19.06.2021,05.07.2021,-,1,2021-06-19,2021-07-05,,Cengiz Ünder
Eintracht Frankfurt,24,19.06.2021,04.07.2021,-,1,2021-06-19,2021-07-04,,Cengiz Ünder
Olympique Marseille,244,29.06.2021,29.06.2021,-,1,2021-06-29,2021-06-29,,Cengiz Ünder
RB Leipzig,23826,20.06.2021,20.06.2021,-,1,2021-06-20,2021-06-20,,Cengiz Ünder
AC Florenz,430,15.06.2021,15.06.2021,-,1,2021-06-15,2021-06-15,,Cengiz Ünder
Hertha BSC,44,20.09.2020,20.09.2020,-,1,2020-09-20,2020-09-20,,Cengiz Ünder
Leicester City,1003,16.09.2020,16.09.2020,-,1,2020-09-16,2020-09-16,,Cengiz Ünder
Newcastle United,762,14.09.2020,14.09.2020,-,1,2020-09-14,2020-09-14,,Cengiz Ünder
SSC Neapel,6195,11.09.2020,11.09.2020,-,1,2020-09-11,2020-09-11,,Cengiz Ünder
Juventus Turin,506,06.06.2020,06.06.2020,-,1,2020-06-06,2020-06-06,,Cengiz Ünder
FC Bayern München,27,04.06.2020,05.06.2020,-,2,2020-06-04,2020-06-05,,Cengiz Ünder
FC Everton,29,20.03.2020,20.03.2020,-,2,2020-03-20,2020-03-20,,Cengiz Ünder
AC Mailand,5,17.01.2020,17.01.2020,-,2,2020-01-17,2020-01-17,,Cengiz Ünder
Manchester United,985,15.01.2019,15.01.2019,-,2,2019-01-15,2019-01-15,,Cengiz Ünder
FC Arsenal,11,02.01.2019,02.01.2019,-,2,2019-01-02,2019-01-02,,Cengiz Ünder
Tottenham Hotspur,148,06.11.2018,06.11.2018,-,2,2018-11-06,2018-11-06,,Cengiz Ünder
Borussia Dortmund,16,11.10.2018,14.10.2018,-,2,2018-10-11,2018-10-14,,Cengiz Ünder
Manchester City,281,18.07.2018,18.07.2018,-,2,2018-07-18,2018-07-18,,Cengiz Ünder
SC Freiburg,60,15.07.2017,15.07.2017,-,2,2017-07-15,2017-07-15,,Cengiz Ünder
AS Rom,12,12.07.2017,14.07.2017,-,2,2017-07-12,2017-07-14,,Cengiz Ünder
Manchester City,281,06.07.2017,06.07.2017,-,2,2017-07-06,2017-07-06,,Cengiz Ünder
FC Chelsea,631,06.07.2017,06.07.2017,-,2,2017-07-06,2017-07-06,,Cengiz Ünder
Manchester United,985,06.07.2017,06.07.2017,-,2,2017-07-06,2017-07-06,,Cengiz Ünder
VfL Wolfsburg,82,19.05.2017,09.06.2017,-,2,2017-05-19,2017-06-09,,Cengiz Ünder
Borussia Dortmund,16,12.05.2017,13.05.2017,-,2,2017-05-12,2017-05-13,,Cengiz Ünder
Bayer 04 Leverkusen,15,04.05.2017,04.05.2017,-,3,2017-05-04,2017-05-04,,Cengiz Ünder
Fenerbahce,36,12.07.2024,12.07.2024,-,1,2024-07-12,2024-07-12,,Cenk Tosun
Chicago Fire FC,432,05.03.2023,05.03.2023,-,1,2023-03-05,2023-03-05,,Cenk Tosun
Besiktas JK,114,31.01.2021,31.01.2021,-,1,2021-01-31,2021-01-31,,Cenk Tosun
FC Schalke 04,33,30.01.2021,31.01.2021,-,1,2021-01-30,2021-01-31,,Cenk Tosun
ZSKA Moskau,2410,29.01.2021,31.01.2021,-,1,2021-01-29,2021-01-31,,Cenk Tosun
Celta Vigo,940,29.01.2021,31.01.2021,-,1,2021-01-29,2021-01-31,,Cenk Tosun
West Bromwich Albion,984,31.12.2020,31.01.2021,-,1,2020-12-31,2021-01-31,,Cenk Tosun
Eintracht Frankfurt,24,30.01.2021,30.01.2021,-,1,2021-01-30,2021-01-30,,Cenk Tosun
Hertha BSC,44,30.01.2021,30.01.2021,-,1,2021-01-30,2021-01-30,,Cenk Tosun
Crystal Palace,873,08.01.2020,10.01.2020,-,1,2020-01-08,2020-01-10,,Cenk Tosun
Newcastle United,762,03.01.2020,03.01.2020,-,1,2020-01-03,2020-01-03,,Cenk Tosun
Aston Villa,405,03.01.2020,03.01.2020,-,1,2020-01-03,2020-01-03,,Cenk Tosun
Borussia Dortmund,16,22.05.2019,18.06.2019,-,1,2019-05-22,2019-06-18,,Cenk Tosun
FC Everton,29,05.01.2018,05.01.2018,-,1,2018-01-05,2018-01-05,,Cenk Tosun
AS Rom,12,31.12.2017,31.12.2017,-,1,2017-12-31,2017-12-31,,Cenk Tosun
Crystal Palace,873,21.12.2017,21.12.2017,-,2,2017-12-21,2017-12-21,,Cenk Tosun
VfB Stuttgart,79,15.12.2017,20.12.2017,-,2,2017-12-15,2017-12-20,,Cenk Tosun
VfL Wolfsburg,82,29.10.2017,29.10.2017,-,2,2017-10-29,2017-10-29,,Cenk Tosun
Tottenham Hotspur,148,19.09.2017,19.09.2017,-,2,2017-09-19,2017-09-19,,Cenk Tosun
Bayer 04 Leverkusen,15,28.03.2017,29.03.2017,-,2,2017-03-28,2017-03-29,,Cenk Tosun
West Ham United,379,02.03.2017,02.03.2017,-,2,2017-03-02,2017-03-02,,Cenk Tosun
Besiktas JK,114,04.02.2014,04.02.2014,-,2,2014-02-04,2014-02-04,,Cenk Tosun
Fenerbahce,36,02.02.2014,03.02.2014,-,2,2014-02-02,2014-02-03,,Cenk Tosun
Bursaspor,20,13.11.2013,13.11.2013,-,2,2013-11-13,2013-11-13,,Cenk Tosun
Trabzonspor,449,17.07.2013,17.07.2013,-,2,2013-07-17,2013-07-17,,Cenk Tosun
Eintracht Frankfurt,24,20.11.2012,22.11.2012,-,2,2012-11-20,2012-11-22,,Cenk Tosun
Gaziantepspor (-2020),524,26.01.2011,26.01.2011,-,2,2011-01-26,2011-01-26,,Cenk Tosun
Galatasaray,141,26.01.2011,26.01.2011,-,2,2011-01-26,2011-01-26,,Cenk Tosun
1.FSV Mainz 05,39,06.01.2011,07.01.2011,-,2,2011-01-06,2011-01-07,,Cenk Tosun
VfL Bochum,80,02.01.2011,03.01.2011,-,2,2011-01-02,2011-01-03,,Cenk Tosun
Karlsruher SC,48,30.12.2010,30.12.2010,-,3,2010-12-30,2010-12-30,,Cenk Tosun
1.FC Köln,3,06.08.2025,09.08.2025,80 %,1,2025-08-06,2025-08-09,80.0,Cenk Özkacar
Besiktas JK,114,03.02.2025,03.02.2025,-,1,2025-02-03,2025-02-03,,Cenk Özkacar
FC Valencia,1049,22.08.2022,22.08.2022,-,1,2022-08-22,2022-08-22,,Cenk Özkacar
Olympique Lyon,1041,03.08.2020,19.08.2020,-,1,2020-08-03,2020-08-19,,Cenk Özkacar
Lazio Rom,398,29.01.2025,02.02.2025,-,1,2025-01-29,2025-02-02,,Cesare Casadei
FC Turin,416,31.01.2025,31.01.2025,-,1,2025-01-31,2025-01-31,,Cesare Casadei
AS Monaco,162,17.01.2025,17.01.2025,-,1,2025-01-17,2025-01-17,,Cesare Casadei
SSC Neapel,6195,08.01.2025,08.01.2025,-,1,2025-01-08,2025-01-08,,Cesare Casadei
AC Monza,2919,19.12.2024,19.12.2024,-,1,2024-12-19,2024-12-19,,Cesare Casadei
Feyenoord Rotterdam,234,19.11.2024,19.11.2024,-,1,2024-11-19,2024-11-19,,Cesare Casadei
PSV Eindhoven,383,19.11.2024,19.11.2024,-,1,2024-11-19,2024-11-19,,Cesare Casadei
Real Betis Sevilla,150,19.11.2024,19.11.2024,-,1,2024-11-19,2024-11-19,,Cesare Casadei
Genua CFC,252,09.08.2023,09.08.2023,-,1,2023-08-09,2023-08-09,,Cesare Casadei
Leicester City,1003,09.08.2023,09.08.2023,-,1,2023-08-09,2023-08-09,,Cesare Casadei
Aston Villa,405,10.06.2023,10.06.2023,-,1,2023-06-10,2023-06-10,,Cesare Casadei
FC Chelsea,631,15.08.2022,15.08.2022,-,1,2022-08-15,2022-08-15,,Cesare Casadei
OGC Nizza,417,10.08.2022,10.08.2022,-,1,2022-08-10,2022-08-10,,Cesare Casadei
Como 1907,1047,01.08.2022,01.08.2022,-,1,2022-08-01,2022-08-01,,Cesc Fàbregas
AS Monaco,162,08.01.2019,09.01.2019,-,1,2019-01-08,2019-01-09,,Cesc Fàbregas
Fenerbahce,36,26.11.2018,02.01.2019,-,1,2018-11-26,2019-01-02,,Cesc Fàbregas
AC Mailand,5,28.11.2018,28.11.2018,-,1,2018-11-28,2018-11-28,,Cesc Fàbregas
FC Arsenal,11,28.10.2018,28.10.2018,-,1,2018-10-28,2018-10-28,,Cesc Fàbregas
Manchester United,985,31.10.2017,31.10.2017,-,1,2017-10-31,2017-10-31,,Cesc Fàbregas
Olympique Marseille,244,01.05.2017,01.05.2017,-,1,2017-05-01,2017-05-01,,Cesc Fàbregas
Olympique Marseille,244,01.05.2017,01.05.2017,-,1,2017-05-01,2017-05-01,,Cesc Fàbregas
FC Arsenal,11,04.12.2016,04.12.2016,-,1,2016-12-04,2016-12-04,,Cesc Fàbregas
West Ham United,379,09.11.2016,09.11.2016,-,1,2016-11-09,2016-11-09,,Cesc Fàbregas
Manchester City,281,23.10.2016,23.10.2016,-,1,2016-10-23,2016-10-23,,Cesc Fàbregas
Juventus Turin,506,12.09.2016,12.09.2016,-,1,2016-09-12,2016-09-12,,Cesc Fàbregas
FC Bayern München,27,28.12.2015,01.01.2016,-,1,2015-12-28,2016-01-01,,Cesc Fàbregas
Manchester United,985,04.05.2014,04.05.2014,-,1,2014-05-04,2014-05-04,,Cesc Fàbregas
FC Barcelona,131,15.08.2011,15.08.2011,-,1,2011-08-15,2011-08-15,,Cesc Fàbregas
FC Chelsea,631,12.06.2014,11.02.2011,-,2,2014-06-12,2011-02-11,,Cesc Fàbregas
Real Madrid,418,30.05.2010,30.05.2010,-,2,2010-05-30,2010-05-30,,Cesc Fàbregas
Inter Mailand,46,23.03.2010,24.03.2010,-,2,2010-03-23,2010-03-24,,Cesc Fàbregas
Genclerbirligi Ankara,820,04.06.2025,04.06.2025,81 %,1,2025-06-04,2025-06-04,81.0,Chadrac Akolo
1.FC Nürnberg,4,30.07.2019,30.07.2019,-,1,2019-07-30,2019-07-30,,Chadrac Akolo
Amiens SC,1416,30.07.2019,30.07.2019,-,1,2019-07-30,2019-07-30,,Chadrac Akolo
Olympique Marseille,244,12.08.2018,13.08.2018,-,1,2018-08-12,2018-08-13,,Chadrac Akolo
RC Straßburg Alsace,667,11.08.2018,12.08.2018,-,1,2018-08-11,2018-08-12,,Chadrac Akolo
VfB Stuttgart,79,09.07.2017,09.07.2017,-,1,2017-07-09,2017-07-09,,Chadrac Akolo
FC Stade Rennes,273,15.01.2017,15.01.2017,-,1,2017-01-15,2017-01-15,,Chadrac Akolo
Olympique Marseille,244,08.01.2017,15.01.2017,-,1,2017-01-08,2017-01-15,,Chadrac Akolo
,,02.02.2016,02.02.2016,-,1,2016-02-02,2016-02-02,,Chadrac Akolo
Leicester City,1003,28.12.2024,28.12.2024,-,1,2024-12-28,2024-12-28,,Chancel Mbemba
Olympique Marseille,244,15.07.2022,15.07.2022,-,1,2022-07-15,2022-07-15,,Chancel Mbemba
Besiktas JK,114,31.12.2018,31.12.2018,-,1,2018-12-31,2018-12-31,,Chancel Mbemba
FC Porto,720,23.07.2018,23.07.2018,-,1,2018-07-23,2018-07-23,,Chancel Mbemba
TSG 1899 Hoffenheim,533,27.05.2018,28.05.2018,-,1,2018-05-27,2018-05-28,,Chancel Mbemba
West Ham United,379,12.01.2018,12.01.2018,-,1,2018-01-12,2018-01-12,,Chancel Mbemba
Crystal Palace,873,30.01.2017,30.01.2017,-,1,2017-01-30,2017-01-30,,Chancel Mbemba
RSC Anderlecht,58,05.01.2017,05.01.2017,-,1,2017-01-05,2017-01-05,,Chancel Mbemba
FC Arsenal,11,24.08.2016,25.08.2016,-,1,2016-08-24,2016-08-25,,Chancel Mbemba
Newcastle United,762,30.07.2015,30.07.2015,-,1,2015-07-30,2015-07-30,,Chancel Mbemba
Borussia Mönchengladbach,18,03.07.2015,28.07.2015,-,1,2015-07-03,2015-07-28,,Chancel Mbemba
VfL Wolfsburg,82,09.07.2015,10.07.2015,-,1,2015-07-09,2015-07-10,,Chancel Mbemba
Atlético Madrid,13,23.04.2015,04.07.2015,-,1,2015-04-23,2015-07-04,,Chancel Mbemba
FC Porto,720,27.05.2015,27.05.2015,-,1,2015-05-27,2015-05-27,,Chancel Mbemba
SSC Neapel,6195,19.07.2021,19.07.2021,-,1,2021-07-19,2021-07-19,,Charalampos Lykogiannis
Cagliari Calcio,1390,18.01.2018,22.01.2018,-,1,2018-01-18,2018-01-22,,Charalampos Lykogiannis
Olympiakos Piräus,683,18.11.2017,20.11.2017,-,1,2017-11-18,2017-11-20,,Charalampos Lykogiannis
AS Saint-Étienne,618,03.07.2017,03.07.2017,-,1,2017-07-03,2017-07-03,,Charalampos Lykogiannis
CF Montréal,4078,30.06.2017,30.06.2017,-,1,2017-06-30,2017-06-30,,Charalampos Lykogiannis
FC Red Bull Salzburg,409,24.06.2017,24.06.2017,-,1,2017-06-24,2017-06-24,,Charalampos Lykogiannis
SK Rapid Wien,170,14.01.2017,17.01.2017,-,1,2017-01-14,2017-01-17,,Charalampos Lykogiannis
Manchester City,281,17.02.2025,17.02.2025,-,1,2025-02-17,2025-02-17,,Charles De Ketelaere
FC Liverpool,31,15.12.2024,15.12.2024,-,1,2024-12-15,2024-12-15,,Charles De Ketelaere
Atalanta Bergamo,800,13.06.2024,29.08.2024,-,1,2024-06-13,2024-08-29,,Charles De Ketelaere
Real Sociedad San Sebastián,681,02.08.2023,02.08.2023,-,1,2023-08-02,2023-08-02,,Charles De Ketelaere
PSV Eindhoven,383,17.07.2023,17.07.2023,-,1,2023-07-17,2023-07-17,,Charles De Ketelaere
RB Leipzig,23826,,14.07.2023,-,1,,2023-07-14,,Charles De Ketelaere
AC Monza,2919,07.05.2023,07.05.2023,-,1,2023-05-07,2023-05-07,,Charles De Ketelaere
AC Mailand,5,02.08.2022,02.08.2022,-,1,2022-08-02,2022-08-02,,Charles De Ketelaere
FC Everton,29,09.07.2022,09.07.2022,-,1,2022-07-09,2022-07-09,,Charles De Ketelaere
Leeds United,399,09.07.2022,09.07.2022,-,1,2022-07-09,2022-07-09,,Charles De Ketelaere
Leicester City,1003,13.05.2022,13.05.2022,-,1,2022-05-13,2022-05-13,,Charles De Ketelaere
Borussia Dortmund,16,02.05.2022,02.05.2022,-,1,2022-05-02,2022-05-02,,Charles De Ketelaere
Lazio Rom,398,29.03.2022,29.03.2022,-,1,2022-03-29,2022-03-29,,Charles De Ketelaere
Tottenham Hotspur,148,22.01.2022,22.01.2022,-,1,2022-01-22,2022-01-22,,Charles De Ketelaere
Manchester City,281,24.10.2021,24.10.2021,-,1,2021-10-24,2021-10-24,,Charles De Ketelaere
FC Liverpool,31,11.10.2021,11.10.2021,-,2,2021-10-11,2021-10-11,,Charles De Ketelaere
Atalanta Bergamo,800,01.06.2020,01.06.2020,-,2,2020-06-01,2020-06-01,,Charles De Ketelaere
Inter Mailand,46,26.05.2020,26.05.2020,-,2,2020-05-26,2020-05-26,,Charles De Ketelaere
Derby County,22,03.10.2020,03.10.2020,-,1,2020-10-03,2020-10-03,,Charlie Austin
Galatasaray,141,25.01.2019,26.01.2019,-,1,2019-01-25,2019-01-26,,Charlie Austin
Wolverhampton Wanderers,543,25.01.2019,25.01.2019,-,1,2019-01-25,2019-01-25,,Charlie Austin
Leicester City,1003,04.04.2018,04.04.2018,-,1,2018-04-04,2018-04-04,,Charlie Austin
AFC Bournemouth,989,04.04.2018,04.04.2018,-,1,2018-04-04,2018-04-04,,Charlie Austin
Aston Villa,405,04.04.2018,04.04.2018,-,1,2018-04-04,2018-04-04,,Charlie Austin
FC Southampton,180,16.01.2016,16.01.2016,-,1,2016-01-16,2016-01-16,,Charlie Austin
Aston Villa,405,16.12.2015,29.12.2015,-,1,2015-12-16,2015-12-29,,Charlie Austin
AFC Bournemouth,989,09.11.2015,09.11.2015,-,1,2015-11-09,2015-11-09,,Charlie Austin
Derby County,22,08.11.2015,08.11.2015,-,1,2015-11-08,2015-11-08,,Charlie Austin
AFC Sunderland,289,04.11.2015,04.11.2015,-,1,2015-11-04,2015-11-04,,Charlie Austin
Newcastle United,762,14.09.2015,14.09.2015,-,1,2015-09-14,2015-09-14,,Charlie Austin
Manchester United,985,31.08.2015,31.08.2015,-,1,2015-08-31,2015-08-31,,Charlie Austin
West Ham United,379,17.08.2015,17.08.2015,-,1,2015-08-17,2015-08-17,,Charlie Austin
Tottenham Hotspur,148,06.08.2015,06.08.2015,-,1,2015-08-06,2015-08-06,,Charlie Austin
Crystal Palace,873,22.06.2015,22.06.2015,-,2,2015-06-22,2015-06-22,,Charlie Austin
FC Chelsea,631,12.06.2015,27.04.2015,-,2,2015-06-12,2015-04-27,,Charlie Austin
FC Everton,29,21.04.2015,21.04.2015,-,2,2015-04-21,2015-04-21,,Charlie Austin
FC Liverpool,31,30.11.2014,30.11.2014,-,2,2014-11-30,2014-11-30,,Charlie Austin
Aston Villa,405,20.05.2013,20.05.2013,-,2,2013-05-20,2013-05-20,,Charlie Austin
Celtic Glasgow,371,08.05.2013,08.05.2013,-,2,2013-05-08,2013-05-08,,Charlie Austin
Leicester City,1003,03.03.2020,03.03.2020,-,1,2020-03-03,2020-03-03,,Charlie Taylor
FC Burnley,1132,25.07.2017,25.07.2017,-,1,2017-07-25,2017-07-25,,Charlie Taylor
West Bromwich Albion,984,11.12.2016,11.12.2016,-,1,2016-12-11,2016-12-11,,Charlie Taylor
Leicester City,1003,26.10.2016,26.10.2016,-,1,2016-10-26,2016-10-26,,Charlie Taylor
Newcastle United,762,07.07.2016,07.07.2016,-,1,2016-07-07,2016-07-07,,Charlie Taylor
FC Middlesbrough,641,07.07.2016,07.07.2016,-,1,2016-07-07,2016-07-07,,Charlie Taylor
FC Liverpool,31,18.05.2016,18.05.2016,-,1,2016-05-18,2016-05-18,,Charlie Taylor
FC Arsenal,11,18.05.2016,18.05.2016,-,1,2016-05-18,2016-05-18,,Charlie Taylor
Hellas Verona,276,21.03.2022,21.03.2022,-,1,2022-03-21,2022-03-21,,Charly Musonda Jr.
AS Rom,12,21.03.2022,21.03.2022,-,1,2022-03-21,2022-03-21,,Charly Musonda Jr.
West Bromwich Albion,984,30.01.2018,30.01.2018,-,1,2018-01-30,2018-01-30,,Charly Musonda Jr.
Newcastle United,762,10.01.2018,10.01.2018,-,1,2018-01-10,2018-01-10,,Charly Musonda Jr.
FC Watford,1010,10.01.2018,10.01.2018,-,1,2018-01-10,2018-01-10,,Charly Musonda Jr.
AFC Bournemouth,989,10.01.2018,10.01.2018,-,1,2018-01-10,2018-01-10,,Charly Musonda Jr.
FC Arsenal,11,03.11.2017,03.11.2017,-,1,2017-11-03,2017-11-03,,Charly Musonda Jr.
AS Rom,12,26.12.2016,26.12.2016,-,1,2016-12-26,2016-12-26,,Charly Musonda Jr.
Fenerbahce,36,23.06.2016,23.06.2016,-,1,2016-06-23,2016-06-23,,Charly Musonda Jr.
Borussia Dortmund,16,02.06.2016,02.06.2016,-,1,2016-06-02,2016-06-02,,Charly Musonda Jr.
Bayer 04 Leverkusen,15,19.01.2016,19.01.2016,-,1,2016-01-19,2016-01-19,,Charly Musonda Jr.
Queens Park Rangers,1039,22.12.2015,22.12.2015,-,1,2015-12-22,2015-12-22,,Charly Musonda Jr.
Feyenoord Rotterdam,234,22.12.2015,22.12.2015,-,1,2015-12-22,2015-12-22,,Charly Musonda Jr.
AZ Alkmaar,1090,22.12.2015,22.12.2015,-,1,2015-12-22,2015-12-22,,Charly Musonda Jr.
Manchester City,281,07.12.2015,07.12.2015,-,1,2015-12-07,2015-12-07,,Charly Musonda Jr.
FC Paris Saint-Germain,583,11.11.2015,11.11.2015,-,2,2015-11-11,2015-11-11,,Charly Musonda Jr.
Manchester United,985,11.11.2015,11.11.2015,-,2,2015-11-11,2015-11-11,,Charly Musonda Jr.
AS Monaco,162,05.11.2015,05.11.2015,-,2,2015-11-05,2015-11-05,,Charly Musonda Jr.
FC Arsenal,11,27.06.2015,27.06.2015,-,2,2015-06-27,2015-06-27,,Charly Musonda Jr.
Zulte Waregem,3508,12.02.2014,12.02.2014,-,2,2014-02-12,2014-02-12,,Charly Musonda Jr.
FC Liverpool,31,20.07.2023,20.07.2023,-,1,2023-07-20,2023-07-20,,Cheick Doucouré
Crystal Palace,873,28.06.2022,28.06.2022,-,1,2022-06-28,2022-06-28,,Cheick Doucouré
FC Everton,29,28.05.2022,28.05.2022,-,1,2022-05-28,2022-05-28,,Cheick Doucouré
VfL Wolfsburg,82,20.04.2022,20.04.2022,-,1,2022-04-20,2022-04-20,,Cheick Doucouré
Olympique Marseille,244,12.05.2021,12.05.2021,-,1,2021-05-12,2021-05-12,,Cheick Doucouré
FC Basel 1893,26,12.01.2019,14.01.2019,-,1,2019-01-12,2019-01-14,,Cheikh M'Bengue
1.FC Köln,3,07.01.2019,08.01.2019,-,1,2019-01-07,2019-01-08,,Cheikh M'Bengue
Hamburger SV,41,27.06.2016,27.06.2016,-,1,2016-06-27,2016-06-27,,Cheikh M'Bengue
AFC Sunderland,289,25.06.2016,25.06.2016,-,1,2016-06-25,2016-06-25,,Cheikh M'Bengue
Stoke City,512,12.05.2015,12.05.2015,-,1,2015-05-12,2015-05-12,,Cheikh M'Bengue
FC Everton,29,12.05.2015,12.05.2015,-,1,2015-05-12,2015-05-12,,Cheikh M'Bengue
Bayer 04 Leverkusen,15,12.05.2015,12.05.2015,-,1,2015-05-12,2015-05-12,,Cheikh M'Bengue
FC Stade Rennes,273,30.08.2013,30.08.2013,-,1,2013-08-30,2013-08-30,,Cheikh M'Bengue
Galatasaray,141,17.01.2013,18.01.2013,-,1,2013-01-17,2013-01-18,,Cheikh M'Bengue
Newcastle United,762,02.06.2011,02.06.2011,-,1,2011-06-02,2011-06-02,,Cheikh M'Bengue
Amed SK,12382,24.08.2025,24.08.2025,-,1,2025-08-24,2025-08-24,,Cheikhou Kouyaté
Nottingham Forest,703,08.08.2022,08.08.2022,-,1,2022-08-08,2022-08-08,,Cheikhou Kouyaté
Trabzonspor,449,24.07.2021,24.07.2021,-,1,2021-07-24,2021-07-24,,Cheikhou Kouyaté
Crystal Palace,873,01.08.2018,01.08.2018,-,1,2018-08-01,2018-08-01,,Cheikhou Kouyaté
West Ham United,379,18.06.2014,14.05.2014,-,1,2014-06-18,2014-05-14,,Cheikhou Kouyaté
Galatasaray,141,14.05.2014,14.05.2014,-,1,2014-05-14,2014-05-14,,Cheikhou Kouyaté
ZSKA Moskau,2410,14.05.2014,14.05.2014,-,1,2014-05-14,2014-05-14,,Cheikhou Kouyaté
FC Arsenal,11,14.05.2014,14.05.2014,-,1,2014-05-14,2014-05-14,,Cheikhou Kouyaté
Borussia Dortmund,16,16.04.2014,16.04.2014,-,1,2014-04-16,2014-04-16,,Cheikhou Kouyaté
FC Valencia,1049,23.03.2014,23.03.2014,-,1,2014-03-23,2014-03-23,,Cheikhou Kouyaté
VfL Wolfsburg,82,10.01.2014,10.01.2014,-,1,2014-01-10,2014-01-10,,Cheikhou Kouyaté
FC Liverpool,31,08.01.2014,08.01.2014,-,1,2014-01-08,2014-01-08,,Cheikhou Kouyaté
Fenerbahce,36,19.05.2013,20.05.2013,-,1,2013-05-19,2013-05-20,,Cheikhou Kouyaté
TSG 1899 Hoffenheim,533,15.01.2013,18.01.2013,-,1,2013-01-15,2013-01-18,,Cheikhou Kouyaté
Anzhi Makhachkala,2700,29.11.2012,30.11.2012,-,1,2012-11-29,2012-11-30,,Cheikhou Kouyaté
VfB Stuttgart,79,08.11.2012,08.11.2012,-,2,2012-11-08,2012-11-08,,Cheikhou Kouyaté
Manchester City,281,24.04.2012,24.04.2012,-,2,2012-04-24,2012-04-24,,Cheikhou Kouyaté
FC Paris Saint-Germain,583,09.03.2012,10.03.2012,-,2,2012-03-09,2012-03-10,,Cheikhou Kouyaté
AC Florenz,430,01.02.2025,01.02.2025,-,1,2025-02-01,2025-02-01,,Cher Ndour
FC Turin,416,24.01.2025,24.01.2025,-,1,2025-01-24,2025-01-24,,Cher Ndour
FC Bologna,1025,23.01.2025,23.01.2025,-,1,2025-01-23,2025-01-23,,Cher Ndour
SC Braga,1075,29.01.2024,29.01.2024,-,1,2024-01-29,2024-01-29,,Cher Ndour
Besiktas JK,114,,04.01.2024,-,1,,2024-01-04,,Cher Ndour
FC Paris Saint-Germain,583,12.07.2023,12.07.2023,-,1,2023-07-12,2023-07-12,,Cher Ndour
Manchester United,985,15.12.2022,15.12.2022,-,1,2022-12-15,2022-12-15,,Cher Ndour
FC Barcelona,131,28.04.2022,28.04.2022,-,1,2022-04-28,2022-04-28,,Cher Ndour
Benfica Lissabon,294,31.07.2020,31.07.2020,-,1,2020-07-31,2020-07-31,,Cher Ndour
Aston Villa,405,30.11.2017,30.11.2017,-,1,2017-11-30,2017-11-30,,Chiedozie Ogbene
VfB Stuttgart,79,28.08.2023,28.08.2023,-,1,2023-08-28,2023-08-28,,Chris Richards
Crystal Palace,873,27.07.2022,27.07.2022,-,1,2022-07-27,2022-07-27,,Chris Richards
Leeds United,399,15.07.2022,16.07.2022,-,1,2022-07-15,2022-07-16,,Chris Richards
TSG 1899 Hoffenheim,533,15.07.2022,15.07.2022,-,1,2022-07-15,2022-07-15,,Chris Richards
FC Southampton,180,15.07.2022,15.07.2022,-,1,2022-07-15,2022-07-15,,Chris Richards
Olympique Lyon,1041,24.06.2022,28.06.2022,-,1,2022-06-24,2022-06-28,,Chris Richards
Leicester City,1003,08.08.2021,09.08.2021,-,1,2021-08-08,2021-08-09,,Chris Richards
1.FC Union Berlin,89,25.07.2020,25.07.2020,-,1,2020-07-25,2020-07-25,,Chris Richards
FC Barcelona,131,10.04.2020,11.04.2020,-,1,2020-04-10,2020-04-11,,Chris Richards
FC Valencia,1049,10.04.2020,11.04.2020,-,1,2020-04-10,2020-04-11,,Chris Richards
FC Chelsea,631,30.03.2020,30.03.2020,-,1,2020-03-30,2020-03-30,,Chris Richards
FC Arsenal,11,30.03.2020,30.03.2020,-,1,2020-03-30,2020-03-30,,Chris Richards
FC Bayern München U19,1462,04.07.2018,04.07.2018,-,1,2018-07-04,2018-07-04,,Chris Richards
Al-Fayha FC,50531,02.09.2024,02.09.2024,-,1,2024-09-02,2024-09-02,,Chris Smalling
Inter Mailand,46,27.01.2023,27.01.2023,-,1,2023-01-27,2023-01-27,,Chris Smalling
Juventus Turin,506,09.12.2022,09.12.2022,-,1,2022-12-09,2022-12-09,,Chris Smalling
Newcastle United,762,15.08.2020,15.08.2020,-,1,2020-08-15,2020-08-15,,Chris Smalling
FC Arsenal,11,09.12.2019,09.12.2019,-,1,2019-12-09,2019-12-09,,Chris Smalling
AS Rom,12,31.08.2019,31.08.2019,-,1,2019-08-31,2019-08-31,,Chris Smalling
FC Everton,29,24.03.2018,24.03.2018,-,1,2018-03-24,2018-03-24,,Chris Smalling
Leicester City,1003,27.08.2017,27.08.2017,-,1,2017-08-27,2017-08-27,,Chris Smalling
Stoke City,512,25.07.2017,25.07.2017,-,1,2017-07-25,2017-07-25,,Chris Smalling
Crystal Palace,873,25.07.2017,25.07.2017,-,1,2017-07-25,2017-07-25,,Chris Smalling
West Bromwich Albion,984,13.07.2017,20.07.2017,-,1,2017-07-13,2017-07-20,,Chris Smalling
West Ham United,379,25.12.2016,25.12.2016,-,1,2016-12-25,2016-12-25,,Chris Smalling
FC Arsenal,11,25.03.2015,25.03.2015,-,1,2015-03-25,2015-03-25,,Chris Smalling
Manchester United,985,26.01.2010,26.01.2010,-,1,2010-01-26,2010-01-26,,Chris Smalling
Nottingham Forest,703,19.01.2023,19.01.2023,-,1,2023-01-19,2023-01-19,,Chris Wood
Newcastle United,762,11.01.2022,11.01.2022,-,1,2022-01-11,2022-01-11,,Chris Wood
Aston Villa,405,03.06.2021,04.06.2021,-,1,2021-06-03,2021-06-04,,Chris Wood
FC Burnley,1132,21.08.2017,21.08.2017,-,1,2017-08-21,2017-08-21,,Chris Wood
Brighton & Hove Albion,1237,12.08.2017,12.08.2017,-,1,2017-08-12,2017-08-12,,Chris Wood
West Bromwich Albion,984,12.08.2017,12.08.2017,-,1,2017-08-12,2017-08-12,,Chris Wood
Swansea City,2288,03.08.2017,03.08.2017,-,1,2017-08-03,2017-08-03,,Chris Wood
FC Southampton,180,03.08.2017,03.08.2017,-,1,2017-08-03,2017-08-03,,Chris Wood
Stoke City,512,03.08.2017,03.08.2017,-,1,2017-08-03,2017-08-03,,Chris Wood
Besiktas JK,114,03.08.2017,03.08.2017,-,1,2017-08-03,2017-08-03,,Chris Wood
Tianjin Tianhai (-2019),33714,20.01.2017,20.01.2017,-,1,2017-01-20,2017-01-20,,Chris Wood
Leeds United,399,29.06.2015,29.06.2015,-,1,2015-06-29,2015-06-29,,Chris Wood
Wolverhampton Wanderers,543,29.06.2015,29.06.2015,-,1,2015-06-29,2015-06-29,,Chris Wood
FC Augsburg,167,21.01.2025,21.01.2025,-,1,2025-01-21,2025-01-21,,Chrislain Matsima
FC Red Bull Salzburg,409,20.08.2024,02.09.2024,-,1,2024-08-20,2024-09-02,,Chrislain Matsima
FC Villarreal,1050,28.07.2023,28.07.2023,-,1,2023-07-28,2023-07-28,,Chrislain Matsima
Udinese Calcio,410,26.07.2023,26.07.2023,-,1,2023-07-26,2023-07-26,,Chrislain Matsima
Borussia Dortmund,16,21.06.2022,21.06.2022,-,1,2022-06-21,2022-06-21,,Chrislain Matsima
SC Freiburg,60,21.06.2022,21.06.2022,-,1,2022-06-21,2022-06-21,,Chrislain Matsima
LOSC Lille,1082,21.06.2022,21.06.2022,-,1,2022-06-21,2022-06-21,,Chrislain Matsima
FC Basel 1893,26,11.01.2022,12.01.2022,-,1,2022-01-11,2022-01-12,,Chrislain Matsima
Wolverhampton Wanderers,543,20.07.2022,20.07.2022,-,1,2022-07-20,2022-07-20,,Christian Benteke
AC Florenz,430,30.01.2021,30.01.2021,-,1,2021-01-30,2021-01-30,,Christian Benteke
Parma Calcio 1913,130,30.01.2021,30.01.2021,-,1,2021-01-30,2021-01-30,,Christian Benteke
West Bromwich Albion,984,23.01.2021,23.01.2021,-,1,2021-01-23,2021-01-23,,Christian Benteke
Aston Villa,405,17.01.2020,17.01.2020,-,1,2020-01-17,2020-01-17,,Christian Benteke
Club Brügge,2282,18.12.2019,18.12.2019,-,1,2019-12-18,2019-12-18,,Christian Benteke
Shandong Taishan,3182,22.05.2019,22.05.2019,-,1,2019-05-22,2019-05-22,,Christian Benteke
FC Chelsea,631,20.01.2018,20.01.2018,-,1,2018-01-20,2018-01-20,,Christian Benteke
FC Everton,29,17.12.2017,17.12.2017,-,1,2017-12-17,2017-12-17,,Christian Benteke
FC Paris Saint-Germain,583,15.01.2017,15.01.2017,-,1,2017-01-15,2017-01-15,,Christian Benteke
Beijing Guoan,3176,02.01.2017,02.01.2017,-,1,2017-01-02,2017-01-02,,Christian Benteke
Crystal Palace,873,19.08.2016,19.08.2016,-,1,2016-08-19,2016-08-19,,Christian Benteke
West Bromwich Albion,984,14.08.2016,14.08.2016,-,1,2016-08-14,2016-08-14,,Christian Benteke
FC Everton,29,04.08.2016,04.08.2016,-,1,2016-08-04,2016-08-04,,Christian Benteke
AFC Sunderland,289,04.08.2016,04.08.2016,-,1,2016-08-04,2016-08-04,,Christian Benteke
FC Chelsea,631,04.06.2016,04.06.2016,-,2,2016-06-04,2016-06-04,,Christian Benteke
Leicester City,1003,05.05.2016,05.05.2016,-,2,2016-05-05,2016-05-05,,Christian Benteke
Atlético Madrid,13,06.04.2016,06.04.2016,-,2,2016-04-06,2016-04-06,,Christian Benteke
West Ham United,379,25.03.2016,25.03.2016,-,2,2016-03-25,2016-03-25,,Christian Benteke
Juventus Turin,506,25.03.2016,25.03.2016,-,2,2016-03-25,2016-03-25,,Christian Benteke
FC Liverpool,31,19.07.2015,22.07.2015,-,2,2015-07-19,2015-07-22,,Christian Benteke
Manchester United,985,16.07.2015,16.07.2015,-,2,2015-07-16,2015-07-16,,Christian Benteke
VfL Wolfsburg,82,21.05.2015,25.05.2015,-,2,2015-05-21,2015-05-25,,Christian Benteke
Atlético Madrid,13,21.05.2015,21.05.2015,-,2,2015-05-21,2015-05-21,,Christian Benteke
FC Chelsea,631,21.05.2015,21.05.2015,-,2,2015-05-21,2015-05-21,,Christian Benteke
AS Rom,12,13.05.2015,13.05.2015,-,2,2015-05-13,2015-05-13,,Christian Benteke
AC Mailand,5,29.04.2015,29.04.2015,-,2,2015-04-29,2015-04-29,,Christian Benteke
Manchester City,281,04.01.2015,04.01.2015,-,2,2015-01-04,2015-01-04,,Christian Benteke
Borussia Dortmund,16,06.01.2014,07.01.2014,-,2,2014-01-06,2014-01-07,,Christian Benteke
Tottenham Hotspur,148,19.07.2013,19.07.2013,-,2,2013-07-19,2013-07-19,,Christian Benteke
Fenerbahce,36,07.06.2013,07.06.2013,-,3,2013-06-07,2013-06-07,,Christian Benteke
FC Arsenal,11,24.05.2013,24.05.2013,-,3,2013-05-24,2013-05-24,,Christian Benteke
Aston Villa,405,31.08.2012,31.08.2012,-,3,2012-08-31,2012-08-31,,Christian Benteke
Borussia Mönchengladbach,18,10.05.2012,29.05.2012,-,3,2012-05-10,2012-05-29,,Christian Benteke
Stoke City,512,27.03.2010,27.03.2010,-,3,2010-03-27,2010-03-27,,Christian Benteke
VfL Wolfsburg,82,10.09.2025,10.09.2025,91 %,1,2025-09-10,2025-09-10,91.0,Christian Eriksen
Bayer 04 Leverkusen,15,10.09.2025,10.09.2025,32 %,1,2025-09-10,2025-09-10,32.0,Christian Eriksen
AFC Wrexham,1112,25.07.2025,25.07.2025,8 %,1,2025-07-25,2025-07-25,8.0,Christian Eriksen
Celtic Glasgow,371,22.11.2024,22.11.2024,-,1,2024-11-22,2024-11-22,,Christian Eriksen
Ajax Amsterdam,610,20.11.2024,20.11.2024,-,1,2024-11-20,2024-11-20,,Christian Eriksen
Fenerbahce,36,20.11.2024,20.11.2024,-,1,2024-11-20,2024-11-20,,Christian Eriksen
Galatasaray,141,07.02.2024,09.02.2024,-,1,2024-02-07,2024-02-09,,Christian Eriksen
FC Brentford,1148,08.02.2024,08.02.2024,-,1,2024-02-08,2024-02-08,,Christian Eriksen
Al-Ettifaq FC,7732,09.12.2023,09.12.2023,-,1,2023-12-09,2023-12-09,,Christian Eriksen
Manchester United,985,10.07.2022,10.07.2022,-,1,2022-07-10,2022-07-10,,Christian Eriksen
FC Everton,29,05.06.2022,05.06.2022,-,1,2022-06-05,2022-06-05,,Christian Eriksen
Tottenham Hotspur,148,05.04.2022,05.04.2022,-,1,2022-04-05,2022-04-05,,Christian Eriksen
FC Brentford,1148,23.01.2022,23.01.2022,-,1,2022-01-23,2022-01-23,,Christian Eriksen
Leicester City,1003,19.01.2022,19.01.2022,-,1,2022-01-19,2022-01-19,,Christian Eriksen
Newcastle United,762,19.01.2022,19.01.2022,-,1,2022-01-19,2022-01-19,,Christian Eriksen
Leicester City,1003,21.01.2021,21.01.2021,-,2,2021-01-21,2021-01-21,,Christian Eriksen
Tottenham Hotspur,148,08.01.2021,08.01.2021,-,2,2021-01-08,2021-01-08,,Christian Eriksen
FC Bayern München,27,08.12.2020,07.01.2021,-,2,2020-12-08,2021-01-07,,Christian Eriksen
Ajax Amsterdam,610,,05.01.2021,-,2,,2021-01-05,,Christian Eriksen
FC Valencia,1049,04.01.2021,04.01.2021,-,2,2021-01-04,2021-01-04,,Christian Eriksen
FC Paris Saint-Germain,583,27.10.2020,02.01.2021,-,2,2020-10-27,2021-01-02,,Christian Eriksen
Borussia Dortmund,16,01.11.2020,16.12.2020,-,2,2020-11-01,2020-12-16,,Christian Eriksen
FC Arsenal,11,14.12.2020,14.12.2020,-,2,2020-12-14,2020-12-14,,Christian Eriksen
Manchester United,985,14.12.2020,14.12.2020,-,2,2020-12-14,2020-12-14,,Christian Eriksen
West Ham United,379,09.12.2020,09.12.2020,-,2,2020-12-09,2020-12-09,,Christian Eriksen
AC Mailand,5,01.11.2020,20.11.2020,-,2,2020-11-01,2020-11-20,,Christian Eriksen
Lazio Rom,398,01.11.2020,06.11.2020,-,2,2020-11-01,2020-11-06,,Christian Eriksen
AS Rom,12,01.11.2020,01.11.2020,-,2,2020-11-01,2020-11-01,,Christian Eriksen
Hertha BSC,44,10.10.2020,10.10.2020,-,2,2020-10-10,2020-10-10,,Christian Eriksen
Inter Mailand,46,27.01.2020,27.01.2020,-,2,2020-01-27,2020-01-27,,Christian Eriksen
Manchester United,985,27.01.2020,27.01.2020,-,3,2020-01-27,2020-01-27,,Christian Eriksen
FC Bayern München,27,16.01.2020,20.01.2020,-,3,2020-01-16,2020-01-20,,Christian Eriksen
Juventus Turin,506,15.10.2019,15.10.2019,-,3,2019-10-15,2019-10-15,,Christian Eriksen
Atlético Madrid,13,06.09.2019,06.09.2019,-,3,2019-09-06,2019-09-06,,Christian Eriksen
Real Madrid,418,29.06.2019,29.06.2019,-,3,2019-06-29,2019-06-29,,Christian Eriksen
FC Bayern München,27,26.01.2019,27.01.2019,-,3,2019-01-26,2019-01-27,,Christian Eriksen
FC Paris Saint-Germain,583,14.08.2018,15.08.2018,-,3,2018-08-14,2018-08-15,,Christian Eriksen
FC Barcelona,131,29.05.2018,29.05.2018,-,3,2018-05-29,2018-05-29,,Christian Eriksen
Borussia Dortmund,16,16.12.2014,17.12.2014,-,3,2014-12-16,2014-12-17,,Christian Eriksen
SSC Neapel,6195,11.12.2014,11.12.2014,-,3,2014-12-11,2014-12-11,,Christian Eriksen
Tottenham Hotspur,148,30.08.2013,30.08.2013,-,3,2013-08-30,2013-08-30,,Christian Eriksen
FC Liverpool,31,02.08.2013,02.08.2013,-,3,2013-08-02,2013-08-02,,Christian Eriksen
AC Mailand,5,18.07.2013,19.07.2013,-,3,2013-07-18,2013-07-19,,Christian Eriksen
AS Monaco,162,18.06.2013,18.06.2013,-,3,2013-06-18,2013-06-18,,Christian Eriksen
Zenit St. Petersburg,964,16.07.2012,16.07.2012,-,3,2012-07-16,2012-07-16,,Christian Eriksen
AS Rom,12,29.02.2012,02.03.2012,-,4,2012-02-29,2012-03-02,,Christian Eriksen
Anzhi Makhachkala,2700,25.11.2011,26.11.2011,-,4,2011-11-25,2011-11-26,,Christian Eriksen
Manchester City,281,12.11.2011,12.11.2011,-,4,2011-11-12,2011-11-12,,Christian Eriksen
FC Chelsea,631,12.11.2011,12.11.2011,-,4,2011-11-12,2011-11-12,,Christian Eriksen
FC Arsenal,11,19.04.2010,19.04.2010,-,4,2010-04-19,2010-04-19,,Christian Eriksen
SC Freiburg,60,03.05.2025,04.05.2025,-,1,2025-05-03,2025-05-04,,Christian Kouamé
1.FC Union Berlin,89,15.07.2024,21.07.2024,-,1,2024-07-15,2024-07-21,,Christian Kouamé
LOSC Lille,1082,28.08.2023,28.08.2023,-,1,2023-08-28,2023-08-28,,Christian Kouamé
FC Lorient,1158,24.08.2023,24.08.2023,-,1,2023-08-24,2023-08-24,,Christian Kouamé
Brighton & Hove Albion,1237,28.08.2022,28.08.2022,-,1,2022-08-28,2022-08-28,,Christian Kouamé
FC Augsburg,167,23.08.2022,23.08.2022,-,1,2022-08-23,2022-08-23,,Christian Kouamé
Eintracht Frankfurt,24,11.01.2021,12.01.2021,-,1,2021-01-11,2021-01-12,,Christian Kouamé
Borussia Dortmund,16,27.08.2019,29.08.2019,-,1,2019-08-27,2019-08-29,,Christian Kouamé
SSC Neapel,6195,09.01.2019,09.01.2019,-,1,2019-01-09,2019-01-09,,Christian Kouamé
AS Monaco,162,29.05.2024,29.05.2024,-,1,2024-05-29,2024-05-29,,Christian Mawissa
FC Arsenal,11,08.07.2025,08.07.2025,84 %,1,2025-07-08,2025-07-08,84.0,Christian Nørgaard
FC Brentford,1148,28.05.2019,28.05.2019,-,1,2019-05-28,2019-05-28,,Christian Nørgaard
Bröndby IF,206,21.08.2013,21.08.2013,-,1,2013-08-21,2013-08-21,,Christian Nørgaard
Hamburger SV,41,25.01.2012,25.01.2012,-,1,2012-01-25,2012-01-25,,Christian Nørgaard
Hamburger SV,41,01.02.2021,01.02.2021,-,1,2021-02-01,2021-02-01,,Christian Oliva
AC Mailand,5,12.07.2023,12.07.2023,-,1,2023-07-12,2023-07-12,,Christian Pulisic
Olympique Lyon,1041,07.07.2023,07.07.2023,-,1,2023-07-07,2023-07-07,,Christian Pulisic
Juventus Turin,506,07.07.2023,07.07.2023,-,1,2023-07-07,2023-07-07,,Christian Pulisic
Real Madrid,418,24.02.2023,24.02.2023,-,1,2023-02-24,2023-02-24,,Christian Pulisic
Atlético Madrid,13,14.02.2023,14.02.2023,-,1,2023-02-14,2023-02-14,,Christian Pulisic
Galatasaray,141,04.02.2023,04.02.2023,-,1,2023-02-04,2023-02-04,,Christian Pulisic
Borussia Dortmund,16,17.12.2022,17.12.2022,-,1,2022-12-17,2022-12-17,,Christian Pulisic
Manchester United,985,27.11.2022,27.11.2022,-,1,2022-11-27,2022-11-27,,Christian Pulisic
FC Liverpool,31,06.06.2022,10.06.2022,-,1,2022-06-06,2022-06-10,,Christian Pulisic
FC Barcelona,131,24.11.2021,24.11.2021,-,1,2021-11-24,2021-11-24,,Christian Pulisic
Genua CFC,252,09.11.2021,09.11.2021,-,1,2021-11-09,2021-11-09,,Christian Pulisic
FC Bayern München,27,15.03.2021,15.03.2021,-,1,2021-03-15,2021-03-15,,Christian Pulisic
FC Chelsea,631,02.01.2019,02.01.2019,-,1,2019-01-02,2019-01-02,,Christian Pulisic
FC Arsenal,11,30.12.2018,31.12.2018,-,1,2018-12-30,2018-12-31,,Christian Pulisic
FC Liverpool,31,05.12.2018,05.12.2018,-,1,2018-12-05,2018-12-05,,Christian Pulisic
Manchester United,985,29.11.2018,01.12.2018,-,2,2018-11-29,2018-12-01,,Christian Pulisic
FC Bayern München,27,20.11.2018,25.11.2018,-,2,2018-11-20,2018-11-25,,Christian Pulisic
AS Rom,12,25.07.2018,25.07.2018,-,2,2018-07-25,2018-07-25,,Christian Pulisic
Real Madrid,418,25.07.2018,25.07.2018,-,2,2018-07-25,2018-07-25,,Christian Pulisic
Tottenham Hotspur,148,30.05.2018,30.05.2018,-,2,2018-05-30,2018-05-30,,Christian Pulisic
FC Paris Saint-Germain,583,03.12.2016,08.12.2016,-,2,2016-12-03,2016-12-08,,Christian Pulisic
FC Barcelona,131,21.10.2016,21.10.2016,-,2,2016-10-21,2016-10-21,,Christian Pulisic
Stoke City,512,25.08.2016,27.08.2016,-,2,2016-08-25,2016-08-27,,Christian Pulisic
RB Leipzig,23826,24.08.2016,27.08.2016,-,2,2016-08-24,2016-08-27,,Christian Pulisic
ZSKA Moskau,2410,24.08.2016,24.08.2016,-,2,2016-08-24,2016-08-24,,Christian Pulisic
VfB Stuttgart,79,17.08.2016,18.08.2016,-,2,2016-08-17,2016-08-18,,Christian Pulisic
Manchester City,281,27.04.2016,28.04.2016,-,2,2016-04-27,2016-04-28,,Christian Pulisic
RB Leipzig,23826,20.06.2023,21.06.2023,-,1,2023-06-20,2023-06-21,,Christoph Baumgartner
Brighton & Hove Albion,1237,10.05.2023,10.05.2023,-,1,2023-05-10,2023-05-10,,Christoph Baumgartner
Eintracht Frankfurt,24,22.03.2023,24.03.2023,-,1,2023-03-22,2023-03-24,,Christoph Baumgartner
Atlético Madrid,13,,06.06.2022,-,1,,2022-06-06,,Christoph Baumgartner
Leicester City,1003,04.05.2022,06.05.2022,-,1,2022-05-04,2022-05-06,,Christoph Baumgartner
FC Sevilla,368,04.05.2022,04.05.2022,-,1,2022-05-04,2022-05-04,,Christoph Baumgartner
FC Liverpool,31,30.06.2021,30.06.2021,-,1,2021-06-30,2021-06-30,,Christoph Baumgartner
Manchester United,985,27.01.2021,28.01.2021,-,1,2021-01-27,2021-01-28,,Christoph Baumgartner
TSG 1899 Hoffenheim,533,02.03.2017,02.03.2017,-,1,2017-03-02,2017-03-02,,Christoph Baumgartner
Montpellier HSC,969,23.08.2022,23.08.2022,-,1,2022-08-23,2022-08-23,,Christopher Jullien
FC Schalke 04,33,04.07.2022,04.07.2022,-,1,2022-07-04,2022-07-04,,Christopher Jullien
Celtic Glasgow,371,26.06.2019,26.06.2019,-,1,2019-06-26,2019-06-26,,Christopher Jullien
Newcastle United,762,07.08.2018,07.08.2018,-,1,2018-08-07,2018-08-07,,Christopher Jullien
FC Southampton,180,01.08.2018,01.08.2018,-,1,2018-08-01,2018-08-01,,Christopher Jullien
FC Toulouse,415,11.06.2016,11.06.2016,-,1,2016-06-11,2016-06-11,,Christopher Jullien
Dijon FCO,2969,27.06.2015,27.06.2015,-,1,2015-06-27,2015-06-27,,Christopher Jullien
SC Freiburg,60,24.06.2013,26.06.2013,-,1,2013-06-24,2013-06-26,,Christopher Jullien
RB Leipzig,23826,30.08.2023,30.08.2023,-,1,2023-08-30,2023-08-30,,Christopher Lenz
FC Schalke 04,33,23.08.2023,23.08.2023,-,1,2023-08-23,2023-08-23,,Christopher Lenz
1.FC Union Berlin,89,19.01.2016,19.01.2016,-,1,2016-01-19,2016-01-19,,Christopher Lenz
Borussia Mönchengladbach,18,12.06.2012,12.06.2012,-,1,2012-06-12,2012-06-12,,Christopher Lenz
AC Mailand,5,29.08.2025,29.08.2025,90 %,1,2025-08-29,2025-08-29,90.0,Christopher Nkunku
FC Bayern München,27,28.08.2025,29.08.2025,39 %,1,2025-08-28,2025-08-29,39.0,Christopher Nkunku
RB Leipzig,23826,20.08.2025,25.08.2025,42 %,1,2025-08-20,2025-08-25,42.0,Christopher Nkunku
Aston Villa,405,23.08.2025,23.08.2025,-,1,2025-08-23,2025-08-23,,Christopher Nkunku
Bayer 04 Leverkusen,15,18.08.2025,19.08.2025,26 %,1,2025-08-18,2025-08-19,26.0,Christopher Nkunku
Borussia Dortmund,16,02.08.2025,04.08.2025,32 %,1,2025-08-02,2025-08-04,32.0,Christopher Nkunku
Inter Mailand,46,30.07.2025,30.07.2025,10 %,1,2025-07-30,2025-07-30,10.0,Christopher Nkunku
Tottenham Hotspur,148,31.05.2025,31.05.2025,36 %,1,2025-05-31,2025-05-31,36.0,Christopher Nkunku
Manchester United,985,03.02.2025,03.02.2025,-,1,2025-02-03,2025-02-03,,Christopher Nkunku
FC Paris Saint-Germain,583,07.01.2025,07.01.2025,-,1,2025-01-07,2025-01-07,,Christopher Nkunku
FC Barcelona,131,02.01.2025,02.01.2025,-,1,2025-01-02,2025-01-02,,Christopher Nkunku
FC Arsenal,11,31.12.2024,01.01.2025,-,1,2024-12-31,2025-01-01,,Christopher Nkunku
FC Chelsea,631,20.06.2023,20.06.2023,-,1,2023-06-20,2023-06-20,,Christopher Nkunku
Real Madrid,418,26.09.2022,21.10.2022,-,1,2022-09-26,2022-10-21,,Christopher Nkunku
Manchester United,985,08.07.2022,09.07.2022,-,1,2022-07-08,2022-07-09,,Christopher Nkunku
Newcastle United,762,05.05.2022,21.06.2022,-,2,2022-05-05,2022-06-21,,Christopher Nkunku
FC Bayern München,27,16.05.2022,20.06.2022,-,2,2022-05-16,2022-06-20,,Christopher Nkunku
FC Arsenal,11,16.06.2022,18.06.2022,-,2,2022-06-16,2022-06-18,,Christopher Nkunku
FC Paris Saint-Germain,583,05.05.2022,05.05.2022,-,2,2022-05-05,2022-05-05,,Christopher Nkunku
FC Barcelona,131,05.05.2022,05.05.2022,-,2,2022-05-05,2022-05-05,,Christopher Nkunku
AC Mailand,5,05.05.2022,05.05.2022,-,2,2022-05-05,2022-05-05,,Christopher Nkunku
Inter Mailand,46,19.04.2022,19.04.2022,-,2,2022-04-19,2022-04-19,,Christopher Nkunku
Manchester City,281,09.03.2022,09.03.2022,-,2,2022-03-09,2022-03-09,,Christopher Nkunku
Tottenham Hotspur,148,05.04.2021,05.04.2021,-,2,2021-04-05,2021-04-05,,Christopher Nkunku
RB Leipzig,23826,18.07.2019,18.07.2019,-,2,2019-07-18,2019-07-18,,Christopher Nkunku
FC Bayern München,27,19.04.2019,23.04.2019,-,2,2019-04-19,2019-04-23,,Christopher Nkunku
FC Arsenal,11,15.03.2019,15.03.2019,-,2,2019-03-15,2019-03-15,,Christopher Nkunku
Trabzonspor,449,24.06.2025,24.06.2025,-,1,2025-06-24,2025-06-24,,Christopher Wooh
Borussia Mönchengladbach,18,22.05.2025,23.05.2025,-,1,2025-05-22,2025-05-23,,Christopher Wooh
Wolverhampton Wanderers,543,01.01.2025,01.01.2025,-,1,2025-01-01,2025-01-01,,Christopher Wooh
VfB Stuttgart,79,30.12.2024,31.12.2024,-,1,2024-12-30,2024-12-31,,Christopher Wooh
FC Red Bull Salzburg,409,30.08.2023,31.08.2023,-,1,2023-08-30,2023-08-31,,Christopher Wooh
Newcastle United,762,21.01.2022,21.01.2022,-,1,2022-01-21,2022-01-21,,Christopher Wooh
Eintracht Frankfurt,24,27.05.2021,28.05.2021,-,1,2021-05-27,2021-05-28,,Christopher Wooh
SC Freiburg,60,13.05.2021,13.05.2021,-,1,2021-05-13,2021-05-13,,Christopher Wooh
Olympique Lyon,1041,05.06.2019,05.06.2019,-,1,2019-06-05,2019-06-05,,Ciprian Tătărușanu
FC Liverpool,31,01.01.2019,01.01.2019,-,1,2019-01-01,2019-01-01,,Ciprian Tătărușanu
FC Nantes,995,29.07.2017,29.07.2017,-,1,2017-07-29,2017-07-29,,Ciprian Tătărușanu
AC Mailand,5,05.04.2014,06.04.2014,-,1,2014-04-05,2014-04-06,,Ciprian Tătărușanu
West Ham United,379,05.04.2014,05.04.2014,-,1,2014-04-05,2014-04-05,,Ciprian Tătărușanu
Tottenham Hotspur,148,05.04.2014,05.04.2014,-,1,2014-04-05,2014-04-05,,Ciprian Tătărușanu
AC Florenz,430,29.01.2014,29.01.2014,-,1,2014-01-29,2014-01-29,,Ciprian Tătărușanu
Olympiakos Piräus,683,30.12.2013,30.12.2013,-,1,2013-12-30,2013-12-30,,Ciprian Tătărușanu
SSC Neapel,6195,25.06.2012,25.06.2012,-,1,2012-06-25,2012-06-25,,Ciprian Tătărușanu
FC Schalke 04,33,12.04.2011,13.04.2011,-,1,2011-04-12,2011-04-13,,Ciprian Tătărușanu
FC Bologna,1025,02.07.2025,02.07.2025,100 %,1,2025-07-02,2025-07-02,100.0,Ciro Immobile
Lazio Rom,398,15.06.2025,17.06.2025,-,1,2025-06-15,2025-06-17,,Ciro Immobile
AC Florenz,430,14.06.2025,14.06.2025,-,1,2025-06-14,2025-06-14,,Ciro Immobile
AC Mailand,5,14.06.2025,14.06.2025,-,1,2025-06-14,2025-06-14,,Ciro Immobile
Delfino Pescara 1936,2921,12.06.2025,12.06.2025,-,1,2025-06-12,2025-06-12,,Ciro Immobile
Besiktas JK,114,12.07.2024,12.07.2024,-,1,2024-07-12,2024-07-12,,Ciro Immobile
Al-Ahli SFC,18487,20.12.2023,20.12.2023,-,1,2023-12-20,2023-12-20,,Ciro Immobile
FC Everton,29,29.07.2020,29.07.2020,-,1,2020-07-29,2020-07-29,,Ciro Immobile
FC Liverpool,31,17.01.2019,17.01.2019,-,1,2019-01-17,2019-01-17,,Ciro Immobile
FC Chelsea,631,17.01.2019,17.01.2019,-,1,2019-01-17,2019-01-17,,Ciro Immobile
AC Mailand,5,29.06.2018,29.06.2018,-,1,2018-06-29,2018-06-29,,Ciro Immobile
Tottenham Hotspur,148,29.04.2018,29.04.2018,-,1,2018-04-29,2018-04-29,,Ciro Immobile
Shanghai Port,27190,27.10.2017,28.10.2017,-,1,2017-10-27,2017-10-28,,Ciro Immobile
FC Paris Saint-Germain,583,14.12.2016,14.12.2016,-,1,2016-12-14,2016-12-14,,Ciro Immobile
Lazio Rom,398,24.07.2016,24.07.2016,-,1,2016-07-24,2016-07-24,,Ciro Immobile
Leicester City,1003,01.06.2016,01.06.2016,-,2,2016-06-01,2016-06-01,,Ciro Immobile
AC Mailand,5,01.04.2016,01.04.2016,-,2,2016-04-01,2016-04-01,,Ciro Immobile
FC Turin,416,14.01.2016,14.01.2016,-,2,2016-01-14,2016-01-14,,Ciro Immobile
SSC Neapel,6195,28.12.2015,28.12.2015,-,2,2015-12-28,2015-12-28,,Ciro Immobile
Sampdoria Genua,1038,28.12.2015,28.12.2015,-,2,2015-12-28,2015-12-28,,Ciro Immobile
Galatasaray,141,27.12.2015,27.12.2015,-,2,2015-12-27,2015-12-27,,Ciro Immobile
LOSC Lille,1082,02.12.2015,02.12.2015,-,2,2015-12-02,2015-12-02,,Ciro Immobile
FC Sevilla,368,12.07.2015,12.07.2015,-,2,2015-07-12,2015-07-12,,Ciro Immobile
AS Rom,12,29.06.2015,29.06.2015,-,2,2015-06-29,2015-06-29,,Ciro Immobile
SSC Neapel,6195,29.06.2015,29.06.2015,-,2,2015-06-29,2015-06-29,,Ciro Immobile
AC Mailand,5,07.06.2015,07.06.2015,-,2,2015-06-07,2015-06-07,,Ciro Immobile
Inter Mailand,46,18.05.2015,18.05.2015,-,2,2015-05-18,2015-05-18,,Ciro Immobile
FC Liverpool,31,22.04.2015,23.04.2015,-,2,2015-04-22,2015-04-23,,Ciro Immobile
FC Valencia,1049,10.04.2015,11.04.2015,-,2,2015-04-10,2015-04-11,,Ciro Immobile
Lazio Rom,398,10.04.2015,10.04.2015,-,2,2015-04-10,2015-04-10,,Ciro Immobile
Tottenham Hotspur,148,10.04.2015,10.04.2015,-,3,2015-04-10,2015-04-10,,Ciro Immobile
AC Florenz,430,19.03.2015,20.03.2015,-,3,2015-03-19,2015-03-20,,Ciro Immobile
Borussia Dortmund,16,02.06.2014,02.06.2014,-,3,2014-06-02,2014-06-02,,Ciro Immobile
Atlético Madrid,13,17.06.2015,30.04.2014,-,3,2015-06-17,2014-04-30,,Ciro Immobile
VfL Wolfsburg,82,16.04.2014,19.04.2014,-,3,2014-04-16,2014-04-19,,Ciro Immobile
SV Werder Bremen,86,02.04.2014,02.04.2014,-,3,2014-04-02,2014-04-02,,Ciro Immobile
Juventus Turin,506,10.07.2013,10.07.2013,-,3,2013-07-10,2013-07-10,,Ciro Immobile
Cagliari Calcio,1390,23.10.2009,23.10.2009,-,3,2009-10-23,2009-10-23,,Ciro Immobile
Celta Vigo,940,16.01.2016,16.01.2016,-,1,2016-01-16,2016-01-16,,Claudio Beauvue
Aston Villa,405,07.01.2016,07.01.2016,-,1,2016-01-07,2016-01-07,,Claudio Beauvue
Olympique Marseille,244,15.06.2015,15.06.2015,-,1,2015-06-15,2015-06-15,,Claudio Beauvue
FC Everton,29,11.05.2015,11.05.2015,-,1,2015-05-11,2015-05-11,,Claudio Beauvue
West Ham United,379,11.05.2015,11.05.2015,-,1,2015-05-11,2015-05-11,,Claudio Beauvue
Borussia Dortmund,16,01.04.2015,02.04.2015,-,1,2015-04-01,2015-04-02,,Claudio Beauvue
EA Guingamp,855,30.06.2013,30.06.2013,-,1,2013-06-30,2013-06-30,,Claudio Beauvue
CA Boca Juniors,189,29.04.2018,29.04.2018,-,1,2018-04-29,2018-04-29,,Claudio Bravo
SSC Neapel,6195,23.03.2018,23.03.2018,-,1,2018-03-23,2018-03-23,,Claudio Bravo
FC Paris Saint-Germain,583,23.03.2018,23.03.2018,-,1,2018-03-23,2018-03-23,,Claudio Bravo
RB Leipzig,23826,23.02.2017,01.03.2017,-,1,2017-02-23,2017-03-01,,Claudio Bravo
Manchester City,281,25.08.2016,25.08.2016,-,1,2016-08-25,2016-08-25,,Claudio Bravo
FC Barcelona,131,24.01.2010,24.01.2010,-,1,2010-01-24,2010-01-24,,Claudio Bravo
Flamengo Rio de Janeiro,614,09.09.2019,09.09.2019,-,1,2019-09-09,2019-09-09,,Claudio Marchisio
AS Monaco,162,03.09.2018,03.09.2018,-,1,2018-09-03,2018-09-03,,Claudio Marchisio
FC Sevilla,368,18.08.2018,18.08.2018,-,1,2018-08-18,2018-08-18,,Claudio Marchisio
Real Betis Sevilla,150,18.08.2018,18.08.2018,-,1,2018-08-18,2018-08-18,,Claudio Marchisio
Olympique Marseille,244,18.08.2018,18.08.2018,-,1,2018-08-18,2018-08-18,,Claudio Marchisio
OGC Nizza,417,18.08.2018,18.08.2018,-,1,2018-08-18,2018-08-18,,Claudio Marchisio
AS Monaco,162,11.07.2018,11.07.2018,-,1,2018-07-11,2018-07-11,,Claudio Marchisio
FC Bayern München,27,08.04.2016,17.04.2016,-,1,2016-04-08,2016-04-17,,Claudio Marchisio
FC Liverpool,31,18.10.2015,18.10.2015,-,1,2015-10-18,2015-10-18,,Claudio Marchisio
FC Arsenal,11,13.03.2014,13.03.2014,-,1,2014-03-13,2014-03-13,,Claudio Marchisio
Manchester United,985,13.03.2014,13.03.2014,-,1,2014-03-13,2014-03-13,,Claudio Marchisio
FC Chelsea,631,30.05.2013,31.05.2013,-,1,2013-05-30,2013-05-31,,Claudio Marchisio
AS Rom,12,25.07.2011,25.07.2011,-,1,2011-07-25,2011-07-25,,Claudio Marchisio
Inter Mailand,46,19.08.2010,19.08.2010,-,1,2010-08-19,2010-08-19,,Claudio Marchisio
Besiktas JK,114,29.01.2019,29.01.2019,-,1,2019-01-29,2019-01-29,,Clinton N'Jie
Cardiff City,603,08.01.2019,08.01.2019,-,1,2019-01-08,2019-01-08,,Clinton N'Jie
Newcastle United,762,06.01.2019,06.01.2019,-,1,2019-01-06,2019-01-06,,Clinton N'Jie
Sporting Lissabon,336,20.08.2018,20.08.2018,-,1,2018-08-20,2018-08-20,,Clinton N'Jie
VfL Wolfsburg,82,07.06.2018,07.06.2018,-,1,2018-06-07,2018-06-07,,Clinton N'Jie
Olympique Marseille,244,18.07.2017,18.07.2017,-,1,2017-07-18,2017-07-18,,Clinton N'Jie
OGC Nizza,417,22.07.2016,22.07.2016,-,1,2016-07-22,2016-07-22,,Clinton N'Jie
Olympique Lyon,1041,22.07.2016,22.07.2016,-,1,2016-07-22,2016-07-22,,Clinton N'Jie
Tottenham Hotspur,148,21.06.2015,21.07.2015,-,1,2015-06-21,2015-07-21,,Clinton N'Jie
FC Paris Saint-Germain,583,02.01.2019,02.01.2019,-,1,2019-01-02,2019-01-02,,Clément Grenier
West Ham United,379,21.01.2018,21.01.2018,-,1,2018-01-21,2018-01-21,,Clément Grenier
Sporting Lissabon,336,30.12.2017,30.12.2017,-,1,2017-12-30,2017-12-30,,Clément Grenier
Fenerbahce,36,04.09.2017,04.09.2017,-,1,2017-09-04,2017-09-04,,Clément Grenier
AS Rom,12,27.01.2017,27.01.2017,-,1,2017-01-27,2017-01-27,,Clément Grenier
OGC Nizza,417,22.01.2017,22.01.2017,-,1,2017-01-22,2017-01-22,,Clément Grenier
LOSC Lille,1082,26.12.2016,26.12.2016,-,1,2016-12-26,2016-12-26,,Clément Grenier
Borussia Mönchengladbach,18,31.05.2016,01.06.2016,-,1,2016-05-31,2016-06-01,,Clément Grenier
FC Middlesbrough,641,28.05.2016,28.05.2016,-,1,2016-05-28,2016-05-28,,Clément Grenier
FC Turin,416,23.04.2015,24.04.2015,-,1,2015-04-23,2015-04-24,,Clément Grenier
Bayer 04 Leverkusen,15,23.04.2015,24.04.2015,-,1,2015-04-23,2015-04-24,,Clément Grenier
Inter Mailand,46,14.07.2014,14.07.2014,-,1,2014-07-14,2014-07-14,,Clément Grenier
Newcastle United,762,30.01.2014,30.01.2014,-,1,2014-01-30,2014-01-30,,Clément Grenier
FC Arsenal,11,17.08.2014,07.01.2014,-,1,2014-08-17,2014-01-07,,Clément Grenier
AC Mailand,5,11.10.2014,25.04.2013,-,1,2014-10-11,2013-04-25,,Clément Grenier
Atlético Madrid,13,07.06.2025,07.06.2025,93 %,1,2025-06-07,2025-06-07,93.0,Clément Lenglet
AC Mailand,5,20.01.2024,20.01.2024,-,1,2024-01-20,2024-01-20,,Clément Lenglet
FC Bayern München,27,22.12.2023,23.12.2023,-,1,2023-12-22,2023-12-23,,Clément Lenglet
Aston Villa,405,31.08.2023,31.08.2023,-,1,2023-08-31,2023-08-31,,Clément Lenglet
FC Stade Rennes,273,30.08.2023,30.08.2023,-,1,2023-08-30,2023-08-30,,Clément Lenglet
Al-Nassr FC,18544,02.08.2023,02.08.2023,-,1,2023-08-02,2023-08-02,,Clément Lenglet
Tottenham Hotspur,148,07.07.2022,07.07.2022,-,1,2022-07-07,2022-07-07,,Clément Lenglet
AS Rom,12,29.06.2022,29.06.2022,-,1,2022-06-29,2022-06-29,,Clément Lenglet
Olympique Marseille,244,18.06.2022,18.06.2022,-,1,2022-06-18,2022-06-18,,Clément Lenglet
FC Arsenal,11,30.05.2022,30.05.2022,-,1,2022-05-30,2022-05-30,,Clément Lenglet
Newcastle United,762,13.10.2021,13.10.2021,-,1,2021-10-13,2021-10-13,,Clément Lenglet
West Ham United,379,19.07.2021,19.07.2021,-,1,2021-07-19,2021-07-19,,Clément Lenglet
FC Everton,29,14.07.2021,14.07.2021,-,1,2021-07-14,2021-07-14,,Clément Lenglet
FC Paris Saint-Germain,583,12.07.2019,12.07.2019,-,1,2019-07-12,2019-07-12,,Clément Lenglet
FC Barcelona,131,12.07.2018,12.07.2018,-,1,2018-07-12,2018-07-12,,Clément Lenglet
FC Chelsea,631,08.06.2018,08.06.2018,-,2,2018-06-08,2018-06-08,,Clément Lenglet
Manchester United,985,06.06.2018,06.06.2018,-,2,2018-06-06,2018-06-06,,Clément Lenglet
FC Liverpool,31,16.04.2018,16.04.2018,-,2,2018-04-16,2018-04-16,,Clément Lenglet
Real Madrid,418,15.03.2018,15.03.2018,-,2,2018-03-15,2018-03-15,,Clément Lenglet
AS Monaco,162,08.10.2015,08.10.2015,-,2,2015-10-08,2015-10-08,,Clément Lenglet
SV Werder Bremen,86,29.05.2015,29.05.2015,-,2,2015-05-29,2015-05-29,,Clément Lenglet
FC Girondins Bordeaux,40,17.08.2022,17.08.2022,-,1,2022-08-17,2022-08-17,,Clément Michelin
AS Saint-Étienne,618,31.01.2022,02.02.2022,-,1,2022-01-31,2022-02-02,,Clément Michelin
FC Augsburg,167,04.10.2020,05.10.2020,-,1,2020-10-04,2020-10-05,,Clément Michelin
Luton Town,1031,26.01.2023,26.01.2023,-,1,2023-01-26,2023-01-26,,Cody Drameh
Borussia Dortmund,16,23.12.2022,23.12.2022,-,1,2022-12-23,2022-12-23,,Cody Drameh
Newcastle United,762,15.12.2022,15.12.2022,-,1,2022-12-15,2022-12-15,,Cody Drameh
Bayer 04 Leverkusen,15,14.11.2022,15.11.2022,-,1,2022-11-14,2022-11-15,,Cody Drameh
Bayer 04 Leverkusen,15,12.01.2022,12.01.2022,-,1,2022-01-12,2022-01-12,,Cody Drameh
Cardiff City,603,11.01.2022,11.01.2022,-,1,2022-01-11,2022-01-11,,Cody Drameh
TSG 1899 Hoffenheim,533,01.01.2022,01.01.2022,-,1,2022-01-01,2022-01-01,,Cody Drameh
Leeds United,399,13.08.2020,13.08.2020,-,1,2020-08-13,2020-08-13,,Cody Drameh
Manchester City,281,20.05.2020,20.05.2020,-,1,2020-05-20,2020-05-20,,Cody Drameh
Eintracht Frankfurt,24,13.06.2019,13.06.2019,-,1,2019-06-13,2019-06-13,,Cody Drameh
LOSC Lille,1082,11.03.2019,11.03.2019,-,1,2019-03-11,2019-03-11,,Cody Drameh
AFC Sunderland,289,01.08.2023,01.08.2023,-,1,2023-08-01,2023-08-01,,Colin Dagba
RC Straßburg Alsace,667,17.06.2022,17.06.2022,-,1,2022-06-17,2022-06-17,,Colin Dagba
AC Mailand,5,22.05.2022,22.05.2022,-,1,2022-05-22,2022-05-22,,Colin Dagba
AS Saint-Étienne,618,02.02.2022,02.02.2022,-,1,2022-02-02,2022-02-02,,Colin Dagba
Borussia Dortmund,16,07.01.2022,14.01.2022,-,1,2022-01-07,2022-01-14,,Colin Dagba
Borussia Mönchengladbach,18,07.01.2022,10.01.2022,-,1,2022-01-07,2022-01-10,,Colin Dagba
RB Leipzig,23826,13.09.2018,13.09.2018,-,1,2018-09-13,2018-09-13,,Colin Dagba
Stoke City,512,21.05.2024,21.05.2024,-,1,2024-05-21,2024-05-21,,Conor Coady
Wolverhampton Wanderers,543,02.06.2023,02.06.2023,-,1,2023-06-02,2023-06-02,,Conor Coady
FC Everton,29,08.08.2022,08.08.2022,-,1,2022-08-08,2022-08-08,,Conor Coady
Tottenham Hotspur,148,02.08.2021,02.08.2021,-,1,2021-08-02,2021-08-02,,Conor Coady
Atlético Madrid,13,20.08.2024,20.08.2024,-,1,2024-08-20,2024-08-20,,Conor Gallagher
Aston Villa,405,18.06.2024,18.06.2024,-,1,2024-06-18,2024-06-18,,Conor Gallagher
Tottenham Hotspur,148,12.04.2024,12.04.2024,-,1,2024-04-12,2024-04-12,,Conor Gallagher
West Ham United,379,25.07.2023,25.07.2023,-,1,2023-07-25,2023-07-25,,Conor Gallagher
Borussia Dortmund,16,25.06.2023,25.06.2023,-,1,2023-06-25,2023-06-25,,Conor Gallagher
Newcastle United,762,16.01.2023,16.01.2023,-,1,2023-01-16,2023-01-16,,Conor Gallagher
Crystal Palace,873,05.09.2022,05.09.2022,-,1,2022-09-05,2022-09-05,,Conor Gallagher
Inter Mailand,46,21.03.2022,22.03.2022,-,1,2022-03-21,2022-03-22,,Conor Gallagher
Juventus Turin,506,21.03.2022,21.03.2022,-,1,2022-03-21,2022-03-21,,Conor Gallagher
FC Everton,29,20.02.2022,20.02.2022,-,1,2022-02-20,2022-02-20,,Conor Gallagher
FC Paris Saint-Germain,583,02.01.2022,02.01.2022,-,1,2022-01-02,2022-01-02,,Conor Gallagher
Crystal Palace,873,30.07.2021,30.07.2021,-,1,2021-07-30,2021-07-30,,Conor Gallagher
1.FSV Mainz 05,39,17.09.2020,17.09.2020,-,1,2020-09-17,2020-09-17,,Conor Gallagher
West Bromwich Albion,984,16.09.2020,17.09.2020,-,1,2020-09-16,2020-09-17,,Conor Gallagher
Arminia Bielefeld,10,17.08.2020,17.08.2020,-,1,2020-08-17,2020-08-17,,Conor Gallagher
Leeds United,399,10.08.2020,10.08.2020,-,2,2020-08-10,2020-08-10,,Conor Gallagher
FC Schalke 04,33,02.08.2020,04.08.2020,-,2,2020-08-02,2020-08-04,,Conor Gallagher
Vitesse Arnheim,499,09.03.2020,09.03.2020,-,2,2020-03-09,2020-03-09,,Conor Gallagher
FC Burnley,1132,09.03.2020,09.03.2020,-,2,2020-03-09,2020-03-09,,Conor Gallagher
FC Burnley,1132,15.01.2020,15.01.2020,-,2,2020-01-15,2020-01-15,,Conor Gallagher
Derby County,22,06.07.2022,06.07.2022,-,1,2022-07-06,2022-07-06,,Conor Hourihane
Swansea City,2288,20.01.2021,20.01.2021,-,1,2021-01-20,2021-01-20,,Conor Hourihane
AFC Bournemouth,989,18.01.2021,18.01.2021,-,1,2021-01-18,2021-01-18,,Conor Hourihane
Aston Villa,405,20.01.2017,20.01.2017,-,1,2017-01-20,2017-01-20,,Conor Hourihane
Los Angeles Galaxy,1061,18.12.2016,18.12.2016,-,1,2016-12-18,2016-12-18,,Conor Hourihane
Norwich City,1123,21.11.2016,21.11.2016,-,1,2016-11-21,2016-11-21,,Conor Hourihane
RC Lens,826,28.12.2019,28.12.2019,-,1,2019-12-28,2019-12-28,,Corentin Jean
FC Toulouse,415,27.12.2016,23.01.2017,-,1,2016-12-27,2017-01-23,,Corentin Jean
AS Monaco,162,16.05.2015,16.05.2015,-,1,2015-05-16,2015-05-16,,Corentin Jean
RC Lens,826,24.01.2014,24.01.2014,-,1,2014-01-24,2014-01-24,,Corentin Jean
Besiktas JK,114,24.06.2025,24.06.2025,-,1,2025-06-24,2025-06-24,,Corentin Tolisso
Brighton & Hove Albion,1237,30.12.2024,03.01.2025,-,1,2024-12-30,2025-01-03,,Corentin Tolisso
Trabzonspor,449,10.12.2024,10.12.2024,-,1,2024-12-10,2024-12-10,,Corentin Tolisso
Fenerbahce,36,06.01.2024,06.01.2024,-,1,2024-01-06,2024-01-06,,Corentin Tolisso
Olympique Lyon,1041,30.06.2022,30.06.2022,-,1,2022-06-30,2022-06-30,,Corentin Tolisso
Fenerbahce,36,11.06.2022,11.06.2022,-,1,2022-06-11,2022-06-11,,Corentin Tolisso
FC Liverpool,31,15.02.2022,15.02.2022,-,1,2022-02-15,2022-02-15,,Corentin Tolisso
Real Madrid,418,04.02.2022,04.02.2022,-,1,2022-02-04,2022-02-04,,Corentin Tolisso
FC Barcelona,131,17.12.2021,17.12.2021,-,1,2021-12-17,2021-12-17,,Corentin Tolisso
Atlético Madrid,13,13.12.2021,13.12.2021,-,1,2021-12-13,2021-12-13,,Corentin Tolisso
AS Rom,12,10.12.2021,10.12.2021,-,1,2021-12-10,2021-12-10,,Corentin Tolisso
Inter Mailand,46,10.12.2021,10.12.2021,-,1,2021-12-10,2021-12-10,,Corentin Tolisso
Tottenham Hotspur,148,10.12.2021,10.12.2021,-,1,2021-12-10,2021-12-10,,Corentin Tolisso
Juventus Turin,506,03.08.2021,14.08.2021,-,1,2021-08-03,2021-08-14,,Corentin Tolisso
West Ham United,379,25.04.2021,06.05.2021,-,1,2021-04-25,2021-05-06,,Corentin Tolisso
Manchester United,985,11.06.2020,11.06.2020,-,2,2020-06-11,2020-06-11,,Corentin Tolisso
FC Arsenal,11,09.04.2020,09.04.2020,-,2,2020-04-09,2020-04-09,,Corentin Tolisso
SSC Neapel,6195,09.04.2020,09.04.2020,-,2,2020-04-09,2020-04-09,,Corentin Tolisso
FC Paris Saint-Germain,583,14.02.2020,14.02.2020,-,2,2020-02-14,2020-02-14,,Corentin Tolisso
FC Bayern München,27,14.06.2017,15.06.2017,-,2,2017-06-14,2017-06-15,,Corentin Tolisso
AC Mailand,5,30.05.2017,30.05.2017,-,2,2017-05-30,2017-05-30,,Corentin Tolisso
Juventus Turin,506,09.03.2017,09.03.2017,-,2,2017-03-09,2017-03-09,,Corentin Tolisso
Borussia Dortmund,16,27.01.2017,27.01.2017,-,2,2017-01-27,2017-01-27,,Corentin Tolisso
SSC Neapel,6195,27.07.2016,27.07.2016,-,2,2016-07-27,2016-07-27,,Corentin Tolisso
Leicester City,1003,18.04.2016,18.04.2016,-,2,2016-04-18,2016-04-18,,Corentin Tolisso
Wolverhampton Wanderers,543,10.01.2023,22.01.2023,-,1,2023-01-10,2023-01-22,,Craig Dawson
FC Watford,1010,19.06.2019,19.06.2019,-,1,2019-06-19,2019-06-19,,Craig Dawson
West Ham United,379,04.07.2018,04.07.2018,-,1,2018-07-04,2018-07-04,,Craig Dawson
Newcastle United,762,25.06.2015,25.06.2015,-,1,2015-06-25,2015-06-25,,Craig Dawson
FC Burnley,1132,22.07.2014,22.07.2014,-,1,2014-07-22,2014-07-22,,Craig Dawson
Wigan Athletic,1071,29.01.2014,29.01.2014,-,1,2014-01-29,2014-01-29,,Craig Dawson
Bolton Wanderers,355,25.01.2013,25.01.2013,-,1,2013-01-25,2013-01-25,,Craig Dawson
FC Everton,29,08.11.2011,08.11.2011,-,1,2011-11-08,2011-11-08,,Craig Dawson
FC Fulham,931,15.06.2010,15.06.2010,-,1,2010-06-15,2010-06-15,,Craig Dawson
Tottenham Hotspur,148,09.03.2010,09.03.2010,-,1,2010-03-09,2010-03-09,,Craig Dawson
Borussia Dortmund,16,11.04.2018,13.04.2018,-,1,2018-04-11,2018-04-13,,Cristian Benavente
West Bromwich Albion,984,07.06.2015,07.06.2015,-,1,2015-06-07,2015-06-07,,Cristian Benavente
Atlético Madrid,13,29.04.2025,29.04.2025,-,1,2025-04-29,2025-04-29,,Cristian Romero
Tottenham Hotspur,148,02.08.2021,02.08.2021,-,1,2021-08-02,2021-08-02,,Cristian Romero
FC Liverpool,31,14.06.2021,14.06.2021,-,1,2021-06-14,2021-06-14,,Cristian Romero
SSC Neapel,6195,29.08.2020,29.08.2020,-,1,2020-08-29,2020-08-29,,Cristian Romero
Bayer 04 Leverkusen,15,31.01.2020,31.01.2020,-,1,2020-01-31,2020-01-31,,Cristian Romero
Juventus Turin,506,12.07.2019,12.07.2019,-,1,2019-07-12,2019-07-12,,Cristian Romero
Espanyol Barcelona,714,21.12.2022,21.12.2022,-,1,2022-12-21,2022-12-21,,Cristian Tello
AC Monza,2919,05.07.2022,05.07.2022,-,1,2022-07-05,2022-07-05,,Cristian Tello
Trabzonspor,449,05.11.2021,05.11.2021,-,1,2021-11-05,2021-11-05,,Cristian Tello
AC Mailand,5,15.03.2017,15.03.2017,-,1,2017-03-15,2017-03-15,,Cristian Tello
AC Florenz,430,23.07.2016,23.07.2016,-,1,2016-07-23,2016-07-23,,Cristian Tello
Tottenham Hotspur,148,12.07.2016,12.07.2016,-,1,2016-07-12,2016-07-12,,Cristian Tello
Swansea City,2288,10.07.2016,10.07.2016,-,1,2016-07-10,2016-07-10,,Cristian Tello
FC Liverpool,31,19.06.2016,19.06.2016,-,1,2016-06-19,2016-06-19,,Cristian Tello
FC Southampton,180,19.06.2016,19.06.2016,-,1,2016-06-19,2016-06-19,,Cristian Tello
AC Florenz,430,22.01.2016,22.01.2016,-,1,2016-01-22,2016-01-22,,Cristian Tello
FC Liverpool,31,02.11.2015,02.11.2015,-,1,2015-11-02,2015-11-02,,Cristian Tello
FC Everton,29,02.11.2015,02.11.2015,-,1,2015-11-02,2015-11-02,,Cristian Tello
FC Porto,720,15.07.2014,15.07.2014,-,1,2014-07-15,2014-07-15,,Cristian Tello
Borussia Dortmund,16,31.05.2014,01.06.2014,-,1,2014-05-31,2014-06-01,,Cristian Tello
FC Liverpool,31,05.05.2014,08.05.2014,-,1,2014-05-05,2014-05-08,,Cristian Tello
SSC Neapel,6195,05.05.2014,06.05.2014,-,2,2014-05-05,2014-05-06,,Cristian Tello
FC Valencia,1049,05.05.2014,05.05.2014,-,2,2014-05-05,2014-05-05,,Cristian Tello
Olympique Marseille,244,16.04.2014,16.04.2014,-,2,2014-04-16,2014-04-16,,Cristian Tello
Manchester United,985,17.02.2014,20.02.2014,-,2,2014-02-17,2014-02-20,,Cristian Tello
FC Schalke 04,33,09.06.2013,12.06.2013,-,2,2013-06-09,2013-06-12,,Cristian Tello
FC Arsenal,11,21.04.2013,21.04.2013,-,2,2013-04-21,2013-04-21,,Cristian Tello
Atlético Madrid,13,18.07.2012,18.07.2012,-,2,2012-07-18,2012-07-18,,Cristian Tello
FC Málaga,1084,06.04.2012,06.04.2012,-,2,2012-04-06,2012-04-06,,Cristian Tello
US Sassuolo,6574,15.06.2023,15.06.2023,-,1,2023-06-15,2023-06-15,,Cristian Volpato
FC Bologna,1025,22.01.2025,22.01.2025,-,1,2025-01-22,2025-01-22,,Cristiano Biraghi
Fenerbahce,36,31.12.2024,31.12.2024,-,1,2024-12-31,2024-12-31,,Cristiano Biraghi
AC Mailand,5,31.12.2024,31.12.2024,-,1,2024-12-31,2024-12-31,,Cristiano Biraghi
Atalanta Bergamo,800,31.12.2024,31.12.2024,-,1,2024-12-31,2024-12-31,,Cristiano Biraghi
Inter Mailand,46,30.08.2019,30.08.2019,-,1,2019-08-30,2019-08-30,,Cristiano Biraghi
AS Rom,12,16.04.2019,16.04.2019,-,1,2019-04-16,2019-04-16,,Cristiano Biraghi
FC Granada,16795,12.05.2016,12.05.2016,-,1,2016-05-12,2016-05-12,,Cristiano Biraghi
FC Augsburg,167,27.06.2015,27.06.2015,-,1,2015-06-27,2015-06-27,,Cristiano Biraghi
Hellas Verona,276,25.06.2015,25.06.2015,-,1,2015-06-25,2015-06-25,,Cristiano Biraghi
Sporting Lissabon,336,09.06.2025,09.06.2025,40 %,1,2025-06-09,2025-06-09,40.0,Cristiano Ronaldo
Al-Ahli SFC,18487,30.05.2025,01.06.2025,39 %,1,2025-05-30,2025-06-01,39.0,Cristiano Ronaldo
Botafogo Rio de Janeiro,537,19.05.2025,30.05.2025,45 %,1,2025-05-19,2025-05-30,45.0,Cristiano Ronaldo
Al-Hilal SFC,1114,27.05.2025,28.05.2025,-,1,2025-05-27,2025-05-28,,Cristiano Ronaldo
Besiktas JK,114,02.09.2024,02.09.2024,-,1,2024-09-02,2024-09-02,,Cristiano Ronaldo
Bayer 04 Leverkusen,15,24.05.2024,24.05.2024,-,1,2024-05-24,2024-05-24,,Cristiano Ronaldo
FC Bayern München,27,21.05.2023,21.05.2023,-,1,2023-05-21,2023-05-21,,Cristiano Ronaldo
FC Paris Saint-Germain,583,30.12.2022,30.12.2022,-,1,2022-12-30,2022-12-30,,Cristiano Ronaldo
Al-Nassr FC,18544,29.12.2022,30.12.2022,-,1,2022-12-29,2022-12-30,,Cristiano Ronaldo
Galatasaray,141,,26.12.2022,-,1,,2022-12-26,,Cristiano Ronaldo
FC Chelsea,631,04.12.2022,04.12.2022,-,1,2022-12-04,2022-12-04,,Cristiano Ronaldo
Flamengo Rio de Janeiro,614,01.12.2022,01.12.2022,-,1,2022-12-01,2022-12-01,,Cristiano Ronaldo
Galatasaray,141,30.11.2022,30.11.2022,-,1,2022-11-30,2022-11-30,,Cristiano Ronaldo
Newcastle United,762,23.11.2022,23.11.2022,-,1,2022-11-23,2022-11-23,,Cristiano Ronaldo
AS Rom,12,24.10.2022,25.10.2022,-,1,2022-10-24,2022-10-25,,Cristiano Ronaldo
FC Chelsea,631,24.10.2022,24.10.2022,-,2,2022-10-24,2022-10-24,,Cristiano Ronaldo
Inter Miami CF,69261,21.10.2022,21.10.2022,-,2,2022-10-21,2022-10-21,,Cristiano Ronaldo
FC Bayern München,27,31.08.2022,31.08.2022,-,2,2022-08-31,2022-08-31,,Cristiano Ronaldo
Sporting Lissabon,336,31.08.2022,31.08.2022,-,2,2022-08-31,2022-08-31,,Cristiano Ronaldo
SSC Neapel,6195,30.08.2022,30.08.2022,-,2,2022-08-30,2022-08-30,,Cristiano Ronaldo
Borussia Dortmund,16,24.08.2022,27.08.2022,-,2,2022-08-24,2022-08-27,,Cristiano Ronaldo
Atlético Madrid,13,27.07.2022,27.07.2022,-,2,2022-07-27,2022-07-27,,Cristiano Ronaldo
Real Madrid,418,21.07.2022,21.07.2022,-,2,2022-07-21,2022-07-21,,Cristiano Ronaldo
FC Barcelona,131,05.07.2022,05.07.2022,-,2,2022-07-05,2022-07-05,,Cristiano Ronaldo
FC Porto,720,25.03.2022,25.03.2022,-,2,2022-03-25,2022-03-25,,Cristiano Ronaldo
FC Paris Saint-Germain,583,11.01.2022,24.02.2022,-,2,2022-01-11,2022-02-24,,Cristiano Ronaldo
Manchester City,281,27.08.2021,27.08.2021,-,2,2021-08-27,2021-08-27,,Cristiano Ronaldo
Manchester United,985,27.08.2021,27.08.2021,-,2,2021-08-27,2021-08-27,,Cristiano Ronaldo
Real Madrid,418,17.08.2021,17.08.2021,-,2,2021-08-17,2021-08-17,,Cristiano Ronaldo
FC Barcelona,131,24.06.2021,03.08.2021,-,2,2021-06-24,2021-08-03,,Cristiano Ronaldo
Sporting Lissabon,336,14.05.2021,17.05.2021,-,3,2021-05-14,2021-05-17,,Cristiano Ronaldo
FC Paris Saint-Germain,583,15.04.2021,15.04.2021,-,3,2021-04-15,2021-04-15,,Cristiano Ronaldo
FC Chelsea,631,18.06.2020,19.06.2020,-,3,2020-06-18,2020-06-19,,Cristiano Ronaldo
FC Bayern München,27,06.01.2020,06.01.2020,-,3,2020-01-06,2020-01-06,,Cristiano Ronaldo
Inter Miami CF,69261,19.04.2019,20.04.2019,-,3,2019-04-19,2019-04-20,,Cristiano Ronaldo
Juventus Turin,506,10.07.2018,10.07.2018,-,3,2018-07-10,2018-07-10,,Cristiano Ronaldo
FC Paris Saint-Germain,583,01.06.2018,01.06.2018,-,3,2018-06-01,2018-06-01,,Cristiano Ronaldo
Manchester United,985,17.01.2018,18.01.2018,-,3,2018-01-17,2018-01-18,,Cristiano Ronaldo
Real Madrid,418,11.07.2017,11.07.2017,-,3,2017-07-11,2017-07-11,,Cristiano Ronaldo
FC Bayern München,27,04.07.2017,04.07.2017,-,3,2017-07-04,2017-07-04,,Cristiano Ronaldo
FC Chelsea,631,12.11.2015,18.11.2015,-,3,2015-11-12,2015-11-18,,Cristiano Ronaldo
Los Angeles Galaxy,1061,23.04.2015,23.04.2015,-,3,2015-04-23,2015-04-23,,Cristiano Ronaldo
AS Monaco,162,13.06.2013,13.06.2013,-,3,2013-06-13,2013-06-13,,Cristiano Ronaldo
Manchester City,281,31.01.2015,06.09.2012,-,3,2015-01-31,2012-09-06,,Cristiano Ronaldo
Anzhi Makhachkala,2700,04.09.2012,04.09.2012,-,3,2012-09-04,2012-09-04,,Cristiano Ronaldo
AC Mailand,5,11.06.2012,11.06.2012,-,4,2012-06-11,2012-06-11,,Cristiano Ronaldo
Borussia Dortmund,16,12.10.2011,12.10.2011,-,4,2011-10-12,2011-10-12,,Cristiano Ronaldo
Feyenoord Rotterdam,234,31.01.2019,31.01.2019,-,1,2019-01-31,2019-01-31,,Cuco Martina
Stoke City,512,16.08.2018,16.08.2018,-,1,2018-08-16,2018-08-16,,Cuco Martina
FC Middlesbrough,641,09.08.2018,09.08.2018,-,1,2018-08-09,2018-08-09,,Cuco Martina
FC Everton,29,17.07.2017,17.07.2017,-,1,2017-07-17,2017-07-17,,Cuco Martina
Hull City,3008,13.01.2017,13.01.2017,-,1,2017-01-13,2017-01-13,,Cuco Martina
West Ham United,379,13.01.2017,13.01.2017,-,1,2017-01-13,2017-01-13,,Cuco Martina
FC Southampton,180,06.07.2015,06.07.2015,-,1,2015-07-06,2015-07-06,,Cuco Martina
RCD Mallorca,237,,18.07.2023,-,1,,2023-07-18,,Cyle Larin
FC Cádiz,2687,22.01.2023,22.01.2023,-,1,2023-01-22,2023-01-22,,Cyle Larin
Nottingham Forest,703,,02.07.2022,-,1,,2022-07-02,,Cyle Larin
Olympiakos Piräus,683,29.06.2022,29.06.2022,-,1,2022-06-29,2022-06-29,,Cyle Larin
ZSKA Moskau,2410,04.06.2020,04.06.2020,-,1,2020-06-04,2020-06-04,,Cyle Larin
PAOK Thessaloniki,1091,03.05.2020,03.05.2020,-,1,2020-05-03,2020-05-03,,Cyle Larin
Besiktas JK,114,13.01.2018,26.01.2018,-,1,2018-01-13,2018-01-26,,Cyle Larin
Borussia Mönchengladbach,18,02.01.2018,02.01.2018,-,1,2018-01-02,2018-01-02,,Cyle Larin
FC Everton,29,27.03.2017,27.03.2017,-,1,2017-03-27,2017-03-27,,Cyle Larin
RSC Anderlecht,58,22.03.2017,22.03.2017,-,1,2017-03-22,2017-03-22,,Cyle Larin
Sporting Lissabon,336,22.07.2016,22.07.2016,-,1,2016-07-22,2016-07-22,,Cyle Larin
Benfica Lissabon,294,19.07.2016,19.07.2016,-,1,2016-07-19,2016-07-19,,Cyle Larin
Lazio Rom,398,28.04.2016,28.04.2016,-,1,2016-04-28,2016-04-28,,Cyle Larin
FC Turin,416,24.07.2025,24.07.2025,-,1,2025-07-24,2025-07-24,,Cyril Ngonge
Lazio Rom,398,01.02.2025,01.02.2025,-,1,2025-02-01,2025-02-01,,Cyril Ngonge
SSC Neapel,6195,19.01.2024,19.01.2024,-,1,2024-01-19,2024-01-19,,Cyril Ngonge
AC Mailand,5,09.01.2024,09.01.2024,-,1,2024-01-09,2024-01-09,,Cyril Ngonge
Aston Villa,405,03.01.2024,03.01.2024,-,1,2024-01-03,2024-01-03,,Cyril Ngonge
SV Darmstadt 98,105,14.05.2020,14.05.2020,-,1,2020-05-14,2020-05-14,,Cyril Ngonge
Real Betis Sevilla,150,02.02.2024,02.02.2024,-,1,2024-02-02,2024-02-02,,Cédric Bakambu
Galatasaray,141,24.07.2023,24.07.2023,-,1,2023-07-24,2023-07-24,,Cédric Bakambu
Olympiakos Piräus,683,15.09.2022,15.09.2022,-,1,2022-09-15,2022-09-15,,Cédric Bakambu
Trabzonspor,449,30.08.2022,30.08.2022,-,1,2022-08-30,2022-08-30,,Cédric Bakambu
Celta Vigo,940,24.08.2022,24.08.2022,-,1,2022-08-24,2022-08-24,,Cédric Bakambu
Fenerbahce,36,07.08.2022,07.08.2022,-,1,2022-08-07,2022-08-07,,Cédric Bakambu
Olympique Marseille,244,11.01.2022,11.01.2022,-,1,2022-01-11,2022-01-11,,Cédric Bakambu
Atlético Madrid,13,30.12.2019,30.12.2019,-,1,2019-12-30,2019-12-30,,Cédric Bakambu
Real Betis Sevilla,150,28.12.2018,28.12.2018,-,1,2018-12-28,2018-12-28,,Cédric Bakambu
FC Valencia,1049,28.12.2018,28.12.2018,-,1,2018-12-28,2018-12-28,,Cédric Bakambu
Beijing Guoan,3176,03.01.2018,03.01.2018,-,1,2018-01-03,2018-01-03,,Cédric Bakambu
Tottenham Hotspur,148,28.12.2017,28.12.2017,-,1,2017-12-28,2017-12-28,,Cédric Bakambu
West Bromwich Albion,984,13.11.2017,13.11.2017,-,1,2017-11-13,2017-11-13,,Cédric Bakambu
Newcastle United,762,13.11.2017,13.11.2017,-,1,2017-11-13,2017-11-13,,Cédric Bakambu
West Ham United,379,13.11.2017,13.11.2017,-,1,2017-11-13,2017-11-13,,Cédric Bakambu
Crystal Palace,873,12.06.2016,12.06.2016,-,2,2016-06-12,2016-06-12,,Cédric Bakambu
VfL Wolfsburg,82,01.05.2016,04.05.2016,-,2,2016-05-01,2016-05-04,,Cédric Bakambu
Lazio Rom,398,06.04.2016,29.04.2016,-,2,2016-04-06,2016-04-29,,Cédric Bakambu
Inter Mailand,46,18.07.2015,15.08.2015,-,2,2015-07-18,2015-08-15,,Cédric Bakambu
Lazio Rom,398,26.06.2015,26.06.2015,-,2,2015-06-26,2015-06-26,,Cédric Bakambu
SC Freiburg,60,26.08.2014,30.08.2014,-,2,2014-08-26,2014-08-30,,Cédric Bakambu
Swansea City,2288,29.08.2014,29.08.2014,-,2,2014-08-29,2014-08-29,,Cédric Bakambu
Crystal Palace,873,25.01.2014,25.01.2014,-,2,2014-01-25,2014-01-25,,Cédric Bakambu
Hertha BSC,44,23.05.2022,23.05.2022,-,1,2022-05-23,2022-05-23,,Cédric Brunner
Hamburger SV,41,21.05.2022,22.05.2022,-,1,2022-05-21,2022-05-22,,Cédric Brunner
FC São Paulo,585,27.01.2025,27.01.2025,-,1,2025-01-27,2025-01-27,,Cédric Soares
Olympiakos Piräus,683,05.07.2024,05.07.2024,-,1,2024-07-05,2024-07-05,,Cédric Soares
Galatasaray,141,26.01.2024,26.01.2024,-,1,2024-01-26,2024-01-26,,Cédric Soares
Trabzonspor,449,30.12.2023,30.12.2023,-,1,2023-12-30,2023-12-30,,Cédric Soares
Besiktas JK,114,30.12.2023,30.12.2023,-,1,2023-12-30,2023-12-30,,Cédric Soares
FC Villarreal,1050,15.12.2023,15.12.2023,-,1,2023-12-15,2023-12-15,,Cédric Soares
FC Fulham,931,01.02.2023,01.02.2023,-,1,2023-02-01,2023-02-01,,Cédric Soares
Bayer 04 Leverkusen,15,17.11.2022,18.11.2022,-,1,2022-11-17,2022-11-18,,Cédric Soares
Atlético Madrid,13,08.01.2022,08.01.2022,-,1,2022-01-08,2022-01-08,,Cédric Soares
FC Arsenal,11,29.01.2020,30.01.2020,-,1,2020-01-29,2020-01-30,,Cédric Soares
Inter Mailand,46,26.01.2019,26.01.2019,-,1,2019-01-26,2019-01-26,,Cédric Soares
Manchester United,985,26.04.2018,26.04.2018,-,1,2018-04-26,2018-04-26,,Cédric Soares
FC Chelsea,631,15.08.2017,15.08.2017,-,1,2017-08-15,2017-08-15,,Cédric Soares
Tottenham Hotspur,148,27.06.2017,27.06.2017,-,1,2017-06-27,2017-06-27,,Cédric Soares
Juventus Turin,506,26.06.2017,26.06.2017,-,1,2017-06-26,2017-06-26,,Cédric Soares
Manchester City,281,23.03.2017,23.03.2017,-,2,2017-03-23,2017-03-23,,Cédric Soares
FC Barcelona,131,23.03.2017,23.03.2017,-,2,2017-03-23,2017-03-23,,Cédric Soares
Stoke City,512,10.06.2015,10.06.2015,-,2,2015-06-10,2015-06-10,,Cédric Soares
FC Southampton,180,18.06.2015,09.06.2015,-,2,2015-06-18,2015-06-09,,Cédric Soares
FC Barcelona,131,27.05.2015,27.05.2015,-,2,2015-05-27,2015-05-27,,Cédric Soares
VfL Wolfsburg,82,05.05.2015,06.05.2015,-,2,2015-05-05,2015-05-06,,Cédric Soares
AC Mailand,5,05.05.2015,05.05.2015,-,2,2015-05-05,2015-05-05,,Cédric Soares
Bayer 04 Leverkusen,15,26.04.2015,26.04.2015,-,2,2015-04-26,2015-04-26,,Cédric Soares
Hamburger SV,41,18.03.2015,19.03.2015,-,2,2015-03-18,2015-03-19,,Cédric Soares
Hannover 96,42,29.12.2014,08.01.2015,-,2,2014-12-29,2015-01-08,,Cédric Soares
Borussia Dortmund,16,31.12.2014,01.01.2015,-,2,2014-12-31,2015-01-01,,Cédric Soares
AS Rom,12,11.12.2014,11.12.2014,-,2,2014-12-11,2014-12-11,,Cédric Soares
Inter Mailand,46,08.12.2014,08.12.2014,-,2,2014-12-08,2014-12-08,,Cédric Soares
SSC Neapel,6195,08.12.2014,08.12.2014,-,2,2014-12-08,2014-12-08,,Cédric Soares
FC Schalke 04,33,20.06.2014,20.06.2014,-,2,2014-06-20,2014-06-20,,Cédric Soares
1.FSV Mainz 05,39,04.06.2013,05.06.2013,-,3,2013-06-04,2013-06-05,,Cédric Soares
Borussia Mönchengladbach,18,14.03.2013,14.03.2013,-,3,2013-03-14,2013-03-14,,Cédric Soares
FC Everton,29,14.03.2013,14.03.2013,-,3,2013-03-14,2013-03-14,,Cédric Soares
Norwich City,1123,14.03.2013,14.03.2013,-,3,2013-03-14,2013-03-14,,Cédric Soares
Fortuna Düsseldorf,38,12.03.2013,12.03.2013,-,3,2013-03-12,2013-03-12,,Cédric Soares
Atlético Madrid,13,06.07.2023,06.07.2023,-,1,2023-07-06,2023-07-06,,César Azpilicueta
Inter Mailand,46,01.07.2023,01.07.2023,-,1,2023-07-01,2023-07-01,,César Azpilicueta
FC Barcelona,131,05.08.2022,05.08.2022,-,1,2022-08-05,2022-08-05,,César Azpilicueta
FC Bayern München,27,15.02.2022,19.03.2022,-,1,2022-02-15,2022-03-19,,César Azpilicueta
FC Paris Saint-Germain,583,18.06.2016,18.06.2016,-,1,2016-06-18,2016-06-18,,César Azpilicueta
Manchester United,985,18.06.2016,18.06.2016,-,1,2016-06-18,2016-06-18,,César Azpilicueta
Athletic Bilbao,621,18.06.2016,18.06.2016,-,1,2016-06-18,2016-06-18,,César Azpilicueta
Real Madrid,418,22.09.2013,22.09.2013,-,1,2013-09-22,2013-09-22,,César Azpilicueta
AC Florenz,430,11.07.2013,13.07.2013,-,1,2013-07-11,2013-07-13,,César Azpilicueta
FC Chelsea,631,23.08.2012,24.08.2012,-,1,2012-08-23,2012-08-24,,César Azpilicueta
FC Valencia,1049,25.05.2012,25.05.2012,-,1,2012-05-25,2012-05-25,,César Azpilicueta
Olympique Marseille,244,23.06.2010,23.06.2010,-,1,2010-06-23,2010-06-23,,César Azpilicueta
FC Liverpool,31,05.03.2010,18.05.2010,-,1,2010-03-05,2010-05-18,,César Azpilicueta
Manchester City,281,05.03.2010,05.03.2010,-,1,2010-03-05,2010-03-05,,César Azpilicueta
FC Arsenal,11,05.03.2010,05.03.2010,-,1,2010-03-05,2010-03-05,,César Azpilicueta
Espanyol Barcelona,714,28.12.2022,28.12.2022,-,1,2022-12-28,2022-12-28,,César Montes
Dinamo Moskau,121,31.07.2022,31.07.2022,-,1,2022-07-31,2022-07-31,,César Montes
PSV Eindhoven,383,17.07.2021,17.07.2021,-,1,2021-07-17,2021-07-17,,César Montes
Crystal Palace,873,04.06.2024,04.06.2024,-,1,2024-06-04,2024-06-04,,Daichi Kamada
Borussia Mönchengladbach,18,29.05.2024,04.06.2024,-,1,2024-05-29,2024-06-04,,Daichi Kamada
Galatasaray,141,17.01.2024,22.01.2024,-,1,2024-01-17,2024-01-22,,Daichi Kamada
Eintracht Frankfurt,24,22.11.2023,23.11.2023,-,1,2023-11-22,2023-11-23,,Daichi Kamada
Lazio Rom,398,04.08.2023,04.08.2023,-,1,2023-08-04,2023-08-04,,Daichi Kamada
AC Mailand,5,02.08.2023,02.08.2023,-,1,2023-08-02,2023-08-02,,Daichi Kamada
Eintracht Frankfurt,24,24.07.2023,24.07.2023,-,1,2023-07-24,2023-07-24,,Daichi Kamada
Atlético Madrid,13,23.07.2023,23.07.2023,-,1,2023-07-23,2023-07-23,,Daichi Kamada
Inter Mailand,46,04.07.2023,06.07.2023,-,1,2023-07-04,2023-07-06,,Daichi Kamada
AS Rom,12,05.07.2023,05.07.2023,-,1,2023-07-05,2023-07-05,,Daichi Kamada
SSC Neapel,6195,29.05.2023,29.05.2023,-,1,2023-05-29,2023-05-29,,Daichi Kamada
Benfica Lissabon,294,27.04.2023,19.05.2023,-,1,2023-04-27,2023-05-19,,Daichi Kamada
Borussia Dortmund,16,15.04.2023,15.04.2023,-,1,2023-04-15,2023-04-15,,Daichi Kamada
Atlético Madrid,13,03.04.2023,03.04.2023,-,1,2023-04-03,2023-04-03,,Daichi Kamada
Newcastle United,762,31.03.2023,31.03.2023,-,1,2023-03-31,2023-03-31,,Daichi Kamada
FC Barcelona,131,31.03.2023,31.03.2023,-,2,2023-03-31,2023-03-31,,Daichi Kamada
Manchester United,985,31.03.2023,31.03.2023,-,2,2023-03-31,2023-03-31,,Daichi Kamada
FC Chelsea,631,10.03.2023,10.03.2023,-,2,2023-03-10,2023-03-10,,Daichi Kamada
FC Liverpool,31,24.02.2023,24.02.2023,-,2,2023-02-24,2023-02-24,,Daichi Kamada
FC Bayern München,27,03.02.2023,07.02.2023,-,2,2023-02-03,2023-02-07,,Daichi Kamada
Tottenham Hotspur,148,08.12.2022,08.12.2022,-,2,2022-12-08,2022-12-08,,Daichi Kamada
FC Villarreal,1050,06.10.2022,13.10.2022,-,2,2022-10-06,2022-10-13,,Daichi Kamada
FC Everton,29,30.09.2022,30.09.2022,-,2,2022-09-30,2022-09-30,,Daichi Kamada
Leeds United,399,03.07.2022,06.07.2022,-,2,2022-07-03,2022-07-06,,Daichi Kamada
FC Sevilla,368,17.05.2021,17.05.2021,-,2,2021-05-17,2021-05-17,,Daichi Kamada
FC Watford,1010,17.05.2021,17.05.2021,-,2,2021-05-17,2021-05-17,,Daichi Kamada
Genua CFC,252,27.07.2019,31.07.2019,-,2,2019-07-27,2019-07-31,,Daichi Kamada
VfB Stuttgart,79,20.06.2019,20.06.2019,-,2,2019-06-20,2019-06-20,,Daichi Kamada
Eintracht Frankfurt,24,25.06.2017,29.06.2017,-,2,2017-06-25,2017-06-29,,Daichi Kamada
Derby County,22,11.07.2022,11.07.2022,-,1,2022-07-11,2022-07-11,,Dale Stephens
FC Burnley,1132,23.09.2020,23.09.2020,-,1,2020-09-23,2020-09-23,,Dale Stephens
Aston Villa,405,29.08.2012,29.08.2012,-,1,2012-08-29,2012-08-29,,Dale Stephens
FC Girona,12321,07.07.2023,08.07.2023,-,1,2023-07-07,2023-07-08,,Daley Blind
FC Getafe,3709,04.07.2023,04.07.2023,-,1,2023-07-04,2023-07-04,,Daley Blind
FC Girona,12321,11.06.2023,12.06.2023,-,1,2023-06-11,2023-06-12,,Daley Blind
Ajax Amsterdam,610,12.05.2023,12.05.2023,-,1,2023-05-12,2023-05-12,,Daley Blind
Royal Antwerpen FC,1096,12.05.2023,12.05.2023,-,1,2023-05-12,2023-05-12,,Daley Blind
FC Bayern München,27,05.01.2023,05.01.2023,-,1,2023-01-05,2023-01-05,,Daley Blind
Real Sociedad San Sebastián,681,27.12.2022,28.12.2022,-,1,2022-12-27,2022-12-28,,Daley Blind
Royal Antwerpen FC,1096,09.12.2022,09.12.2022,-,1,2022-12-09,2022-12-09,,Daley Blind
Ajax Amsterdam,610,17.07.2018,17.07.2018,-,1,2018-07-17,2018-07-17,,Daley Blind
Inter Mailand,46,03.06.2018,03.06.2018,-,1,2018-06-03,2018-06-03,,Daley Blind
AS Rom,12,31.01.2018,31.01.2018,-,1,2018-01-31,2018-01-31,,Daley Blind
Galatasaray,141,09.10.2017,09.10.2017,-,1,2017-10-09,2017-10-09,,Daley Blind
FC Arsenal,11,19.06.2016,19.06.2016,-,1,2016-06-19,2016-06-19,,Daley Blind
FC Barcelona,131,01.06.2016,01.06.2016,-,1,2016-06-01,2016-06-01,,Daley Blind
Manchester United,985,22.08.2014,19.07.2014,-,1,2014-08-22,2014-07-19,,Daley Blind
FC Liverpool,31,19.07.2014,19.07.2014,-,2,2014-07-19,2014-07-19,,Daley Blind
FC Arsenal,11,19.07.2014,19.07.2014,-,2,2014-07-19,2014-07-19,,Daley Blind
FC Barcelona,131,19.07.2014,19.07.2014,-,2,2014-07-19,2014-07-19,,Daley Blind
Borussia Dortmund,16,17.06.2014,15.07.2014,-,2,2014-06-17,2014-07-15,,Daley Blind
Hannover 96,42,29.01.2014,29.01.2014,-,2,2014-01-29,2014-01-29,,Daley Blind
FC Chelsea,631,10.01.2014,10.01.2014,-,2,2014-01-10,2014-01-10,,Daley Blind
Lech Posen,238,20.06.2023,20.06.2023,-,1,2023-06-20,2023-06-20,,Daley Sinkgraven
GNK Dinamo Zagreb,419,30.08.2022,31.08.2022,-,1,2022-08-30,2022-08-31,,Daley Sinkgraven
Feyenoord Rotterdam,234,16.06.2022,16.06.2022,-,1,2022-06-16,2022-06-16,,Daley Sinkgraven
FC Twente Enschede,317,09.06.2022,13.06.2022,-,1,2022-06-09,2022-06-13,,Daley Sinkgraven
Bayer 04 Leverkusen,15,13.06.2019,17.06.2019,-,1,2019-06-13,2019-06-17,,Daley Sinkgraven
FC Bayern München,27,08.10.2014,08.10.2014,-,1,2014-10-08,2014-10-08,,Daley Sinkgraven
FC Nantes,995,13.01.2023,13.01.2023,-,1,2023-01-13,2023-01-13,,Damien Da Silva
Clermont Foot 63,3524,08.08.2022,08.08.2022,-,1,2022-08-08,2022-08-08,,Damien Da Silva
FC Metz,347,23.07.2022,23.07.2022,-,1,2022-07-23,2022-07-23,,Damien Da Silva
AEK Athen,2441,15.05.2021,15.05.2021,-,1,2021-05-15,2021-05-15,,Damien Da Silva
FC Sion,321,27.06.2018,27.06.2018,-,1,2018-06-27,2018-06-27,,Damien Da Silva
Trabzonspor,449,25.06.2018,25.06.2018,-,1,2018-06-25,2018-06-25,,Damien Da Silva
Fenerbahce,36,08.06.2018,08.06.2018,-,1,2018-06-08,2018-06-08,,Damien Da Silva
Torpedo Moskau,1186,27.08.2022,27.08.2022,-,1,2022-08-27,2022-08-27,,Damien Le Tallec
FC Utrecht,200,01.08.2012,02.08.2012,-,1,2012-08-01,2012-08-02,,Damien Le Tallec
FC Sochaux-Montbéliard,750,13.12.2011,14.12.2011,-,1,2011-12-13,2011-12-14,,Damien Le Tallec
Eintracht Braunschweig,23,26.08.2011,26.08.2011,-,1,2011-08-26,2011-08-26,,Damien Le Tallec
FC St. Pauli,35,05.07.2011,25.07.2011,-,1,2011-07-05,2011-07-25,,Damien Le Tallec
Fortuna Düsseldorf,38,18.01.2011,21.01.2011,-,1,2011-01-18,2011-01-21,,Damien Le Tallec
FC Energie Cottbus,25,14.01.2011,17.01.2011,-,1,2011-01-14,2011-01-17,,Damien Le Tallec
FC Paris Saint-Germain,583,15.02.2010,15.02.2010,-,1,2010-02-15,2010-02-15,,Damien Le Tallec
Nottingham Forest,703,29.07.2025,29.07.2025,73 %,1,2025-07-29,2025-07-29,73.0,Dan Ndoye
Borussia Dortmund,16,28.07.2025,28.07.2025,30 %,1,2025-07-28,2025-07-28,30.0,Dan Ndoye
SSC Neapel,6195,23.07.2025,23.07.2025,-,1,2025-07-23,2025-07-23,,Dan Ndoye
Crystal Palace,873,01.07.2025,01.07.2025,-,1,2025-07-01,2025-07-01,,Dan Ndoye
Manchester United,985,21.05.2025,21.05.2025,-,1,2025-05-21,2025-05-21,,Dan Ndoye
FC Bologna,1025,07.08.2023,14.08.2023,-,1,2023-08-07,2023-08-14,,Dan Ndoye
FC Everton,29,02.07.2023,08.08.2023,-,1,2023-07-02,2023-08-08,,Dan Ndoye
FC Fulham,931,24.07.2023,24.07.2023,-,1,2023-07-24,2023-07-24,,Dan Ndoye
Olympique Marseille,244,23.07.2023,23.07.2023,-,1,2023-07-23,2023-07-23,,Dan Ndoye
FC Porto,720,11.07.2023,11.07.2023,-,1,2023-07-11,2023-07-11,,Dan Ndoye
West Ham United,379,09.07.2023,09.07.2023,-,1,2023-07-09,2023-07-09,,Dan Ndoye
AS Monaco,162,09.07.2023,09.07.2023,-,1,2023-07-09,2023-07-09,,Dan Ndoye
Sporting Lissabon,336,02.06.2023,08.06.2023,-,1,2023-06-02,2023-06-08,,Dan Ndoye
Leeds United,399,27.12.2022,17.01.2023,-,1,2022-12-27,2023-01-17,,Dan Ndoye
Leeds United,399,27.12.2022,27.12.2022,-,1,2022-12-27,2022-12-27,,Dan Ndoye
FC Basel 1893,26,31.08.2021,31.08.2021,-,2,2021-08-31,2021-08-31,,Dan Ndoye
OGC Nizza,417,29.01.2020,29.01.2020,-,2,2020-01-29,2020-01-29,,Dan Ndoye
FC Stade Rennes,273,26.08.2019,27.08.2019,-,2,2019-08-26,2019-08-27,,Dan Ndoye
FC Brentford,1148,15.08.2025,15.08.2025,-,1,2025-08-15,2025-08-15,,Dango Ouattara
AFC Bournemouth,989,16.01.2023,16.01.2023,-,1,2023-01-16,2023-01-16,,Dango Ouattara
FC Everton,29,08.01.2023,08.01.2023,-,1,2023-01-08,2023-01-08,,Dango Ouattara
Leicester City,1003,05.01.2023,05.01.2023,-,1,2023-01-05,2023-01-05,,Dango Ouattara
UNAM Pumas,7633,21.07.2022,21.07.2022,-,1,2022-07-21,2022-07-21,,Dani Alves
FC Arsenal,11,14.07.2019,14.07.2019,-,1,2019-07-14,2019-07-14,,Dani Alves
Inter Mailand,46,13.07.2019,13.07.2019,-,1,2019-07-13,2019-07-13,,Dani Alves
FC Sevilla,368,05.07.2019,05.07.2019,-,1,2019-07-05,2019-07-05,,Dani Alves
CA Boca Juniors,189,22.03.2019,22.03.2019,-,1,2019-03-22,2019-03-22,,Dani Alves
FC Paris Saint-Germain,583,13.07.2017,13.07.2017,-,1,2017-07-13,2017-07-13,,Dani Alves
Manchester City,281,11.07.2017,11.07.2017,-,1,2017-07-11,2017-07-11,,Dani Alves
FC Paris Saint-Germain,583,09.07.2017,09.07.2017,-,1,2017-07-09,2017-07-09,,Dani Alves
FC Chelsea,631,26.06.2017,26.06.2017,-,1,2017-06-26,2017-06-26,,Dani Alves
Tottenham Hotspur,148,17.05.2017,17.05.2017,-,1,2017-05-17,2017-05-17,,Dani Alves
Shanghai Port,27190,23.01.2017,23.01.2017,-,1,2017-01-23,2017-01-23,,Dani Alves
Tianjin Tianhai (-2019),33714,23.01.2017,23.01.2017,-,1,2017-01-23,2017-01-23,,Dani Alves
Hebei FC (2010-2023),36630,23.01.2017,23.01.2017,-,1,2017-01-23,2017-01-23,,Dani Alves
Juventus Turin,506,27.06.2016,27.06.2016,-,1,2016-06-27,2016-06-27,,Dani Alves
FC Barcelona,131,,09.06.2015,-,1,,2015-06-09,,Dani Alves
AC Mailand,5,07.06.2015,02.06.2015,-,2,2015-06-07,2015-06-02,,Dani Alves
Borussia Dortmund,16,25.03.2015,27.03.2015,-,2,2015-03-25,2015-03-27,,Dani Alves
FC Liverpool,31,25.03.2015,25.03.2015,-,2,2015-03-25,2015-03-25,,Dani Alves
Manchester United,985,25.03.2015,25.03.2015,-,2,2015-03-25,2015-03-25,,Dani Alves
Inter Mailand,46,25.03.2015,25.03.2015,-,2,2015-03-25,2015-03-25,,Dani Alves
Tottenham Hotspur,148,09.11.2014,09.11.2014,-,2,2014-11-09,2014-11-09,,Dani Alves
AS Monaco,162,16.05.2013,16.05.2013,-,2,2013-05-16,2013-05-16,,Dani Alves
FC Arsenal,11,09.11.2014,13.03.2013,-,2,2014-11-09,2013-03-13,,Dani Alves
FC Schalke 04,33,26.05.2012,26.05.2012,-,2,2012-05-26,2012-05-26,,Dani Alves
Anzhi Makhachkala,2700,07.05.2012,07.05.2012,-,2,2012-05-07,2012-05-07,,Dani Alves
Manchester City,281,28.01.2011,28.01.2011,-,2,2011-01-28,2011-01-28,,Dani Alves
Real Madrid,418,14.12.2010,15.12.2010,-,2,2010-12-14,2010-12-15,,Dani Alves
FC Chelsea,631,10.02.2010,23.02.2010,-,2,2010-02-10,2010-02-23,,Dani Alves
FC Valencia,1049,02.08.2024,02.08.2024,-,1,2024-08-02,2024-08-02,,Dani Gómez
FC Bayern München,27,03.01.2025,04.01.2025,-,1,2025-01-03,2025-01-04,,Dani Olmo
Bayer 04 Leverkusen,15,01.01.2025,01.01.2025,-,1,2025-01-01,2025-01-01,,Dani Olmo
RB Leipzig,23826,01.01.2025,01.01.2025,-,1,2025-01-01,2025-01-01,,Dani Olmo
FC Barcelona,131,07.08.2024,08.08.2024,-,1,2024-08-07,2024-08-08,,Dani Olmo
Manchester City,281,25.07.2024,25.07.2024,-,1,2024-07-25,2024-07-25,,Dani Olmo
FC Bayern München,27,21.07.2024,22.07.2024,-,1,2024-07-21,2024-07-22,,Dani Olmo
FC Liverpool,31,28.05.2024,22.07.2024,-,1,2024-05-28,2024-07-22,,Dani Olmo
Atlético Madrid,13,17.07.2024,18.07.2024,-,1,2024-07-17,2024-07-18,,Dani Olmo
FC Chelsea,631,13.10.2023,13.10.2023,-,1,2023-10-13,2023-10-13,,Dani Olmo
Real Madrid,418,13.10.2023,13.10.2023,-,1,2023-10-13,2023-10-13,,Dani Olmo
FC Arsenal,11,13.10.2023,13.10.2023,-,1,2023-10-13,2023-10-13,,Dani Olmo
FC Paris Saint-Germain,583,18.08.2023,18.08.2023,-,1,2023-08-18,2023-08-18,,Dani Olmo
Borussia Dortmund,16,01.06.2023,01.06.2023,-,1,2023-06-01,2023-06-01,,Dani Olmo
Manchester United,985,03.01.2023,03.01.2023,-,1,2023-01-03,2023-01-03,,Dani Olmo
AC Mailand,5,23.02.2022,23.02.2022,-,1,2022-02-23,2022-02-23,,Dani Olmo
Juventus Turin,506,13.09.2021,13.09.2021,-,2,2021-09-13,2021-09-13,,Dani Olmo
RB Leipzig,23826,24.01.2020,24.01.2020,-,2,2020-01-24,2020-01-24,,Dani Olmo
Borussia Dortmund,16,22.01.2020,23.01.2020,-,2,2020-01-22,2020-01-23,,Dani Olmo
AC Mailand,5,15.01.2020,18.01.2020,-,2,2020-01-15,2020-01-18,,Dani Olmo
FC Barcelona,131,22.11.2019,22.11.2019,-,2,2019-11-22,2019-11-22,,Dani Olmo
FC Paris Saint-Germain,583,22.09.2019,22.09.2019,-,2,2019-09-22,2019-09-22,,Dani Olmo
Bayer 04 Leverkusen,15,27.08.2019,27.08.2019,-,2,2019-08-27,2019-08-27,,Dani Olmo
Atlético Madrid,13,21.08.2019,21.08.2019,-,2,2019-08-21,2019-08-21,,Dani Olmo
FC Bayern München,27,15.08.2019,20.08.2019,-,2,2019-08-15,2019-08-20,,Dani Olmo
Tottenham Hotspur,148,09.07.2019,09.07.2019,-,2,2019-07-09,2019-07-09,,Dani Olmo
Borussia Mönchengladbach,18,16.06.2019,18.06.2019,-,2,2019-06-16,2019-06-18,,Dani Olmo
1.FSV Mainz 05,39,26.09.2018,09.10.2018,-,2,2018-09-26,2018-10-09,,Dani Olmo
AFC Sunderland,289,30.06.2013,30.06.2013,-,1,2013-06-30,2013-06-30,,Daniel Bessa
Spezia Calcio,3522,10.06.2012,10.06.2012,-,1,2012-06-10,2012-06-10,,Daniel Bessa
FC Schalke 04,33,25.11.2022,26.11.2022,-,1,2022-11-25,2022-11-26,,Daniel Caligiuri
FC Augsburg,167,29.06.2020,29.06.2020,-,1,2020-06-29,2020-06-29,,Daniel Caligiuri
AC Mailand,5,30.04.2019,30.04.2019,-,1,2019-04-30,2019-04-30,,Daniel Caligiuri
AS Rom,12,30.04.2019,30.04.2019,-,1,2019-04-30,2019-04-30,,Daniel Caligiuri
Inter Mailand,46,30.04.2019,30.04.2019,-,1,2019-04-30,2019-04-30,,Daniel Caligiuri
Lazio Rom,398,15.12.2018,16.12.2018,-,1,2018-12-15,2018-12-16,,Daniel Caligiuri
FC Schalke 04,33,25.01.2017,26.01.2017,-,1,2017-01-25,2017-01-26,,Daniel Caligiuri
FC Turin,416,17.10.2016,17.10.2016,-,1,2016-10-17,2016-10-17,,Daniel Caligiuri
AC Florenz,430,17.10.2016,17.10.2016,-,1,2016-10-17,2016-10-17,,Daniel Caligiuri
FC Villarreal,1050,28.08.2016,29.08.2016,-,1,2016-08-28,2016-08-29,,Daniel Caligiuri
Lazio Rom,398,05.06.2015,05.06.2015,-,1,2015-06-05,2015-06-05,,Daniel Caligiuri
Eintracht Frankfurt,24,10.06.2014,11.06.2014,-,1,2014-06-10,2014-06-11,,Daniel Caligiuri
VfL Wolfsburg,82,24.04.2013,24.04.2013,-,1,2013-04-24,2013-04-24,,Daniel Caligiuri
Bayer 04 Leverkusen,15,17.04.2013,17.04.2013,-,1,2013-04-17,2013-04-17,,Daniel Caligiuri
Hannover 96,42,11.04.2013,11.04.2013,-,1,2013-04-11,2013-04-11,,Daniel Caligiuri
Borussia Mönchengladbach,18,24.03.2013,30.03.2013,-,2,2013-03-24,2013-03-30,,Daniel Caligiuri
Hamburger SV,41,21.03.2013,22.03.2013,-,2,2013-03-21,2013-03-22,,Daniel Caligiuri
FC Sevilla,368,18.04.2012,18.04.2012,-,1,2012-04-18,2012-04-18,,Daniel Carriço
Manchester City,281,17.04.2010,17.04.2010,-,1,2010-04-17,2010-04-17,,Daniel Carriço
Atlético Madrid,13,07.03.2010,12.03.2010,-,1,2010-03-07,2010-03-12,,Daniel Carriço
VfB Stuttgart,79,29.06.2018,29.06.2018,-,1,2018-06-29,2018-06-29,,Daniel Didavi
Hamburger SV,41,31.05.2017,31.05.2017,-,1,2017-05-31,2017-05-31,,Daniel Didavi
Hamburger SV,41,24.05.2017,24.05.2017,-,1,2017-05-24,2017-05-24,,Daniel Didavi
VfL Wolfsburg,82,05.04.2016,05.04.2016,-,1,2016-04-05,2016-04-05,,Daniel Didavi
Besiktas JK,114,12.03.2016,13.03.2016,-,1,2016-03-12,2016-03-13,,Daniel Didavi
Borussia Mönchengladbach,18,16.02.2016,17.02.2016,-,1,2016-02-16,2016-02-17,,Daniel Didavi
Tottenham Hotspur,148,20.12.2015,21.12.2015,-,1,2015-12-20,2015-12-21,,Daniel Didavi
Bayer 04 Leverkusen,15,08.12.2015,08.12.2015,-,1,2015-12-08,2015-12-08,,Daniel Didavi
TSG 1899 Hoffenheim,533,09.06.2015,09.06.2015,-,1,2015-06-09,2015-06-09,,Daniel Didavi
1.FC Nürnberg,4,18.05.2012,18.05.2012,-,1,2012-05-18,2012-05-18,,Daniel Didavi
FC Augsburg,167,10.06.2011,10.06.2011,-,1,2011-06-10,2011-06-10,,Daniel Didavi
MSV Duisburg,52,06.01.2024,08.01.2024,-,1,2024-01-06,2024-01-08,,Daniel Ginczek
Fortuna Düsseldorf,38,29.01.2022,29.01.2022,-,1,2022-01-29,2022-01-29,,Daniel Ginczek
1.FC Köln,3,20.01.2021,22.01.2021,-,1,2021-01-20,2021-01-22,,Daniel Ginczek
FC Schalke 04,33,17.01.2021,18.01.2021,-,1,2021-01-17,2021-01-18,,Daniel Ginczek
VfL Wolfsburg,82,29.06.2018,29.06.2018,-,1,2018-06-29,2018-06-29,,Daniel Ginczek
Borussia Dortmund,16,02.12.2015,03.12.2015,-,1,2015-12-02,2015-12-03,,Daniel Ginczek
TSG 1899 Hoffenheim,533,21.05.2015,21.05.2015,-,1,2015-05-21,2015-05-21,,Daniel Ginczek
VfB Stuttgart,79,06.06.2014,06.06.2014,-,1,2014-06-06,2014-06-06,,Daniel Ginczek
SV Werder Bremen,86,03.06.2014,06.06.2014,-,1,2014-06-03,2014-06-06,,Daniel Ginczek
Eintracht Frankfurt,24,04.06.2014,04.06.2014,-,1,2014-06-04,2014-06-04,,Daniel Ginczek
Hertha BSC,44,10.02.2014,10.02.2014,-,1,2014-02-10,2014-02-10,,Daniel Ginczek
1.FC Nürnberg,4,01.06.2013,03.06.2013,-,1,2013-06-01,2013-06-03,,Daniel Ginczek
SC Freiburg,60,14.05.2013,14.05.2013,-,1,2013-05-14,2013-05-14,,Daniel Ginczek
1.FSV Mainz 05,39,14.05.2013,14.05.2013,-,1,2013-05-14,2013-05-14,,Daniel Ginczek
Hamburger SV,41,12.05.2013,12.05.2013,-,1,2013-05-12,2013-05-12,,Daniel Ginczek
FC St. Pauli,35,07.04.2013,08.04.2013,-,2,2013-04-07,2013-04-08,,Daniel Ginczek
West Ham United,379,10.03.2013,11.03.2013,-,2,2013-03-10,2013-03-11,,Daniel Ginczek
Fortuna Düsseldorf,38,14.05.2012,14.05.2012,-,2,2012-05-14,2012-05-14,,Daniel Ginczek
VfL Bochum,80,04.05.2012,08.05.2012,-,2,2012-05-04,2012-05-08,,Daniel Ginczek
SC Paderborn 07,127,02.06.2011,02.06.2011,-,2,2011-06-02,2011-06-02,,Daniel Ginczek
MSV Duisburg,52,25.05.2011,25.05.2011,-,2,2011-05-25,2011-05-25,,Daniel Ginczek
Alemannia Aachen,8,30.03.2011,30.03.2011,-,2,2011-03-30,2011-03-30,,Daniel Ginczek
Tottenham Hotspur,148,02.09.2022,02.09.2022,-,1,2022-09-02,2022-09-02,,Daniel James
Leeds United,399,31.08.2021,31.08.2021,-,1,2021-08-31,2021-08-31,,Daniel James
West Bromwich Albion,984,01.01.2021,01.01.2021,-,1,2021-01-01,2021-01-01,,Daniel James
Brighton & Hove Albion,1237,20.12.2020,20.12.2020,-,1,2020-12-20,2020-12-20,,Daniel James
FC Everton,29,20.11.2020,20.11.2020,-,1,2020-11-20,2020-11-20,,Daniel James
Manchester United,985,07.06.2019,07.06.2019,-,1,2019-06-07,2019-06-07,,Daniel James
AS Monaco,162,04.06.2019,04.06.2019,-,1,2019-06-04,2019-06-04,,Daniel James
Manchester City,281,30.04.2019,30.04.2019,-,1,2019-04-30,2019-04-30,,Daniel James
Leeds United,399,31.01.2019,31.01.2019,-,1,2019-01-31,2019-01-31,,Daniel James
Atalanta Bergamo,800,31.01.2025,31.01.2025,-,1,2025-01-31,2025-01-31,,Daniel Maldini
AC Florenz,430,23.11.2024,23.11.2024,-,1,2024-11-23,2024-11-23,,Daniel Maldini
Juventus Turin,506,18.11.2024,18.11.2024,-,1,2024-11-18,2024-11-18,,Daniel Maldini
AC Monza,2919,10.06.2024,10.06.2024,-,1,2024-06-10,2024-06-10,,Daniel Maldini
Atalanta Bergamo,800,10.06.2024,10.06.2024,-,1,2024-06-10,2024-06-10,,Daniel Maldini
Al-Shabab FC,9840,02.09.2024,02.09.2024,-,1,2024-09-02,2024-09-02,,Daniel Podence
Olympiakos Piräus,683,04.09.2023,05.09.2023,-,1,2023-09-04,2023-09-05,,Daniel Podence
FC Everton,29,27.10.2022,27.10.2022,-,1,2022-10-27,2022-10-27,,Daniel Podence
Wolverhampton Wanderers,543,30.01.2020,30.01.2020,-,1,2020-01-30,2020-01-30,,Daniel Podence
Nottingham Forest,703,09.07.2018,09.07.2018,-,1,2018-07-09,2018-07-09,,Daniel Podence
FC Schalke 04,33,10.09.2021,13.09.2021,-,1,2021-09-10,2021-09-13,,Daniel Sturridge
Inter Miami CF,69261,30.03.2021,30.03.2021,-,1,2021-03-30,2021-03-30,,Daniel Sturridge
Benevento Calcio,4171,04.07.2020,04.07.2020,-,1,2020-07-04,2020-07-04,,Daniel Sturridge
D.C. United Academy,16985,18.05.2020,18.05.2020,-,1,2020-05-18,2020-05-18,,Daniel Sturridge
Inter Miami CF,69261,18.05.2020,18.05.2020,-,1,2020-05-18,2020-05-18,,Daniel Sturridge
Eintracht Frankfurt,24,17.08.2019,21.08.2019,-,1,2019-08-17,2019-08-21,,Daniel Sturridge
Trabzonspor,449,17.08.2019,20.08.2019,-,1,2019-08-17,2019-08-20,,Daniel Sturridge
Atalanta Bergamo,800,14.08.2019,14.08.2019,-,1,2019-08-14,2019-08-14,,Daniel Sturridge
Glasgow Rangers,124,14.07.2019,14.07.2019,-,1,2019-07-14,2019-07-14,,Daniel Sturridge
Aston Villa,405,14.07.2019,14.07.2019,-,1,2019-07-14,2019-07-14,,Daniel Sturridge
FC Bologna,1025,14.07.2019,14.07.2019,-,1,2019-07-14,2019-07-14,,Daniel Sturridge
Leicester City,1003,14.04.2019,14.04.2019,-,1,2019-04-14,2019-04-14,,Daniel Sturridge
Fenerbahce,36,18.06.2018,18.06.2018,-,1,2018-06-18,2018-06-18,,Daniel Sturridge
Inter Mailand,46,30.01.2018,30.01.2018,-,1,2018-01-30,2018-01-30,,Daniel Sturridge
West Bromwich Albion,984,29.01.2018,29.01.2018,-,1,2018-01-29,2018-01-29,,Daniel Sturridge
FC Sevilla,368,22.01.2018,22.01.2018,-,2,2018-01-22,2018-01-22,,Daniel Sturridge
Besiktas JK,114,12.01.2018,12.01.2018,-,2,2018-01-12,2018-01-12,,Daniel Sturridge
FC Southampton,180,29.12.2017,29.12.2017,-,2,2017-12-29,2017-12-29,,Daniel Sturridge
Newcastle United,762,21.12.2017,21.12.2017,-,2,2017-12-21,2017-12-21,,Daniel Sturridge
FC Valencia,1049,14.12.2017,14.12.2017,-,2,2017-12-14,2017-12-14,,Daniel Sturridge
Real Betis Sevilla,150,14.12.2017,14.12.2017,-,2,2017-12-14,2017-12-14,,Daniel Sturridge
West Ham United,379,20.11.2016,20.11.2016,-,2,2016-11-20,2016-11-20,,Daniel Sturridge
Stoke City,512,15.11.2016,15.11.2016,-,2,2016-11-15,2016-11-15,,Daniel Sturridge
FC Arsenal,11,08.05.2016,08.05.2016,-,2,2016-05-08,2016-05-08,,Daniel Sturridge
FC Paris Saint-Germain,583,23.03.2016,25.03.2016,-,2,2016-03-23,2016-03-25,,Daniel Sturridge
FC Chelsea,631,05.02.2016,05.02.2016,-,2,2016-02-05,2016-02-05,,Daniel Sturridge
Manchester City,281,05.02.2016,05.02.2016,-,2,2016-02-05,2016-02-05,,Daniel Sturridge
FC Liverpool,31,02.01.2013,02.01.2013,-,2,2013-01-02,2013-01-02,,Daniel Sturridge
Tottenham Hotspur,148,07.07.2012,07.07.2012,-,2,2012-07-07,2012-07-07,,Daniel Sturridge
FC Everton,29,13.08.2011,13.08.2011,-,2,2011-08-13,2011-08-13,,Daniel Sturridge
Bolton Wanderers,355,31.01.2011,31.01.2011,-,3,2011-01-31,2011-01-31,,Daniel Sturridge
Bröndby IF,206,12.08.2022,12.08.2022,-,1,2022-08-12,2022-08-12,,Daniel Wass
Atlético Madrid,13,20.01.2022,20.01.2022,-,1,2022-01-20,2022-01-20,,Daniel Wass
Olympique Marseille,244,22.06.2021,22.06.2021,-,1,2021-06-22,2021-06-22,,Daniel Wass
AS Rom,12,08.05.2018,19.05.2018,-,1,2018-05-08,2018-05-19,,Daniel Wass
Celta Vigo,940,18.06.2015,18.06.2015,-,1,2015-06-18,2015-06-18,,Daniel Wass
FC Liverpool,31,03.04.2015,03.04.2015,-,1,2015-04-03,2015-04-03,,Daniel Wass
FC Chelsea,631,03.04.2015,03.04.2015,-,1,2015-04-03,2015-04-03,,Daniel Wass
West Ham United,379,03.04.2015,03.04.2015,-,1,2015-04-03,2015-04-03,,Daniel Wass
Tottenham Hotspur,148,03.04.2015,03.04.2015,-,1,2015-04-03,2015-04-03,,Daniel Wass
Newcastle United,762,03.04.2015,03.04.2015,-,1,2015-04-03,2015-04-03,,Daniel Wass
SV Werder Bremen,86,30.03.2015,31.03.2015,-,1,2015-03-30,2015-03-31,,Daniel Wass
Olympique Lyon,1041,09.03.2015,09.03.2015,-,1,2015-03-09,2015-03-09,,Daniel Wass
AC Florenz,430,09.03.2015,09.03.2015,-,1,2015-03-09,2015-03-09,,Daniel Wass
Borussia Dortmund,16,07.03.2015,08.03.2015,-,1,2015-03-07,2015-03-08,,Daniel Wass
Borussia Mönchengladbach,18,08.01.2015,09.01.2015,-,1,2015-01-08,2015-01-09,,Daniel Wass
VfL Wolfsburg,82,08.01.2015,08.01.2015,-,2,2015-01-08,2015-01-08,,Daniel Wass
Hamburger SV,41,24.12.2014,24.12.2014,-,2,2014-12-24,2014-12-24,,Daniel Wass
FC Schalke 04,33,14.07.2014,14.07.2014,-,2,2014-07-14,2014-07-14,,Daniel Wass
Thonon Évian Grand Genève FC,14171,19.06.2012,19.06.2012,-,2,2012-06-19,2012-06-19,,Daniel Wass
FC St. Pauli,35,23.12.2010,23.12.2010,-,2,2010-12-23,2010-12-23,,Daniel Wass
Ajax Amsterdam,610,18.08.2024,18.08.2024,-,1,2024-08-18,2024-08-18,,Daniele Rugani
Galatasaray,141,04.08.2022,08.08.2022,-,1,2022-08-04,2022-08-08,,Daniele Rugani
Real Betis Sevilla,150,28.06.2021,28.06.2021,-,1,2021-06-28,2021-06-28,,Daniele Rugani
Cagliari Calcio,1390,13.06.2021,13.06.2021,-,1,2021-06-13,2021-06-13,,Daniele Rugani
Fenerbahce,36,13.06.2021,13.06.2021,-,1,2021-06-13,2021-06-13,,Daniele Rugani
Newcastle United,762,04.10.2020,04.10.2020,-,1,2020-10-04,2020-10-04,,Daniele Rugani
Wolverhampton Wanderers,543,07.06.2020,07.06.2020,-,1,2020-06-07,2020-06-07,,Daniele Rugani
FC Arsenal,11,07.06.2020,07.06.2020,-,1,2020-06-07,2020-06-07,,Daniele Rugani
Eintracht Frankfurt,24,09.01.2020,13.01.2020,-,1,2020-01-09,2020-01-13,,Daniele Rugani
AS Rom,12,13.08.2019,13.08.2019,-,1,2019-08-13,2019-08-13,,Daniele Rugani
FC Barcelona,131,21.12.2018,21.12.2018,-,1,2018-12-21,2018-12-21,,Daniele Rugani
FC Chelsea,631,04.08.2018,04.08.2018,-,1,2018-08-04,2018-08-04,,Daniele Rugani
Manchester United,985,21.12.2017,21.12.2017,-,1,2017-12-21,2017-12-21,,Daniele Rugani
FC Everton,29,11.07.2016,11.07.2016,-,1,2016-07-11,2016-07-11,,Daniele Rugani
FC Villarreal,1050,08.07.2016,08.07.2016,-,1,2016-07-08,2016-07-08,,Daniele Rugani
Hellas Verona,276,11.11.2015,11.11.2015,-,2,2015-11-11,2015-11-11,,Daniele Rugani
FC Bologna,1025,11.11.2015,11.11.2015,-,2,2015-11-11,2015-11-11,,Daniele Rugani
Genua CFC,252,11.11.2015,11.11.2015,-,2,2015-11-11,2015-11-11,,Daniele Rugani
Sampdoria Genua,1038,11.11.2015,11.11.2015,-,2,2015-11-11,2015-11-11,,Daniele Rugani
SSC Neapel,6195,03.11.2015,04.11.2015,-,2,2015-11-03,2015-11-04,,Daniele Rugani
AC Florenz,430,03.11.2015,03.11.2015,-,2,2015-11-03,2015-11-03,,Daniele Rugani
SSC Neapel,6195,13.06.2015,13.06.2015,-,2,2015-06-13,2015-06-13,,Daniele Rugani
Genua CFC,252,13.06.2015,22.05.2015,-,2,2015-06-13,2015-05-22,,Daniele Rugani
SV Werder Bremen,86,28.05.2014,28.05.2014,-,2,2014-05-28,2014-05-28,,Daniele Rugani
Eintracht Frankfurt,24,09.01.2014,09.01.2014,-,2,2014-01-09,2014-01-09,,Daniele Rugani
Frosinone Calcio,8970,26.05.2020,26.05.2020,-,1,2020-05-26,2020-05-26,,Daniele Verde
Eintracht Frankfurt,24,08.08.2018,08.08.2018,-,1,2018-08-08,2018-08-08,,Daniele Verde
Flamengo Rio de Janeiro,614,27.01.2025,27.01.2025,-,1,2025-01-27,2025-01-27,,Danilo
AC Mailand,5,26.12.2024,26.12.2024,-,1,2024-12-26,2024-12-26,,Danilo
FC Bayern München,27,04.08.2021,06.08.2021,-,1,2021-08-04,2021-08-06,,Danilo
Juventus Turin,506,08.08.2019,08.08.2019,-,1,2019-08-08,2019-08-08,,Danilo
Inter Mailand,46,29.04.2019,29.04.2019,-,1,2019-04-29,2019-04-29,,Danilo
Manchester City,281,23.07.2017,23.07.2017,-,1,2017-07-23,2017-07-23,,Danilo
FC Chelsea,631,20.07.2017,20.07.2017,-,1,2017-07-20,2017-07-20,,Danilo
Juventus Turin,506,01.07.2017,01.07.2017,-,1,2017-07-01,2017-07-01,,Danilo
FC Bayern München,27,12.03.2015,12.03.2015,-,1,2015-03-12,2015-03-12,,Danilo
Real Madrid,418,10.03.2015,10.03.2015,-,1,2015-03-10,2015-03-10,,Danilo
Manchester United,985,04.03.2015,04.03.2015,-,1,2015-03-04,2015-03-04,,Danilo
Juventus Turin,506,02.03.2014,02.03.2014,-,1,2014-03-02,2014-03-02,,Danilo
Benfica Lissabon,294,03.07.2011,09.07.2011,-,1,2011-07-03,2011-07-09,,Danilo
AC Mailand,5,05.05.2011,05.05.2011,-,1,2011-05-05,2011-05-05,,Danilo
Inter Mailand,46,21.04.2011,21.04.2011,-,1,2011-04-21,2011-04-21,,Danilo
FC Turin,416,17.06.2015,10.06.2015,-,1,2015-06-17,2015-06-10,,Danilo Avelar
Leeds United,399,03.02.2014,03.02.2014,-,1,2014-02-03,2014-02-03,,Danilo Avelar
Cagliari Calcio,1390,16.07.2012,16.07.2012,-,1,2012-07-16,2012-07-16,,Danilo Avelar
FC Schalke 04,33,24.01.2011,24.01.2011,-,1,2011-01-24,2011-01-24,,Danilo Avelar
Manchester United,985,10.06.2012,11.06.2012,-,1,2012-06-10,2012-06-11,,Danilo Cataldi
Manchester City,281,10.06.2012,11.06.2012,-,1,2012-06-10,2012-06-11,,Danilo Cataldi
Al-Ittihad Club,8023,02.09.2024,02.09.2024,-,1,2024-09-02,2024-09-02,,Danilo Pereira
AS Monaco,162,27.08.2024,27.08.2024,-,1,2024-08-27,2024-08-27,,Danilo Pereira
Galatasaray,141,04.09.2023,04.09.2023,-,1,2023-09-04,2023-09-04,,Danilo Pereira
Fenerbahce,36,31.08.2023,31.08.2023,-,1,2023-08-31,2023-08-31,,Danilo Pereira
FC Paris Saint-Germain,583,05.10.2020,05.10.2020,-,1,2020-10-05,2020-10-05,,Danilo Pereira
FC Arsenal,11,23.01.2018,23.01.2018,-,1,2018-01-23,2018-01-23,,Danilo Pereira
Manchester United,985,23.01.2018,23.01.2018,-,1,2018-01-23,2018-01-23,,Danilo Pereira
FC Porto,720,08.06.2015,08.06.2015,-,1,2015-06-08,2015-06-08,,Danilo Pereira
Benfica Lissabon,294,08.06.2015,08.06.2015,-,1,2015-06-08,2015-06-08,,Danilo Pereira
Sporting Lissabon,336,15.06.2015,07.06.2015,-,1,2015-06-15,2015-06-07,,Danilo Pereira
Hamburger SV,41,29.12.2014,30.12.2014,-,1,2014-12-29,2014-12-30,,Danilo Pereira
Roda JC Kerkrade,192,30.06.2012,30.06.2012,-,1,2012-06-30,2012-06-30,,Danilo Pereira
Aris Thessaloniki,605,14.01.2011,14.01.2011,-,1,2011-01-14,2011-01-14,,Danilo Pereira
Kasimpasa,10484,18.01.2021,18.01.2021,-,1,2021-01-18,2021-01-18,,Danny Drinkwater
FC Schalke 04,33,05.01.2021,05.01.2021,-,1,2021-01-05,2021-01-05,,Danny Drinkwater
Aston Villa,405,07.01.2020,07.01.2020,-,1,2020-01-07,2020-01-07,,Danny Drinkwater
FC Burnley,1132,09.08.2019,09.08.2019,-,1,2019-08-09,2019-08-09,,Danny Drinkwater
AS Rom,12,15.03.2019,15.03.2019,-,1,2019-03-15,2019-03-15,,Danny Drinkwater
FC Fulham,931,26.11.2018,26.11.2018,-,1,2018-11-26,2018-11-26,,Danny Drinkwater
West Ham United,379,31.07.2018,31.07.2018,-,1,2018-07-31,2018-07-31,,Danny Drinkwater
Crystal Palace,873,29.07.2018,29.07.2018,-,1,2018-07-29,2018-07-29,,Danny Drinkwater
FC Southampton,180,29.07.2018,29.07.2018,-,1,2018-07-29,2018-07-29,,Danny Drinkwater
Leicester City,1003,29.07.2018,29.07.2018,-,1,2018-07-29,2018-07-29,,Danny Drinkwater
FC Chelsea,631,01.09.2017,01.09.2017,-,1,2017-09-01,2017-09-01,,Danny Drinkwater
West Bromwich Albion,984,09.03.2017,09.03.2017,-,1,2017-03-09,2017-03-09,,Danny Drinkwater
Tottenham Hotspur,148,15.08.2016,15.08.2016,-,1,2016-08-15,2016-08-15,,Danny Drinkwater
FC Liverpool,31,22.05.2016,22.05.2016,-,1,2016-05-22,2016-05-22,,Danny Drinkwater
Wolverhampton Wanderers,543,10.01.2024,10.01.2024,-,1,2024-01-10,2024-01-10,,Danny Ings
West Ham United,379,20.01.2023,20.01.2023,-,1,2023-01-20,2023-01-20,,Danny Ings
Tottenham Hotspur,148,14.07.2021,14.07.2021,-,1,2021-07-14,2021-07-14,,Danny Ings
Manchester United,985,05.07.2021,05.07.2021,-,1,2021-07-05,2021-07-05,,Danny Ings
Manchester City,281,08.02.2021,08.02.2021,-,1,2021-02-08,2021-02-08,,Danny Ings
Bayer 04 Leverkusen,15,31.07.2018,10.08.2018,-,1,2018-07-31,2018-08-10,,Danny Ings
Crystal Palace,873,02.08.2018,03.08.2018,-,1,2018-08-02,2018-08-03,,Danny Ings
Newcastle United,762,24.07.2018,24.07.2018,-,1,2018-07-24,2018-07-24,,Danny Ings
FC Southampton,180,24.07.2018,24.07.2018,-,1,2018-07-24,2018-07-24,,Danny Ings
Leicester City,1003,24.07.2018,24.07.2018,-,1,2018-07-24,2018-07-24,,Danny Ings
FC Schalke 04,33,26.06.2018,03.07.2018,-,1,2018-06-26,2018-07-03,,Danny Ings
RB Leipzig,23826,26.06.2018,26.06.2018,-,1,2018-06-26,2018-06-26,,Danny Ings
West Ham United,379,21.12.2017,21.12.2017,-,1,2017-12-21,2017-12-21,,Danny Ings
Stoke City,512,21.12.2017,21.12.2017,-,1,2017-12-21,2017-12-21,,Danny Ings
FC Everton,29,27.10.2017,29.10.2017,-,1,2017-10-27,2017-10-29,,Danny Ings
AFC Sunderland,289,29.08.2016,29.08.2016,-,2,2016-08-29,2016-08-29,,Danny Ings
West Bromwich Albion,984,26.04.2016,26.04.2016,-,2,2016-04-26,2016-04-26,,Danny Ings
Borussia Mönchengladbach,18,08.06.2015,08.06.2015,-,2,2015-06-08,2015-06-08,,Danny Ings
FC Liverpool,31,08.06.2015,29.05.2015,-,2,2015-06-08,2015-05-29,,Danny Ings
Tottenham Hotspur,148,29.05.2015,29.05.2015,-,2,2015-05-29,2015-05-29,,Danny Ings
Manchester United,985,15.05.2015,15.05.2015,-,2,2015-05-15,2015-05-15,,Danny Ings
Borussia Dortmund,16,05.04.2015,06.04.2015,-,2,2015-04-05,2015-04-06,,Danny Ings
Real Sociedad San Sebastián,681,02.06.2015,05.04.2015,-,2,2015-06-02,2015-04-05,,Danny Ings
FC Schalke 04,33,05.04.2015,05.04.2015,-,2,2015-04-05,2015-04-05,,Danny Ings
Newcastle United,762,05.04.2015,05.04.2015,-,2,2015-04-05,2015-04-05,,Danny Ings
VfL Wolfsburg,82,30.03.2015,30.03.2015,-,2,2015-03-30,2015-03-30,,Danny Ings
SV Werder Bremen,86,29.12.2014,30.12.2014,-,2,2014-12-29,2014-12-30,,Danny Ings
West Bromwich Albion,984,29.12.2014,29.12.2014,-,2,2014-12-29,2014-12-29,,Danny Ings
FC Everton,29,14.12.2014,14.12.2014,-,2,2014-12-14,2014-12-14,,Danny Ings
FC Southampton,180,14.12.2014,14.12.2014,-,2,2014-12-14,2014-12-14,,Danny Ings
Ajax Amsterdam,610,14.12.2014,14.12.2014,-,3,2014-12-14,2014-12-14,,Danny Ings
Stoke City,512,15.11.2014,15.11.2014,-,3,2014-11-15,2014-11-15,,Danny Ings
Aston Villa,405,15.11.2014,15.11.2014,-,3,2014-11-15,2014-11-15,,Danny Ings
Bayer 04 Leverkusen,15,19.06.2014,20.06.2014,-,3,2014-06-19,2014-06-20,,Danny Ings
Norwich City,1123,29.01.2014,29.01.2014,-,3,2014-01-29,2014-01-29,,Danny Ings
FC Fulham,931,19.01.2014,19.01.2014,-,3,2014-01-19,2014-01-19,,Danny Ings
FC Schalke 04,33,17.03.2021,17.03.2021,-,1,2021-03-17,2021-03-17,,Danny Latza
FC Liverpool,31,06.01.2016,07.01.2016,-,1,2016-01-06,2016-01-07,,Danny Latza
FC Everton,29,06.01.2016,06.01.2016,-,1,2016-01-06,2016-01-06,,Danny Latza
1.FSV Mainz 05,39,06.05.2015,06.05.2015,-,1,2015-05-06,2015-05-06,,Danny Latza
1.FC Köln,3,01.04.2015,01.04.2015,-,1,2015-04-01,2015-04-01,,Danny Latza
SV Werder Bremen,86,31.03.2015,31.03.2015,-,1,2015-03-31,2015-03-31,,Danny Latza
1.FC Kaiserslautern,2,31.03.2015,31.03.2015,-,1,2015-03-31,2015-03-31,,Danny Latza
VfL Bochum,80,06.07.2013,06.07.2013,-,1,2013-07-06,2013-07-06,,Danny Latza
SV Darmstadt 98,105,25.06.2013,25.06.2013,-,1,2013-06-25,2013-06-25,,Danny Latza
1.FC Saarbrücken,1,05.06.2013,08.06.2013,-,1,2013-06-05,2013-06-08,,Danny Latza
MSV Duisburg,52,22.05.2013,22.05.2013,-,1,2013-05-22,2013-05-22,,Danny Latza
FC Ingolstadt 04,4795,19.05.2010,20.05.2010,-,1,2010-05-19,2010-05-20,,Danny Latza
SpVgg Greuther Fürth,65,05.04.2010,09.04.2010,-,1,2010-04-05,2010-04-09,,Danny Latza
Newcastle United,762,30.04.2019,30.04.2019,-,1,2019-04-30,2019-04-30,,Danny Welbeck
Crystal Palace,873,07.11.2018,07.11.2018,-,1,2018-11-07,2018-11-07,,Danny Welbeck
FC Everton,29,03.10.2018,03.10.2018,-,1,2018-10-03,2018-10-03,,Danny Welbeck
AFC Bournemouth,989,06.08.2018,06.08.2018,-,1,2018-08-06,2018-08-06,,Danny Welbeck
FC Southampton,180,06.08.2018,06.08.2018,-,1,2018-08-06,2018-08-06,,Danny Welbeck
Besiktas JK,114,24.07.2015,24.07.2015,-,1,2015-07-24,2015-07-24,,Danny Welbeck
FC Schalke 04,33,01.09.2014,01.09.2014,-,1,2014-09-01,2014-09-01,,Danny Welbeck
FC Arsenal,11,01.09.2014,27.08.2014,-,1,2014-09-01,2014-08-27,,Danny Welbeck
Newcastle United,762,22.08.2014,22.08.2014,-,1,2014-08-22,2014-08-22,,Danny Welbeck
Hull City,3008,14.08.2014,14.08.2014,-,1,2014-08-14,2014-08-14,,Danny Welbeck
SSC Neapel,6195,01.05.2014,01.05.2014,-,1,2014-05-01,2014-05-01,,Danny Welbeck
FC Everton,29,26.04.2014,26.04.2014,-,1,2014-04-26,2014-04-26,,Danny Welbeck
Tottenham Hotspur,148,01.09.2014,20.04.2014,-,1,2014-09-01,2014-04-20,,Danny Welbeck
AFC Sunderland,289,12.08.2010,12.08.2010,-,1,2010-08-12,2010-08-12,,Danny Welbeck
Preston North End,466,25.01.2010,25.01.2010,-,1,2010-01-25,2010-01-25,,Danny Welbeck
Wigan Athletic,1071,24.01.2010,24.01.2010,-,2,2010-01-24,2010-01-24,,Danny Welbeck
1.FSV Mainz 05,39,29.03.2022,29.04.2022,-,1,2022-03-29,2022-04-29,,Danny da Costa
Hertha BSC,44,31.01.2022,31.01.2022,-,1,2022-01-31,2022-01-31,,Danny da Costa
FC Augsburg,167,15.12.2021,17.01.2022,-,1,2021-12-15,2022-01-17,,Danny da Costa
Besiktas JK,114,09.06.2021,09.06.2021,-,1,2021-06-09,2021-06-09,,Danny da Costa
FC Schalke 04,33,14.10.2020,14.10.2020,-,1,2020-10-14,2020-10-14,,Danny da Costa
VfL Wolfsburg,82,30.09.2020,30.09.2020,-,1,2020-09-30,2020-09-30,,Danny da Costa
Bayer 04 Leverkusen,15,28.04.2016,02.05.2016,-,1,2016-04-28,2016-05-02,,Danny da Costa
FC Ingolstadt 04,4795,15.05.2014,15.05.2014,-,1,2014-05-15,2014-05-15,,Danny da Costa
FC St. Pauli,35,14.06.2012,14.06.2012,-,1,2012-06-14,2012-06-14,,Danny da Costa
FC Burnley,1132,23.06.2023,23.06.2023,-,1,2023-06-23,2023-06-23,,Dara O'Shea
Olympique Marseille,244,20.07.2022,20.07.2022,-,1,2022-07-20,2022-07-20,,Darko Lazović
Besiktas JK,114,23.05.2019,23.05.2019,-,1,2019-05-23,2019-05-23,,Darko Lazović
Genua CFC,252,05.05.2015,14.01.2015,-,1,2015-05-05,2015-01-14,,Darko Lazović
KRC Genk,1184,14.05.2014,14.05.2014,-,1,2014-05-14,2014-05-14,,Darko Lazović
Udinese Calcio,410,21.05.2013,21.05.2013,-,1,2013-05-21,2013-05-21,,Darko Lazović
FC Red Bull Salzburg,409,01.07.2012,07.07.2012,-,1,2012-07-01,2012-07-07,,Darko Lazović
Borussia Mönchengladbach,18,04.06.2012,05.06.2012,-,1,2012-06-04,2012-06-05,,Darko Lazović
FC Paris Saint-Germain,583,10.01.2012,10.01.2012,-,1,2012-01-10,2012-01-10,,Darko Lazović
VfL Wolfsburg,82,15.09.2011,26.09.2011,-,1,2011-09-15,2011-09-26,,Darko Lazović
AEK Athen,2441,18.06.2017,18.06.2017,-,1,2017-06-18,2017-06-18,,Darwin Machís
Udinese Calcio,410,14.07.2012,14.07.2012,-,1,2012-07-14,2012-07-14,,Darwin Machís
AS Rom,12,26.05.2012,26.05.2012,-,1,2012-05-26,2012-05-26,,Darwin Machís
Inter Mailand,46,26.05.2012,26.05.2012,-,1,2012-05-26,2012-05-26,,Darwin Machís
FC Bayern München,27,05.05.2025,06.05.2025,-,1,2025-05-05,2025-05-06,,David Alaba
Manchester United,985,17.07.2023,21.07.2023,-,1,2023-07-17,2023-07-21,,David Alaba
FC Arsenal,11,20.07.2023,20.07.2023,-,1,2023-07-20,2023-07-20,,David Alaba
Real Madrid,418,01.05.2021,28.05.2021,-,1,2021-05-01,2021-05-28,,David Alaba
FC Barcelona,131,20.04.2021,21.04.2021,-,1,2021-04-20,2021-04-21,,David Alaba
FC Chelsea,631,29.03.2021,29.03.2021,-,1,2021-03-29,2021-03-29,,David Alaba
FC Paris Saint-Germain,583,29.03.2021,29.03.2021,-,1,2021-03-29,2021-03-29,,David Alaba
Manchester City,281,22.03.2021,22.03.2021,-,1,2021-03-22,2021-03-22,,David Alaba
FC Liverpool,31,16.02.2021,16.02.2021,-,1,2021-02-16,2021-02-16,,David Alaba
Manchester United,985,26.12.2020,26.12.2020,-,1,2020-12-26,2020-12-26,,David Alaba
Juventus Turin,506,18.11.2020,18.11.2020,-,1,2020-11-18,2020-11-18,,David Alaba
Inter Mailand,46,07.05.2020,07.05.2020,-,1,2020-05-07,2020-05-07,,David Alaba
FC Arsenal,11,29.03.2019,01.04.2019,-,1,2019-03-29,2019-04-01,,David Alaba
AS Monaco,162,04.11.2013,04.11.2013,-,1,2013-11-04,2013-11-04,,David Alaba
FC Bayern München,27,06.07.2011,06.07.2011,-,1,2011-07-06,2011-07-06,,David Alaba
FC Schalke 04,33,30.06.2011,30.06.2011,-,2,2011-06-30,2011-06-30,,David Alaba
Hamburger SV,41,29.06.2011,30.06.2011,-,2,2011-06-29,2011-06-30,,David Alaba
Bolton Wanderers,355,28.06.2011,28.06.2011,-,2,2011-06-28,2011-06-28,,David Alaba
TSG 1899 Hoffenheim,533,21.06.2011,27.06.2011,-,2,2011-06-21,2011-06-27,,David Alaba
SSC Neapel,6195,21.04.2011,24.04.2011,-,2,2011-04-21,2011-04-24,,David Alaba
Wolverhampton Wanderers,543,09.08.2025,09.08.2025,-,1,2025-08-09,2025-08-09,,David Datro Fofana
FC Toulouse,415,09.08.2025,09.08.2025,-,1,2025-08-09,2025-08-09,,David Datro Fofana
Göztepe,1467,12.09.2024,12.09.2024,-,1,2024-09-12,2024-09-12,,David Datro Fofana
AEK Athen,2441,12.09.2024,12.09.2024,-,1,2024-09-12,2024-09-12,,David Datro Fofana
VfB Stuttgart,79,01.09.2024,02.09.2024,-,1,2024-09-01,2024-09-02,,David Datro Fofana
FC Sevilla,368,04.04.2024,04.04.2024,-,1,2024-04-04,2024-04-04,,David Datro Fofana
FC Burnley,1132,11.01.2024,11.01.2024,-,1,2024-01-11,2024-01-11,,David Datro Fofana
1.FC Union Berlin,89,11.07.2023,11.07.2023,-,1,2023-07-11,2023-07-11,,David Datro Fofana
FC Augsburg,167,26.06.2023,27.06.2023,-,1,2023-06-26,2023-06-27,,David Datro Fofana
RC Straßburg Alsace,667,23.06.2023,23.06.2023,-,1,2023-06-23,2023-06-23,,David Datro Fofana
Galatasaray,141,22.06.2023,22.06.2023,-,1,2023-06-22,2023-06-22,,David Datro Fofana
OGC Nizza,417,31.01.2023,31.01.2023,-,1,2023-01-31,2023-01-31,,David Datro Fofana
FC Chelsea,631,22.12.2022,22.12.2022,-,1,2022-12-22,2022-12-22,,David Datro Fofana
FC Schalke 04,33,28.11.2022,15.12.2022,-,1,2022-11-28,2022-12-15,,David Datro Fofana
Brighton & Hove Albion,1237,28.11.2022,28.11.2022,-,1,2022-11-28,2022-11-28,,David Datro Fofana
Pafos FC,45457,23.07.2025,23.07.2025,-,1,2025-07-23,2025-07-23,,David Luiz
FK Austria Wien,14,15.01.2025,16.01.2025,-,1,2025-01-15,2025-01-16,,David Luiz
Besiktas JK,114,03.09.2023,03.09.2023,-,1,2023-09-03,2023-09-03,,David Luiz
Inter Mailand,46,05.07.2022,05.07.2022,-,1,2022-07-05,2022-07-05,,David Luiz
Flamengo Rio de Janeiro,614,09.09.2021,09.09.2021,-,1,2021-09-09,2021-09-09,,David Luiz
Benfica Lissabon,294,02.09.2021,02.09.2021,-,1,2021-09-02,2021-09-02,,David Luiz
Olympique Marseille,244,02.09.2021,02.09.2021,-,1,2021-09-02,2021-09-02,,David Luiz
Clube Atlético Mineiro,330,02.09.2021,02.09.2021,-,1,2021-09-02,2021-09-02,,David Luiz
Adana Demirspor,3840,23.07.2021,23.07.2021,-,1,2021-07-23,2021-07-23,,David Luiz
Olympique Marseille,244,22.06.2021,22.06.2021,-,1,2021-06-22,2021-06-22,,David Luiz
FC Arsenal,11,08.08.2019,08.08.2019,-,1,2019-08-08,2019-08-08,,David Luiz
SE Palmeiras São Paulo,1023,04.04.2019,04.04.2019,-,1,2019-04-04,2019-04-04,,David Luiz
Benfica Lissabon,294,13.01.2019,13.01.2019,-,1,2019-01-13,2019-01-13,,David Luiz
FC Barcelona,131,04.11.2018,04.11.2018,-,1,2018-11-04,2018-11-04,,David Luiz
SSC Neapel,6195,26.06.2018,26.06.2018,-,1,2018-06-26,2018-06-26,,David Luiz
AS Monaco,162,29.04.2018,29.04.2018,-,2,2018-04-29,2018-04-29,,David Luiz
Newcastle United,762,20.12.2017,20.12.2017,-,2,2017-12-20,2017-12-20,,David Luiz
FC Bayern München,27,15.12.2017,15.12.2017,-,2,2017-12-15,2017-12-15,,David Luiz
Real Madrid,418,28.11.2017,28.11.2017,-,2,2017-11-28,2017-11-28,,David Luiz
FC Chelsea,631,31.08.2016,31.08.2016,-,2,2016-08-31,2016-08-31,,David Luiz
FC Bayern München,27,24.05.2014,24.05.2014,-,2,2014-05-24,2014-05-24,,David Luiz
FC Barcelona,131,24.05.2014,14.05.2014,-,2,2014-05-24,2014-05-14,,David Luiz
FC Paris Saint-Germain,583,24.05.2014,15.08.2013,-,2,2014-05-24,2013-08-15,,David Luiz
AC Mailand,5,02.01.2011,02.01.2011,-,2,2011-01-02,2011-01-02,,David Luiz
Manchester City,281,13.08.2010,13.08.2010,-,2,2010-08-13,2010-08-13,,David Luiz
Bayer 04 Leverkusen,15,04.03.2010,31.03.2010,-,2,2010-03-04,2010-03-31,,David Luiz
Real Madrid,418,03.03.2010,03.03.2010,-,2,2010-03-03,2010-03-03,,David Luiz
Manchester United,985,12.02.2010,15.02.2010,-,2,2010-02-12,2010-02-15,,David Luiz
FC St. Pauli,35,09.06.2022,09.06.2022,-,1,2022-06-09,2022-06-09,,David Nemeth
SK Sturm Graz,122,22.05.2022,09.06.2022,-,1,2022-05-22,2022-06-09,,David Nemeth
SK Sturm Graz,122,09.09.2020,05.10.2020,-,1,2020-09-09,2020-10-05,,David Nemeth
SK Rapid Wien,170,09.09.2020,09.09.2020,-,1,2020-09-09,2020-09-09,,David Nemeth
FK Austria Wien,14,12.08.2020,09.09.2020,-,1,2020-08-12,2020-09-09,,David Nemeth
AC Mailand U20,10958,10.01.2019,23.01.2019,-,1,2019-01-10,2019-01-23,,David Nemeth
FC Turin,416,31.01.2024,31.01.2024,-,1,2024-01-31,2024-01-31,,David Okereke
Besiktas JK,114,07.07.2023,18.07.2023,-,1,2023-07-07,2023-07-18,,David Okereke
Cagliari Calcio,1390,09.07.2023,09.07.2023,-,1,2023-07-09,2023-07-09,,David Okereke
FC Empoli,749,09.07.2023,09.07.2023,-,1,2023-07-09,2023-07-09,,David Okereke
VfB Stuttgart,79,20.06.2021,20.06.2021,-,1,2021-06-20,2021-06-20,,David Okereke
Borussia Dortmund,16,26.08.2019,26.08.2019,-,1,2019-08-26,2019-08-26,,David Okereke
FC Southampton,180,27.06.2019,27.06.2019,-,1,2019-06-27,2019-06-27,,David Okereke
Eintracht Frankfurt,24,17.04.2019,17.04.2019,-,1,2019-04-17,2019-04-17,,David Okereke
Real Madrid,418,17.05.2022,17.05.2022,-,1,2022-05-17,2022-05-17,,David Ospina
Juventus Turin,506,16.06.2021,16.06.2021,-,1,2021-06-16,2021-06-16,,David Ospina
AC Florenz,430,13.06.2021,13.06.2021,-,1,2021-06-13,2021-06-13,,David Ospina
Atalanta Bergamo,800,13.06.2021,13.06.2021,-,1,2021-06-13,2021-06-13,,David Ospina
SSC Neapel,6195,17.08.2018,17.08.2018,-,1,2018-08-17,2018-08-17,,David Ospina
Besiktas JK,114,08.08.2018,14.08.2018,-,1,2018-08-08,2018-08-14,,David Ospina
Tigres UANL,7055,20.06.2018,20.06.2018,-,1,2018-06-20,2018-06-20,,David Ospina
Juventus Turin,506,09.05.2016,29.05.2016,-,1,2016-05-09,2016-05-29,,David Ospina
Palermo FC,458,18.02.2016,18.02.2016,-,1,2016-02-18,2016-02-18,,David Ospina
Genua CFC,252,18.02.2016,18.02.2016,-,1,2016-02-18,2016-02-18,,David Ospina
FC Getafe,3709,18.02.2016,18.02.2016,-,1,2016-02-18,2016-02-18,,David Ospina
FC Everton,29,15.01.2016,15.01.2016,-,1,2016-01-15,2016-01-15,,David Ospina
Real Madrid,418,17.07.2015,19.07.2015,-,1,2015-07-17,2015-07-19,,David Ospina
Fenerbahce,36,27.06.2015,01.07.2015,-,1,2015-06-27,2015-07-01,,David Ospina
FC Arsenal,11,12.07.2014,12.07.2014,-,1,2014-07-12,2014-07-12,,David Ospina
FC Sevilla,368,23.05.2012,23.05.2012,-,2,2012-05-23,2012-05-23,,David Ospina
FC Paris Saint-Germain,583,24.03.2011,24.03.2011,-,2,2011-03-24,2011-03-24,,David Ospina
Olympique Marseille,244,01.05.2010,01.05.2010,-,2,2010-05-01,2010-05-01,,David Ospina
FC Bayern München,27,28.11.2024,28.12.2024,-,1,2024-11-28,2024-12-28,,David Raum
Manchester United,985,03.12.2024,03.12.2024,-,1,2024-12-03,2024-12-03,,David Raum
FC Barcelona,131,30.05.2024,30.05.2024,-,1,2024-05-30,2024-05-30,,David Raum
Real Madrid,418,28.11.2022,29.11.2022,-,1,2022-11-28,2022-11-29,,David Raum
RB Leipzig,23826,31.07.2022,31.07.2022,-,1,2022-07-31,2022-07-31,,David Raum
Borussia Dortmund,16,21.07.2022,21.07.2022,-,1,2022-07-21,2022-07-21,,David Raum
West Ham United,379,19.07.2022,20.07.2022,-,1,2022-07-19,2022-07-20,,David Raum
FC Bayern München,27,19.07.2022,19.07.2022,-,1,2022-07-19,2022-07-19,,David Raum
Newcastle United,762,15.07.2022,15.07.2022,-,1,2022-07-15,2022-07-15,,David Raum
Manchester United,985,20.06.2022,29.06.2022,-,1,2022-06-20,2022-06-29,,David Raum
Manchester City,281,15.06.2022,16.06.2022,-,1,2022-06-15,2022-06-16,,David Raum
Juventus Turin,506,13.05.2022,13.05.2022,-,1,2022-05-13,2022-05-13,,David Raum
TSG 1899 Hoffenheim,533,13.01.2021,13.01.2021,-,1,2021-01-13,2021-01-13,,David Raum
FC Augsburg,167,22.05.2018,23.05.2018,-,1,2018-05-22,2018-05-23,,David Raum
FC Arsenal,11,04.05.2024,04.05.2024,-,1,2024-05-04,2024-05-04,,David Raya
FC Bayern München,27,08.08.2023,08.08.2023,-,1,2023-08-08,2023-08-08,,David Raya
Tottenham Hotspur,148,20.06.2023,20.06.2023,-,1,2023-06-20,2023-06-20,,David Raya
FC Chelsea,631,13.02.2023,13.02.2023,-,1,2023-02-13,2023-02-13,,David Raya
Manchester United,985,25.01.2023,25.01.2023,-,1,2023-01-25,2023-01-25,,David Raya
Lazio Rom,398,17.08.2020,17.08.2020,-,1,2020-08-17,2020-08-17,,David Silva
Al-Duhail SC,26091,08.06.2020,08.06.2020,-,1,2020-06-08,2020-06-08,,David Silva
AC Mailand,5,15.05.2020,15.05.2020,-,1,2020-05-15,2020-05-15,,David Silva
Inter Miami CF,69261,20.03.2020,20.03.2020,-,1,2020-03-20,2020-03-20,,David Silva
Vissel Kobe,3958,14.11.2019,14.11.2019,-,1,2019-11-14,2019-11-14,,David Silva
Hokkaido Consadole Sapporo,16032,05.11.2019,05.11.2019,-,1,2019-11-05,2019-11-05,,David Silva
Hebei FC (2010-2023),36630,21.01.2017,21.01.2017,-,1,2017-01-21,2017-01-21,,David Silva
FC Valencia,1049,15.04.2015,16.04.2015,-,1,2015-04-15,2015-04-16,,David Silva
Real Madrid,418,17.09.2012,17.09.2012,-,1,2012-09-17,2012-09-17,,David Silva
Manchester City,281,30.06.2010,30.06.2010,-,1,2010-06-30,2010-06-30,,David Silva
FC Chelsea,631,24.06.2010,29.06.2010,-,1,2010-06-24,2010-06-29,,David Silva
Inter Mailand,46,13.06.2010,13.06.2010,-,1,2010-06-13,2010-06-13,,David Silva
FC Bayern München,27,20.01.2010,21.01.2010,-,1,2010-01-20,2010-01-21,,David Silva
Manchester United,985,21.12.2009,25.12.2009,-,1,2009-12-21,2009-12-25,,David Silva
FC Barcelona,131,24.11.2009,24.11.2009,-,1,2009-11-24,2009-11-24,,David Silva
Atlético Madrid,13,22.08.2009,22.08.2009,-,2,2009-08-22,2009-08-22,,David Silva
Nottingham Forest,703,21.07.2023,21.07.2023,-,1,2023-07-21,2023-07-21,,David Soria
Real Madrid,418,18.06.2023,18.06.2023,-,1,2023-06-18,2023-06-18,,David Soria
SSC Neapel,6195,03.06.2025,03.06.2025,-,1,2025-06-03,2025-06-03,,Davide Frattesi
AS Rom,12,16.01.2025,16.01.2025,-,1,2025-01-16,2025-01-16,,Davide Frattesi
Tottenham Hotspur,148,26.11.2024,30.11.2024,-,1,2024-11-26,2024-11-30,,Davide Frattesi
Inter Mailand,46,04.07.2023,05.07.2023,-,1,2023-07-04,2023-07-05,,Davide Frattesi
AS Rom,12,01.07.2023,01.07.2023,-,1,2023-07-01,2023-07-01,,Davide Frattesi
AC Mailand,5,23.06.2023,23.06.2023,-,1,2023-06-23,2023-06-23,,Davide Frattesi
Juventus Turin,506,07.06.2023,07.06.2023,-,1,2023-06-07,2023-06-07,,Davide Frattesi
Brighton & Hove Albion,1237,12.05.2023,12.05.2023,-,1,2023-05-12,2023-05-12,,Davide Frattesi
SSC Neapel,6195,26.01.2022,26.01.2022,-,1,2022-01-26,2022-01-26,,Davide Frattesi
Fenerbahce,36,30.05.2021,30.05.2021,-,1,2021-05-30,2021-05-30,,Davide Santon
Basaksehir FK,6890,13.01.2021,13.01.2021,-,1,2021-01-13,2021-01-13,,Davide Santon
AS Rom,12,26.06.2018,26.06.2018,-,1,2018-06-26,2018-06-26,,Davide Santon
West Ham United,379,05.08.2016,05.08.2016,-,1,2016-08-05,2016-08-05,,Davide Santon
SSC Neapel,6195,14.07.2016,14.07.2016,-,1,2016-07-14,2016-07-14,,Davide Santon
Crystal Palace,873,07.07.2016,07.07.2016,-,1,2016-07-07,2016-07-07,,Davide Santon
AFC Sunderland,289,07.07.2016,07.07.2016,-,1,2016-07-07,2016-07-07,,Davide Santon
FC Watford,1010,23.05.2016,23.05.2016,-,1,2016-05-23,2016-05-23,,Davide Santon
AC Florenz,430,28.04.2016,28.04.2016,-,1,2016-04-28,2016-04-28,,Davide Santon
Genua CFC,252,28.04.2016,28.04.2016,-,1,2016-04-28,2016-04-28,,Davide Santon
FC Turin,416,28.04.2016,28.04.2016,-,1,2016-04-28,2016-04-28,,Davide Santon
Sampdoria Genua,1038,28.04.2016,28.04.2016,-,1,2016-04-28,2016-04-28,,Davide Santon
Juventus Turin,506,01.04.2016,01.04.2016,-,1,2016-04-01,2016-04-01,,Davide Santon
Norwich City,1123,28.01.2016,28.01.2016,-,1,2016-01-28,2016-01-28,,Davide Santon
Inter Mailand,46,02.02.2015,02.02.2015,-,1,2015-02-02,2015-02-02,,Davide Santon
AC Florenz,430,13.08.2014,13.08.2014,-,2,2014-08-13,2014-08-13,,Davide Santon
Zenit St. Petersburg,964,05.04.2013,07.04.2013,-,2,2013-04-05,2013-04-07,,Davide Santon
AC Mailand,5,09.06.2014,21.03.2013,-,2,2014-06-09,2013-03-21,,Davide Santon
AS Rom,12,04.11.2014,06.08.2012,-,2,2014-11-04,2012-08-06,,Davide Santon
Lazio Rom,398,03.07.2012,03.07.2012,-,2,2012-07-03,2012-07-03,,Davide Santon
Newcastle United,762,30.08.2011,30.08.2011,-,2,2011-08-30,2011-08-30,,Davide Santon
FC Arsenal,11,25.08.2011,26.08.2011,-,2,2011-08-25,2011-08-26,,Davide Santon
FC Schalke 04,33,10.08.2011,16.08.2011,-,2,2011-08-10,2011-08-16,,Davide Santon
Hamburger SV,41,10.08.2011,11.08.2011,-,2,2011-08-10,2011-08-11,,Davide Santon
FC Liverpool,31,25.12.2010,25.12.2010,-,2,2010-12-25,2010-12-25,,Davide Santon
FC Bayern München,27,05.01.2010,05.01.2010,-,2,2010-01-05,2010-01-05,,Davide Santon
Genua CFC,252,28.10.2009,28.10.2009,-,2,2009-10-28,2009-10-28,,Davide Santon
AC Florenz,430,18.08.2021,22.08.2021,-,1,2021-08-18,2021-08-22,,Davide Zappacosta
Atalanta Bergamo,800,18.08.2021,18.08.2021,-,1,2021-08-18,2021-08-18,,Davide Zappacosta
AS Rom,12,21.08.2019,21.08.2019,-,1,2019-08-21,2019-08-21,,Davide Zappacosta
Lazio Rom,398,15.01.2019,15.01.2019,-,1,2019-01-15,2019-01-15,,Davide Zappacosta
Inter Mailand,46,20.06.2018,20.06.2018,-,1,2018-06-20,2018-06-20,,Davide Zappacosta
FC Chelsea,631,31.08.2017,31.08.2017,-,1,2017-08-31,2017-08-31,,Davide Zappacosta
AFC Sunderland,289,13.08.2016,13.08.2016,-,1,2016-08-13,2016-08-13,,Davide Zappacosta
Inter Mailand,46,28.06.2015,28.06.2015,-,1,2015-06-28,2015-06-28,,Davide Zappacosta
FC Villarreal,1050,28.06.2015,28.06.2015,-,1,2015-06-28,2015-06-28,,Davide Zappacosta
SSC Neapel,6195,28.06.2015,28.06.2015,-,1,2015-06-28,2015-06-28,,Davide Zappacosta
AS Rom,12,28.06.2015,28.06.2015,-,1,2015-06-28,2015-06-28,,Davide Zappacosta
AC Mailand,5,28.06.2015,28.06.2015,-,1,2015-06-28,2015-06-28,,Davide Zappacosta
FC Liverpool,31,26.06.2015,26.06.2015,-,1,2015-06-26,2015-06-26,,Davide Zappacosta
AC Florenz,430,17.06.2015,17.06.2015,-,1,2015-06-17,2015-06-17,,Davide Zappacosta
Trabzonspor,449,28.04.2025,28.04.2025,-,1,2025-04-28,2025-04-28,,Davy Klaassen
Trabzonspor,449,11.12.2023,11.12.2023,-,1,2023-12-11,2023-12-11,,Davy Klaassen
Inter Mailand,46,01.09.2023,01.09.2023,-,1,2023-09-01,2023-09-01,,Davy Klaassen
Ajax Amsterdam,610,05.10.2020,05.10.2020,-,1,2020-10-05,2020-10-05,,Davy Klaassen
Lazio Rom,398,01.08.2019,02.08.2019,-,1,2019-08-01,2019-08-02,,Davy Klaassen
SV Werder Bremen,86,27.07.2018,27.07.2018,-,1,2018-07-27,2018-07-27,,Davy Klaassen
Besiktas JK,114,02.07.2018,02.07.2018,-,1,2018-07-02,2018-07-02,,Davy Klaassen
Fenerbahce,36,09.12.2017,09.12.2017,-,1,2017-12-09,2017-12-09,,Davy Klaassen
FC Everton,29,15.06.2017,15.06.2017,-,1,2017-06-15,2017-06-15,,Davy Klaassen
Lazio Rom,398,06.06.2017,06.06.2017,-,1,2017-06-06,2017-06-06,,Davy Klaassen
AS Rom,12,30.05.2017,30.05.2017,-,1,2017-05-30,2017-05-30,,Davy Klaassen
FC Schalke 04,33,21.04.2017,24.04.2017,-,1,2017-04-21,2017-04-24,,Davy Klaassen
FC Villarreal,1050,10.04.2017,10.04.2017,-,1,2017-04-10,2017-04-10,,Davy Klaassen
Eintracht Frankfurt,24,05.03.2017,09.03.2017,-,1,2017-03-05,2017-03-09,,Davy Klaassen
SSC Neapel,6195,02.03.2017,05.03.2017,-,1,2017-03-02,2017-03-05,,Davy Klaassen
Juventus Turin,506,10.02.2016,10.02.2016,-,2,2016-02-10,2016-02-10,,Davy Klaassen
FC Barcelona,131,09.10.2015,09.10.2015,-,2,2015-10-09,2015-10-09,,Davy Klaassen
Borussia Dortmund,16,24.07.2015,06.08.2015,-,2,2015-07-24,2015-08-06,,Davy Klaassen
FC Liverpool,31,16.03.2014,17.03.2014,-,2,2014-03-16,2014-03-17,,Davy Klaassen
FC Chelsea,631,13.02.2014,17.02.2014,-,2,2014-02-13,2014-02-17,,Davy Klaassen
Aston Villa,405,13.02.2014,13.02.2014,-,2,2014-02-13,2014-02-13,,Davy Klaassen
Tottenham Hotspur,148,13.02.2014,13.02.2014,-,2,2014-02-13,2014-02-13,,Davy Klaassen
PSV Eindhoven,383,27.04.2021,27.04.2021,-,1,2021-04-27,2021-04-27,,Davy Pröpper
Ajax Amsterdam,610,29.05.2019,29.05.2019,-,1,2019-05-29,2019-05-29,,Davy Pröpper
Brighton & Hove Albion,1237,08.08.2017,08.08.2017,-,1,2017-08-08,2017-08-08,,Davy Pröpper
SSC Neapel,6195,15.11.2015,15.11.2015,-,1,2015-11-15,2015-11-15,,Davy Pröpper
PSV Eindhoven,383,21.05.2015,21.05.2015,-,1,2015-05-21,2015-05-21,,Davy Pröpper
Hertha BSC,44,16.01.2015,21.01.2015,-,1,2015-01-16,2015-01-21,,Davy Pröpper
Hertha BSC,44,21.07.2025,21.07.2025,59 %,1,2025-07-21,2025-07-21,59.0,Dawid Kownacki
Fortuna Düsseldorf,38,17.07.2025,21.07.2025,31 %,1,2025-07-17,2025-07-21,31.0,Dawid Kownacki
Widzew Lodz,88,28.04.2025,28.04.2025,-,1,2025-04-28,2025-04-28,,Dawid Kownacki
Hamburger SV,41,04.06.2024,19.06.2024,-,1,2024-06-04,2024-06-19,,Dawid Kownacki
FC Kopenhagen,190,15.06.2024,15.06.2024,-,1,2024-06-15,2024-06-15,,Dawid Kownacki
1.FC Union Berlin,89,05.01.2024,06.01.2024,-,1,2024-01-05,2024-01-06,,Dawid Kownacki
SV Werder Bremen,86,22.05.2023,22.05.2023,-,1,2023-05-22,2023-05-22,,Dawid Kownacki
TSG 1899 Hoffenheim,533,03.05.2023,03.05.2023,-,1,2023-05-03,2023-05-03,,Dawid Kownacki
1.FC Union Berlin,89,03.05.2023,03.05.2023,-,1,2023-05-03,2023-05-03,,Dawid Kownacki
Borussia Mönchengladbach,18,27.04.2023,27.04.2023,-,1,2023-04-27,2023-04-27,,Dawid Kownacki
SC Freiburg,60,04.04.2023,06.04.2023,-,1,2023-04-04,2023-04-06,,Dawid Kownacki
FC Midtjylland,865,30.01.2023,30.01.2023,-,1,2023-01-30,2023-01-30,,Dawid Kownacki
SK Slavia Prag,62,12.01.2023,12.01.2023,-,1,2023-01-12,2023-01-12,,Dawid Kownacki
PSV Eindhoven,383,06.01.2023,06.01.2023,-,1,2023-01-06,2023-01-06,,Dawid Kownacki
Eintracht Frankfurt,24,03.12.2022,07.12.2022,-,1,2022-12-03,2022-12-07,,Dawid Kownacki
1.FSV Mainz 05,39,03.12.2022,05.12.2022,-,2,2022-12-03,2022-12-05,,Dawid Kownacki
Olympiakos Piräus,683,03.12.2022,03.12.2022,-,2,2022-12-03,2022-12-03,,Dawid Kownacki
Lech Posen,238,17.07.2022,17.07.2022,-,2,2022-07-17,2022-07-17,,Dawid Kownacki
FC Empoli,749,25.08.2021,25.08.2021,-,2,2021-08-25,2021-08-25,,Dawid Kownacki
Espanyol Barcelona,714,17.01.2021,20.01.2021,-,2,2021-01-17,2021-01-20,,Dawid Kownacki
Fortuna Düsseldorf,38,30.06.2019,30.06.2019,-,2,2019-06-30,2019-06-30,,Dawid Kownacki
Fortuna Düsseldorf,38,31.01.2019,31.01.2019,-,2,2019-01-31,2019-01-31,,Dawid Kownacki
FC Empoli,749,10.01.2019,19.01.2019,-,2,2019-01-10,2019-01-19,,Dawid Kownacki
VfB Stuttgart,79,10.01.2019,13.01.2019,-,2,2019-01-10,2019-01-13,,Dawid Kownacki
Hamburger SV,41,10.01.2018,11.01.2018,-,2,2018-01-10,2018-01-11,,Dawid Kownacki
Borussia Dortmund,16,27.06.2017,27.06.2017,-,2,2017-06-27,2017-06-27,,Dawid Kownacki
SC Freiburg,60,02.06.2017,02.06.2017,-,2,2017-06-02,2017-06-02,,Dawid Kownacki
Eintracht Frankfurt,24,28.01.2017,01.02.2017,-,2,2017-01-28,2017-02-01,,Dawid Kownacki
VfL Wolfsburg,82,26.01.2017,27.01.2017,-,2,2017-01-26,2017-01-27,,Dawid Kownacki
RB Leipzig,23826,14.05.2016,14.05.2016,-,2,2016-05-14,2016-05-14,,Dawid Kownacki
FC Liverpool,31,10.04.2016,10.04.2016,-,3,2016-04-10,2016-04-10,,Dawid Kownacki
FC Red Bull Salzburg,409,03.01.2015,03.01.2015,-,3,2015-01-03,2015-01-03,,Dawid Kownacki
FC Arsenal,11,03.05.2014,06.05.2014,-,3,2014-05-03,2014-05-06,,Dawid Kownacki
AS Rom,12,03.05.2014,04.05.2014,-,3,2014-05-03,2014-05-04,,Dawid Kownacki
FC Paris Saint-Germain,583,11.05.2025,11.05.2025,36 %,1,2025-05-11,2025-05-11,36.0,Dayot Upamecano
Manchester United,985,04.04.2024,16.07.2024,-,1,2024-04-04,2024-07-16,,Dayot Upamecano
FC Chelsea,631,12.07.2022,12.07.2022,-,1,2022-07-12,2022-07-12,,Dayot Upamecano
FC Bayern München,27,12.02.2021,12.02.2021,-,1,2021-02-12,2021-02-12,,Dayot Upamecano
Manchester United,985,10.02.2021,12.02.2021,-,1,2021-02-10,2021-02-12,,Dayot Upamecano
FC Chelsea,631,28.02.2020,09.02.2021,-,1,2020-02-28,2021-02-09,,Dayot Upamecano
FC Liverpool,31,13.11.2020,30.01.2021,-,1,2020-11-13,2021-01-30,,Dayot Upamecano
FC Paris Saint-Germain,583,21.01.2021,21.01.2021,-,1,2021-01-21,2021-01-21,,Dayot Upamecano
FC Arsenal,11,14.06.2020,14.06.2020,-,1,2020-06-14,2020-06-14,,Dayot Upamecano
AC Mailand,5,14.06.2020,14.06.2020,-,1,2020-06-14,2020-06-14,,Dayot Upamecano
Real Madrid,418,14.06.2020,14.06.2020,-,1,2020-06-14,2020-06-14,,Dayot Upamecano
Manchester City,281,14.06.2020,14.06.2020,-,1,2020-06-14,2020-06-14,,Dayot Upamecano
FC Barcelona,131,10.06.2020,10.06.2020,-,1,2020-06-10,2020-06-10,,Dayot Upamecano
Tottenham Hotspur,148,15.02.2020,15.02.2020,-,1,2020-02-15,2020-02-15,,Dayot Upamecano
FC Southampton,180,21.12.2018,21.12.2018,-,1,2018-12-21,2018-12-21,,Dayot Upamecano
RB Leipzig,23826,11.01.2017,13.01.2017,-,2,2017-01-11,2017-01-13,,Dayot Upamecano
Manchester United,985,11.01.2017,11.01.2017,-,2,2017-01-11,2017-01-11,,Dayot Upamecano
FC Barcelona,131,10.01.2017,10.01.2017,-,2,2017-01-10,2017-01-10,,Dayot Upamecano
Real Madrid,418,10.01.2017,10.01.2017,-,2,2017-01-10,2017-01-10,,Dayot Upamecano
Inter Mailand,46,14.12.2016,15.12.2016,-,2,2016-12-14,2016-12-15,,Dayot Upamecano
FC Chelsea,631,14.12.2016,14.12.2016,-,2,2016-12-14,2016-12-14,,Dayot Upamecano
FC Bayern München,27,12.12.2016,14.12.2016,-,2,2016-12-12,2016-12-14,,Dayot Upamecano
Manchester City,281,09.12.2016,09.12.2016,-,2,2016-12-09,2016-12-09,,Dayot Upamecano
FC Arsenal,11,06.12.2016,06.12.2016,-,2,2016-12-06,2016-12-06,,Dayot Upamecano
Juventus Turin,506,06.12.2016,06.12.2016,-,2,2016-12-06,2016-12-06,,Dayot Upamecano
FC Liefering,37024,11.07.2015,11.07.2015,-,2,2015-07-11,2015-07-11,,Dayot Upamecano
FC Red Bull Salzburg,409,09.07.2015,09.07.2015,-,2,2015-07-09,2015-07-09,,Dayot Upamecano
Manchester United,985,22.05.2015,22.05.2015,-,2,2015-05-22,2015-05-22,,Dayot Upamecano
Manchester City,281,24.04.2015,24.04.2015,-,2,2015-04-24,2015-04-24,,Dayot Upamecano
FC Arsenal,11,24.04.2015,24.04.2015,-,2,2015-04-24,2015-04-24,,Dayot Upamecano
Inter Mailand,46,05.03.2015,05.03.2015,-,3,2015-03-05,2015-03-05,,Dayot Upamecano
AS Monaco,162,05.03.2015,05.03.2015,-,3,2015-03-05,2015-03-05,,Dayot Upamecano
FC Paris Saint-Germain,583,05.03.2015,05.03.2015,-,3,2015-03-05,2015-03-05,,Dayot Upamecano
Manchester United U21,9251,05.03.2015,05.03.2015,-,3,2015-03-05,2015-03-05,,Dayot Upamecano
Nottingham Forest,703,31.08.2023,31.08.2023,-,1,2023-08-31,2023-08-31,,Dean Henderson
Crystal Palace,873,31.08.2023,31.08.2023,-,1,2023-08-31,2023-08-31,,Dean Henderson
Newcastle United,762,20.05.2022,20.05.2022,-,1,2022-05-20,2022-05-20,,Dean Henderson
FC Southampton,180,15.01.2022,15.01.2022,-,1,2022-01-15,2022-01-15,,Dean Henderson
Ajax Amsterdam,610,08.12.2021,09.12.2021,-,1,2021-12-08,2021-12-09,,Dean Henderson
Borussia Dortmund,16,20.05.2021,23.05.2021,-,1,2021-05-20,2021-05-23,,Dean Henderson
West Ham United,379,25.02.2021,25.02.2021,-,1,2021-02-25,2021-02-25,,Dean Henderson
FC Chelsea,631,25.02.2021,25.02.2021,-,1,2021-02-25,2021-02-25,,Dean Henderson
Tottenham Hotspur,148,24.02.2021,24.02.2021,-,1,2021-02-24,2021-02-24,,Dean Henderson
Leeds United,399,22.11.2020,23.11.2020,-,1,2020-11-22,2020-11-23,,Dean Henderson
Brighton & Hove Albion,1237,22.11.2020,22.11.2020,-,1,2020-11-22,2020-11-22,,Dean Henderson
Celtic Glasgow,371,18.11.2020,18.11.2020,-,1,2020-11-18,2020-11-18,,Dean Henderson
FC Chelsea,631,15.02.2020,20.02.2020,-,1,2020-02-15,2020-02-20,,Dean Henderson
FC Paris Saint-Germain,583,14.02.2020,14.02.2020,-,1,2020-02-14,2020-02-14,,Dean Henderson
FC Bayern München,27,20.11.2019,21.11.2019,-,1,2019-11-20,2019-11-21,,Dean Henderson
Sheffield United,350,26.07.2019,26.07.2019,-,2,2019-07-26,2019-07-26,,Dean Henderson
FC Bayern München,27,17.05.2025,17.05.2025,-,1,2025-05-17,2025-05-17,,Dean Huijsen
Real Madrid,418,17.05.2025,17.05.2025,-,1,2025-05-17,2025-05-17,,Dean Huijsen
FC Arsenal,11,23.04.2025,23.04.2025,-,1,2025-04-23,2025-04-23,,Dean Huijsen
FC Chelsea,631,23.04.2025,23.04.2025,-,1,2025-04-23,2025-04-23,,Dean Huijsen
FC Liverpool,31,11.04.2025,11.04.2025,-,1,2025-04-11,2025-04-11,,Dean Huijsen
Newcastle United,762,27.03.2025,28.03.2025,-,1,2025-03-27,2025-03-28,,Dean Huijsen
Borussia Dortmund,16,21.06.2024,27.07.2024,-,1,2024-06-21,2024-07-27,,Dean Huijsen
VfB Stuttgart,79,25.07.2024,25.07.2024,-,1,2024-07-25,2024-07-25,,Dean Huijsen
AFC Bournemouth,989,25.07.2024,25.07.2024,-,1,2024-07-25,2024-07-25,,Dean Huijsen
VfL Wolfsburg,82,24.07.2024,24.07.2024,-,1,2024-07-24,2024-07-24,,Dean Huijsen
Bayer 04 Leverkusen,15,20.07.2024,22.07.2024,-,1,2024-07-20,2024-07-22,,Dean Huijsen
FC Paris Saint-Germain,583,09.07.2024,09.07.2024,-,1,2024-07-09,2024-07-09,,Dean Huijsen
Atalanta Bergamo,800,04.06.2024,04.06.2024,-,1,2024-06-04,2024-06-04,,Dean Huijsen
Newcastle United,762,22.04.2024,22.04.2024,-,1,2024-04-22,2024-04-22,,Dean Huijsen
RB Leipzig,23826,25.03.2024,26.03.2024,-,1,2024-03-25,2024-03-26,,Dean Huijsen
AS Rom,12,05.01.2024,05.01.2024,-,2,2024-01-05,2024-01-05,,Dean Huijsen
Frosinone Calcio,8970,23.12.2023,23.12.2023,-,2,2023-12-23,2023-12-23,,Dean Huijsen
FC Bayern München,27,27.12.2022,27.12.2022,-,2,2022-12-27,2022-12-27,,Dean Huijsen
FC Barcelona,131,25.12.2022,25.12.2022,-,2,2022-12-25,2022-12-25,,Dean Huijsen
FC Arsenal,11,15.07.2023,15.07.2023,-,1,2023-07-15,2023-07-15,,Declan Rice
FC Bayern München,27,29.06.2023,15.07.2023,-,1,2023-06-29,2023-07-15,,Declan Rice
Manchester City,281,28.06.2023,28.06.2023,-,1,2023-06-28,2023-06-28,,Declan Rice
Manchester United,985,25.05.2023,23.06.2023,-,1,2023-05-25,2023-06-23,,Declan Rice
FC Chelsea,631,07.05.2023,07.05.2023,-,1,2023-05-07,2023-05-07,,Declan Rice
FC Liverpool,31,15.04.2023,20.04.2023,-,1,2023-04-15,2023-04-20,,Declan Rice
Real Madrid,418,15.04.2019,15.04.2019,-,1,2019-04-15,2019-04-15,,Declan Rice
Tottenham Hotspur,148,09.02.2019,09.02.2019,-,1,2019-02-09,2019-02-09,,Declan Rice
Borussia Dortmund,16,13.11.2018,13.11.2018,-,1,2018-11-13,2018-11-13,,Declan Rice
Royal Charleroi SC,172,21.12.2024,21.12.2024,-,1,2024-12-21,2024-12-21,,Dedryck Boyata
Club Brügge,2282,22.08.2022,22.08.2022,-,1,2022-08-22,2022-08-22,,Dedryck Boyata
FC Valencia,1049,17.08.2022,21.08.2022,-,1,2022-08-17,2022-08-21,,Dedryck Boyata
Trabzonspor,449,17.07.2022,21.08.2022,-,1,2022-07-17,2022-08-21,,Dedryck Boyata
FC Stade Rennes,273,12.08.2021,12.08.2021,-,1,2021-08-12,2021-08-12,,Dedryck Boyata
FC Turin,416,12.08.2021,12.08.2021,-,1,2021-08-12,2021-08-12,,Dedryck Boyata
LOSC Lille,1082,23.06.2021,25.06.2021,-,1,2021-06-23,2021-06-25,,Dedryck Boyata
Olympique Lyon,1041,23.06.2021,23.06.2021,-,1,2021-06-23,2021-06-23,,Dedryck Boyata
Hertha BSC,44,19.05.2019,19.05.2019,-,1,2019-05-19,2019-05-19,,Dedryck Boyata
Leicester City,1003,03.03.2019,03.03.2019,-,1,2019-03-03,2019-03-03,,Dedryck Boyata
FC Fulham,931,25.11.2018,25.11.2018,-,1,2018-11-25,2018-11-25,,Dedryck Boyata
Besiktas JK,114,25.10.2018,25.10.2018,-,1,2018-10-25,2018-10-25,,Dedryck Boyata
Olympique Lyon,1041,19.07.2018,19.07.2018,-,1,2018-07-19,2018-07-19,,Dedryck Boyata
RSC Anderlecht,58,11.01.2017,11.01.2017,-,1,2017-01-11,2017-01-11,,Dedryck Boyata
Celtic Glasgow,371,16.05.2015,16.05.2015,-,1,2015-05-16,2015-05-16,,Dedryck Boyata
RSC Anderlecht,58,18.08.2014,18.08.2014,-,2,2014-08-18,2014-08-18,,Dedryck Boyata
ZSKA Moskau,2410,07.09.2024,07.09.2024,-,1,2024-09-07,2024-09-07,,Dejan Joveljić
Los Angeles Galaxy,1061,05.08.2021,05.08.2021,-,1,2021-08-05,2021-08-05,,Dejan Joveljić
Eintracht Frankfurt,24,28.12.2020,28.12.2020,-,1,2020-12-28,2020-12-28,,Dejan Joveljić
RSC Anderlecht,58,31.01.2020,31.01.2020,-,1,2020-01-31,2020-01-31,,Dejan Joveljić
Eintracht Frankfurt,24,14.06.2019,14.06.2019,-,1,2019-06-14,2019-06-14,,Dejan Joveljić
TSG 1899 Hoffenheim,533,13.06.2019,13.06.2019,-,1,2019-06-13,2019-06-13,,Dejan Joveljić
1.FSV Mainz 05,39,10.04.2019,25.04.2019,-,1,2019-04-10,2019-04-25,,Dejan Joveljić
VfL Wolfsburg,82,10.04.2019,10.04.2019,-,1,2019-04-10,2019-04-10,,Dejan Joveljić
VfB Stuttgart,79,20.03.2019,05.04.2019,-,1,2019-03-20,2019-04-05,,Dejan Joveljić
Tottenham Hotspur,148,30.01.2022,30.01.2022,-,1,2022-01-30,2022-01-30,,Dejan Kulusevski
FC Arsenal,11,18.11.2021,01.12.2021,-,1,2021-11-18,2021-12-01,,Dejan Kulusevski
Juventus Turin,506,02.01.2020,02.01.2020,-,1,2020-01-02,2020-01-02,,Dejan Kulusevski
Inter Mailand,46,26.12.2019,26.12.2019,-,1,2019-12-26,2019-12-26,,Dejan Kulusevski
FC Bayern München,27,01.12.2019,01.12.2019,-,1,2019-12-01,2019-12-01,,Dejan Kulusevski
PAOK Thessaloniki,1091,11.09.2024,11.09.2024,-,1,2024-09-11,2024-09-11,,Dejan Lovren
Fenerbahce,36,22.12.2022,22.12.2022,-,1,2022-12-22,2022-12-22,,Dejan Lovren
West Ham United,379,26.03.2022,26.03.2022,-,1,2022-03-26,2022-03-26,,Dejan Lovren
Zenit St. Petersburg,964,24.07.2020,24.07.2020,-,1,2020-07-24,2020-07-24,,Dejan Lovren
AS Rom,12,13.05.2020,13.05.2020,-,1,2020-05-13,2020-05-13,,Dejan Lovren
Lazio Rom,398,23.03.2020,23.03.2020,-,1,2020-03-23,2020-03-23,,Dejan Lovren
AC Mailand,5,31.10.2019,31.10.2019,-,1,2019-10-31,2019-10-31,,Dejan Lovren
Bayer 04 Leverkusen,15,22.08.2019,06.09.2019,-,1,2019-08-22,2019-09-06,,Dejan Lovren
SSC Neapel,6195,28.03.2019,28.03.2019,-,1,2019-03-28,2019-03-28,,Dejan Lovren
FC Liverpool,31,27.07.2014,17.05.2014,-,1,2014-07-27,2014-05-17,,Dejan Lovren
Manchester United,985,20.03.2014,21.03.2014,-,1,2014-03-20,2014-03-21,,Dejan Lovren
Atlético Madrid,13,10.05.2013,12.05.2013,-,1,2013-05-10,2013-05-12,,Dejan Lovren
Rubin Kazan,2698,23.04.2013,25.04.2013,-,1,2013-04-23,2013-04-25,,Dejan Lovren
Lokomotiv Moskau,932,14.03.2013,14.03.2013,-,1,2013-03-14,2013-03-14,,Dejan Lovren
FC Everton,29,20.02.2013,24.02.2013,-,1,2013-02-20,2013-02-24,,Dejan Lovren
FC Barcelona,131,17.07.2012,17.07.2012,-,2,2012-07-17,2012-07-17,,Dejan Lovren
Inter Mailand,46,23.01.2012,23.01.2012,-,2,2012-01-23,2012-01-23,,Dejan Lovren
Juventus Turin,506,31.10.2011,31.10.2011,-,2,2011-10-31,2011-10-31,,Dejan Lovren
FC Bayern München,27,12.07.2011,13.07.2011,-,2,2011-07-12,2011-07-13,,Dejan Lovren
Fenerbahce,36,26.01.2011,26.01.2011,-,2,2011-01-26,2011-01-26,,Dejan Lovren
Olympique Lyon,1041,13.01.2010,13.01.2010,-,2,2010-01-13,2010-01-13,,Dejan Lovren
Tottenham Hotspur,148,10.01.2010,10.01.2010,-,2,2010-01-10,2010-01-10,,Dejan Lovren
FC Chelsea,631,08.01.2010,08.01.2010,-,2,2010-01-08,2010-01-08,,Dejan Lovren
Como 1907,1047,18.01.2025,18.01.2025,-,1,2025-01-18,2025-01-18,,Dele Alli
Tottenham Hotspur,148,,12.07.2024,-,1,,2024-07-12,,Dele Alli
Besiktas JK,114,17.08.2022,25.08.2022,-,1,2022-08-17,2022-08-25,,Dele Alli
FC Everton,29,01.02.2022,01.02.2022,-,1,2022-02-01,2022-02-01,,Dele Alli
Borussia Dortmund,16,31.01.2022,31.01.2022,-,1,2022-01-31,2022-01-31,,Dele Alli
Crystal Palace,873,31.01.2022,31.01.2022,-,1,2022-01-31,2022-01-31,,Dele Alli
Brighton & Hove Albion,1237,26.01.2022,26.01.2022,-,1,2022-01-26,2022-01-26,,Dele Alli
FC Southampton,180,26.01.2022,26.01.2022,-,1,2022-01-26,2022-01-26,,Dele Alli
Newcastle United,762,15.12.2021,15.12.2021,-,1,2021-12-15,2021-12-15,,Dele Alli
FC Paris Saint-Germain,583,01.02.2021,01.02.2021,-,1,2021-02-01,2021-02-01,,Dele Alli
Real Madrid,418,15.09.2020,15.09.2020,-,1,2020-09-15,2020-09-15,,Dele Alli
FC Barcelona,131,16.07.2017,16.07.2017,-,1,2017-07-16,2017-07-16,,Dele Alli
FC Bayern München,27,03.03.2017,06.03.2017,-,1,2017-03-03,2017-03-06,,Dele Alli
Tottenham Hotspur,148,02.02.2015,02.02.2015,-,1,2015-02-02,2015-02-02,,Dele Alli
Newcastle United,762,29.01.2015,29.01.2015,-,1,2015-01-29,2015-01-29,,Dele Alli
Aston Villa,405,29.01.2015,29.01.2015,-,2,2015-01-29,2015-01-29,,Dele Alli
FC Liverpool,31,01.10.2014,01.10.2014,-,2,2014-10-01,2014-10-01,,Dele Alli
FC Bayern München,27,25.09.2014,26.09.2014,-,2,2014-09-25,2014-09-26,,Dele Alli
Manchester City,281,15.05.2014,15.05.2014,-,2,2014-05-15,2014-05-15,,Dele Alli
FC Chelsea,631,15.05.2014,15.05.2014,-,2,2014-05-15,2014-05-15,,Dele Alli
FC Arsenal,11,16.01.2014,16.01.2014,-,2,2014-01-16,2014-01-16,,Dele Alli
Birmingham City,337,26.06.2025,26.06.2025,-,1,2025-06-26,2025-06-26,,Demarai Gray
FC Fulham,931,30.12.2024,30.12.2024,-,1,2024-12-30,2024-12-30,,Demarai Gray
Al-Ettifaq FC,7732,06.09.2023,07.09.2023,-,1,2023-09-06,2023-09-07,,Demarai Gray
LOSC Lille,1082,01.09.2023,05.09.2023,-,1,2023-09-01,2023-09-05,,Demarai Gray
Al-Shabab FC,9840,21.08.2023,21.08.2023,-,1,2023-08-21,2023-08-21,,Demarai Gray
FC Fulham,931,05.08.2023,05.08.2023,-,1,2023-08-05,2023-08-05,,Demarai Gray
Crystal Palace,873,31.07.2023,31.07.2023,-,1,2023-07-31,2023-07-31,,Demarai Gray
West Ham United,379,31.07.2023,31.07.2023,-,1,2023-07-31,2023-07-31,,Demarai Gray
Besiktas JK,114,28.07.2023,28.07.2023,-,1,2023-07-28,2023-07-28,,Demarai Gray
Al-Hilal SFC,1114,25.06.2023,25.06.2023,-,1,2023-06-25,2023-06-25,,Demarai Gray
FC Everton,29,18.07.2021,20.07.2021,-,1,2021-07-18,2021-07-20,,Demarai Gray
Bayer 04 Leverkusen,15,31.01.2021,31.01.2021,-,1,2021-01-31,2021-01-31,,Demarai Gray
Benfica Lissabon,294,26.01.2021,26.01.2021,-,1,2021-01-26,2021-01-26,,Demarai Gray
Olympique Marseille,244,26.01.2021,26.01.2021,-,1,2021-01-26,2021-01-26,,Demarai Gray
Crystal Palace,873,24.01.2021,24.01.2021,-,1,2021-01-24,2021-01-24,,Demarai Gray
RB Leipzig,23826,24.01.2021,24.01.2021,-,2,2021-01-24,2021-01-24,,Demarai Gray
Tottenham Hotspur,148,27.11.2020,28.11.2020,-,2,2020-11-27,2020-11-28,,Demarai Gray
FC Valencia,1049,04.08.2018,04.08.2018,-,2,2018-08-04,2018-08-04,,Demarai Gray
AFC Bournemouth,989,05.08.2017,05.08.2017,-,2,2017-08-05,2017-08-05,,Demarai Gray
Borussia Dortmund,16,01.08.2017,02.08.2017,-,2,2017-08-01,2017-08-02,,Demarai Gray
FC Everton,29,31.07.2017,31.07.2017,-,2,2017-07-31,2017-07-31,,Demarai Gray
FC Liverpool,31,06.05.2017,24.05.2017,-,2,2017-05-06,2017-05-24,,Demarai Gray
FC Everton,29,09.12.2016,09.12.2016,-,2,2016-12-09,2016-12-09,,Demarai Gray
Leicester City,1003,04.01.2016,04.01.2016,-,2,2016-01-04,2016-01-04,,Demarai Gray
AS Monaco,162,02.01.2016,04.01.2016,-,2,2016-01-02,2016-01-04,,Demarai Gray
Olympique Marseille,244,02.01.2016,02.01.2016,-,2,2016-01-02,2016-01-02,,Demarai Gray
FC Liverpool,31,09.12.2015,09.12.2015,-,2,2015-12-09,2015-12-09,,Demarai Gray
Tottenham Hotspur,148,26.10.2015,26.10.2015,-,2,2015-10-26,2015-10-26,,Demarai Gray
FC Bayern München,27,24.09.2015,24.09.2015,-,2,2015-09-24,2015-09-24,,Demarai Gray
FC Red Bull Salzburg,409,20.05.2015,20.05.2015,-,2,2015-05-20,2015-05-20,,Demarai Gray
Manchester United,985,17.05.2015,17.05.2015,-,3,2015-05-17,2015-05-17,,Demarai Gray
AFC Bournemouth,989,14.05.2015,14.05.2015,-,3,2015-05-14,2015-05-14,,Demarai Gray
FC Arsenal,11,19.04.2015,19.04.2015,-,3,2015-04-19,2015-04-19,,Demarai Gray
AFC Sunderland,289,14.12.2014,14.12.2014,-,3,2014-12-14,2014-12-14,,Demarai Gray
Newcastle United,762,14.12.2014,14.12.2014,-,3,2014-12-14,2014-12-14,,Demarai Gray
RC Lens,826,11.01.2024,11.01.2024,-,1,2024-01-11,2024-01-11,,Denis Bouanga
FC Stade Rennes,273,11.01.2024,11.01.2024,-,1,2024-01-11,2024-01-11,,Denis Bouanga
OGC Nizza,417,26.12.2023,26.12.2023,-,1,2023-12-26,2023-12-26,,Denis Bouanga
Borussia Mönchengladbach,18,29.07.2022,04.08.2022,-,1,2022-07-29,2022-08-04,,Denis Bouanga
LOSC Lille,1082,09.07.2022,09.07.2022,-,1,2022-07-09,2022-07-09,,Denis Bouanga
OGC Nizza,417,13.05.2022,13.05.2022,-,1,2022-05-13,2022-05-13,,Denis Bouanga
FC Villarreal,1050,07.08.2021,07.08.2021,-,1,2021-08-07,2021-08-07,,Denis Bouanga
Olympique Marseille,244,07.07.2021,07.07.2021,-,1,2021-07-07,2021-07-07,,Denis Bouanga
Hannover 96,42,28.06.2017,28.07.2017,-,1,2017-06-28,2017-07-28,,Denis Bouanga
FC Barnsley,349,20.06.2017,20.06.2017,-,1,2017-06-20,2017-06-20,,Denis Bouanga
Queens Park Rangers,1039,20.06.2017,20.06.2017,-,1,2017-06-20,2017-06-20,,Denis Bouanga
FC Everton,29,16.07.2018,16.07.2018,-,1,2018-07-16,2018-07-16,,Denis Cheryshev
FC Villarreal,1050,15.06.2016,15.06.2016,-,1,2016-06-15,2016-06-15,,Denis Cheryshev
FC Valencia,1049,08.05.2016,08.05.2016,-,1,2016-05-08,2016-05-08,,Denis Cheryshev
FC Villarreal,1050,25.12.2015,25.12.2015,-,1,2015-12-25,2015-12-25,,Denis Cheryshev
Olympique Marseille,244,19.12.2015,19.12.2015,-,1,2015-12-19,2015-12-19,,Denis Cheryshev
FC Liverpool,31,30.11.2015,30.11.2015,-,1,2015-11-30,2015-11-30,,Denis Cheryshev
FC Everton,29,30.11.2015,30.11.2015,-,1,2015-11-30,2015-11-30,,Denis Cheryshev
FC Valencia,1049,14.11.2015,14.11.2015,-,1,2015-11-14,2015-11-14,,Denis Cheryshev
FC Arsenal,11,14.10.2015,16.10.2015,-,1,2015-10-14,2015-10-16,,Denis Cheryshev
FC Liverpool,31,30.04.2015,30.04.2015,-,1,2015-04-30,2015-04-30,,Denis Cheryshev
FC Sevilla,368,02.09.2013,02.09.2013,-,1,2013-09-02,2013-09-02,,Denis Cheryshev
Bayer 04 Leverkusen,15,24.07.2013,24.07.2013,-,1,2013-07-24,2013-07-24,,Denis Cheryshev
Borussia Mönchengladbach,18,11.07.2013,19.07.2013,-,1,2013-07-11,2013-07-19,,Denis Cheryshev
ZSKA Moskau,2410,09.06.2015,29.06.2013,-,1,2015-06-09,2013-06-29,,Denis Cheryshev
FC Málaga,1084,23.06.2013,23.06.2013,-,1,2013-06-23,2013-06-23,,Denis Cheryshev
FC Getafe,3709,01.04.2013,02.04.2013,-,2,2013-04-01,2013-04-02,,Denis Cheryshev
Zenit St. Petersburg,964,11.11.2012,12.11.2012,-,2,2012-11-11,2012-11-12,,Denis Cheryshev
Spartak Moskau,232,21.09.2012,22.09.2012,-,2,2012-09-21,2012-09-22,,Denis Cheryshev
Espanyol Barcelona,714,29.01.2023,29.01.2023,-,1,2023-01-29,2023-01-29,,Denis Suárez
FC Villarreal,1050,30.12.2022,30.12.2022,-,1,2022-12-30,2022-12-30,,Denis Suárez
Celta Vigo,940,30.06.2019,30.06.2019,-,1,2019-06-30,2019-06-30,,Denis Suárez
Borussia Dortmund,16,30.06.2019,30.06.2019,-,1,2019-06-30,2019-06-30,,Denis Suárez
FC Arsenal,11,30.01.2019,30.01.2019,-,1,2019-01-30,2019-01-30,,Denis Suárez
FC Chelsea,631,04.01.2019,04.01.2019,-,1,2019-01-04,2019-01-04,,Denis Suárez
FC Sevilla,368,13.12.2018,13.12.2018,-,1,2018-12-13,2018-12-13,,Denis Suárez
FC Valencia,1049,13.12.2018,13.12.2018,-,1,2018-12-13,2018-12-13,,Denis Suárez
SSC Neapel,6195,13.12.2018,13.12.2018,-,1,2018-12-13,2018-12-13,,Denis Suárez
AC Mailand,5,13.12.2018,13.12.2018,-,1,2018-12-13,2018-12-13,,Denis Suárez
AS Rom,12,30.11.2018,30.11.2018,-,1,2018-11-30,2018-11-30,,Denis Suárez
Inter Mailand,46,25.10.2018,25.10.2018,-,1,2018-10-25,2018-10-25,,Denis Suárez
FC Barcelona,131,28.12.2015,28.12.2015,-,1,2015-12-28,2015-12-28,,Denis Suárez
FC Sevilla,368,27.05.2015,27.05.2015,-,1,2015-05-27,2015-05-27,,Denis Suárez
Celta Vigo,940,02.05.2014,02.05.2014,-,1,2014-05-02,2014-05-02,,Denis Suárez
FC Barcelona,131,20.08.2013,22.08.2013,-,2,2013-08-20,2013-08-22,,Denis Suárez
VfL Wolfsburg,82,06.12.2024,06.12.2024,-,1,2024-12-06,2024-12-06,,Denis Vavro
Genua CFC,252,31.12.2020,31.12.2020,-,1,2020-12-31,2020-12-31,,Denis Vavro
Fenerbahce,36,26.12.2020,26.12.2020,-,1,2020-12-26,2020-12-26,,Denis Vavro
Lazio Rom,398,04.07.2019,04.07.2019,-,1,2019-07-04,2019-07-04,,Denis Vavro
Genua CFC,252,25.04.2013,25.04.2013,-,1,2013-04-25,2013-04-25,,Denis Vavro
AS Monaco,162,09.08.2023,10.08.2023,-,1,2023-08-09,2023-08-10,,Denis Zakaria
RB Leipzig,23826,01.08.2023,02.08.2023,-,1,2023-08-01,2023-08-02,,Denis Zakaria
West Ham United,379,31.07.2023,31.07.2023,-,1,2023-07-31,2023-07-31,,Denis Zakaria
Bayer 04 Leverkusen,15,25.07.2023,27.07.2023,-,1,2023-07-25,2023-07-27,,Denis Zakaria
RC Lens,826,27.06.2023,27.06.2023,-,1,2023-06-27,2023-06-27,,Denis Zakaria
Lazio Rom,398,20.06.2023,20.06.2023,-,1,2023-06-20,2023-06-20,,Denis Zakaria
Olympique Marseille,244,22.04.2023,22.04.2023,-,1,2023-04-22,2023-04-22,,Denis Zakaria
Borussia Mönchengladbach,18,04.11.2022,21.11.2022,-,1,2022-11-04,2022-11-21,,Denis Zakaria
FC Chelsea,631,01.09.2022,01.09.2022,-,1,2022-09-01,2022-09-01,,Denis Zakaria
Borussia Dortmund,16,21.08.2022,22.08.2022,-,1,2022-08-21,2022-08-22,,Denis Zakaria
Juventus Turin,506,31.01.2022,31.01.2022,-,1,2022-01-31,2022-01-31,,Denis Zakaria
FC Bayern München,27,27.01.2022,30.01.2022,-,1,2022-01-27,2022-01-30,,Denis Zakaria
Borussia Dortmund,16,16.01.2022,19.01.2022,-,1,2022-01-16,2022-01-19,,Denis Zakaria
Manchester United,985,18.01.2022,18.01.2022,-,1,2022-01-18,2022-01-18,,Denis Zakaria
FC Barcelona,131,17.12.2021,17.12.2021,-,1,2021-12-17,2021-12-17,,Denis Zakaria
West Ham United,379,11.12.2021,14.12.2021,-,2,2021-12-11,2021-12-14,,Denis Zakaria
FC Arsenal,11,04.12.2021,04.12.2021,-,2,2021-12-04,2021-12-04,,Denis Zakaria
Inter Mailand,46,13.11.2021,13.11.2021,-,2,2021-11-13,2021-11-13,,Denis Zakaria
AS Rom,12,11.11.2021,11.11.2021,-,2,2021-11-11,2021-11-11,,Denis Zakaria
SSC Neapel,6195,23.08.2021,26.08.2021,-,2,2021-08-23,2021-08-26,,Denis Zakaria
Atalanta Bergamo,800,09.08.2021,09.08.2021,-,2,2021-08-09,2021-08-09,,Denis Zakaria
Manchester City,281,27.05.2021,29.06.2021,-,2,2021-05-27,2021-06-29,,Denis Zakaria
FC Liverpool,31,12.02.2021,12.02.2021,-,2,2021-02-12,2021-02-12,,Denis Zakaria
Atlético Madrid,13,12.02.2021,12.02.2021,-,2,2021-02-12,2021-02-12,,Denis Zakaria
FC Chelsea,631,01.12.2020,01.12.2020,-,2,2020-12-01,2020-12-01,,Denis Zakaria
Lazio Rom,398,16.06.2020,16.06.2020,-,2,2020-06-16,2020-06-16,,Denis Zakaria
Real Madrid,418,04.06.2020,06.06.2020,-,2,2020-06-04,2020-06-06,,Denis Zakaria
Tottenham Hotspur,148,23.10.2019,23.10.2019,-,2,2019-10-23,2019-10-23,,Denis Zakaria
FC Everton,29,24.07.2018,29.07.2018,-,2,2018-07-24,2018-07-29,,Denis Zakaria
Borussia Mönchengladbach,18,09.06.2017,09.06.2017,-,2,2017-06-09,2017-06-09,,Denis Zakaria
FC Schalke 04,33,05.05.2017,16.05.2017,-,3,2017-05-05,2017-05-16,,Denis Zakaria
Bayer 04 Leverkusen,15,05.05.2017,05.05.2017,-,3,2017-05-05,2017-05-05,,Denis Zakaria
FC Liverpool,31,05.05.2017,05.05.2017,-,3,2017-05-05,2017-05-05,,Denis Zakaria
Tottenham Hotspur,148,05.05.2017,05.05.2017,-,3,2017-05-05,2017-05-05,,Denis Zakaria
RB Leipzig,23826,03.05.2017,03.05.2017,-,3,2017-05-03,2017-05-03,,Denis Zakaria
Manchester City,281,15.05.2016,18.05.2016,-,3,2016-05-15,2016-05-18,,Denis Zakaria
SSC Neapel,6195,15.05.2016,15.05.2016,-,3,2016-05-15,2016-05-15,,Denis Zakaria
FC Southampton,180,15.05.2016,15.05.2016,-,3,2016-05-15,2016-05-15,,Denis Zakaria
BSC Young Boys,452,26.06.2015,27.06.2015,-,3,2015-06-26,2015-06-27,,Denis Zakaria
VfB Stuttgart,79,09.08.2024,09.08.2024,-,1,2024-08-09,2024-08-09,,Deniz Undav
Brighton & Hove Albion,1237,,04.04.2024,-,1,,2024-04-04,,Deniz Undav
SV Werder Bremen,86,19.12.2022,20.01.2023,-,1,2022-12-19,2023-01-20,,Deniz Undav
1.FC Köln,3,06.12.2022,13.12.2022,-,1,2022-12-06,2022-12-13,,Deniz Undav
FC Schalke 04,33,04.12.2022,05.12.2022,-,1,2022-12-04,2022-12-05,,Deniz Undav
Hertha BSC,44,01.12.2022,01.12.2022,-,1,2022-12-01,2022-12-01,,Deniz Undav
Borussia Mönchengladbach,18,31.01.2022,31.01.2022,-,1,2022-01-31,2022-01-31,,Deniz Undav
VfL Wolfsburg,82,31.01.2022,31.01.2022,-,1,2022-01-31,2022-01-31,,Deniz Undav
Eintracht Braunschweig II,1212,19.05.2017,19.05.2017,-,1,2017-05-19,2017-05-19,,Deniz Undav
US Lecce,1005,18.07.2024,18.07.2024,-,1,2024-07-18,2024-07-18,,Dennis Praet
AC Florenz,430,29.06.2022,29.06.2022,-,1,2022-06-29,2022-06-29,,Dennis Praet
FC Turin,416,30.08.2021,30.08.2021,-,1,2021-08-30,2021-08-30,,Dennis Praet
Leicester City,1003,09.08.2019,09.08.2019,-,1,2019-08-09,2019-08-09,,Dennis Praet
FC Arsenal,11,06.06.2019,08.06.2019,-,1,2019-06-06,2019-06-08,,Dennis Praet
SSC Neapel,6195,05.06.2018,05.06.2018,-,1,2018-06-05,2018-06-05,,Dennis Praet
Newcastle United,762,20.05.2018,20.05.2018,-,1,2018-05-20,2018-05-20,,Dennis Praet
Inter Mailand,46,20.05.2018,20.05.2018,-,1,2018-05-20,2018-05-20,,Dennis Praet
FC Everton,29,24.08.2017,24.08.2017,-,1,2017-08-24,2017-08-24,,Dennis Praet
Olympique Marseille,244,23.08.2017,23.08.2017,-,1,2017-08-23,2017-08-23,,Dennis Praet
Leicester City,1003,20.05.2016,20.05.2016,-,1,2016-05-20,2016-05-20,,Dennis Praet
AC Florenz,430,11.05.2016,11.05.2016,-,1,2016-05-11,2016-05-11,,Dennis Praet
Bayer 04 Leverkusen,15,12.04.2016,12.04.2016,-,1,2016-04-12,2016-04-12,,Dennis Praet
FC Sevilla,368,25.03.2016,25.03.2016,-,1,2016-03-25,2016-03-25,,Dennis Praet
Inter Mailand,46,21.02.2016,21.02.2016,-,1,2016-02-21,2016-02-21,,Dennis Praet
FC Everton,29,19.01.2016,19.01.2016,-,2,2016-01-19,2016-01-19,,Dennis Praet
FC Liverpool,31,10.01.2016,10.01.2016,-,2,2016-01-10,2016-01-10,,Dennis Praet
Aston Villa,405,16.12.2015,16.12.2015,-,2,2015-12-16,2015-12-16,,Dennis Praet
Juventus Turin,506,16.11.2015,16.11.2015,-,2,2015-11-16,2015-11-16,,Dennis Praet
SSC Neapel,6195,07.09.2015,07.09.2015,-,2,2015-09-07,2015-09-07,,Dennis Praet
FC Schalke 04,33,30.08.2015,31.08.2015,-,2,2015-08-30,2015-08-31,,Dennis Praet
VfL Wolfsburg,82,30.08.2015,31.08.2015,-,2,2015-08-30,2015-08-31,,Dennis Praet
West Bromwich Albion,984,05.08.2015,05.08.2015,-,2,2015-08-05,2015-08-05,,Dennis Praet
FC Southampton,180,29.06.2015,29.06.2015,-,2,2015-06-29,2015-06-29,,Dennis Praet
TSG 1899 Hoffenheim,533,19.03.2015,19.03.2015,-,2,2015-03-19,2015-03-19,,Dennis Praet
Borussia Dortmund,16,10.03.2015,10.03.2015,-,2,2015-03-10,2015-03-10,,Dennis Praet
Manchester City,281,23.12.2014,23.12.2014,-,2,2014-12-23,2014-12-23,,Dennis Praet
FC Valencia,1049,22.12.2014,22.12.2014,-,2,2014-12-22,2014-12-22,,Dennis Praet
Ajax Amsterdam,610,28.04.2014,29.04.2014,-,2,2014-04-28,2014-04-29,,Dennis Praet
Atlético Madrid,13,08.11.2014,26.02.2014,-,2,2014-11-08,2014-02-26,,Dennis Praet
Besiktas JK,114,29.10.2013,02.11.2013,-,3,2013-10-29,2013-11-02,,Dennis Praet
AEK Athen,2441,22.05.2025,22.05.2025,-,1,2025-05-22,2025-05-22,,Dereck Kutesa
Fenerbahce,36,09.05.2025,22.05.2025,-,1,2025-05-09,2025-05-22,,Dereck Kutesa
Oxford United,988,09.05.2025,22.05.2025,-,1,2025-05-09,2025-05-22,,Dereck Kutesa
Al Ahly FC,7,10.02.2025,10.02.2025,-,1,2025-02-10,2025-02-10,,Dereck Kutesa
Galatasaray,141,18.08.2023,18.08.2023,-,1,2023-08-18,2023-08-18,,Dereck Kutesa
Stade Reims,1421,27.08.2019,27.08.2019,-,1,2019-08-27,2019-08-27,,Dereck Kutesa
FC St. Gallen 1879,257,05.07.2018,05.07.2018,-,1,2018-07-05,2018-07-05,,Dereck Kutesa
FC Basel 1893,26,31.12.2015,31.12.2015,-,1,2015-12-31,2015-12-31,,Dereck Kutesa
Olympiakos Piräus,683,12.04.2017,12.04.2017,-,1,2017-04-12,2017-04-12,,Deyverson
Olympique Marseille,244,07.04.2017,07.04.2017,-,1,2017-04-07,2017-04-07,,Deyverson
1.FC Köln,3,02.02.2015,02.02.2015,-,1,2015-02-02,2015-02-02,,Deyverson
AS Arta/Solar7,84230,11.05.2021,11.05.2021,-,1,2021-05-11,2021-05-11,,Diafra Sakho
Górnik Zabrze,428,01.03.2020,01.03.2020,-,1,2020-03-01,2020-03-01,,Diafra Sakho
FC Stade Rennes,273,28.01.2018,28.01.2018,-,1,2018-01-28,2018-01-28,,Diafra Sakho
FC Girondins Bordeaux,40,24.01.2018,24.01.2018,-,1,2018-01-24,2018-01-24,,Diafra Sakho
Crystal Palace,873,10.01.2018,12.01.2018,-,1,2018-01-10,2018-01-12,,Diafra Sakho
FC Everton,29,07.01.2018,07.01.2018,-,1,2018-01-07,2018-01-07,,Diafra Sakho
Swansea City,2288,04.01.2018,04.01.2018,-,1,2018-01-04,2018-01-04,,Diafra Sakho
Cardiff City,603,20.12.2017,20.12.2017,-,1,2017-12-20,2017-12-20,,Diafra Sakho
Lazio Rom,398,22.08.2017,23.08.2017,-,1,2017-08-22,2017-08-23,,Diafra Sakho
Fenerbahce,36,29.07.2017,29.07.2017,-,1,2017-07-29,2017-07-29,,Diafra Sakho
Hamburger SV,41,17.07.2016,17.07.2016,-,1,2016-07-17,2016-07-17,,Diafra Sakho
West Bromwich Albion,984,14.06.2016,14.06.2016,-,1,2016-06-14,2016-06-14,,Diafra Sakho
AFC Sunderland,289,31.05.2016,31.05.2016,-,1,2016-05-31,2016-05-31,,Diafra Sakho
Manchester United,985,20.07.2015,20.07.2015,-,1,2015-07-20,2015-07-20,,Diafra Sakho
FC Liverpool,31,11.12.2014,11.12.2014,-,1,2014-12-11,2014-12-11,,Diafra Sakho
West Ham United,379,14.08.2014,10.08.2014,-,2,2014-08-14,2014-08-10,,Diafra Sakho
VfL Wolfsburg,82,15.04.2014,27.06.2014,-,2,2014-04-15,2014-06-27,,Diafra Sakho
FC Schalke 04,33,23.06.2014,26.06.2014,-,2,2014-06-23,2014-06-26,,Diafra Sakho
FC Bayern München,27,01.05.2014,01.05.2014,-,2,2014-05-01,2014-05-01,,Diafra Sakho
Borussia Dortmund,16,30.04.2014,30.04.2014,-,2,2014-04-30,2014-04-30,,Diafra Sakho
Olympique Marseille,244,18.04.2014,18.04.2014,-,2,2014-04-18,2014-04-18,,Diafra Sakho
FC Hansa Rostock,30,17.01.2012,17.01.2012,-,2,2012-01-17,2012-01-17,,Diafra Sakho
Como 1907,1047,30.08.2025,30.08.2025,-,1,2025-08-30,2025-08-30,,Diego Carlos
Fenerbahce,36,20.01.2025,20.01.2025,-,1,2025-01-20,2025-01-20,,Diego Carlos
Galatasaray,141,15.01.2025,15.01.2025,-,1,2025-01-15,2025-01-15,,Diego Carlos
FC Fulham,931,02.08.2024,02.08.2024,-,1,2024-08-02,2024-08-02,,Diego Carlos
AC Mailand,5,27.04.2024,27.04.2024,-,1,2024-04-27,2024-04-27,,Diego Carlos
Aston Villa,405,25.05.2022,25.05.2022,-,1,2022-05-25,2022-05-25,,Diego Carlos
Newcastle United,762,25.01.2022,25.01.2022,-,1,2022-01-25,2022-01-25,,Diego Carlos
Tottenham Hotspur,148,06.04.2021,06.04.2021,-,1,2021-04-06,2021-04-06,,Diego Carlos
Manchester City,281,17.07.2020,17.07.2020,-,1,2020-07-17,2020-07-17,,Diego Carlos
FC Bayern München,27,15.07.2020,16.07.2020,-,1,2020-07-15,2020-07-16,,Diego Carlos
FC Liverpool,31,22.05.2020,22.05.2020,-,1,2020-05-22,2020-05-22,,Diego Carlos
FC Barcelona,131,11.04.2020,11.04.2020,-,1,2020-04-11,2020-04-11,,Diego Carlos
Lazio Rom,398,01.06.2018,01.06.2018,-,1,2018-06-01,2018-06-01,,Diego Carlos
Hamburger SV,41,01.07.2016,04.07.2016,-,1,2016-07-01,2016-07-04,,Diego Farias
AC Florenz,430,22.05.2015,22.05.2015,-,1,2015-05-22,2015-05-22,,Diego Farias
Rayo Vallecano,367,07.05.2015,07.05.2015,-,1,2015-05-07,2015-05-07,,Diego Farias
FC Getafe,3709,07.05.2015,07.05.2015,-,1,2015-05-07,2015-05-07,,Diego Farias
FC Elche,1531,07.05.2015,07.05.2015,-,1,2015-05-07,2015-05-07,,Diego Farias
Atlético Mineiro,46928,09.01.2022,09.01.2022,-,1,2022-01-09,2022-01-09,,Diego Godín
Cagliari Calcio,1390,12.09.2020,12.09.2020,-,1,2020-09-12,2020-09-12,,Diego Godín
Fenerbahce,36,23.08.2020,28.08.2020,-,1,2020-08-23,2020-08-28,,Diego Godín
FC Everton,29,30.05.2020,30.05.2020,-,1,2020-05-30,2020-05-30,,Diego Godín
Manchester United,985,13.04.2020,13.04.2020,-,1,2020-04-13,2020-04-13,,Diego Godín
Tottenham Hotspur,148,13.04.2020,13.04.2020,-,1,2020-04-13,2020-04-13,,Diego Godín
Inter Mailand,46,08.05.2019,01.07.2019,-,1,2019-05-08,2019-07-01,,Diego Godín
AC Mailand,5,22.11.2018,22.11.2018,-,1,2018-11-22,2018-11-22,,Diego Godín
Manchester United,985,09.08.2018,09.08.2018,-,1,2018-08-09,2018-08-09,,Diego Godín
Juventus Turin,506,17.07.2018,17.07.2018,-,1,2018-07-17,2018-07-17,,Diego Godín
FC Bayern München,27,19.08.2014,30.08.2014,-,1,2014-08-19,2014-08-30,,Diego Godín
FC Chelsea,631,20.06.2013,20.06.2013,-,1,2013-06-20,2013-06-20,,Diego Godín
Manchester City,281,14.06.2013,14.06.2013,-,1,2013-06-14,2013-06-14,,Diego Godín
FC Liverpool,31,09.08.2012,09.08.2012,-,1,2012-08-09,2012-08-09,,Diego Godín
SSC Neapel,6195,03.07.2012,03.07.2012,-,1,2012-07-03,2012-07-03,,Diego Godín
Atlético Madrid,13,04.08.2010,04.08.2010,-,2,2010-08-04,2010-08-04,,Diego Godín
FC Schalke 04,33,17.07.2010,17.07.2010,-,2,2010-07-17,2010-07-17,,Diego Godín
Fenerbahce,36,18.03.2010,20.03.2010,-,2,2010-03-18,2010-03-20,,Diego Godín
Tigres UANL,7055,25.01.2023,25.01.2023,-,1,2023-01-25,2023-01-25,,Diego Lainez
CF América,3631,11.05.2022,11.05.2022,-,1,2022-05-11,2022-05-11,,Diego Lainez
Galatasaray,141,26.05.2020,26.05.2020,-,1,2020-05-26,2020-05-26,,Diego Lainez
Real Betis Sevilla,150,10.01.2019,10.01.2019,-,1,2019-01-10,2019-01-10,,Diego Lainez
Ajax Amsterdam,610,17.12.2018,17.12.2018,-,1,2018-12-17,2018-12-17,,Diego Lainez
RB Leipzig,23826,11.09.2018,11.09.2018,-,1,2018-09-11,2018-09-11,,Diego Lainez
Olympique Lyon,1041,31.05.2018,31.05.2018,-,1,2018-05-31,2018-05-31,,Diego Lainez
AS Monaco,162,18.04.2018,18.04.2018,-,1,2018-04-18,2018-04-18,,Diego Lainez
AC Florenz,430,17.08.2019,17.08.2019,-,1,2019-08-17,2019-08-17,,Diego Laxalt
Newcastle United,762,14.01.2019,14.01.2019,-,1,2019-01-14,2019-01-14,,Diego Laxalt
AC Mailand,5,17.08.2018,17.08.2018,-,1,2018-08-17,2018-08-17,,Diego Laxalt
VfB Stuttgart,79,13.07.2018,16.08.2018,-,1,2018-07-13,2018-08-16,,Diego Laxalt
Zenit St. Petersburg,964,06.08.2018,06.08.2018,-,1,2018-08-06,2018-08-06,,Diego Laxalt
FC Schalke 04,33,31.07.2017,21.07.2018,-,1,2017-07-31,2018-07-21,,Diego Laxalt
FC Valencia,1049,17.07.2018,17.07.2018,-,1,2018-07-17,2018-07-17,,Diego Laxalt
VfL Wolfsburg,82,16.07.2017,16.07.2018,-,1,2017-07-16,2018-07-16,,Diego Laxalt
Lazio Rom,398,08.06.2018,08.06.2018,-,1,2018-06-08,2018-06-08,,Diego Laxalt
FC Turin,416,18.05.2018,18.05.2018,-,1,2018-05-18,2018-05-18,,Diego Laxalt
Borussia Dortmund,16,19.06.2017,20.06.2017,-,1,2017-06-19,2017-06-20,,Diego Laxalt
West Ham United,379,03.03.2017,03.03.2017,-,1,2017-03-03,2017-03-03,,Diego Laxalt
Genua CFC,252,29.01.2015,29.01.2015,-,1,2015-01-29,2015-01-29,,Diego Laxalt
FC Empoli,749,13.08.2014,13.08.2014,-,1,2014-08-13,2014-08-13,,Diego Laxalt
VfB Stuttgart,79,22.07.2014,24.07.2014,-,1,2014-07-22,2014-07-24,,Diego Laxalt
Real Betis Sevilla,150,07.07.2024,07.07.2024,-,1,2024-07-07,2024-07-07,,Diego Llorente
FC Paris Saint-Germain,583,10.01.2024,10.01.2024,-,1,2024-01-10,2024-01-10,,Diego Llorente
AS Rom,12,08.07.2023,08.07.2023,-,1,2023-07-08,2023-07-08,,Diego Llorente
FC Liverpool,31,18.05.2020,18.05.2020,-,1,2020-05-18,2020-05-18,,Diego Llorente
AS Monaco,162,31.01.2020,31.01.2020,-,1,2020-01-31,2020-01-31,,Diego Llorente
West Ham United,379,06.11.2019,06.11.2019,-,1,2019-11-06,2019-11-06,,Diego Llorente
Leicester City,1003,06.11.2019,06.11.2019,-,1,2019-11-06,2019-11-06,,Diego Llorente
FC Everton,29,21.06.2019,21.06.2019,-,1,2019-06-21,2019-06-21,,Diego Llorente
Olympique Marseille,244,30.10.2016,30.10.2016,-,1,2016-10-30,2016-10-30,,Diego Llorente
FC Villarreal,1050,16.06.2016,16.06.2016,-,1,2016-06-16,2016-06-16,,Diego Llorente
Olympique Lyon,1041,01.09.2023,01.09.2023,-,1,2023-09-01,2023-09-01,,Diego Moreira
FC Chelsea,631,13.12.2022,13.12.2022,-,1,2022-12-13,2022-12-13,,Diego Moreira
Genua CFC,252,20.08.2021,20.08.2021,-,1,2021-08-20,2021-08-20,,Diego Perotti
FC Everton,29,09.07.2019,09.07.2019,-,1,2019-07-09,2019-07-09,,Diego Perotti
Spartak Moskau,232,03.03.2017,03.03.2017,-,1,2017-03-03,2017-03-03,,Diego Perotti
Leicester City,1003,29.01.2016,29.01.2016,-,1,2016-01-29,2016-01-29,,Diego Perotti
FC Arsenal,11,01.11.2015,01.11.2015,-,1,2015-11-01,2015-11-01,,Diego Perotti
Inter Mailand,46,11.08.2015,11.08.2015,-,1,2015-08-11,2015-08-11,,Diego Perotti
SSC Neapel,6195,08.07.2015,08.07.2015,-,1,2015-07-08,2015-07-08,,Diego Perotti
FC Watford,1010,21.06.2015,21.06.2015,-,1,2015-06-21,2015-06-21,,Diego Perotti
West Ham United,379,16.06.2015,16.06.2015,-,1,2015-06-16,2015-06-16,,Diego Perotti
Lazio Rom,398,14.05.2015,14.05.2015,-,1,2015-05-14,2015-05-14,,Diego Perotti
AS Rom,12,14.05.2015,14.05.2015,-,1,2015-05-14,2015-05-14,,Diego Perotti
SV Werder Bremen,86,31.01.2014,31.01.2014,-,1,2014-01-31,2014-01-31,,Diego Perotti
Tottenham Hotspur,148,24.11.2013,25.11.2013,-,1,2013-11-24,2013-11-25,,Diego Perotti
Dinamo Moskau,121,05.02.2012,07.02.2012,-,1,2012-02-05,2012-02-07,,Diego Perotti
Juventus Turin,506,08.06.2011,08.06.2011,-,1,2011-06-08,2011-06-08,,Diego Perotti
Real Madrid,418,20.11.2009,20.11.2009,-,2,2009-11-20,2009-11-20,,Diego Perotti
Borussia Dortmund,16,25.07.2018,25.07.2018,-,1,2018-07-25,2018-07-25,,Diego Rico
AFC Bournemouth,989,24.07.2018,24.07.2018,-,1,2018-07-24,2018-07-24,,Diego Rico
FC Fulham,931,02.07.2017,02.07.2017,-,1,2017-07-02,2017-07-02,,Diego Rolán
1.FC Köln,3,26.06.2017,26.06.2017,-,1,2017-06-26,2017-06-26,,Diego Rolán
Bayer 04 Leverkusen,15,23.06.2017,23.06.2017,-,1,2017-06-23,2017-06-23,,Diego Rolán
FC Schalke 04,33,23.06.2017,23.06.2017,-,1,2017-06-23,2017-06-23,,Diego Rolán
FC Bayern München,27,29.08.2016,31.08.2016,-,1,2016-08-29,2016-08-31,,Diego Rolán
Brighton & Hove Albion,1237,29.08.2016,29.08.2016,-,1,2016-08-29,2016-08-29,,Diego Rolán
Norwich City,1123,29.08.2016,29.08.2016,-,1,2016-08-29,2016-08-29,,Diego Rolán
Manchester United,985,29.08.2016,29.08.2016,-,1,2016-08-29,2016-08-29,,Diego Rolán
RB Leipzig,23826,16.08.2016,16.08.2016,-,1,2016-08-16,2016-08-16,,Diego Rolán
FC Everton,29,12.07.2016,12.07.2016,-,1,2016-07-12,2016-07-12,,Diego Rolán
Fenerbahce,36,19.01.2016,19.01.2016,-,1,2016-01-19,2016-01-19,,Diego Rolán
Fenerbahce,36,04.01.2016,04.01.2016,-,1,2016-01-04,2016-01-04,,Diego Rolán
Aston Villa,405,02.08.2015,02.08.2015,-,1,2015-08-02,2015-08-02,,Diego Rolán
Newcastle United,762,25.07.2015,25.07.2015,-,1,2015-07-25,2015-07-25,,Diego Rolán
FC Valencia,1049,29.08.2021,29.08.2021,-,1,2021-08-29,2021-08-29,,Dimitri Foulquier
FC Nantes,995,23.12.2019,23.12.2019,-,1,2019-12-23,2019-12-23,,Dimitri Foulquier
Olympique Marseille,244,15.07.2013,16.07.2013,-,1,2013-07-15,2013-07-16,,Dimitri Foulquier
FC Liverpool,31,18.09.2020,20.09.2020,-,1,2020-09-18,2020-09-20,,Diogo Jota
FC Arsenal,11,14.03.2020,14.03.2020,-,1,2020-03-14,2020-03-14,,Diogo Jota
Manchester United,985,22.02.2020,28.02.2020,-,1,2020-02-22,2020-02-28,,Diogo Jota
Tottenham Hotspur,148,24.03.2019,24.03.2019,-,1,2019-03-24,2019-03-24,,Diogo Jota
Lazio Rom,398,02.06.2018,02.06.2018,-,1,2018-06-02,2018-06-02,,Diogo Jota
Atlético Madrid,13,15.03.2016,15.03.2016,-,1,2016-03-15,2016-03-15,,Diogo Jota
FC Barcelona,131,23.09.2015,23.09.2015,-,1,2015-09-23,2015-09-23,,Diogo Jota
FC Barcelona,131,22.01.2025,22.01.2025,-,1,2025-01-22,2025-01-22,,Dion Lopy
Atlético Madrid,13,02.07.2024,02.07.2024,-,1,2024-07-02,2024-07-02,,Dion Lopy
SC Freiburg,60,,22.01.2024,-,1,,2024-01-22,,Dion Lopy
Borussia Dortmund,16,06.08.2023,06.08.2023,-,1,2023-08-06,2023-08-06,,Dion Lopy
UD Almería,3302,05.08.2023,05.08.2023,-,1,2023-08-05,2023-08-05,,Dion Lopy
AC Florenz,430,19.11.2024,19.11.2024,-,1,2024-11-19,2024-11-19,,Divock Origi
Nottingham Forest,703,01.09.2023,01.09.2023,-,1,2023-09-01,2023-09-01,,Divock Origi
FC Burnley,1132,01.09.2023,01.09.2023,-,1,2023-09-01,2023-09-01,,Divock Origi
Sheffield United,350,23.08.2023,23.08.2023,-,1,2023-08-23,2023-08-23,,Divock Origi
Al-Ettifaq FC,7732,10.07.2023,10.07.2023,-,1,2023-07-10,2023-07-10,,Divock Origi
AC Mailand,5,09.06.2022,09.06.2022,-,1,2022-06-09,2022-06-09,,Divock Origi
Lazio Rom,398,06.01.2022,06.01.2022,-,1,2022-01-06,2022-01-06,,Divock Origi
Atalanta Bergamo,800,06.01.2022,06.01.2022,-,1,2022-01-06,2022-01-06,,Divock Origi
RC Lens,826,19.09.2021,19.09.2021,-,1,2021-09-19,2021-09-19,,Divock Origi
Borussia Mönchengladbach,18,14.07.2021,14.07.2021,-,1,2021-07-14,2021-07-14,,Divock Origi
Borussia Dortmund,16,24.03.2021,26.03.2021,-,1,2021-03-24,2021-03-26,,Divock Origi
Inter Mailand,46,24.03.2021,24.03.2021,-,1,2021-03-24,2021-03-24,,Divock Origi
Eintracht Frankfurt,24,15.03.2021,16.03.2021,-,1,2021-03-15,2021-03-16,,Divock Origi
RB Leipzig,23826,20.01.2021,20.01.2021,-,1,2021-01-20,2021-01-20,,Divock Origi
FC Schalke 04,33,22.12.2020,28.12.2020,-,1,2020-12-22,2020-12-28,,Divock Origi
Wolverhampton Wanderers,543,18.12.2020,18.12.2020,-,2,2020-12-18,2020-12-18,,Divock Origi
Tottenham Hotspur,148,17.01.2019,17.01.2019,-,2,2019-01-17,2019-01-17,,Divock Origi
Newcastle United,762,18.10.2018,18.10.2018,-,2,2018-10-18,2018-10-18,,Divock Origi
Besiktas JK,114,16.10.2018,16.10.2018,-,2,2018-10-16,2018-10-16,,Divock Origi
Galatasaray,141,16.10.2018,16.10.2018,-,2,2018-10-16,2018-10-16,,Divock Origi
Fenerbahce,36,13.08.2018,20.08.2018,-,2,2018-08-13,2018-08-20,,Divock Origi
FC Valencia,1049,13.08.2018,13.08.2018,-,2,2018-08-13,2018-08-13,,Divock Origi
FC Watford,1010,29.07.2018,29.07.2018,-,2,2018-07-29,2018-07-29,,Divock Origi
VfL Wolfsburg,82,08.01.2018,19.01.2018,-,2,2018-01-08,2018-01-19,,Divock Origi
VfL Wolfsburg,82,31.08.2017,31.08.2017,-,2,2017-08-31,2017-08-31,,Divock Origi
SV Werder Bremen,86,30.08.2017,30.08.2017,-,2,2017-08-30,2017-08-30,,Divock Origi
Bayer 04 Leverkusen,15,28.08.2017,29.08.2017,-,2,2017-08-28,2017-08-29,,Divock Origi
Hamburger SV,41,28.08.2017,28.08.2017,-,2,2017-08-28,2017-08-28,,Divock Origi
Olympique Marseille,244,26.08.2017,26.08.2017,-,2,2017-08-26,2017-08-26,,Divock Origi
RSC Anderlecht,58,26.08.2017,26.08.2017,-,2,2017-08-26,2017-08-26,,Divock Origi
Olympique Lyon,1041,30.05.2017,30.05.2017,-,3,2017-05-30,2017-05-30,,Divock Origi
AS Monaco,162,30.05.2017,30.05.2017,-,3,2017-05-30,2017-05-30,,Divock Origi
Atlético Madrid,13,20.07.2016,20.07.2016,-,3,2016-07-20,2016-07-20,,Divock Origi
VfB Stuttgart,79,25.09.2015,26.09.2015,-,3,2015-09-25,2015-09-26,,Divock Origi
Borussia Dortmund,16,29.07.2014,29.07.2014,-,3,2014-07-29,2014-07-29,,Divock Origi
VfL Wolfsburg,82,11.07.2014,11.07.2014,-,3,2014-07-11,2014-07-11,,Divock Origi
FC Liverpool,31,23.07.2014,16.04.2014,-,3,2014-07-23,2014-04-16,,Divock Origi
Genua CFC,252,09.01.2024,09.01.2024,-,1,2024-01-09,2024-01-09,,Djed Spence
Leeds United,399,30.08.2023,30.08.2023,-,1,2023-08-30,2023-08-30,,Djed Spence
Olympique Lyon,1041,26.01.2023,26.01.2023,-,1,2023-01-26,2023-01-26,,Djed Spence
FC Southampton,180,18.01.2023,18.01.2023,-,1,2023-01-18,2023-01-18,,Djed Spence
Tottenham Hotspur,148,19.07.2022,19.07.2022,-,1,2022-07-19,2022-07-19,,Djed Spence
Borussia Dortmund,16,08.03.2022,08.03.2022,-,1,2022-03-08,2022-03-08,,Djed Spence
FC Bayern München,27,07.03.2022,08.03.2022,-,1,2022-03-07,2022-03-08,,Djed Spence
FC Arsenal,11,17.01.2022,17.01.2022,-,1,2022-01-17,2022-01-17,,Djed Spence
AS Rom,12,17.01.2022,17.01.2022,-,1,2022-01-17,2022-01-17,,Djed Spence
Inter Mailand,46,17.01.2022,17.01.2022,-,1,2022-01-17,2022-01-17,,Djed Spence
FC Getafe,3709,04.08.2023,04.08.2023,-,1,2023-08-04,2023-08-04,,Djibril Sidibé
Deportivo Alavés,1108,04.08.2023,04.08.2023,-,1,2023-08-04,2023-08-04,,Djibril Sidibé
Le Havre AC,738,17.06.2023,17.06.2023,-,1,2023-06-17,2023-06-17,,Djibril Sidibé
Nottingham Forest,703,26.08.2022,26.08.2022,-,1,2022-08-26,2022-08-26,,Djibril Sidibé
FC Fulham,931,17.07.2022,17.07.2022,-,1,2022-07-17,2022-07-17,,Djibril Sidibé
Hertha BSC,44,27.04.2022,06.05.2022,-,1,2022-04-27,2022-05-06,,Djibril Sidibé
FC Schalke 04,33,27.04.2022,29.04.2022,-,1,2022-04-27,2022-04-29,,Djibril Sidibé
Bayer 04 Leverkusen,15,06.08.2020,06.08.2020,-,1,2020-08-06,2020-08-06,,Djibril Sidibé
FC Sevilla,368,11.06.2020,11.06.2020,-,1,2020-06-11,2020-06-11,,Djibril Sidibé
AC Mailand,5,24.10.2019,24.10.2019,-,1,2019-10-24,2019-10-24,,Djibril Sidibé
FC Everton,29,08.08.2019,08.08.2019,-,1,2019-08-08,2019-08-08,,Djibril Sidibé
West Ham United,379,22.07.2019,22.07.2019,-,1,2019-07-22,2019-07-22,,Djibril Sidibé
Atlético Madrid,13,24.06.2018,24.06.2018,-,1,2018-06-24,2018-06-24,,Djibril Sidibé
Manchester United,985,22.05.2018,22.05.2018,-,1,2018-05-22,2018-05-22,,Djibril Sidibé
FC Chelsea,631,02.03.2017,02.03.2017,-,1,2017-03-02,2017-03-02,,Djibril Sidibé
Manchester City,281,14.02.2017,14.02.2017,-,2,2017-02-14,2017-02-14,,Djibril Sidibé
FC Arsenal,11,07.07.2016,07.07.2016,-,2,2016-07-07,2016-07-07,,Djibril Sidibé
FC Southampton,180,04.07.2016,04.07.2016,-,2,2016-07-04,2016-07-04,,Djibril Sidibé
AS Monaco,162,25.06.2016,25.06.2016,-,2,2016-06-25,2016-06-25,,Djibril Sidibé
Borussia Dortmund,16,27.05.2025,28.05.2025,-,1,2025-05-27,2025-05-28,,Djibril Sow
SC Freiburg,60,27.05.2025,28.05.2025,-,1,2025-05-27,2025-05-28,,Djibril Sow
FC Sevilla,368,02.08.2023,04.08.2023,-,1,2023-08-02,2023-08-04,,Djibril Sow
West Ham United,379,01.08.2023,01.08.2023,-,1,2023-08-01,2023-08-01,,Djibril Sow
Lazio Rom,398,30.07.2023,31.07.2023,-,1,2023-07-30,2023-07-31,,Djibril Sow
Galatasaray,141,19.07.2023,21.07.2023,-,1,2023-07-19,2023-07-21,,Djibril Sow
FC Arsenal,11,06.04.2023,08.04.2023,-,1,2023-04-06,2023-04-08,,Djibril Sow
Nottingham Forest,703,07.12.2022,07.12.2022,-,1,2022-12-07,2022-12-07,,Djibril Sow
Newcastle United,762,07.12.2022,07.12.2022,-,1,2022-12-07,2022-12-07,,Djibril Sow
Aston Villa,405,07.12.2022,07.12.2022,-,1,2022-12-07,2022-12-07,,Djibril Sow
Crystal Palace,873,,03.09.2022,-,1,,2022-09-03,,Djibril Sow
RB Leipzig,23826,11.07.2022,11.07.2022,-,1,2022-07-11,2022-07-11,,Djibril Sow
Borussia Dortmund,16,22.03.2022,23.03.2022,-,1,2022-03-22,2022-03-23,,Djibril Sow
Eintracht Frankfurt,24,27.06.2019,27.06.2019,-,1,2019-06-27,2019-06-27,,Djibril Sow
FC Bologna,1025,14.06.2019,15.06.2019,-,1,2019-06-14,2019-06-15,,Djibril Sow
Olympique Lyon,1041,02.04.2019,12.04.2019,-,2,2019-04-02,2019-04-12,,Djibril Sow
AS Monaco,162,08.12.2018,31.12.2018,-,2,2018-12-08,2018-12-31,,Djibril Sow
FC Arsenal,11,20.12.2018,21.12.2018,-,2,2018-12-20,2018-12-21,,Djibril Sow
BSC Young Boys,452,26.06.2017,26.06.2017,-,2,2017-06-26,2017-06-26,,Djibril Sow
Besiktas JK,114,25.06.2025,25.06.2025,-,1,2025-06-25,2025-06-25,,Domagoj Bradarić
Glasgow Rangers,124,19.08.2024,19.08.2024,-,1,2024-08-19,2024-08-19,,Domagoj Bradarić
US Salernitana 1919,380,14.07.2022,14.07.2022,-,1,2022-07-14,2022-07-14,,Domagoj Bradarić
LOSC Lille,1082,20.07.2019,20.07.2019,-,1,2019-07-20,2019-07-20,,Domagoj Bradarić
Borussia Dortmund,16,20.02.2019,20.02.2019,-,1,2019-02-20,2019-02-20,,Domagoj Bradarić
Ajax Amsterdam,610,29.01.2019,29.01.2019,-,1,2019-01-29,2019-01-29,,Domagoj Bradarić
FC Barcelona,131,23.07.2018,23.07.2018,-,1,2018-07-23,2018-07-23,,Domingos Quina
SV Werder Bremen,86,19.07.2018,21.07.2018,-,1,2018-07-19,2018-07-21,,Domingos Quina
TSG 1899 Hoffenheim,533,19.07.2018,20.07.2018,-,1,2018-07-19,2018-07-20,,Domingos Quina
AC Mailand,5,01.04.2018,01.04.2018,-,1,2018-04-01,2018-04-01,,Domingos Quina
Borussia Dortmund,16,17.03.2018,18.03.2018,-,1,2018-03-17,2018-03-18,,Domingos Quina
Sheffield United,350,31.08.2017,31.08.2017,-,1,2017-08-31,2017-08-31,,Domingos Quina
FC Paris Saint-Germain,583,23.07.2017,23.07.2017,-,1,2017-07-23,2017-07-23,,Domingos Quina
FC Arsenal,11,11.07.2017,11.07.2017,-,1,2017-07-11,2017-07-11,,Domingos Quina
Tottenham Hotspur,148,28.03.2016,28.03.2016,-,1,2016-03-28,2016-03-28,,Domingos Quina
Manchester United,985,28.03.2016,28.03.2016,-,1,2016-03-28,2016-03-28,,Domingos Quina
FC Arsenal,11,28.03.2016,28.03.2016,-,1,2016-03-28,2016-03-28,,Domingos Quina
Tottenham Hotspur,148,18.03.2016,18.03.2016,-,1,2016-03-18,2016-03-18,,Domingos Quina
FC Arsenal,11,18.03.2016,18.03.2016,-,1,2016-03-18,2016-03-18,,Domingos Quina
Tottenham Hotspur,148,06.08.2024,09.08.2024,-,1,2024-08-06,2024-08-09,,Dominic Solanke
West Ham United,379,22.02.2024,22.02.2024,-,1,2024-02-22,2024-02-22,,Dominic Solanke
VfB Stuttgart,79,04.01.2019,04.01.2019,-,1,2019-01-04,2019-01-04,,Dominic Solanke
Brighton & Hove Albion,1237,04.01.2019,04.01.2019,-,1,2019-01-04,2019-01-04,,Dominic Solanke
Crystal Palace,873,02.01.2019,02.01.2019,-,1,2019-01-02,2019-01-02,,Dominic Solanke
FC Schalke 04,33,02.01.2019,02.01.2019,-,1,2019-01-02,2019-01-02,,Dominic Solanke
AFC Bournemouth,989,03.12.2018,04.12.2018,-,1,2018-12-03,2018-12-04,,Dominic Solanke
Huddersfield Town,1110,28.11.2018,28.11.2018,-,1,2018-11-28,2018-11-28,,Dominic Solanke
West Ham United,379,11.11.2018,11.11.2018,-,1,2018-11-11,2018-11-11,,Dominic Solanke
Newcastle United,762,18.10.2018,18.10.2018,-,1,2018-10-18,2018-10-18,,Dominic Solanke
Glasgow Rangers,124,08.05.2018,08.05.2018,-,1,2018-05-08,2018-05-08,,Dominic Solanke
FC Liverpool,31,30.05.2017,30.05.2017,-,1,2017-05-30,2017-05-30,,Dominic Solanke
RB Leipzig,23826,17.05.2017,17.05.2017,-,1,2017-05-17,2017-05-17,,Dominic Solanke
FC Bayern München,27,19.02.2017,22.02.2017,-,1,2017-02-19,2017-02-22,,Dominic Solanke
FC Arsenal,11,27.04.2016,27.04.2016,-,1,2016-04-27,2016-04-27,,Dominic Solanke
AS Rom,12,09.04.2016,09.04.2016,-,2,2016-04-09,2016-04-09,,Dominic Solanke
Hannover 96,42,17.01.2020,18.01.2020,-,1,2020-01-17,2020-01-18,,Dominik Kaiser
Hamburger SV,41,25.01.2018,25.01.2018,-,1,2018-01-25,2018-01-25,,Dominik Kaiser
1.FC Köln,3,09.01.2018,09.01.2018,-,1,2018-01-09,2018-01-09,,Dominik Kaiser
SG Dynamo Dresden,129,24.11.2017,26.11.2017,-,1,2017-11-24,2017-11-26,,Dominik Kaiser
Bröndby IF,206,18.06.2017,18.06.2017,-,1,2017-06-18,2017-06-18,,Dominik Kaiser
RB Leipzig,23826,12.07.2012,12.07.2012,-,1,2012-07-12,2012-07-12,,Dominik Kaiser
SSV Jahn Regensburg,109,12.07.2012,12.07.2012,-,1,2012-07-12,2012-07-12,,Dominik Kaiser
1.FSV Mainz 05,39,10.02.2022,11.05.2022,-,1,2022-02-10,2022-05-11,,Dominik Kohr
Eintracht Frankfurt,24,03.07.2019,03.07.2019,-,1,2019-07-03,2019-07-03,,Dominik Kohr
Bayer 04 Leverkusen,15,12.04.2017,12.04.2017,-,1,2017-04-12,2017-04-12,,Dominik Kohr
Borussia Mönchengladbach,18,22.02.2017,10.03.2017,-,1,2017-02-22,2017-03-10,,Dominik Kohr
Hertha BSC,44,01.06.2016,07.06.2016,-,1,2016-06-01,2016-06-07,,Dominik Kohr
FC Liverpool,31,10.03.2016,10.03.2016,-,1,2016-03-10,2016-03-10,,Dominik Kohr
West Ham United,379,17.02.2016,18.02.2016,-,1,2016-02-17,2016-02-18,,Dominik Kohr
FC Southampton,180,17.02.2016,17.02.2016,-,1,2016-02-17,2016-02-17,,Dominik Kohr
Tottenham Hotspur,148,17.02.2016,17.02.2016,-,1,2016-02-17,2016-02-17,,Dominik Kohr
AC Mailand,5,30.11.2014,02.12.2014,-,1,2014-11-30,2014-12-02,,Dominik Kohr
FC Augsburg,167,13.01.2014,13.01.2014,-,1,2014-01-13,2014-01-13,,Dominik Kohr
FC Liverpool,31,02.07.2023,02.07.2023,-,1,2023-07-02,2023-07-02,,Dominik Szoboszlai
Newcastle United,762,19.06.2023,30.06.2023,-,1,2023-06-19,2023-06-30,,Dominik Szoboszlai
FC Chelsea,631,03.03.2023,06.03.2023,-,1,2023-03-03,2023-03-06,,Dominik Szoboszlai
Olympique Marseille,244,26.06.2022,26.06.2022,-,1,2022-06-26,2022-06-26,,Dominik Szoboszlai
Real Sociedad San Sebastián,681,26.06.2022,26.06.2022,-,1,2022-06-26,2022-06-26,,Dominik Szoboszlai
Manchester United,985,15.11.2021,15.11.2021,-,1,2021-11-15,2021-11-15,,Dominik Szoboszlai
Atlético Madrid,13,,07.10.2021,-,1,,2021-10-07,,Dominik Szoboszlai
RB Leipzig,23826,17.12.2020,17.12.2020,-,1,2020-12-17,2020-12-17,,Dominik Szoboszlai
FC Arsenal,11,13.12.2020,17.12.2020,-,1,2020-12-13,2020-12-17,,Dominik Szoboszlai
FC Bayern München,27,11.12.2020,11.12.2020,-,1,2020-12-11,2020-12-11,,Dominik Szoboszlai
Real Madrid,418,04.12.2020,04.12.2020,-,1,2020-12-04,2020-12-04,,Dominik Szoboszlai
FC Paris Saint-Germain,583,20.11.2020,20.11.2020,-,1,2020-11-20,2020-11-20,,Dominik Szoboszlai
Tottenham Hotspur,148,19.11.2020,19.11.2020,-,1,2020-11-19,2020-11-19,,Dominik Szoboszlai
AC Mailand,5,17.11.2020,17.11.2020,-,1,2020-11-17,2020-11-17,,Dominik Szoboszlai
FC Liverpool,31,17.11.2020,17.11.2020,-,1,2020-11-17,2020-11-17,,Dominik Szoboszlai
Atlético Madrid,13,01.11.2020,02.11.2020,-,2,2020-11-01,2020-11-02,,Dominik Szoboszlai
Hertha BSC,44,10.09.2020,10.09.2020,-,2,2020-09-10,2020-09-10,,Dominik Szoboszlai
Borussia Dortmund,16,11.08.2020,13.08.2020,-,2,2020-08-11,2020-08-13,,Dominik Szoboszlai
SSC Neapel,6195,01.07.2020,01.07.2020,-,2,2020-07-01,2020-07-01,,Dominik Szoboszlai
FC Chelsea,631,27.04.2020,27.04.2020,-,2,2020-04-27,2020-04-27,,Dominik Szoboszlai
Leicester City,1003,27.04.2020,27.04.2020,-,2,2020-04-27,2020-04-27,,Dominik Szoboszlai
Lazio Rom,398,18.04.2020,18.04.2020,-,2,2020-04-18,2020-04-18,,Dominik Szoboszlai
Bayer 04 Leverkusen,15,23.06.2019,14.07.2019,-,2,2019-06-23,2019-07-14,,Dominik Szoboszlai
FC Barcelona,131,25.06.2019,25.06.2019,-,2,2019-06-25,2019-06-25,,Dominik Szoboszlai
Ajax Amsterdam,610,14.05.2019,14.05.2019,-,2,2019-05-14,2019-05-14,,Dominik Szoboszlai
Atalanta Bergamo,800,10.02.2019,10.02.2019,-,2,2019-02-10,2019-02-10,,Dominik Szoboszlai
Juventus Turin,506,30.01.2019,31.01.2019,-,2,2019-01-30,2019-01-31,,Dominik Szoboszlai
Inter Mailand,46,29.05.2018,29.05.2018,-,2,2018-05-29,2018-05-29,,Dominik Szoboszlai
1.FC Köln,3,31.08.2023,31.08.2023,-,1,2023-08-31,2023-08-31,,Dominique Heintz
VfL Bochum,80,10.08.2022,11.08.2022,-,1,2022-08-10,2022-08-11,,Dominique Heintz
1.FC Union Berlin,89,21.12.2021,22.12.2021,-,1,2021-12-21,2021-12-22,,Dominique Heintz
1.FC Köln,3,25.07.2021,30.07.2021,-,1,2021-07-25,2021-07-30,,Dominique Heintz
Celtic Glasgow,371,22.06.2021,05.07.2021,-,1,2021-06-22,2021-07-05,,Dominique Heintz
Bayer 04 Leverkusen,15,23.08.2019,28.08.2019,-,1,2019-08-23,2019-08-28,,Dominique Heintz
Eintracht Frankfurt,24,23.05.2018,23.05.2018,-,1,2018-05-23,2018-05-23,,Dominique Heintz
Hannover 96,42,21.05.2018,22.05.2018,-,1,2018-05-21,2018-05-22,,Dominique Heintz
Borussia Mönchengladbach,18,19.05.2018,22.05.2018,-,1,2018-05-19,2018-05-22,,Dominique Heintz
Eintracht Frankfurt,24,11.05.2018,11.05.2018,-,1,2018-05-11,2018-05-11,,Dominique Heintz
FC Schalke 04,33,13.03.2018,20.04.2018,-,1,2018-03-13,2018-04-20,,Dominique Heintz
Borussia Dortmund,16,19.03.2018,19.03.2018,-,1,2018-03-19,2018-03-19,,Dominique Heintz
Borussia Mönchengladbach,18,11.06.2015,11.06.2015,-,1,2015-06-11,2015-06-11,,Dominique Heintz
1.FC Köln,3,11.06.2015,11.06.2015,-,1,2015-06-11,2015-06-11,,Dominique Heintz
RB Leipzig,23826,28.05.2015,29.05.2015,-,1,2015-05-28,2015-05-29,,Dominique Heintz
Bayer 04 Leverkusen,15,22.01.2015,22.01.2015,-,2,2015-01-22,2015-01-22,,Dominique Heintz
Hamburger SV,41,13.05.2013,15.05.2013,-,2,2013-05-13,2013-05-15,,Dominique Heintz
1.FC Kaiserslautern,2,13.05.2013,13.05.2013,-,2,2013-05-13,2013-05-13,,Dominique Heintz
FC Girona,12321,10.07.2024,10.07.2024,-,1,2024-07-10,2024-07-10,,Donny van de Beek
Eintracht Frankfurt,24,01.01.2024,01.01.2024,-,1,2024-01-01,2024-01-01,,Donny van de Beek
Juventus Turin,506,04.12.2023,04.12.2023,-,1,2023-12-04,2023-12-04,,Donny van de Beek
Galatasaray,141,03.09.2023,03.09.2023,-,1,2023-09-03,2023-09-03,,Donny van de Beek
Genua CFC,252,30.08.2023,30.08.2023,-,1,2023-08-30,2023-08-30,,Donny van de Beek
FC Lorient,1158,30.08.2023,30.08.2023,-,1,2023-08-30,2023-08-30,,Donny van de Beek
Ajax Amsterdam,610,13.08.2023,13.08.2023,-,1,2023-08-13,2023-08-13,,Donny van de Beek
Real Sociedad San Sebastián,681,03.08.2023,03.08.2023,-,1,2023-08-03,2023-08-03,,Donny van de Beek
Leicester City,1003,06.10.2022,06.10.2022,-,1,2022-10-06,2022-10-06,,Donny van de Beek
FC Everton,29,31.01.2022,31.01.2022,-,1,2022-01-31,2022-01-31,,Donny van de Beek
Crystal Palace,873,25.01.2022,25.01.2022,-,1,2022-01-25,2022-01-25,,Donny van de Beek
Newcastle United,762,17.01.2022,17.01.2022,-,1,2022-01-17,2022-01-17,,Donny van de Beek
Borussia Dortmund,16,14.01.2022,15.01.2022,-,1,2022-01-14,2022-01-15,,Donny van de Beek
FC Bayern München,27,02.01.2022,06.01.2022,-,1,2022-01-02,2022-01-06,,Donny van de Beek
Wolverhampton Wanderers,543,16.11.2021,16.11.2021,-,1,2021-11-16,2021-11-16,,Donny van de Beek
FC Barcelona,131,01.11.2021,01.11.2021,-,2,2021-11-01,2021-11-01,,Donny van de Beek
Real Madrid,418,24.10.2021,24.10.2021,-,2,2021-10-24,2021-10-24,,Donny van de Beek
Inter Mailand,46,19.09.2021,19.09.2021,-,2,2021-09-19,2021-09-19,,Donny van de Beek
FC Arsenal,11,13.06.2021,13.06.2021,-,2,2021-06-13,2021-06-13,,Donny van de Beek
AS Rom,12,09.05.2021,09.05.2021,-,2,2021-05-09,2021-05-09,,Donny van de Beek
Manchester United,985,30.08.2020,31.08.2020,-,2,2020-08-30,2020-08-31,,Donny van de Beek
Newcastle United,762,10.05.2020,11.05.2020,-,2,2020-05-10,2020-05-11,,Donny van de Beek
FC Everton,29,29.04.2020,29.04.2020,-,2,2020-04-29,2020-04-29,,Donny van de Beek
Real Madrid,418,12.01.2020,12.01.2020,-,2,2020-01-12,2020-01-12,,Donny van de Beek
Borussia Dortmund,16,17.05.2019,17.05.2019,-,2,2019-05-17,2019-05-17,,Donny van de Beek
FC Paris Saint-Germain,583,08.05.2019,08.05.2019,-,2,2019-05-08,2019-05-08,,Donny van de Beek
FC Bayern München,27,05.05.2019,05.05.2019,-,2,2019-05-05,2019-05-05,,Donny van de Beek
AC Mailand,5,22.04.2019,22.04.2019,-,2,2019-04-22,2019-04-22,,Donny van de Beek
AS Rom,12,22.11.2018,22.11.2018,-,2,2018-11-22,2018-11-22,,Donny van de Beek
Tottenham Hotspur,148,25.10.2017,25.10.2017,-,2,2017-10-25,2017-10-25,,Donny van de Beek
FC Barcelona,131,02.07.2016,02.07.2016,-,3,2016-07-02,2016-07-02,,Donny van de Beek
Manchester United,985,01.11.2015,01.11.2015,-,3,2015-11-01,2015-11-01,,Donny van de Beek
Aston Villa,405,14.01.2025,14.01.2025,-,1,2025-01-14,2025-01-14,,Donyell Malen
Newcastle United,762,09.01.2025,09.01.2025,-,1,2025-01-09,2025-01-09,,Donyell Malen
FC Barcelona,131,06.12.2024,17.12.2024,-,1,2024-12-06,2024-12-17,,Donyell Malen
FC Arsenal,11,17.07.2024,26.08.2024,-,1,2024-07-17,2024-08-26,,Donyell Malen
FC Liverpool,31,17.07.2024,18.07.2024,-,1,2024-07-17,2024-07-18,,Donyell Malen
Manchester United,985,05.01.2024,05.01.2024,-,1,2024-01-05,2024-01-05,,Donyell Malen
FC Bayern München,27,03.10.2023,20.10.2023,-,1,2023-10-03,2023-10-20,,Donyell Malen
Lazio Rom,398,20.06.2023,20.06.2023,-,1,2023-06-20,2023-06-20,,Donyell Malen
FC Sevilla,368,28.02.2023,02.03.2023,-,1,2023-02-28,2023-03-02,,Donyell Malen
PSV Eindhoven,383,04.01.2023,05.01.2023,-,1,2023-01-04,2023-01-05,,Donyell Malen
Tottenham Hotspur,148,13.12.2022,14.12.2022,-,1,2022-12-13,2022-12-14,,Donyell Malen
Borussia Dortmund,16,27.07.2021,27.07.2021,-,1,2021-07-27,2021-07-27,,Donyell Malen
FC Liverpool,31,25.06.2021,25.06.2021,-,1,2021-06-25,2021-06-25,,Donyell Malen
VfL Wolfsburg,82,27.05.2021,28.05.2021,-,1,2021-05-27,2021-05-28,,Donyell Malen
FC Arsenal,11,09.03.2020,09.03.2020,-,1,2020-03-09,2020-03-09,,Donyell Malen
FC Barcelona,131,14.10.2019,14.10.2019,-,2,2019-10-14,2019-10-14,,Donyell Malen
FC Bayern München,27,28.09.2019,03.10.2019,-,2,2019-09-28,2019-10-03,,Donyell Malen
AC Mailand,5,25.09.2019,25.09.2019,-,2,2019-09-25,2019-09-25,,Donyell Malen
FC Everton,29,25.09.2019,25.09.2019,-,2,2019-09-25,2019-09-25,,Donyell Malen
FC Arsenal,11,23.04.2015,24.04.2015,-,2,2015-04-23,2015-04-24,,Donyell Malen
Sydney FC,8054,25.08.2024,25.08.2024,-,1,2024-08-25,2024-08-25,,Douglas Costa
Fluminense Football Club,2462,22.01.2024,22.01.2024,-,1,2024-01-22,2024-01-22,,Douglas Costa
Samsunspor,152,20.01.2024,20.01.2024,-,1,2024-01-20,2024-01-20,,Douglas Costa
Juventus Turin,506,03.11.2023,03.11.2023,-,1,2023-11-03,2023-11-03,,Douglas Costa
Los Angeles Galaxy,1061,03.02.2022,03.02.2022,-,1,2022-02-03,2022-02-03,,Douglas Costa
Grêmio Porto Alegre,210,13.05.2021,13.05.2021,-,1,2021-05-13,2021-05-13,,Douglas Costa
Tigres UANL,7055,01.04.2021,01.04.2021,-,1,2021-04-01,2021-04-01,,Douglas Costa
FC Bayern München,27,25.03.2021,25.03.2021,-,1,2021-03-25,2021-03-25,,Douglas Costa
AC Mailand,5,29.01.2021,29.01.2021,-,1,2021-01-29,2021-01-29,,Douglas Costa
Hertha BSC,44,20.01.2021,21.01.2021,-,1,2021-01-20,2021-01-21,,Douglas Costa
Juventus Turin,506,19.01.2021,19.01.2021,-,1,2021-01-19,2021-01-19,,Douglas Costa
Fenerbahce,36,09.01.2021,11.01.2021,-,1,2021-01-09,2021-01-11,,Douglas Costa
Wolverhampton Wanderers,543,23.09.2020,23.09.2020,-,1,2020-09-23,2020-09-23,,Douglas Costa
Manchester United,985,17.08.2020,17.08.2020,-,1,2020-08-17,2020-08-17,,Douglas Costa
FC Barcelona,131,04.07.2020,04.07.2020,-,1,2020-07-04,2020-07-04,,Douglas Costa
Manchester City,281,04.04.2020,04.04.2020,-,2,2020-04-04,2020-04-04,,Douglas Costa
FC Paris Saint-Germain,583,18.06.2019,18.06.2019,-,2,2019-06-18,2019-06-18,,Douglas Costa
Tottenham Hotspur,148,03.04.2019,03.04.2019,-,2,2019-04-03,2019-04-03,,Douglas Costa
Juventus Turin,506,12.07.2017,12.07.2017,-,2,2017-07-12,2017-07-12,,Douglas Costa
Inter Mailand,46,04.07.2017,04.07.2017,-,2,2017-07-04,2017-07-04,,Douglas Costa
Zenit St. Petersburg,964,08.06.2017,08.06.2017,-,2,2017-06-08,2017-06-08,,Douglas Costa
FC Barcelona,131,07.06.2017,07.06.2017,-,2,2017-06-07,2017-06-07,,Douglas Costa
FC Liverpool,31,07.06.2017,07.06.2017,-,2,2017-06-07,2017-06-07,,Douglas Costa
Manchester United,985,25.05.2017,31.05.2017,-,2,2017-05-25,2017-05-31,,Douglas Costa
FC Paris Saint-Germain,583,29.05.2017,30.05.2017,-,2,2017-05-29,2017-05-30,,Douglas Costa
Tottenham Hotspur,148,19.04.2017,21.04.2017,-,2,2017-04-19,2017-04-21,,Douglas Costa
Manchester City,281,19.02.2016,09.03.2016,-,2,2016-02-19,2016-03-09,,Douglas Costa
FC Bayern München,27,01.07.2015,01.07.2015,-,2,2015-07-01,2015-07-01,,Douglas Costa
FC Liverpool,31,07.04.2015,07.04.2015,-,2,2015-04-07,2015-04-07,,Douglas Costa
FC Chelsea,631,26.01.2015,23.01.2015,-,2,2015-01-26,2015-01-23,,Douglas Costa
AC Mailand,5,13.08.2014,13.08.2014,-,3,2014-08-13,2014-08-13,,Douglas Costa
Juventus Turin,506,22.07.2014,22.07.2014,-,3,2014-07-22,2014-07-22,,Douglas Costa
SSC Neapel,6195,09.09.2012,09.09.2012,-,3,2012-09-09,2012-09-09,,Douglas Costa
AS Rom,12,27.07.2011,28.07.2011,-,3,2011-07-27,2011-07-28,,Douglas Costa
Manchester United,985,18.04.2011,19.04.2011,-,3,2011-04-18,2011-04-19,,Douglas Costa
Manchester City,281,10.03.2011,10.03.2011,-,3,2011-03-10,2011-03-10,,Douglas Costa
Shakhtar Donetsk,660,17.12.2009,30.12.2009,-,3,2009-12-17,2009-12-30,,Douglas Costa
Real Madrid Castilla,6767,18.08.2009,19.08.2009,-,3,2009-08-18,2009-08-19,,Douglas Costa
Nottingham Forest,703,20.08.2025,20.08.2025,-,1,2025-08-20,2025-08-20,,Douglas Luiz
Juventus Turin,506,13.06.2024,13.06.2024,-,1,2024-06-13,2024-06-13,,Douglas Luiz
FC Barcelona,131,28.12.2023,15.03.2024,-,1,2023-12-28,2024-03-15,,Douglas Luiz
FC Arsenal,11,27.01.2022,27.01.2022,-,1,2022-01-27,2022-01-27,,Douglas Luiz
AS Rom,12,16.06.2021,16.06.2021,-,1,2021-06-16,2021-06-16,,Douglas Luiz
Aston Villa,405,13.07.2019,13.07.2019,-,1,2019-07-13,2019-07-13,,Douglas Luiz
Celtic Glasgow,371,28.08.2018,28.08.2018,-,1,2018-08-28,2018-08-28,,Douglas Luiz
ESTAC Troyes,1095,01.07.2023,01.07.2023,-,1,2023-07-01,2023-07-01,,Doğan Alemdar
Olympique Lyon,1041,21.06.2021,21.06.2021,-,1,2021-06-21,2021-06-21,,Doğan Alemdar
AS Rom,12,06.08.2023,08.08.2023,-,1,2023-08-06,2023-08-08,,Dries Mertens
Galatasaray,141,07.08.2022,08.08.2022,-,1,2022-08-07,2022-08-08,,Dries Mertens
Juventus Turin,506,26.07.2022,04.08.2022,-,1,2022-07-26,2022-08-04,,Dries Mertens
Lazio Rom,398,26.07.2022,26.07.2022,-,1,2022-07-26,2022-07-26,,Dries Mertens
Royal Antwerpen FC,1096,24.07.2022,24.07.2022,-,1,2022-07-24,2022-07-24,,Dries Mertens
Royal Antwerpen FC,1096,18.06.2022,18.06.2022,-,1,2022-06-18,2022-06-18,,Dries Mertens
AS Rom,12,11.06.2022,11.06.2022,-,1,2022-06-11,2022-06-11,,Dries Mertens
FC Valencia,1049,09.06.2022,09.06.2022,-,1,2022-06-09,2022-06-09,,Dries Mertens
1.FC Union Berlin,89,24.05.2022,24.05.2022,-,1,2022-05-24,2022-05-24,,Dries Mertens
PSV Eindhoven,383,05.01.2022,05.01.2022,-,1,2022-01-05,2022-01-05,,Dries Mertens
Inter Mailand,46,19.05.2020,19.05.2020,-,1,2020-05-19,2020-05-19,,Dries Mertens
Borussia Dortmund,16,19.05.2020,19.05.2020,-,1,2020-05-19,2020-05-19,,Dries Mertens
FC Chelsea,631,11.05.2020,11.05.2020,-,1,2020-05-11,2020-05-11,,Dries Mertens
FC Paris Saint-Germain,583,06.05.2020,06.05.2020,-,1,2020-05-06,2020-05-06,,Dries Mertens
Newcastle United,762,02.05.2020,02.05.2020,-,1,2020-05-02,2020-05-02,,Dries Mertens
Manchester United,985,16.04.2020,16.04.2020,-,2,2020-04-16,2020-04-16,,Dries Mertens
FC Arsenal,11,16.04.2020,16.04.2020,-,2,2020-04-16,2020-04-16,,Dries Mertens
FC Bayern München,27,22.12.2019,25.12.2019,-,2,2019-12-22,2019-12-25,,Dries Mertens
Tottenham Hotspur,148,12.11.2019,12.11.2019,-,2,2019-11-12,2019-11-12,,Dries Mertens
Dalian Professional (2009-2024),33304,18.03.2019,18.03.2019,-,2,2019-03-18,2019-03-18,,Dries Mertens
FC Schalke 04,33,19.05.2018,04.06.2018,-,2,2018-05-19,2018-06-04,,Dries Mertens
Fenerbahce,36,30.03.2016,30.03.2016,-,2,2016-03-30,2016-03-30,,Dries Mertens
FC Everton,29,01.07.2015,01.07.2015,-,2,2015-07-01,2015-07-01,,Dries Mertens
FC Schalke 04,33,19.06.2015,27.06.2015,-,2,2015-06-19,2015-06-27,,Dries Mertens
VfL Wolfsburg,82,19.06.2015,24.06.2015,-,2,2015-06-19,2015-06-24,,Dries Mertens
SSC Neapel,6195,24.06.2013,25.06.2013,-,2,2013-06-24,2013-06-25,,Dries Mertens
Fenerbahce,36,20.05.2013,20.05.2013,-,2,2013-05-20,2013-05-20,,Dries Mertens
FC Liverpool,31,07.10.2012,08.10.2012,-,2,2012-10-07,2012-10-08,,Dries Mertens
Ajax Amsterdam,610,30.01.2011,30.01.2011,-,2,2011-01-30,2011-01-30,,Dries Mertens
FC Twente Enschede,317,16.08.2010,16.08.2010,-,2,2010-08-16,2010-08-16,,Dries Mertens
CD Cruz Azul,3711,28.04.2024,12.05.2024,-,1,2024-04-28,2024-05-12,,Duván Zapata
FC Turin,416,01.09.2023,01.09.2023,-,1,2023-09-01,2023-09-01,,Duván Zapata
FC Fulham,931,24.08.2023,24.08.2023,-,1,2023-08-24,2023-08-24,,Duván Zapata
AS Rom,12,21.08.2023,21.08.2023,-,1,2023-08-21,2023-08-21,,Duván Zapata
FC Everton,29,15.01.2023,15.01.2023,-,1,2023-01-15,2023-01-15,,Duván Zapata
Newcastle United,762,18.01.2022,21.01.2022,-,1,2022-01-18,2022-01-21,,Duván Zapata
Inter Mailand,46,09.08.2021,09.08.2021,-,1,2021-08-09,2021-08-09,,Duván Zapata
FC Arsenal,11,03.04.2021,03.04.2021,-,1,2021-04-03,2021-04-03,,Duván Zapata
FC Liverpool,31,03.04.2021,03.04.2021,-,1,2021-04-03,2021-04-03,,Duván Zapata
FC Chelsea,631,03.04.2021,03.04.2021,-,1,2021-04-03,2021-04-03,,Duván Zapata
SSC Neapel,6195,04.06.2019,04.06.2019,-,1,2019-06-04,2019-06-04,,Duván Zapata
Borussia Dortmund,16,23.05.2019,24.05.2019,-,1,2019-05-23,2019-05-24,,Duván Zapata
West Ham United,379,23.01.2019,23.01.2019,-,1,2019-01-23,2019-01-23,,Duván Zapata
Besiktas JK,114,18.08.2017,18.08.2017,-,1,2017-08-18,2017-08-18,,Duván Zapata
SV Werder Bremen,86,13.07.2017,23.07.2017,-,1,2017-07-13,2017-07-23,,Duván Zapata
FC Turin,416,08.07.2017,08.07.2017,-,2,2017-07-08,2017-07-08,,Duván Zapata
FC Everton,29,03.07.2017,03.07.2017,-,2,2017-07-03,2017-07-03,,Duván Zapata
FC Everton,29,17.06.2017,17.06.2017,-,2,2017-06-17,2017-06-17,,Duván Zapata
FC Schalke 04,33,20.03.2017,22.03.2017,-,2,2017-03-20,2017-03-22,,Duván Zapata
VfL Wolfsburg,82,20.03.2017,21.03.2017,-,2,2017-03-20,2017-03-21,,Duván Zapata
FC Arsenal,11,30.05.2016,30.05.2016,-,2,2016-05-30,2016-05-30,,Duván Zapata
Udinese Calcio,410,03.07.2015,03.07.2015,-,2,2015-07-03,2015-07-03,,Duván Zapata
Hamburger SV,41,02.07.2015,02.07.2015,-,2,2015-07-02,2015-07-02,,Duván Zapata
Bayer 04 Leverkusen,15,02.07.2015,02.07.2015,-,2,2015-07-02,2015-07-02,,Duván Zapata
US Sassuolo,6574,16.06.2015,16.06.2015,-,2,2015-06-16,2015-06-16,,Duván Zapata
SSC Neapel,6195,23.08.2013,23.08.2013,-,2,2013-08-23,2013-08-23,,Duván Zapata
Borussia Dortmund,16,06.07.2013,06.07.2013,-,2,2013-07-06,2013-07-06,,Duván Zapata
Benfica Lissabon,294,06.07.2013,06.07.2013,-,2,2013-07-06,2013-07-06,,Duván Zapata
West Ham United,379,06.07.2013,06.07.2013,-,2,2013-07-06,2013-07-06,,Duván Zapata
FC Zürich,260,09.07.2025,09.07.2025,34 %,1,2025-07-09,2025-07-09,34.0,Dušan Tadić
Qarabağ Ağdam,10625,25.06.2025,25.06.2025,-,1,2025-06-25,2025-06-25,,Dušan Tadić
Besiktas JK,114,10.07.2023,20.07.2023,-,1,2023-07-10,2023-07-20,,Dušan Tadić
Fenerbahce,36,16.07.2023,16.07.2023,-,1,2023-07-16,2023-07-16,,Dušan Tadić
AC Mailand,5,03.07.2021,03.07.2021,-,1,2021-07-03,2021-07-03,,Dušan Tadić
FC Barcelona,131,29.01.2020,29.01.2020,-,1,2020-01-29,2020-01-29,,Dušan Tadić
FC Bayern München,27,06.05.2019,07.05.2019,-,1,2019-05-06,2019-05-07,,Dušan Tadić
Ajax Amsterdam,610,27.06.2018,27.06.2018,-,1,2018-06-27,2018-06-27,,Dušan Tadić
FC Liverpool,31,12.06.2017,12.06.2017,-,1,2017-06-12,2017-06-12,,Dušan Tadić
Inter Mailand,46,05.06.2017,05.06.2017,-,1,2017-06-05,2017-06-05,,Dušan Tadić
AC Mailand,5,10.10.2016,10.10.2016,-,1,2016-10-10,2016-10-10,,Dušan Tadić
FC Schalke 04,33,20.07.2016,02.08.2016,-,1,2016-07-20,2016-08-02,,Dušan Tadić
FC Southampton,180,08.07.2014,07.07.2014,-,1,2014-07-08,2014-07-07,,Dušan Tadić
FC Arsenal,11,19.01.2014,19.01.2014,-,1,2014-01-19,2014-01-19,,Dušan Tadić
Borussia Mönchengladbach,18,05.01.2014,06.01.2014,-,1,2014-01-05,2014-01-06,,Dušan Tadić
Manchester United,985,24.10.2013,24.10.2013,-,2,2013-10-24,2013-10-24,,Dušan Tadić
FC Everton,29,21.08.2013,21.08.2013,-,2,2013-08-21,2013-08-21,,Dušan Tadić
Besiktas JK,114,22.05.2013,22.05.2013,-,2,2013-05-22,2013-05-22,,Dušan Tadić
